Result,Lemma (Greek),Tense (Logos Greek),Voice (Logos Greek),Mood (Logos Greek),Person (Logos Greek),Gender (Logos Greek),Case (Logos Greek),Number (Logos Greek),Part of Speech,Reference,Previous Context,Next Context
σῶμα,σῶμα,—,—,—,—,neuter,accusative,singular,noun,Mark 15:43,"τὴν βασιλείαν τοῦ θεοῦ, τολμήσας εἰσῆλθεν πρὸς τὸν Πιλᾶτον καὶ ᾐτήσατο τὸ",τοῦ Ἰησοῦ.
σῶμα,σῶμα,—,—,—,—,neuter,accusative,singular,noun,Luke 12:4,"Λέγω δὲ ὑμῖν τοῖς φίλοις μου, μὴ φοβηθῆτε ἀπὸ τῶν ἀποκτεινόντων τὸ",καὶ μετὰ ταῦτα μὴ ἐχόντων περισσότερόν τι ποιῆσαι.
σῶμα,σῶμα,—,—,—,—,neuter,nominative,singular,noun,Luke 12:23,ἡ γὰρ ψυχὴ πλεῖόν ἐστιν τῆς τροφῆς καὶ τὸ,τοῦ ἐνδύματος.
σῶμα,σῶμα,—,—,—,—,neuter,nominative,singular,noun,Luke 17:37,"καὶ ἀποκριθέντες λέγουσιν αὐτῷ· ποῦ, κύριε; ὁ δὲ εἶπεν αὐτοῖς· ὅπου τὸ",", ἐκεῖ καὶ οἱ ἀετοὶ ἐπισυναχθήσονται."
σῶμα,σῶμα,—,—,—,—,neuter,accusative,singular,noun,Luke 23:52,οὗτος προσελθὼν τῷ Πιλάτῳ ᾐτήσατο τὸ,τοῦ Ἰησοῦ
σῶμα,σῶμα,—,—,—,—,neuter,nominative,singular,noun,Luke 23:55,"Κατακολουθήσασαι δὲ αἱ γυναῖκες, αἵτινες ἦσαν συνεληλυθυῖαι ἐκ τῆς Γαλιλαίας αὐτῷ, ἐθεάσαντο τὸ μνημεῖον καὶ ὡς ἐτέθη τὸ","αὐτοῦ,"
σῶμα,σῶμα,—,—,—,—,neuter,accusative,singular,noun,Luke 24:3,εἰσελθοῦσαι δὲ οὐχ εὗρον τὸ,τοῦ κυρίου Ἰησοῦ.
σῶμα,σῶμα,—,—,—,—,neuter,accusative,singular,noun,Luke 24:23,καὶ μὴ εὑροῦσαι τὸ,"αὐτοῦ ἦλθον λέγουσαι καὶ ὀπτασίαν ἀγγέλων ἑωρακέναι, οἳ λέγουσιν αὐτὸν ζῆν."
σῶμα,σῶμα,—,—,—,—,neuter,accusative,singular,noun,John 19:38,"τοῦ Ἰησοῦ κεκρυμμένος δὲ διὰ τὸν φόβον τῶν Ἰουδαίων, ἵνα ἄρῃ τὸ",τοῦ Ἰησοῦ· καὶ ἐπέτρεψεν ὁ Πιλᾶτος. ἦλθεν οὖν καὶ ἦρεν τὸ σῶμα αὐτοῦ.
σῶμα,σῶμα,—,—,—,—,neuter,accusative,singular,noun,John 19:38,σῶμα τοῦ Ἰησοῦ· καὶ ἐπέτρεψεν ὁ Πιλᾶτος. ἦλθεν οὖν καὶ ἦρεν τὸ,αὐτοῦ.
σῶμα,σῶμα,—,—,—,—,neuter,accusative,singular,noun,John 19:40,ἔλαβον οὖν τὸ,"τοῦ Ἰησοῦ καὶ ἔδησαν αὐτὸ  ὀθονίοις μετὰ τῶν ἀρωμάτων, καθὼς ἔθος ἐστὶν τοῖς Ἰουδαίοις ἐνταφιάζειν."
σῶμα,σῶμα,—,—,—,—,neuter,nominative,singular,noun,John 20:12,"ἕνα πρὸς τῇ κεφαλῇ καὶ ἕνα πρὸς τοῖς ποσίν, ὅπου ἔκειτο τὸ",τοῦ Ἰησοῦ.
σῶμα,σῶμα,—,—,—,—,neuter,accusative,singular,noun,Acts 9:40,ἐκβαλὼν δὲ ἔξω πάντας ὁ Πέτρος καὶ θεὶς τὰ γόνατα προσηύξατο καὶ ἐπιστρέψας πρὸς τὸ,"εἶπεν· Ταβιθά, ἀνάστηθι. ἡ δὲ ἤνοιξεν τοὺς ὀφθαλμοὺς αὐτῆς, καὶ ἰδοῦσα τὸν Πέτρον ἀνεκάθισεν."
σῶμα,σῶμα,—,—,—,—,neuter,accusative,singular,noun,Romans 4:19,καὶ μὴ ἀσθενήσας  τῇ πίστει  κατενόησεν τὸ ἑαυτοῦ,"[ἤδη] νενεκρωμένον, ἑκατονταετής που ὑπάρχων, καὶ τὴν νέκρωσιν τῆς μήτρας Σάρρας·"
σῶμα,σῶμα,—,—,—,—,neuter,nominative,singular,noun,Romans 6:6,"τοῦτο γινώσκοντες ὅτι ὁ παλαιὸς ἡμῶν ἄνθρωπος συνεσταυρώθη, ἵνα καταργηθῇ τὸ","τῆς ἁμαρτίας, τοῦ μηκέτι δουλεύειν ἡμᾶς τῇ ἁμαρτίᾳ·"
σῶμα,σῶμα,—,—,—,—,neuter,nominative,singular,noun,Romans 8:10,"εἰ δὲ Χριστὸς ἐν ὑμῖν, τὸ μὲν",νεκρὸν διὰ ἁμαρτίαν τὸ δὲ πνεῦμα ζωὴ διὰ δικαιοσύνην.
σῶμα,σῶμα,—,—,—,—,neuter,nominative,singular,noun,1 Corinthians 6:13,"τοῖς βρώμασιν, ὁ δὲ θεὸς καὶ ταύτην καὶ ταῦτα καταργήσει. τὸ δὲ","οὐ τῇ πορνείᾳ ἀλλὰ τῷ κυρίῳ, καὶ ὁ κύριος τῷ σώματι·"
σῶμα,σῶμα,—,—,—,—,neuter,accusative,singular,noun,1 Corinthians 6:18,ποιήσῃ ἄνθρωπος ἐκτὸς τοῦ σώματός ἐστιν· ὁ δὲ πορνεύων εἰς τὸ ἴδιον,ἁμαρτάνει.
σῶμα,σῶμα,—,—,—,—,neuter,nominative,singular,noun,1 Corinthians 6:19,ἢ οὐκ οἴδατε ὅτι τὸ,"ὑμῶν ναὸς τοῦ ἐν ὑμῖν ἁγίου πνεύματός ἐστιν οὗ ἔχετε ἀπὸ θεοῦ, καὶ οὐκ ἐστὲ ἑαυτῶν;"
σῶμα,σῶμα,—,—,—,—,neuter,accusative,singular,noun,1 Corinthians 9:27,ἀλλʼ ὑπωπιάζω μου τὸ,"καὶ δουλαγωγῶ, μή πως ἄλλοις κηρύξας αὐτὸς ἀδόκιμος γένωμαι."
σῶμα,σῶμα,—,—,—,—,neuter,nominative,singular,noun,1 Corinthians 10:17,"ὅτι εἷς ἄρτος, ἓν","οἱ πολλοί ἐσμεν, οἱ γὰρ πάντες ἐκ τοῦ ἑνὸς ἄρτου  μετέχομεν."
σῶμα,σῶμα,—,—,—,—,neuter,nominative,singular,noun,1 Corinthians 11:24,καὶ εὐχαριστήσας ἔκλασεν καὶ εἶπεν· τοῦτό μού ἐστιν τὸ,τὸ ὑπὲρ ὑμῶν · τοῦτο ποιεῖτε εἰς τὴν ἐμὴν ἀνάμνησιν.
σῶμα,σῶμα,—,—,—,—,neuter,accusative,singular,noun,1 Corinthians 11:29,ὁ γὰρ ἐσθίων καὶ πίνων  κρίμα ἑαυτῷ ἐσθίει καὶ πίνει μὴ διακρίνων τὸ,.
σῶμα,σῶμα,—,—,—,—,neuter,nominative,singular,noun,1 Corinthians 12:12,Καθάπερ γὰρ τὸ,"ἕν ἐστιν καὶ μέλη πολλὰ ἔχει, πάντα δὲ τὰ μέλη τοῦ σώματος  πολλὰ"
σῶμα,σῶμα,—,—,—,—,neuter,nominative,singular,noun,1 Corinthians 12:12,"πολλὰ ἔχει, πάντα δὲ τὰ μέλη τοῦ σώματος  πολλὰ ὄντα ἕν ἐστιν",", οὕτως καὶ ὁ Χριστός·"
σῶμα,σῶμα,—,—,—,—,neuter,accusative,singular,noun,1 Corinthians 12:13,καὶ γὰρ ἐν ἑνὶ πνεύματι ἡμεῖς πάντες εἰς ἓν,"ἐβαπτίσθημεν, εἴτε Ἰουδαῖοι εἴτε Ἕλληνες εἴτε δοῦλοι εἴτε ἐλεύθεροι, καὶ πάντες  ἓν πνεῦμα ἐποτίσθημεν."
σῶμα,σῶμα,—,—,—,—,neuter,nominative,singular,noun,1 Corinthians 12:14,Καὶ γὰρ τὸ,οὐκ ἔστιν ἓν μέλος ἀλλὰ πολλά.
σῶμα,σῶμα,—,—,—,—,neuter,nominative,singular,noun,1 Corinthians 12:17,εἰ ὅλον τὸ,"ὀφθαλμός, ποῦ ἡ ἀκοή; εἰ ὅλον ἀκοή, ποῦ ἡ ὄσφρησις;"
σῶμα,σῶμα,—,—,—,—,neuter,nominative,singular,noun,1 Corinthians 12:19,"εἰ δὲ ἦν τὰ πάντα ἓν μέλος, ποῦ τὸ",;
σῶμα,σῶμα,—,—,—,—,neuter,nominative,singular,noun,1 Corinthians 12:20,"νῦν δὲ πολλὰ μὲν μέλη, ἓν δὲ",.
σῶμα,σῶμα,—,—,—,—,neuter,accusative,singular,noun,1 Corinthians 12:24,τὰ δὲ εὐσχήμονα ἡμῶν οὐ χρείαν ἔχει. Ἀλλʼ ὁ θεὸς συνεκέρασεν τὸ,"τῷ ὑστερουμένῳ περισσοτέραν δοὺς τιμήν,"
σῶμα,σῶμα,—,—,—,—,neuter,nominative,singular,noun,1 Corinthians 12:27,Ὑμεῖς δέ ἐστε,Χριστοῦ καὶ μέλη ἐκ μέρους.
σῶμα,σῶμα,—,—,—,—,neuter,accusative,singular,noun,1 Corinthians 15:37,"καὶ ὃ σπείρεις, οὐ τὸ",τὸ γενησόμενον σπείρεις ἀλλὰ γυμνὸν κόκκον εἰ τύχοι σίτου ἤ τινος τῶν λοιπῶν·
σῶμα,σῶμα,—,—,—,—,neuter,accusative,singular,noun,1 Corinthians 15:38,ὁ δὲ θεὸς δίδωσιν αὐτῷ,"καθὼς ἠθέλησεν, καὶ ἑκάστῳ τῶν σπερμάτων ἴδιον σῶμα."
σῶμα,σῶμα,—,—,—,—,neuter,accusative,singular,noun,1 Corinthians 15:38,"ὁ δὲ θεὸς δίδωσιν αὐτῷ σῶμα καθὼς ἠθέλησεν, καὶ ἑκάστῳ τῶν σπερμάτων ἴδιον",.
σῶμα,σῶμα,—,—,—,—,neuter,nominative,singular,noun,1 Corinthians 15:44,σπείρεται,"ψυχικόν, ἐγείρεται σῶμα πνευματικόν. Εἰ ἔστιν σῶμα ψυχικόν, ἔστιν καὶ πνευματικόν."
σῶμα,σῶμα,—,—,—,—,neuter,nominative,singular,noun,1 Corinthians 15:44,"σπείρεται σῶμα ψυχικόν, ἐγείρεται","πνευματικόν. Εἰ ἔστιν σῶμα ψυχικόν, ἔστιν καὶ πνευματικόν."
σῶμα,σῶμα,—,—,—,—,neuter,nominative,singular,noun,1 Corinthians 15:44,"σπείρεται σῶμα ψυχικόν, ἐγείρεται σῶμα πνευματικόν. Εἰ ἔστιν","ψυχικόν, ἔστιν καὶ πνευματικόν."
σῶμα,σῶμα,—,—,—,—,neuter,nominative,singular,noun,Ephesians 1:23,ἥτις ἐστὶν τὸ,"αὐτοῦ, τὸ πλήρωμα τοῦ τὰ πάντα ἐν πᾶσιν πληρουμένου."
σῶμα,σῶμα,—,—,—,—,neuter,nominative,singular,noun,Ephesians 4:4,Ἓν,"καὶ ἓν πνεῦμα, καθὼς καὶ ἐκλήθητε ἐν μιᾷ ἐλπίδι τῆς κλήσεως ὑμῶν·"
σῶμα,σῶμα,—,—,—,—,neuter,nominative,singular,noun,Ephesians 4:16,ἐξ οὗ πᾶν τὸ,συναρμολογούμενον καὶ συμβιβαζόμενον διὰ πάσης ἁφῆς τῆς ἐπιχορηγίας κατʼ ἐνέργειαν ἐν μέτρῳ ἑνὸς
σῶμα,σῶμα,—,—,—,—,neuter,accusative,singular,noun,Philippians 3:21,ὃς μετασχηματίσει τὸ,τῆς ταπεινώσεως ἡμῶν  σύμμορφον τῷ σώματι τῆς δόξης αὐτοῦ κατὰ τὴν ἐνέργειαν τοῦ
σῶμα,σῶμα,—,—,—,—,neuter,nominative,singular,noun,Colossians 2:17,"ἅ ἐστιν σκιὰ τῶν μελλόντων, τὸ δὲ",τοῦ Χριστοῦ.
σῶμα,σῶμα,—,—,—,—,neuter,nominative,singular,noun,Colossians 2:19,"καὶ οὐ κρατῶν τὴν κεφαλήν, ἐξ οὗ πᾶν τὸ",διὰ τῶν ἁφῶν καὶ συνδέσμων ἐπιχορηγούμενον καὶ συμβιβαζόμενον αὔξει τὴν αὔξησιν τοῦ θεοῦ.
σῶμα,σῶμα,—,—,—,—,neuter,nominative,singular,noun,1 Thessalonians 5:23,"ὑμᾶς ὁλοτελεῖς, καὶ ὁλόκληρον ὑμῶν τὸ πνεῦμα καὶ ἡ ψυχὴ καὶ τὸ",ἀμέμπτως ἐν τῇ παρουσίᾳ τοῦ κυρίου ἡμῶν Ἰησοῦ Χριστοῦ τηρηθείη.
σῶμα,σῶμα,—,—,—,—,neuter,accusative,singular,noun,Hebrews 10:5,"Διὸ εἰσερχόμενος εἰς τὸν κόσμον λέγει·        θυσίαν καὶ προσφορὰν οὐκ ἠθέλησας,",δὲ κατηρτίσω μοι·
σῶμα,σῶμα,—,—,—,—,neuter,accusative,singular,noun,Hebrews 10:22,προσερχώμεθα μετὰ ἀληθινῆς καρδίας ἐν πληροφορίᾳ πίστεως ῥεραντισμένοι τὰς καρδίας ἀπὸ συνειδήσεως πονηρᾶς καὶ λελουσμένοι τὸ,ὕδατι καθαρῷ·
σῶμα,σῶμα,—,—,—,—,neuter,nominative,singular,noun,James 2:26,ὥσπερ γὰρ τὸ,"χωρὶς  πνεύματος νεκρόν ἐστιν, οὕτως καὶ ἡ πίστις χωρὶς  ἔργων νεκρά ἐστιν."
σῶμα,σῶμα,—,—,—,—,neuter,accusative,singular,noun,James 3:2,"πολλὰ γὰρ πταίομεν ἅπαντες. εἴ τις ἐν λόγῳ οὐ πταίει, οὗτος τέλειος ἀνὴρ δυνατὸς χαλιναγωγῆσαι καὶ ὅλον τὸ",.
σῶμα,σῶμα,—,—,—,—,neuter,accusative,singular,noun,James 3:3,"εἰ δὲ τῶν ἵππων τοὺς χαλινοὺς εἰς τὰ στόματα βάλλομεν εἰς τὸ πείθεσθαι αὐτοὺς ἡμῖν, καὶ ὅλον τὸ",αὐτῶν μετάγομεν.
σῶμα,σῶμα,—,—,—,—,neuter,accusative,singular,noun,James 3:6,ἀδικίας  ἡ γλῶσσα καθίσταται ἐν τοῖς μέλεσιν ἡμῶν ἡ σπιλοῦσα ὅλον τὸ,καὶ φλογίζουσα τὸν τροχὸν τῆς γενέσεως  καὶ φλογιζομένη ὑπὸ τῆς γεέννης.
