Result,Lemma (Greek),Tense (Logos Greek),Voice (Logos Greek),Mood (Logos Greek),Person (Logos Greek),Gender (Logos Greek),Case (Logos Greek),Number (Logos Greek),Part of Speech,Reference,Previous Context,Next Context
ἁμάρτανε,ἁμαρτάνω,present,active,imperative,second person,—,—,singular,verb,John 5:14,"μετὰ ταῦτα εὑρίσκει αὐτὸν ὁ Ἰησοῦς ἐν τῷ ἱερῷ καὶ εἶπεν αὐτῷ· ἴδε ὑγιὴς γέγονας, μηκέτι",", ἵνα μὴ χεῖρόν σοί τι γένηται."
ἁμάρτανε,ἁμαρτάνω,present,active,imperative,second person,—,—,singular,verb,John 8:11,"ὁ Ἰησοῦς· οὐδὲ ἐγώ σε κατακρίνω· πορεύου, [καὶ] ἀπὸ τοῦ νῦν μηκέτι",.⟧
ἁμάρτητε,ἁμαρτάνω,aorist,active,subjunctive,second person,—,—,plural,verb,1 John 2:1,"Τεκνία μου, ταῦτα γράφω ὑμῖν ἵνα μὴ",". καὶ ἐάν τις ἁμάρτῃ, παράκλητον ἔχομεν πρὸς τὸν πατέρα Ἰησοῦν Χριστὸν δίκαιον·"
ἁμάρτῃ,ἁμαρτάνω,aorist,active,subjunctive,third person,—,—,singular,verb,Luke 17:3,προσέχετε ἑαυτοῖς.  Ἐὰν,"ὁ ἀδελφός σου ἐπιτίμησον αὐτῷ,  καὶ ἐὰν μετανοήσῃ ἄφες αὐτῷ."
ἁμάρτῃ,ἁμαρτάνω,aorist,active,subjunctive,third person,—,—,singular,verb,1 John 2:1,"Τεκνία μου, ταῦτα γράφω ὑμῖν ἵνα μὴ ἁμάρτητε. καὶ ἐάν τις",", παράκλητον ἔχομεν πρὸς τὸν πατέρα Ἰησοῦν Χριστὸν δίκαιον·"
ἁμαρτάνει,ἁμαρτάνω,present,active,indicative,third person,—,—,singular,verb,1 Corinthians 6:18,ἄνθρωπος ἐκτὸς τοῦ σώματός ἐστιν· ὁ δὲ πορνεύων εἰς τὸ ἴδιον σῶμα,.
ἁμαρτάνει,ἁμαρτάνω,present,active,indicative,third person,—,—,singular,verb,1 Corinthians 7:36,"νομίζει, ἐὰν ᾖ ὑπέρακμος καὶ οὕτως ὀφείλει γίνεσθαι, ὃ θέλει ποιείτω, οὐχ",", γαμείτωσαν."
ἁμαρτάνει,ἁμαρτάνω,present,active,indicative,third person,—,—,singular,verb,Titus 3:11,εἰδὼς ὅτι ἐξέστραπται ὁ τοιοῦτος καὶ,ὢν αὐτοκατάκριτος.
ἁμαρτάνει,ἁμαρτάνω,present,active,indicative,third person,—,—,singular,verb,1 John 3:6,πᾶς ὁ ἐν αὐτῷ μένων οὐχ,· πᾶς ὁ ἁμαρτάνων οὐχ ἑώρακεν αὐτὸν οὐδὲ ἔγνωκεν αὐτόν.
ἁμαρτάνει,ἁμαρτάνω,present,active,indicative,third person,—,—,singular,verb,1 John 3:8,"ὁ ποιῶν τὴν ἁμαρτίαν ἐκ τοῦ διαβόλου ἐστίν, ὅτι ἀπʼ ἀρχῆς ὁ διάβολος",". εἰς τοῦτο ἐφανερώθη ὁ υἱὸς τοῦ θεοῦ, ἵνα λύσῃ τὰ ἔργα τοῦ διαβόλου."
ἁμαρτάνει,ἁμαρτάνω,present,active,indicative,third person,—,—,singular,verb,1 John 5:18,Οἴδαμεν ὅτι πᾶς ὁ γεγεννημένος ἐκ τοῦ θεοῦ οὐχ,", ἀλλʼ ὁ γεννηθεὶς ἐκ τοῦ θεοῦ τηρεῖ ἑαυτὸν καὶ ὁ πονηρὸς οὐχ ἅπτεται αὐτοῦ."
ἁμαρτάνειν,ἁμαρτάνω,present,active,infinitive,—,—,—,—,verb,1 John 3:9,"Πᾶς ὁ γεγεννημένος ἐκ τοῦ θεοῦ ἁμαρτίαν οὐ ποιεῖ, ὅτι σπέρμα αὐτοῦ ἐν αὐτῷ μένει, καὶ οὐ δύναται",", ὅτι ἐκ τοῦ θεοῦ γεγέννηται."
ἁμαρτάνετε,ἁμαρτάνω,present,active,indicative,second person,—,—,plural,verb,1 Corinthians 8:12,οὕτως δὲ ἁμαρτάνοντες εἰς τοὺς ἀδελφοὺς καὶ τύπτοντες αὐτῶν τὴν συνείδησιν ἀσθενοῦσαν εἰς Χριστὸν,.
ἁμαρτάνετε,ἁμαρτάνω,present,active,imperative,second person,—,—,plural,verb,1 Corinthians 15:34,ἐκνήψατε δικαίως καὶ μὴ,", ἀγνωσίαν γὰρ θεοῦ τινες ἔχουσιν, πρὸς ἐντροπὴν ὑμῖν λαλῶ."
ἁμαρτάνετε,ἁμαρτάνω,present,active,imperative,second person,—,—,plural,verb,Ephesians 4:26,ὀργίζεσθε καὶ μὴ,"· ὁ ἥλιος μὴ ἐπιδυέτω ἐπὶ [τῷ] παροργισμῷ ὑμῶν,"
ἁμαρτάνοντα,ἁμαρτάνω,present,active,participle,—,masculine,accusative,singular,verb,1 John 5:16,Ἐάν τις ἴδῃ τὸν ἀδελφὸν αὐτοῦ,"ἁμαρτίαν μὴ πρὸς θάνατον, αἰτήσει καὶ δώσει αὐτῷ ζωήν, τοῖς ἁμαρτάνουσιν μὴ πρὸς"
ἁμαρτάνοντας,ἁμαρτάνω,present,active,participle,—,masculine,accusative,plural,verb,1 Timothy 5:20,Τοὺς,"ἐνώπιον πάντων ἔλεγχε, ἵνα καὶ οἱ λοιποὶ φόβον ἔχωσιν."
ἁμαρτάνοντες,ἁμαρτάνω,present,active,participle,—,masculine,nominative,plural,verb,1 Corinthians 8:12,οὕτως δὲ,εἰς τοὺς ἀδελφοὺς καὶ τύπτοντες αὐτῶν τὴν συνείδησιν ἀσθενοῦσαν εἰς Χριστὸν ἁμαρτάνετε.
ἁμαρτάνοντες,ἁμαρτάνω,present,active,participle,—,masculine,nominative,plural,verb,1 Peter 2:20,"ποῖον γὰρ κλέος, εἰ","καὶ κολαφιζόμενοι ὑπομενεῖτε; ἀλλʼ εἰ ἀγαθοποιοῦντες καὶ πάσχοντες ὑπομενεῖτε, τοῦτο χάρις παρὰ θεῷ."
ἁμαρτάνουσιν,ἁμαρτάνω,present,active,participle,—,masculine,dative,plural,verb,1 John 5:16,"Ἐάν τις ἴδῃ τὸν ἀδελφὸν αὐτοῦ ἁμαρτάνοντα ἁμαρτίαν μὴ πρὸς θάνατον, αἰτήσει καὶ δώσει αὐτῷ ζωήν, τοῖς",μὴ πρὸς θάνατον. ἔστιν ἁμαρτία πρὸς θάνατον· οὐ περὶ ἐκείνης λέγω ἵνα ἐρωτήσῃ.
ἁμαρτάνων,ἁμαρτάνω,present,active,participle,—,masculine,nominative,singular,verb,1 John 3:6,πᾶς ὁ ἐν αὐτῷ μένων οὐχ ἁμαρτάνει· πᾶς ὁ,οὐχ ἑώρακεν αὐτὸν οὐδὲ ἔγνωκεν αὐτόν.
ἁμαρτήσαντας,ἁμαρτάνω,aorist,active,participle,—,masculine,accusative,plural,verb,Romans 5:14,ἀλλʼ ἐβασίλευσεν ὁ θάνατος ἀπὸ Ἀδὰμ μέχρι Μωϋσέως καὶ ἐπὶ τοὺς μὴ,ἐπὶ τῷ ὁμοιώματι τῆς παραβάσεως Ἀδὰμ ὅς ἐστιν τύπος τοῦ μέλλοντος.
ἁμαρτήσαντος,ἁμαρτάνω,aorist,active,participle,—,masculine,genitive,singular,verb,Romans 5:16,καὶ οὐχ ὡς διʼ ἑνὸς,"τὸ δώρημα· τὸ μὲν γὰρ κρίμα ἐξ ἑνὸς εἰς κατάκριμα, τὸ δὲ χάρισμα"
ἁμαρτήσασιν,ἁμαρτάνω,aorist,active,participle,—,masculine,dative,plural,verb,Hebrews 3:17,τίσιν δὲ  προσώχθισεν τεσσεράκοντα ἔτη; οὐχὶ τοῖς,", ὧν τὰ κῶλα ἔπεσεν ἐν τῇ ἐρήμῳ;"
ἁμαρτήσει,ἁμαρτάνω,future,active,indicative,third person,—,—,singular,verb,Matthew 18:21,"Τότε προσελθὼν ὁ Πέτρος εἶπεν αὐτῷ·  κύριε, ποσάκις",εἰς ἐμὲ ὁ ἀδελφός μου καὶ ἀφήσω αὐτῷ; ἕως ἑπτάκις;
ἁμαρτήσωμεν,ἁμαρτάνω,aorist,active,subjunctive,first person,—,—,plural,verb,Romans 6:15,Τί οὖν;,", ὅτι οὐκ ἐσμὲν ὑπὸ νόμον ἀλλʼ ὑπὸ χάριν; μὴ γένοιτο."
ἁμαρτήσῃ,ἁμαρτάνω,aorist,active,subjunctive,third person,—,—,singular,verb,Matthew 18:15,Ἐὰν δὲ,"[εἰς σὲ] ὁ ἀδελφός σου, ὕπαγε ἔλεγξον αὐτὸν μεταξὺ σοῦ καὶ αὐτοῦ μόνου"
ἁμαρτήσῃ,ἁμαρτάνω,aorist,active,subjunctive,third person,—,—,singular,verb,Luke 17:4,καὶ ἐὰν ἑπτάκις τῆς ἡμέρας,"εἰς σὲ καὶ  ἑπτάκις  ἐπιστρέψῃ πρὸς σὲ λέγων· μετανοῶ, ἀφήσεις αὐτῷ."
ἁμαρτανόντων,ἁμαρτάνω,present,active,participle,—,masculine,genitive,plural,verb,Hebrews 10:26,Ἑκουσίως γὰρ,"ἡμῶν μετὰ τὸ λαβεῖν τὴν ἐπίγνωσιν τῆς ἀληθείας, οὐκέτι περὶ ἁμαρτιῶν ἀπολείπεται θυσία,"
ἁμαρτησάντων,ἁμαρτάνω,aorist,active,participle,—,masculine,genitive,plural,verb,2 Peter 2:4,Εἰ γὰρ ὁ θεὸς ἀγγέλων,οὐκ ἐφείσατο ἀλλὰ σειραῖς ζόφου ταρταρώσας παρέδωκεν εἰς κρίσιν τηρουμένους
ἡμαρτήκαμεν,ἁμαρτάνω,perfect,active,indicative,first person,—,—,plural,verb,1 John 1:10,ἐὰν εἴπωμεν ὅτι οὐχ,", ψεύστην ποιοῦμεν αὐτόν, καὶ ὁ λόγος αὐτοῦ οὐκ ἔστιν ἐν ἡμῖν."
ἥμαρτεν,ἁμαρτάνω,aorist,active,indicative,third person,—,—,singular,verb,John 9:2,"καὶ ἠρώτησαν αὐτὸν οἱ μαθηταὶ αὐτοῦ λέγοντες· ῥαββί, τίς",", οὗτος ἢ οἱ γονεῖς αὐτοῦ, ἵνα τυφλὸς γεννηθῇ;"
ἥμαρτεν,ἁμαρτάνω,aorist,active,indicative,third person,—,—,singular,verb,John 9:3,ἀπεκρίθη Ἰησοῦς· οὔτε οὗτος,"οὔτε οἱ γονεῖς αὐτοῦ, ἀλλʼ ἵνα φανερωθῇ τὰ ἔργα τοῦ θεοῦ ἐν αὐτῷ."
ἥμαρτεν,ἁμαρτάνω,aorist,active,indicative,third person,—,—,singular,verb,1 Corinthians 7:28,"ἐὰν δὲ καὶ γαμήσῃς, οὐχ ἥμαρτες, καὶ ἐὰν γήμῃ ἡ παρθένος, οὐχ","· θλῖψιν δὲ τῇ σαρκὶ ἕξουσιν οἱ τοιοῦτοι, ἐγὼ δὲ ὑμῶν φείδομαι."
ἥμαρτες,ἁμαρτάνω,aorist,active,indicative,second person,—,—,singular,verb,1 Corinthians 7:28,"ἐὰν δὲ καὶ γαμήσῃς, οὐχ",", καὶ ἐὰν γήμῃ ἡ παρθένος, οὐχ ἥμαρτεν· θλῖψιν δὲ τῇ σαρκὶ ἕξουσιν οἱ"
ἥμαρτον,ἁμαρτάνω,aorist,active,indicative,first person,—,—,singular,verb,Matthew 27:4,λέγων·,παραδοὺς αἷμα ἀθῷον. οἱ δὲ εἶπαν· τί πρὸς ἡμᾶς; σὺ ὄψῃ.
ἥμαρτον,ἁμαρτάνω,aorist,active,indicative,first person,—,—,singular,verb,Luke 15:18,"ἀναστὰς πορεύσομαι πρὸς τὸν πατέρα μου καὶ ἐρῶ αὐτῷ· πάτερ,","εἰς τὸν οὐρανὸν καὶ ἐνώπιόν σου,"
ἥμαρτον,ἁμαρτάνω,aorist,active,indicative,first person,—,—,singular,verb,Luke 15:21,"εἶπεν δὲ ὁ υἱὸς αὐτῷ· πάτερ,","εἰς τὸν οὐρανὸν καὶ ἐνώπιόν σου, οὐκέτι εἰμὶ ἄξιος κληθῆναι υἱός σου."
ἥμαρτον,ἁμαρτάνω,aorist,active,indicative,first person,—,—,singular,verb,Acts 25:8,τοῦ Παύλου ἀπολογουμένου ὅτι οὔτε εἰς τὸν νόμον τῶν Ἰουδαίων οὔτε εἰς τὸ ἱερὸν οὔτε εἰς Καίσαρά τι,.
ἥμαρτον,ἁμαρτάνω,aorist,active,indicative,third person,—,—,plural,verb,Romans 2:12,Ὅσοι γὰρ ἀνόμως,", ἀνόμως καὶ ἀπολοῦνται, καὶ ὅσοι ἐν νόμῳ ἥμαρτον, διὰ νόμου κριθήσονται·"
ἥμαρτον,ἁμαρτάνω,aorist,active,indicative,third person,—,—,plural,verb,Romans 2:12,"Ὅσοι γὰρ ἀνόμως ἥμαρτον, ἀνόμως καὶ ἀπολοῦνται, καὶ ὅσοι ἐν νόμῳ",", διὰ νόμου κριθήσονται·"
ἥμαρτον,ἁμαρτάνω,aorist,active,indicative,third person,—,—,plural,verb,Romans 3:23,πάντες γὰρ,καὶ ὑστεροῦνται τῆς δόξης τοῦ θεοῦ
ἥμαρτον,ἁμαρτάνω,aorist,active,indicative,third person,—,—,plural,verb,Romans 5:12,"θάνατος, καὶ οὕτως εἰς πάντας ἀνθρώπους ὁ θάνατος διῆλθεν, ἐφʼ ᾧ πάντες",·
