Result,Lemma (Greek),Tense (Logos Greek),Voice (Logos Greek),Mood (Logos Greek),Person (Logos Greek),Gender (Logos Greek),Case (Logos Greek),Number (Logos Greek),Part of Speech,Reference,Previous Context,Next Context
σωμάτων,σῶμα,—,—,—,—,neuter,genitive,plural,noun,Revelation 18:13,"σεμίδαλιν καὶ σῖτον καὶ κτήνη καὶ πρόβατα, καὶ ἵππων καὶ ῥεδῶν καὶ",", καὶ ψυχὰς ἀνθρώπων."
σώματί,σῶμα,—,—,—,—,neuter,dative,singular,noun,Galatians 6:17,Τοῦ λοιποῦ κόπους μοι μηδεὶς παρεχέτω· ἐγὼ γὰρ τὰ στίγματα τοῦ Ἰησοῦ ἐν τῷ,μου βαστάζω.
σώματί,σῶμα,—,—,—,—,neuter,dative,singular,noun,Philippians 1:20,ἀλλʼ ἐν πάσῃ παρρησίᾳ ὡς πάντοτε καὶ νῦν μεγαλυνθήσεται Χριστὸς ἐν τῷ,"μου, εἴτε διὰ ζωῆς εἴτε διὰ θανάτου."
σώματα,σῶμα,—,—,—,—,neuter,nominative,plural,noun,Matthew 27:52,καὶ τὰ μνημεῖα ἀνεῴχθησαν καὶ πολλὰ,"τῶν κεκοιμημένων ἁγίων ἠγέρθησαν,"
σώματα,σῶμα,—,—,—,—,neuter,nominative,plural,noun,John 19:31,"Οἱ οὖν Ἰουδαῖοι, ἐπεὶ παρασκευὴ ἦν, ἵνα μὴ μείνῃ ἐπὶ τοῦ σταυροῦ τὰ","ἐν τῷ σαββάτῳ, ἦν γὰρ μεγάλη ἡ ἡμέρα ἐκείνου τοῦ σαββάτου, ἠρώτησαν τὸν"
σώματα,σῶμα,—,—,—,—,neuter,accusative,plural,noun,Romans 1:24,Διὸ  παρέδωκεν αὐτοὺς ὁ θεὸς ἐν ταῖς ἐπιθυμίαις τῶν καρδιῶν αὐτῶν εἰς ἀκαθαρσίαν τοῦ ἀτιμάζεσθαι τὰ,αὐτῶν ἐν αὐτοῖς·
σώματα,σῶμα,—,—,—,—,neuter,accusative,plural,noun,Romans 8:11,"οἰκεῖ ἐν ὑμῖν, ὁ ἐγείρας Χριστὸν ἐκ νεκρῶν ζῳοποιήσει καὶ τὰ θνητὰ",ὑμῶν διὰ τοῦ ἐνοικοῦντος αὐτοῦ πνεύματος ἐν ὑμῖν.
σώματα,σῶμα,—,—,—,—,neuter,accusative,plural,noun,Romans 12:1,"Παρακαλῶ οὖν ὑμᾶς, ἀδελφοί, διὰ τῶν οἰκτιρμῶν τοῦ θεοῦ παραστῆσαι τὰ","ὑμῶν θυσίαν ζῶσαν ἁγίαν εὐάρεστον τῷ θεῷ, τὴν λογικὴν λατρείαν ὑμῶν·"
σώματα,σῶμα,—,—,—,—,neuter,nominative,plural,noun,1 Corinthians 6:15,οὐκ οἴδατε ὅτι τὰ,ὑμῶν μέλη Χριστοῦ ἐστιν; ἄρας οὖν τὰ μέλη τοῦ Χριστοῦ ποιήσω πόρνης μέλη; μὴ γένοιτο.
σώματα,σῶμα,—,—,—,—,neuter,nominative,plural,noun,1 Corinthians 15:40,καὶ,"ἐπουράνια, καὶ σώματα ἐπίγεια· ἀλλʼ ἑτέρα μὲν ἡ τῶν ἐπουρανίων δόξα, ἑτέρα δὲ ἡ τῶν ἐπιγείων."
σώματα,σῶμα,—,—,—,—,neuter,nominative,plural,noun,1 Corinthians 15:40,"καὶ σώματα ἐπουράνια, καὶ","ἐπίγεια· ἀλλʼ ἑτέρα μὲν ἡ τῶν ἐπουρανίων δόξα, ἑτέρα δὲ ἡ τῶν ἐπιγείων."
σώματα,σῶμα,—,—,—,—,neuter,accusative,plural,noun,Ephesians 5:28,οὕτως ὀφείλουσιν [καὶ] οἱ ἄνδρες ἀγαπᾶν τὰς ἑαυτῶν γυναῖκας ὡς τὰ ἑαυτῶν,. ὁ ἀγαπῶν τὴν ἑαυτοῦ γυναῖκα ἑαυτὸν ἀγαπᾷ.
σώματα,σῶμα,—,—,—,—,neuter,nominative,plural,noun,Hebrews 13:11,"ὧν γὰρ εἰσφέρεται ζῴων τὸ αἷμα περὶ ἁμαρτίας εἰς τὰ ἅγια διὰ τοῦ ἀρχιερέως, τούτων τὰ",κατακαίεται ἔξω τῆς παρεμβολῆς.
σώματι,σῶμα,—,—,—,—,neuter,dative,singular,noun,Matthew 6:25,"Διὰ τοῦτο λέγω ὑμῖν· μὴ μεριμνᾶτε τῇ ψυχῇ ὑμῶν τί φάγητε [ἢ τί πίητε], μηδὲ τῷ",ὑμῶν τί ἐνδύσησθε. οὐχὶ ἡ ψυχὴ πλεῖόν ἐστιν τῆς τροφῆς καὶ τὸ σῶμα τοῦ ἐνδύματος;
σώματι,σῶμα,—,—,—,—,neuter,dative,singular,noun,Mark 5:29,καὶ εὐθὺς ἐξηράνθη ἡ πηγὴ τοῦ αἵματος αὐτῆς καὶ ἔγνω τῷ,ὅτι ἴαται ἀπὸ τῆς μάστιγος.
σώματι,σῶμα,—,—,—,—,neuter,dative,singular,noun,Luke 12:22,"Εἶπεν δὲ πρὸς τοὺς μαθητὰς [αὐτοῦ]· διὰ τοῦτο λέγω ὑμῖν· μὴ μεριμνᾶτε τῇ ψυχῇ  τί φάγητε, μηδὲ τῷ",τί ἐνδύσησθε.
σώματι,σῶμα,—,—,—,—,neuter,dative,singular,noun,Romans 6:12,Μὴ οὖν βασιλευέτω ἡ ἁμαρτία ἐν τῷ θνητῷ ὑμῶν,"εἰς τὸ ὑπακούειν ταῖς ἐπιθυμίαις αὐτοῦ,"
σώματι,σῶμα,—,—,—,—,neuter,dative,singular,noun,Romans 12:4,καθάπερ γὰρ ἐν ἑνὶ,"πολλὰ μέλη ἔχομεν, τὰ δὲ μέλη πάντα οὐ τὴν αὐτὴν ἔχει πρᾶξιν,"
σώματι,σῶμα,—,—,—,—,neuter,dative,singular,noun,1 Corinthians 5:3,"ἐγὼ μὲν γάρ,  ἀπὼν τῷ","παρὼν δὲ τῷ πνεύματι, ἤδη κέκρικα ὡς παρὼν τὸν οὕτως τοῦτο κατεργασάμενον·"
σώματι,σῶμα,—,—,—,—,neuter,dative,singular,noun,1 Corinthians 6:13,"δὲ σῶμα οὐ τῇ πορνείᾳ ἀλλὰ τῷ κυρίῳ, καὶ ὁ κύριος τῷ",·
σώματι,σῶμα,—,—,—,—,neuter,dative,singular,noun,1 Corinthians 6:20,ἠγοράσθητε γὰρ τιμῆς· δοξάσατε δὴ τὸν θεὸν ἐν τῷ,ὑμῶν.
σώματι,σῶμα,—,—,—,—,neuter,dative,singular,noun,1 Corinthians 7:34,"καὶ ἡ παρθένος μεριμνᾷ τὰ τοῦ κυρίου, ἵνα ᾖ ἁγία καὶ τῷ","καὶ τῷ πνεύματι· ἡ δὲ γαμήσασα μεριμνᾷ τὰ τοῦ κόσμου, πῶς ἀρέσῃ τῷ ἀνδρί."
σώματι,σῶμα,—,—,—,—,neuter,dative,singular,noun,1 Corinthians 12:18,"νυνὶ δὲ ὁ θεὸς ἔθετο τὰ μέλη, ἓν ἕκαστον αὐτῶν ἐν τῷ",καθὼς ἠθέλησεν.
σώματι,σῶμα,—,—,—,—,neuter,dative,singular,noun,1 Corinthians 12:25,ἵνα μὴ ᾖ σχίσμα ἐν τῷ,ἀλλὰ τὸ αὐτὸ ὑπὲρ ἀλλήλων μεριμνῶσιν τὰ μέλη.
σώματι,σῶμα,—,—,—,—,neuter,dative,singular,noun,1 Corinthians 15:35,Ἀλλʼ ἐρεῖ τις· πῶς ἐγείρονται οἱ νεκροί; ποίῳ δὲ,ἔρχονται;
σώματι,σῶμα,—,—,—,—,neuter,dative,singular,noun,2 Corinthians 4:10,πάντοτε τὴν νέκρωσιν τοῦ Ἰησοῦ ἐν τῷ,"περιφέροντες, ἵνα καὶ ἡ ζωὴ τοῦ Ἰησοῦ ἐν τῷ σώματι ἡμῶν φανερωθῇ."
σώματι,σῶμα,—,—,—,—,neuter,dative,singular,noun,2 Corinthians 4:10,"πάντοτε τὴν νέκρωσιν τοῦ Ἰησοῦ ἐν τῷ σώματι περιφέροντες, ἵνα καὶ ἡ ζωὴ τοῦ Ἰησοῦ ἐν τῷ",ἡμῶν φανερωθῇ.
σώματι,σῶμα,—,—,—,—,neuter,dative,singular,noun,2 Corinthians 5:6,Θαρροῦντες οὖν πάντοτε καὶ εἰδότες ὅτι ἐνδημοῦντες ἐν τῷ,ἐκδημοῦμεν ἀπὸ τοῦ κυρίου·
σώματι,σῶμα,—,—,—,—,neuter,dative,singular,noun,2 Corinthians 12:2,"οἶδα ἄνθρωπον ἐν Χριστῷ πρὸ ἐτῶν δεκατεσσάρων, εἴτε ἐν","οὐκ οἶδα, εἴτε ἐκτὸς τοῦ σώματος οὐκ οἶδα, ὁ θεὸς οἶδεν, ἁρπαγέντα τὸν τοιοῦτον ἕως τρίτου οὐρανοῦ."
σώματι,σῶμα,—,—,—,—,neuter,dative,singular,noun,2 Corinthians 12:3,"καὶ οἶδα τὸν τοιοῦτον ἄνθρωπον, εἴτε ἐν","εἴτε χωρὶς τοῦ σώματος οὐκ οἶδα, ὁ θεὸς οἶδεν,"
σώματι,σῶμα,—,—,—,—,neuter,dative,singular,noun,Ephesians 2:16,καὶ ἀποκαταλλάξῃ τοὺς ἀμφοτέρους ἐν ἑνὶ,"τῷ θεῷ διὰ τοῦ σταυροῦ, ἀποκτείνας τὴν ἔχθραν ἐν αὐτῷ."
σώματι,σῶμα,—,—,—,—,neuter,dative,singular,noun,Philippians 3:21,ὃς μετασχηματίσει τὸ σῶμα τῆς ταπεινώσεως ἡμῶν  σύμμορφον τῷ,τῆς δόξης αὐτοῦ κατὰ τὴν ἐνέργειαν τοῦ δύνασθαι αὐτὸν καὶ ὑποτάξαι αὐτῷ τὰ πάντα.
σώματι,σῶμα,—,—,—,—,neuter,dative,singular,noun,Colossians 1:22,νυνὶ δὲ ἀποκατήλλαξεν ἐν τῷ,"τῆς σαρκὸς αὐτοῦ διὰ τοῦ θανάτου  παραστῆσαι ὑμᾶς ἁγίους καὶ ἀμώμους καὶ ἀνεγκλήτους κατενώπιον αὐτοῦ,"
σώματι,σῶμα,—,—,—,—,neuter,dative,singular,noun,Colossians 3:15,"καὶ ἡ εἰρήνη τοῦ Χριστοῦ βραβευέτω ἐν ταῖς καρδίαις ὑμῶν, εἰς ἣν καὶ ἐκλήθητε ἐν ἑνὶ",· καὶ εὐχάριστοι γίνεσθε.
σώματι,σῶμα,—,—,—,—,neuter,dative,singular,noun,Hebrews 13:3,"μιμνῄσκεσθε τῶν δεσμίων ὡς συνδεδεμένοι, τῶν κακουχουμένων ὡς καὶ αὐτοὶ ὄντες ἐν",.
σώματι,σῶμα,—,—,—,—,neuter,dative,singular,noun,1 Peter 2:24,ὃς τὰς ἁμαρτίας ἡμῶν αὐτὸς ἀνήνεγκεν        ἐν τῷ,"αὐτοῦ ἐπὶ τὸ ξύλον,        ἵνα ταῖς ἁμαρτίαις ἀπογενόμενοι        τῇ δικαιοσύνῃ ζήσωμεν,        οὗ τῷ μώλωπι  ἰάθητε."
σώματος,σῶμα,—,—,—,—,neuter,genitive,singular,noun,Romans 7:4,"ὥστε, ἀδελφοί μου, καὶ ὑμεῖς ἐθανατώθητε τῷ νόμῳ διὰ τοῦ","τοῦ Χριστοῦ, εἰς τὸ γενέσθαι ὑμᾶς ἑτέρῳ, τῷ ἐκ νεκρῶν ἐγερθέντι, ἵνα καρποφορήσωμεν τῷ θεῷ."
σώματος,σῶμα,—,—,—,—,neuter,genitive,singular,noun,Romans 7:24,Ταλαίπωρος ἐγὼ ἄνθρωπος· τίς με ῥύσεται ἐκ τοῦ,τοῦ θανάτου τούτου;
σώματος,σῶμα,—,—,—,—,neuter,genitive,singular,noun,Romans 8:13,"εἰ γὰρ κατὰ σάρκα ζῆτε, μέλλετε ἀποθνῄσκειν· εἰ δὲ πνεύματι τὰς πράξεις τοῦ","θανατοῦτε, ζήσεσθε."
σώματος,σῶμα,—,—,—,—,neuter,genitive,singular,noun,Romans 8:23,"ἔχοντες, ἡμεῖς καὶ αὐτοὶ ἐν ἑαυτοῖς στενάζομεν υἱοθεσίαν ἀπεκδεχόμενοι, τὴν ἀπολύτρωσιν τοῦ",ἡμῶν.
σώματος,σῶμα,—,—,—,—,neuter,genitive,singular,noun,1 Corinthians 7:4,ἡ γυνὴ τοῦ ἰδίου,"οὐκ ἐξουσιάζει ἀλλʼ ὁ ἀνήρ, ὁμοίως δὲ καὶ ὁ ἀνὴρ τοῦ ἰδίου σώματος"
σώματος,σῶμα,—,—,—,—,neuter,genitive,singular,noun,1 Corinthians 7:4,"ἡ γυνὴ τοῦ ἰδίου σώματος οὐκ ἐξουσιάζει ἀλλʼ ὁ ἀνήρ, ὁμοίως δὲ καὶ ὁ ἀνὴρ τοῦ ἰδίου",οὐκ ἐξουσιάζει ἀλλʼ ἡ γυνή.
σώματος,σῶμα,—,—,—,—,neuter,genitive,singular,noun,1 Corinthians 10:16,"ἐστὶν τοῦ αἵματος τοῦ Χριστοῦ; τὸν ἄρτον ὃν κλῶμεν, οὐχὶ κοινωνία τοῦ",τοῦ Χριστοῦ ἐστιν;
σώματος,σῶμα,—,—,—,—,neuter,genitive,singular,noun,1 Corinthians 11:27,"Ὥστε ὃς ἂν ἐσθίῃ τὸν ἄρτον  ἢ πίνῃ τὸ ποτήριον τοῦ κυρίου ἀναξίως, ἔνοχος ἔσται τοῦ",καὶ τοῦ αἵματος τοῦ κυρίου.
σώματος,σῶμα,—,—,—,—,neuter,genitive,singular,noun,1 Corinthians 12:12,"Καθάπερ γὰρ τὸ σῶμα ἕν ἐστιν καὶ μέλη πολλὰ ἔχει, πάντα δὲ τὰ μέλη τοῦ","πολλὰ ὄντα ἕν ἐστιν σῶμα, οὕτως καὶ ὁ Χριστός·"
σώματος,σῶμα,—,—,—,—,neuter,genitive,singular,noun,1 Corinthians 12:15,"ἐὰν εἴπῃ ὁ πούς· ὅτι οὐκ εἰμὶ χείρ, οὐκ εἰμὶ ἐκ τοῦ",", οὐ παρὰ τοῦτο οὐκ ἔστιν ἐκ τοῦ σώματος;"
σώματος,σῶμα,—,—,—,—,neuter,genitive,singular,noun,1 Corinthians 12:15,"οὐκ εἰμὶ ἐκ τοῦ σώματος, οὐ παρὰ τοῦτο οὐκ ἔστιν ἐκ τοῦ",;
σώματος,σῶμα,—,—,—,—,neuter,genitive,singular,noun,1 Corinthians 12:16,"καὶ ἐὰν εἴπῃ τὸ οὖς· ὅτι οὐκ εἰμὶ ὀφθαλμός, οὐκ εἰμὶ ἐκ τοῦ",", οὐ παρὰ τοῦτο οὐκ ἔστιν ἐκ τοῦ σώματος;"
σώματος,σῶμα,—,—,—,—,neuter,genitive,singular,noun,1 Corinthians 12:16,"οὐκ εἰμὶ ἐκ τοῦ σώματος, οὐ παρὰ τοῦτο οὐκ ἔστιν ἐκ τοῦ",;
σώματος,σῶμα,—,—,—,—,neuter,genitive,singular,noun,1 Corinthians 12:22,ἀλλὰ πολλῷ μᾶλλον τὰ δοκοῦντα μέλη τοῦ,"ἀσθενέστερα ὑπάρχειν ἀναγκαῖά ἐστιν,"
σώματος,σῶμα,—,—,—,—,neuter,genitive,singular,noun,1 Corinthians 12:23,καὶ ἃ δοκοῦμεν ἀτιμότερα εἶναι τοῦ,"τούτοις τιμὴν περισσοτέραν περιτίθεμεν, καὶ τὰ ἀσχήμονα ἡμῶν εὐσχημοσύνην περισσοτέραν ἔχει,"
σώματος,σῶμα,—,—,—,—,neuter,genitive,singular,noun,2 Corinthians 5:8,θαρροῦμεν δὲ καὶ εὐδοκοῦμεν μᾶλλον ἐκδημῆσαι ἐκ τοῦ,καὶ ἐνδημῆσαι πρὸς τὸν κύριον.
σώματος,σῶμα,—,—,—,—,neuter,genitive,singular,noun,2 Corinthians 5:10,"τοὺς γὰρ πάντας ἡμᾶς φανερωθῆναι δεῖ ἔμπροσθεν τοῦ βήματος τοῦ Χριστοῦ, ἵνα κομίσηται ἕκαστος τὰ διὰ τοῦ","πρὸς ἃ ἔπραξεν, εἴτε ἀγαθὸν εἴτε φαῦλον."
σώματος,σῶμα,—,—,—,—,neuter,genitive,singular,noun,2 Corinthians 10:10,"ὅτι αἱ ἐπιστολαὶ μέν, φησίν, βαρεῖαι καὶ ἰσχυραί, ἡ δὲ παρουσία τοῦ",ἀσθενὴς καὶ ὁ λόγος ἐξουθενημένος.
σώματος,σῶμα,—,—,—,—,neuter,genitive,singular,noun,2 Corinthians 12:2,"οἶδα ἄνθρωπον ἐν Χριστῷ πρὸ ἐτῶν δεκατεσσάρων, εἴτε ἐν σώματι οὐκ οἶδα, εἴτε ἐκτὸς τοῦ","οὐκ οἶδα, ὁ θεὸς οἶδεν, ἁρπαγέντα τὸν τοιοῦτον ἕως τρίτου οὐρανοῦ."
σώματος,σῶμα,—,—,—,—,neuter,genitive,singular,noun,2 Corinthians 12:3,"καὶ οἶδα τὸν τοιοῦτον ἄνθρωπον, εἴτε ἐν σώματι εἴτε χωρὶς τοῦ","οὐκ οἶδα, ὁ θεὸς οἶδεν,"
σώματος,σῶμα,—,—,—,—,neuter,genitive,singular,noun,Ephesians 4:16,τῆς ἐπιχορηγίας κατʼ ἐνέργειαν ἐν μέτρῳ ἑνὸς ἑκάστου μέρους τὴν αὔξησιν τοῦ,ποιεῖται εἰς οἰκοδομὴν ἑαυτοῦ ἐν ἀγάπῃ.
σώματος,σῶμα,—,—,—,—,neuter,genitive,singular,noun,Ephesians 5:23,"ὅτι ἀνήρ ἐστιν κεφαλὴ τῆς γυναικὸς ὡς καὶ ὁ Χριστὸς κεφαλὴ τῆς ἐκκλησίας, αὐτὸς σωτὴρ τοῦ",·
σώματος,σῶμα,—,—,—,—,neuter,genitive,singular,noun,Ephesians 5:30,ὅτι μέλη ἐσμὲν τοῦ,αὐτοῦ.
σώματος,σῶμα,—,—,—,—,neuter,genitive,singular,noun,Colossians 1:24,τὰ ὑστερήματα τῶν θλίψεων τοῦ Χριστοῦ ἐν τῇ σαρκί μου ὑπὲρ τοῦ,"αὐτοῦ, ὅ ἐστιν ἡ ἐκκλησία,"
σώματος,σῶμα,—,—,—,—,neuter,genitive,singular,noun,Colossians 2:23,ἅτινά ἐστιν λόγον μὲν ἔχοντα σοφίας ἐν ἐθελοθρησκίᾳ καὶ ταπεινοφροσύνῃ  [καὶ] ἀφειδίᾳ,", οὐκ ἐν τιμῇ τινι πρὸς πλησμονὴν τῆς σαρκός."
σώματος,σῶμα,—,—,—,—,neuter,genitive,singular,noun,Hebrews 10:10,ἐν ᾧ θελήματι ἡγιασμένοι ἐσμὲν  διὰ τῆς προσφορᾶς τοῦ,Ἰησοῦ Χριστοῦ ἐφάπαξ.
σώματος,σῶμα,—,—,—,—,neuter,genitive,singular,noun,James 2:16,"ἐν εἰρήνῃ, θερμαίνεσθε καὶ χορτάζεσθε, μὴ δῶτε δὲ αὐτοῖς τὰ ἐπιτήδεια τοῦ",", τί τὸ ὄφελος;"
σώματος,σῶμα,—,—,—,—,neuter,genitive,singular,noun,Jude 9,"Ὁ δὲ Μιχαὴλ ὁ ἀρχάγγελος, ὅτε τῷ διαβόλῳ διακρινόμενος διελέγετο περὶ τοῦ Μωϋσέως",", οὐκ ἐτόλμησεν κρίσιν ἐπενεγκεῖν βλασφημίας ἀλλʼ εἶπεν· ἐπιτιμήσαι σοι κύριος."
σώματος,σῶμα,—,—,—,—,neuter,genitive,singular,noun,John 2:21,ἐκεῖνος δὲ ἔλεγεν περὶ τοῦ ναοῦ τοῦ,αὐτοῦ.
σώματος,σῶμα,—,—,—,—,neuter,genitive,singular,noun,Ephesians 4:12,"πρὸς τὸν καταρτισμὸν τῶν ἁγίων εἰς ἔργον διακονίας, εἰς οἰκοδομὴν τοῦ","τοῦ Χριστοῦ,"
σώματος,σῶμα,—,—,—,—,neuter,genitive,singular,noun,Colossians 1:18,καὶ αὐτός ἐστιν ἡ κεφαλὴ τοῦ,"τῆς ἐκκλησίας·        ὅς ἐστιν  ἀρχή,        πρωτότοκος ἐκ τῶν νεκρῶν,        ἵνα γένηται ἐν πᾶσιν αὐτὸς πρωτεύων,"
σώματος,σῶμα,—,—,—,—,neuter,genitive,singular,noun,Colossians 2:11,Ἐν ᾧ καὶ περιετμήθητε περιτομῇ ἀχειροποιήτῳ ἐν τῇ ἀπεκδύσει τοῦ,"τῆς σαρκός, ἐν τῇ περιτομῇ τοῦ Χριστοῦ,"
σώματός,σῶμα,—,—,—,—,neuter,genitive,singular,noun,Matthew 6:22,Ὁ λύχνος τοῦ,"ἐστιν ὁ ὀφθαλμός. ἐὰν οὖν ᾖ ὁ ὀφθαλμός σου ἁπλοῦς, ὅλον τὸ σῶμά σου φωτεινὸν ἔσται·"
σώματός,σῶμα,—,—,—,—,neuter,genitive,singular,noun,Matthew 26:12,βαλοῦσα γὰρ αὕτη τὸ μύρον τοῦτο ἐπὶ τοῦ,μου πρὸς τὸ ἐνταφιάσαι με ἐποίησεν.
σώματός,σῶμα,—,—,—,—,neuter,genitive,singular,noun,Luke 11:34,Ὁ λύχνος τοῦ,"ἐστιν ὁ ὀφθαλμός σου. ὅταν  ὁ ὀφθαλμός σου ἁπλοῦς ᾖ, καὶ ὅλον τὸ"
σώματός,σῶμα,—,—,—,—,neuter,genitive,singular,noun,1 Corinthians 6:18,Φεύγετε τὴν πορνείαν. πᾶν ἁμάρτημα ὃ ἐὰν ποιήσῃ ἄνθρωπος ἐκτὸς τοῦ,ἐστιν· ὁ δὲ πορνεύων εἰς τὸ ἴδιον σῶμα ἁμαρτάνει.
σῶμά,σῶμα,—,—,—,—,neuter,nominative,singular,noun,Matthew 5:29,γάρ σοι ἵνα ἀπόληται ἓν τῶν μελῶν σου καὶ μὴ ὅλον τὸ,σου βληθῇ εἰς γέενναν.
σῶμά,σῶμα,—,—,—,—,neuter,nominative,singular,noun,Matthew 5:30,γάρ σοι ἵνα ἀπόληται ἓν τῶν μελῶν σου καὶ μὴ ὅλον τὸ,σου εἰς γέενναν ἀπέλθῃ.
σῶμά,σῶμα,—,—,—,—,neuter,nominative,singular,noun,Matthew 6:22,"Ὁ λύχνος τοῦ σώματός ἐστιν ὁ ὀφθαλμός. ἐὰν οὖν ᾖ ὁ ὀφθαλμός σου ἁπλοῦς, ὅλον τὸ",σου φωτεινὸν ἔσται·
σῶμά,σῶμα,—,—,—,—,neuter,nominative,singular,noun,Matthew 6:23,"ἐὰν δὲ ὁ ὀφθαλμός σου πονηρὸς ᾖ, ὅλον τὸ","σου σκοτεινὸν ἔσται. εἰ οὖν τὸ φῶς τὸ ἐν σοὶ σκότος ἐστίν, τὸ σκότος πόσον."
σῶμά,σῶμα,—,—,—,—,neuter,nominative,singular,noun,Matthew 26:26,"εὐλογήσας ἔκλασεν καὶ δοὺς τοῖς μαθηταῖς εἶπεν· λάβετε φάγετε, τοῦτό ἐστιν τὸ",μου.
σῶμά,σῶμα,—,—,—,—,neuter,accusative,singular,noun,Mark 14:8,ὃ ἔσχεν  ἐποίησεν· προέλαβεν μυρίσαι τὸ,μου εἰς τὸν ἐνταφιασμόν.
σῶμά,σῶμα,—,—,—,—,neuter,nominative,singular,noun,Mark 14:22,"Καὶ ἐσθιόντων αὐτῶν λαβὼν  ἄρτον εὐλογήσας ἔκλασεν καὶ ἔδωκεν αὐτοῖς  καὶ εἶπεν· λάβετε , τοῦτό ἐστιν τὸ",μου.
σῶμά,σῶμα,—,—,—,—,neuter,nominative,singular,noun,Luke 11:34,"Ὁ λύχνος τοῦ σώματός ἐστιν ὁ ὀφθαλμός σου. ὅταν  ὁ ὀφθαλμός σου ἁπλοῦς ᾖ, καὶ ὅλον τὸ","σου φωτεινόν ἐστιν· ἐπὰν δὲ πονηρὸς ᾖ, καὶ τὸ σῶμά σου σκοτεινόν."
σῶμά,σῶμα,—,—,—,—,neuter,nominative,singular,noun,Luke 11:34,"ὅλον τὸ σῶμά σου φωτεινόν ἐστιν· ἐπὰν δὲ πονηρὸς ᾖ, καὶ τὸ",σου σκοτεινόν.
σῶμά,σῶμα,—,—,—,—,neuter,nominative,singular,noun,Luke 11:36,εἰ οὖν τὸ,"σου ὅλον φωτεινόν, μὴ ἔχον μέρος τι σκοτεινόν, ἔσται φωτεινὸν ὅλον ὡς ὅταν"
σῶμά,σῶμα,—,—,—,—,neuter,nominative,singular,noun,Luke 22:19,Καὶ λαβὼν ἄρτον εὐχαριστήσας ἔκλασεν καὶ ἔδωκεν αὐτοῖς λέγων· τοῦτό ἐστιν τὸ,μου τὸ ὑπὲρ ὑμῶν διδόμενον· τοῦτο ποιεῖτε εἰς τὴν ἐμὴν ἀνάμνησιν.
σῶμά,σῶμα,—,—,—,—,neuter,nominative,singular,noun,Romans 12:5,οὕτως οἱ πολλοὶ ἓν,"ἐσμεν ἐν Χριστῷ, τὸ δὲ καθʼ εἷς ἀλλήλων μέλη."
σῶμά,σῶμα,—,—,—,—,neuter,nominative,singular,noun,1 Corinthians 6:16,[ἢ] οὐκ οἴδατε ὅτι ὁ κολλώμενος τῇ πόρνῃ ἓν,"ἐστιν; ἔσονται γάρ, φησίν, οἱ δύο εἰς σάρκα μίαν."
σῶμά,σῶμα,—,—,—,—,neuter,accusative,singular,noun,1 Corinthians 13:3,κἂν ψωμίσω πάντα τὰ ὑπάρχοντά μου καὶ ἐὰν παραδῶ τὸ,"μου ἵνα καυχήσωμαι, ἀγάπην δὲ μὴ ἔχω, οὐδὲν ὠφελοῦμαι."
σῶμα,σῶμα,—,—,—,—,neuter,nominative,singular,noun,Matthew 6:25,ὑμῶν τί ἐνδύσησθε. οὐχὶ ἡ ψυχὴ πλεῖόν ἐστιν τῆς τροφῆς καὶ τὸ,τοῦ ἐνδύματος;
σῶμα,σῶμα,—,—,—,—,neuter,accusative,singular,noun,Matthew 10:28,Καὶ μὴ φοβεῖσθε ἀπὸ τῶν ἀποκτεννόντων τὸ,", τὴν δὲ ψυχὴν μὴ δυναμένων ἀποκτεῖναι· φοβεῖσθε δὲ μᾶλλον τὸν δυνάμενον καὶ ψυχὴν"
σῶμα,σῶμα,—,—,—,—,neuter,accusative,singular,noun,Matthew 10:28,ψυχὴν μὴ δυναμένων ἀποκτεῖναι· φοβεῖσθε δὲ μᾶλλον τὸν δυνάμενον καὶ ψυχὴν καὶ,ἀπολέσαι ἐν γεέννῃ.
σῶμα,σῶμα,—,—,—,—,neuter,accusative,singular,noun,Matthew 27:58,οὗτος προσελθὼν τῷ Πιλάτῳ ᾐτήσατο τὸ,τοῦ Ἰησοῦ. τότε ὁ Πιλᾶτος ἐκέλευσεν ἀποδοθῆναι.
σῶμα,σῶμα,—,—,—,—,neuter,accusative,singular,noun,Matthew 27:59,Καὶ λαβὼν τὸ,ὁ Ἰωσὴφ ἐνετύλιξεν αὐτὸ [ἐν] σινδόνι καθαρᾷ
