Result,Lemma (Greek),Tense (Logos Greek),Voice (Logos Greek),Mood (Logos Greek),Person (Logos Greek),Gender (Logos Greek),Case (Logos Greek),Number (Logos Greek),Part of Speech,Reference,Previous Context,Next Context
Γυναῖκας,γυνή,—,—,—,—,feminine,accusative,plural,noun,1 Timothy 3:11,—,"ὡσαύτως σεμνάς, μὴ διαβόλους, νηφαλίους, πιστὰς ἐν πᾶσιν."
Γυνὴ,γυνή,—,—,—,—,feminine,nominative,singular,noun,1 Corinthians 7:39,—,δέδεται  ἐφʼ ὅσον χρόνον ζῇ ὁ ἀνὴρ αὐτῆς· ἐὰν δὲ  κοιμηθῇ ὁ ἀνήρ
Γυνὴ,γυνή,—,—,—,—,feminine,nominative,singular,noun,1 Timothy 2:11,—,ἐν ἡσυχίᾳ μανθανέτω ἐν πάσῃ ὑποταγῇ·
γυνή,γυνή,—,—,—,—,feminine,nominative,singular,noun,Matthew 22:27,ὕστερον δὲ πάντων ἀπέθανεν  ἡ,.
γυνή,γυνή,—,—,—,—,feminine,nominative,singular,noun,Matthew 22:28,ἐν τῇ ἀναστάσει οὖν τίνος τῶν ἑπτὰ ἔσται,; πάντες γὰρ ἔσχον αὐτήν·
γυνή,γυνή,—,—,—,—,feminine,nominative,singular,noun,Mark 12:23,ἐν τῇ ἀναστάσει [ὅταν ἀναστῶσιν] τίνος αὐτῶν ἔσται,; οἱ γὰρ ἑπτὰ ἔσχον αὐτὴν γυναῖκα.
γυνή,γυνή,—,—,—,—,feminine,nominative,singular,noun,Luke 1:13,"εἶπεν δὲ πρὸς αὐτὸν ὁ ἄγγελος·        μὴ φοβοῦ, Ζαχαρία,        διότι εἰσηκούσθη ἡ δέησίς σου,        καὶ ἡ",σου Ἐλισάβετ γεννήσει υἱόν σοι        καὶ καλέσεις τὸ ὄνομα αὐτοῦ Ἰωάννην.
γυνή,γυνή,—,—,—,—,feminine,nominative,singular,noun,Luke 1:18,καὶ εἶπεν Ζαχαρίας πρὸς τὸν ἄγγελον· κατὰ τί γνώσομαι τοῦτο; ἐγὼ γάρ εἰμι πρεσβύτης καὶ ἡ,μου προβεβηκυῖα ἐν ταῖς ἡμέραις αὐτῆς.
γυνή,γυνή,—,—,—,—,feminine,nominative,singular,noun,Luke 20:33,ἡ γυνὴ οὖν ἐν τῇ ἀναστάσει τίνος αὐτῶν γίνεται,; οἱ γὰρ ἑπτὰ ἔσχον αὐτὴν γυναῖκα.
γυνή,γυνή,—,—,—,—,feminine,nominative,singular,noun,John 4:11,Λέγει αὐτῷ [ἡ,"]· κύριε, οὔτε ἄντλημα ἔχεις καὶ τὸ φρέαρ ἐστὶν βαθύ· πόθεν οὖν ἔχεις τὸ ὕδωρ τὸ ζῶν;"
γυνή,γυνή,—,—,—,—,feminine,nominative,singular,noun,John 4:15,Λέγει πρὸς αὐτὸν ἡ,"· κύριε, δός μοι τοῦτο τὸ ὕδωρ, ἵνα μὴ διψῶ μηδὲ διέρχωμαι ἐνθάδε ἀντλεῖν."
γυνή,γυνή,—,—,—,—,feminine,nominative,singular,noun,John 4:19,Λέγει αὐτῷ ἡ,"· κύριε, θεωρῶ ὅτι προφήτης εἶ σύ."
γυνή,γυνή,—,—,—,—,feminine,nominative,singular,noun,John 4:25,Λέγει αὐτῷ ἡ,"· οἶδα ὅτι Μεσσίας ἔρχεται ὁ λεγόμενος χριστός· ὅταν ἔλθῃ ἐκεῖνος, ἀναγγελεῖ ἡμῖν ἅπαντα."
γυνή,γυνή,—,—,—,—,feminine,nominative,singular,noun,1 Corinthians 7:4,ὁμοίως δὲ καὶ ὁ ἀνὴρ τοῦ ἰδίου σώματος οὐκ ἐξουσιάζει ἀλλʼ ἡ,.
γυνή,γυνή,—,—,—,—,feminine,nominative,singular,noun,1 Timothy 5:9,"Χήρα καταλεγέσθω μὴ ἔλαττον ἐτῶν ἑξήκοντα γεγονυῖα, ἑνὸς ἀνδρὸς",","
γυνή,γυνή,—,—,—,—,feminine,nominative,singular,noun,1 Corinthians 11:6,εἰ γὰρ οὐ κατακαλύπτεται,", καὶ κειράσθω· εἰ δὲ αἰσχρὸν γυναικὶ τὸ κείρασθαι ἢ ξυρᾶσθαι, κατακαλυπτέσθω."
γυναικί,γυνή,—,—,—,—,feminine,dative,singular,noun,1 Corinthians 7:27,δέδεσαι,", μὴ ζήτει λύσιν· λέλυσαι ἀπὸ γυναικός, μὴ ζήτει γυναῖκα."
γυναικί,γυνή,—,—,—,—,feminine,dative,singular,noun,1 Corinthians 7:33,"ὁ δὲ γαμήσας μεριμνᾷ τὰ τοῦ κόσμου, πῶς ἀρέσῃ τῇ",","
γυναικί,γυνή,—,—,—,—,feminine,dative,singular,noun,Matthew 26:10,Γνοὺς δὲ ὁ Ἰησοῦς εἶπεν αὐτοῖς· τί κόπους παρέχετε τῇ,; ἔργον γὰρ καλὸν ἠργάσατο εἰς ἐμέ·
γυναικός,γυνή,—,—,—,—,feminine,genitive,singular,noun,Matthew 19:10,Λέγουσιν αὐτῷ οἱ μαθηταὶ [αὐτοῦ]· εἰ οὕτως ἐστὶν ἡ αἰτία τοῦ ἀνθρώπου μετὰ τῆς,", οὐ συμφέρει γαμῆσαι."
γυναικός,γυνή,—,—,—,—,feminine,genitive,singular,noun,Acts 5:2,"καὶ ἐνοσφίσατο ἀπὸ τῆς τιμῆς, συνειδυίης καὶ τῆς",", καὶ ἐνέγκας μέρος τι παρὰ τοὺς πόδας τῶν ἀποστόλων ἔθηκεν."
γυναικός,γυνή,—,—,—,—,feminine,genitive,singular,noun,1 Corinthians 7:27,"δέδεσαι γυναικί, μὴ ζήτει λύσιν· λέλυσαι ἀπὸ",", μὴ ζήτει γυναῖκα."
γυναικός,γυνή,—,—,—,—,feminine,genitive,singular,noun,1 Corinthians 11:12,"ὥσπερ γὰρ ἡ γυνὴ ἐκ τοῦ ἀνδρός, οὕτως καὶ ὁ ἀνὴρ διὰ τῆς",· τὰ δὲ πάντα ἐκ τοῦ θεοῦ.
γυναικός,γυνή,—,—,—,—,feminine,genitive,singular,noun,Galatians 4:4,"ὅτε δὲ ἦλθεν τὸ πλήρωμα τοῦ χρόνου, ἐξαπέστειλεν ὁ θεὸς τὸν υἱὸν αὐτοῦ, γενόμενον ἐκ",", γενόμενον ὑπὸ νόμον,"
γυναικὶ,γυνή,—,—,—,—,feminine,dative,singular,noun,Matthew 19:5,καὶ εἶπεν· ἕνεκα τούτου καταλείψει ἄνθρωπος τὸν πατέρα καὶ τὴν μητέρα καὶ κολληθήσεται τῇ,"αὐτοῦ, καὶ ἔσονται οἱ δύο εἰς σάρκα μίαν."
γυναικὶ,γυνή,—,—,—,—,feminine,dative,singular,noun,John 4:42,τῇ τε,"ἔλεγον ὅτι οὐκέτι διὰ τὴν σὴν λαλιὰν πιστεύομεν, αὐτοὶ γὰρ ἀκηκόαμεν καὶ οἴδαμεν"
γυναικὶ,γυνή,—,—,—,—,feminine,dative,singular,noun,Acts 5:1,Ἀνὴρ δέ τις Ἁνανίας ὀνόματι σὺν Σαπφίρῃ τῇ,αὐτοῦ ἐπώλησεν κτῆμα
γυναικὶ,γυνή,—,—,—,—,feminine,dative,singular,noun,Acts 24:24,Μετὰ δὲ ἡμέρας τινὰς παραγενόμενος ὁ Φῆλιξ σὺν Δρουσίλλῃ τῇ ἰδίᾳ,οὔσῃ Ἰουδαίᾳ  μετεπέμψατο τὸν Παῦλον καὶ ἤκουσεν αὐτοῦ περὶ τῆς εἰς Χριστὸν Ἰησοῦν πίστεως.
γυναικὶ,γυνή,—,—,—,—,feminine,dative,singular,noun,1 Corinthians 7:3,τῇ,"ὁ ἀνὴρ τὴν ὀφειλὴν ἀποδιδότω, ὁμοίως δὲ καὶ ἡ γυνὴ τῷ ἀνδρί."
γυναικὶ,γυνή,—,—,—,—,feminine,dative,singular,noun,1 Corinthians 7:14,ἡγίασται γὰρ ὁ ἀνὴρ ὁ ἄπιστος ἐν τῇ,καὶ ἡγίασται ἡ γυνὴ ἡ ἄπιστος ἐν τῷ ἀδελφῷ· ἐπεὶ ἄρα τὰ τέκνα
γυναικὶ,γυνή,—,—,—,—,feminine,dative,singular,noun,1 Corinthians 14:35,"εἰ δέ τι μαθεῖν θέλουσιν, ἐν οἴκῳ τοὺς ἰδίους ἄνδρας ἐπερωτάτωσαν· αἰσχρὸν γάρ ἐστιν",λαλεῖν ἐν ἐκκλησίᾳ.
γυναικὶ,γυνή,—,—,—,—,feminine,dative,singular,noun,1 Timothy 2:12,διδάσκειν δὲ,"οὐκ ἐπιτρέπω οὐδὲ αὐθεντεῖν ἀνδρός, ἀλλʼ εἶναι ἐν ἡσυχίᾳ."
γυναικὶ,γυνή,—,—,—,—,feminine,dative,singular,noun,Revelation 12:14,καὶ ἐδόθησαν τῇ,"αἱ δύο πτέρυγες τοῦ ἀετοῦ τοῦ μεγάλου, ἵνα πέτηται εἰς τὴν ἔρημον εἰς"
γυναικὶ,γυνή,—,—,—,—,feminine,dative,singular,noun,Revelation 12:16,καὶ ἐβοήθησεν ἡ γῆ τῇ,καὶ ἤνοιξεν ἡ γῆ τὸ στόμα αὐτῆς καὶ κατέπιεν τὸν ποταμὸν ὃν ἔβαλεν
γυναικὶ,γυνή,—,—,—,—,feminine,dative,singular,noun,Revelation 12:17,καὶ ὠργίσθη ὁ δράκων ἐπὶ τῇ,καὶ ἀπῆλθεν ποιῆσαι πόλεμον μετὰ τῶν λοιπῶν τοῦ σπέρματος αὐτῆς τῶν τηρούντων τὰς
γυναικὶ,γυνή,—,—,—,—,feminine,dative,singular,noun,1 Corinthians 11:6,"εἰ γὰρ οὐ κατακαλύπτεται γυνή, καὶ κειράσθω· εἰ δὲ αἰσχρὸν","τὸ κείρασθαι ἢ ξυρᾶσθαι, κατακαλυπτέσθω."
γυναικὸς,γυνή,—,—,—,—,feminine,genitive,singular,noun,Luke 3:19,"Ὁ δὲ Ἡρῴδης ὁ τετραάρχης, ἐλεγχόμενος ὑπʼ αὐτοῦ περὶ Ἡρῳδιάδος τῆς","τοῦ ἀδελφοῦ αὐτοῦ καὶ περὶ πάντων ὧν ἐποίησεν πονηρῶν ὁ Ἡρῴδης,"
γυναικὸς,γυνή,—,—,—,—,feminine,genitive,singular,noun,Luke 17:32,μνημονεύετε τῆς,Λώτ.
γυναικὸς,γυνή,—,—,—,—,feminine,genitive,singular,noun,John 4:9,λέγει οὖν αὐτῷ ἡ γυνὴ ἡ Σαμαρῖτις· πῶς σὺ Ἰουδαῖος ὢν παρʼ ἐμοῦ πεῖν αἰτεῖς,Σαμαρίτιδος οὔσης; οὐ γὰρ συγχρῶνται Ἰουδαῖοι Σαμαρίταις.
γυναικὸς,γυνή,—,—,—,—,feminine,genitive,singular,noun,John 4:27,Καὶ ἐπὶ τούτῳ ἦλθαν οἱ μαθηταὶ αὐτοῦ καὶ ἐθαύμαζον ὅτι μετὰ,ἐλάλει· οὐδεὶς μέντοι εἶπεν· τί ζητεῖς ἢ τί λαλεῖς μετʼ αὐτῆς;
γυναικὸς,γυνή,—,—,—,—,feminine,genitive,singular,noun,John 4:39,Ἐκ δὲ τῆς πόλεως ἐκείνης πολλοὶ ἐπίστευσαν εἰς αὐτὸν τῶν Σαμαριτῶν διὰ τὸν λόγον τῆς,μαρτυρούσης ὅτι εἶπέν μοι πάντα ἃ ἐποίησα.
γυναικὸς,γυνή,—,—,—,—,feminine,genitive,singular,noun,Acts 16:1,"Κατήντησεν δὲ [καὶ] εἰς Δέρβην καὶ εἰς Λύστραν. καὶ ἰδοὺ μαθητής τις ἦν ἐκεῖ ὀνόματι Τιμόθεος, υἱὸς","Ἰουδαίας πιστῆς, πατρὸς δὲ Ἕλληνος,"
γυναικὸς,γυνή,—,—,—,—,feminine,genitive,singular,noun,1 Corinthians 11:8,οὐ γάρ ἐστιν ἀνὴρ ἐκ,ἀλλὰ γυνὴ ἐξ ἀνδρός·
γυναικὸς,γυνή,—,—,—,—,feminine,genitive,singular,noun,1 Corinthians 11:11,πλὴν οὔτε γυνὴ χωρὶς ἀνδρὸς οὔτε ἀνὴρ χωρὶς,ἐν κυρίῳ· ὥσπερ
γυναικὸς,γυνή,—,—,—,—,feminine,genitive,singular,noun,Ephesians 5:23,ὅτι ἀνήρ ἐστιν κεφαλὴ τῆς,"ὡς καὶ ὁ Χριστὸς κεφαλὴ τῆς ἐκκλησίας, αὐτὸς σωτὴρ τοῦ σώματος·"
γυναικὸς,γυνή,—,—,—,—,feminine,genitive,singular,noun,1 Timothy 3:2,"δεῖ οὖν τὸν ἐπίσκοπον ἀνεπίλημπτον εἶναι, μιᾶς","ἄνδρα, νηφάλιον σώφρονα κόσμιον φιλόξενον διδακτικόν,"
γυναικὸς,γυνή,—,—,—,—,feminine,genitive,singular,noun,1 Timothy 3:12,διάκονοι ἔστωσαν μιᾶς,"ἄνδρες, τέκνων καλῶς προϊστάμενοι καὶ τῶν ἰδίων οἴκων."
γυναικὸς,γυνή,—,—,—,—,feminine,genitive,singular,noun,Titus 1:6,"εἴ τίς ἐστιν ἀνέγκλητος, μιᾶς","ἀνήρ, τέκνα ἔχων πιστά, μὴ ἐν κατηγορίᾳ ἀσωτίας ἢ ἀνυπότακτα."
γυναικὸς,γυνή,—,—,—,—,feminine,genitive,singular,noun,Revelation 12:4,καὶ ἔβαλεν αὐτοὺς εἰς τὴν γῆν. Καὶ ὁ δράκων ἕστηκεν ἐνώπιον τῆς,"τῆς μελλούσης τεκεῖν, ἵνα ὅταν τέκῃ τὸ τέκνον αὐτῆς καταφάγῃ."
γυναικὸς,γυνή,—,—,—,—,feminine,genitive,singular,noun,Revelation 12:15,καὶ ἔβαλεν ὁ ὄφις ἐκ τοῦ στόματος αὐτοῦ ὀπίσω τῆς,"ὕδωρ ὡς ποταμόν, ἵνα αὐτὴν ποταμοφόρητον ποιήσῃ."
γυναικὸς,γυνή,—,—,—,—,feminine,genitive,singular,noun,Revelation 17:7,Καὶ εἶπέν μοι ὁ ἄγγελος· διὰ τί ἐθαύμασας; ἐγὼ ἐρῶ σοι τὸ μυστήριον τῆς,καὶ τοῦ θηρίου τοῦ βαστάζοντος αὐτὴν τοῦ ἔχοντος τὰς ἑπτὰ κεφαλὰς καὶ τὰ δέκα κέρατα.
γυναικὸς,γυνή,—,—,—,—,feminine,genitive,singular,noun,1 Corinthians 7:1,"Περὶ δὲ ὧν ἐγράψατε, καλὸν ἀνθρώπῳ",μὴ ἅπτεσθαι·
γυναικὸς,γυνή,—,—,—,—,feminine,genitive,singular,noun,1 Corinthians 11:3,"Θέλω δὲ ὑμᾶς εἰδέναι ὅτι παντὸς ἀνδρὸς ἡ κεφαλὴ ὁ Χριστός ἐστιν, κεφαλὴ δὲ","ὁ ἀνήρ, κεφαλὴ δὲ τοῦ Χριστοῦ ὁ θεός."
γυναικῶν,γυνή,—,—,—,—,feminine,genitive,plural,noun,Matthew 11:11,Ἀμὴν λέγω ὑμῖν· οὐκ ἐγήγερται ἐν γεννητοῖς,μείζων Ἰωάννου τοῦ βαπτιστοῦ· ὁ δὲ μικρότερος ἐν τῇ βασιλείᾳ τῶν οὐρανῶν μείζων αὐτοῦ ἐστιν.
γυναικῶν,γυνή,—,—,—,—,feminine,genitive,plural,noun,Matthew 14:21,οἱ δὲ ἐσθίοντες ἦσαν ἄνδρες ὡσεὶ πεντακισχίλιοι χωρὶς,καὶ παιδίων.
γυναικῶν,γυνή,—,—,—,—,feminine,genitive,plural,noun,Matthew 15:38,οἱ δὲ ἐσθίοντες ἦσαν  τετρακισχίλιοι ἄνδρες χωρὶς,καὶ παιδίων.
γυναικῶν,γυνή,—,—,—,—,feminine,genitive,plural,noun,Luke 7:28,"λέγω ὑμῖν, μείζων ἐν γεννητοῖς",Ἰωάννου οὐδείς ἐστιν· ὁ δὲ μικρότερος ἐν τῇ βασιλείᾳ τοῦ θεοῦ μείζων αὐτοῦ ἐστιν.
γυναικῶν,γυνή,—,—,—,—,feminine,genitive,plural,noun,Luke 23:27,Ἠκολούθει δὲ αὐτῷ πολὺ πλῆθος τοῦ λαοῦ καὶ,αἳ ἐκόπτοντο καὶ ἐθρήνουν αὐτόν.
γυναικῶν,γυνή,—,—,—,—,feminine,genitive,plural,noun,Acts 5:14,"μᾶλλον δὲ προσετίθεντο πιστεύοντες τῷ κυρίῳ, πλήθη ἀνδρῶν τε καὶ",","
γυναικῶν,γυνή,—,—,—,—,feminine,genitive,plural,noun,Acts 17:4,"καί τινες ἐξ αὐτῶν ἐπείσθησαν καὶ προσεκληρώθησαν τῷ Παύλῳ καὶ τῷ Σιλᾷ, τῶν τε σεβομένων  Ἑλλήνων πλῆθος πολύ,",τε τῶν πρώτων οὐκ ὀλίγαι.
γυναικῶν,γυνή,—,—,—,—,feminine,genitive,plural,noun,Acts 17:12,πολλοὶ μὲν οὖν ἐξ αὐτῶν ἐπίστευσαν  καὶ τῶν Ἑλληνίδων,τῶν εὐσχημόνων καὶ ἀνδρῶν οὐκ ὀλίγοι.
γυναικῶν,γυνή,—,—,—,—,feminine,genitive,plural,noun,1 Peter 3:1,"Ὁμοίως αἱ γυναῖκες, ὑποτασσόμεναι τοῖς ἰδίοις ἀνδράσιν, ἵνα καὶ εἴ τινες ἀπειθοῦσιν τῷ λόγῳ, διὰ τῆς τῶν",ἀναστροφῆς ἄνευ λόγου κερδηθήσονται
γυναικῶν,γυνή,—,—,—,—,feminine,genitive,plural,noun,Revelation 9:8,καὶ εἶχον τρίχας ὡς τρίχας,", καὶ οἱ ὀδόντες αὐτῶν ὡς λεόντων ἦσαν,"
γυναικῶν,γυνή,—,—,—,—,feminine,genitive,plural,noun,Revelation 14:4,οὗτοί εἰσιν οἳ μετὰ,"οὐκ ἐμολύνθησαν, παρθένοι γάρ εἰσιν, οὗτοι  οἱ ἀκολουθοῦντες τῷ ἀρνίῳ ὅπου ἂν ὑπάγῃ"
γυναιξίν,γυνή,—,—,—,—,feminine,dative,plural,noun,Matthew 28:5,Ἀποκριθεὶς δὲ ὁ ἄγγελος εἶπεν ταῖς,"· μὴ φοβεῖσθε ὑμεῖς, οἶδα γὰρ ὅτι Ἰησοῦν τὸν ἐσταυρωμένον ζητεῖτε·"
γυναιξίν,γυνή,—,—,—,—,feminine,dative,plural,noun,Acts 16:13,"πύλης παρὰ  ποταμὸν οὗ ἐνομίζομεν προσευχὴν εἶναι, καὶ καθίσαντες ἐλαλοῦμεν ταῖς συνελθούσαις",.
γυναιξὶν,γυνή,—,—,—,—,feminine,dative,plural,noun,Luke 1:42,καὶ ἀνεφώνησεν κραυγῇ μεγάλῃ καὶ εἶπεν·      εὐλογημένη σὺ ἐν,καὶ εὐλογημένος ὁ καρπὸς τῆς κοιλίας σου.
γυναιξὶν,γυνή,—,—,—,—,feminine,dative,plural,noun,Acts 1:14,οὗτοι πάντες ἦσαν προσκαρτεροῦντες ὁμοθυμαδὸν τῇ προσευχῇ  σὺν,καὶ Μαριὰμ τῇ μητρὶ τοῦ Ἰησοῦ καὶ  τοῖς ἀδελφοῖς αὐτοῦ.
γυναιξὶν,γυνή,—,—,—,—,feminine,dative,plural,noun,Acts 21:5,"ὅτε δὲ ἐγένετο ἡμᾶς ἐξαρτίσαι τὰς ἡμέρας, ἐξελθόντες ἐπορευόμεθα προπεμπόντων ἡμᾶς πάντων σὺν","καὶ τέκνοις ἕως ἔξω τῆς πόλεως, καὶ θέντες τὰ γόνατα ἐπὶ τὸν αἰγιαλὸν προσευξάμενοι"
γυναιξὶν,γυνή,—,—,—,—,feminine,dative,plural,noun,1 Timothy 2:10,ἀλλʼ ὃ πρέπει,"ἐπαγγελλομέναις θεοσέβειαν, διʼ ἔργων ἀγαθῶν."
γυναῖκά,γυνή,—,—,—,—,feminine,accusative,singular,noun,Matthew 1:20,"ὄναρ ἐφάνη αὐτῷ λέγων· Ἰωσὴφ υἱὸς Δαυίδ, μὴ φοβηθῇς παραλαβεῖν Μαρίαν τὴν",σου· τὸ γὰρ ἐν αὐτῇ γεννηθὲν ἐκ πνεύματός ἐστιν ἁγίου.
γυναῖκά,γυνή,—,—,—,—,feminine,accusative,singular,noun,1 Corinthians 5:1,"Ὅλως ἀκούεται ἐν ὑμῖν πορνεία, καὶ τοιαύτη πορνεία ἥτις οὐδὲ ἐν τοῖς ἔθνεσιν, ὥστε",τινα τοῦ πατρὸς ἔχειν.
γυναῖκές,γυνή,—,—,—,—,feminine,nominative,plural,noun,Luke 8:2,καὶ,"τινες αἳ ἦσαν τεθεραπευμέναι ἀπὸ πνευμάτων πονηρῶν καὶ ἀσθενειῶν, Μαρία ἡ καλουμένη Μαγδαληνή"
γυναῖκές,γυνή,—,—,—,—,feminine,nominative,plural,noun,Luke 24:22,ἀλλὰ καὶ,"τινες ἐξ ἡμῶν ἐξέστησαν ἡμᾶς, γενόμεναι ὀρθριναὶ ἐπὶ τὸ μνημεῖον,"
γυναῖκα,γυνή,—,—,—,—,feminine,accusative,singular,noun,Matthew 1:24,ἐγερθεὶς δὲ ὁ Ἰωσὴφ ἀπὸ τοῦ ὕπνου ἐποίησεν ὡς προσέταξεν αὐτῷ ὁ ἄγγελος κυρίου καὶ παρέλαβεν τὴν,"αὐτοῦ,"
γυναῖκα,γυνή,—,—,—,—,feminine,accusative,singular,noun,Matthew 5:28,ἐγὼ δὲ λέγω ὑμῖν ὅτι πᾶς ὁ βλέπων,πρὸς τὸ ἐπιθυμῆσαι αὐτὴν ἤδη ἐμοίχευσεν αὐτὴν ἐν τῇ καρδίᾳ αὐτοῦ.
γυναῖκα,γυνή,—,—,—,—,feminine,accusative,singular,noun,Matthew 5:31,Ἐρρέθη δέ· ὃς ἂν ἀπολύσῃ τὴν,"αὐτοῦ, δότω αὐτῇ ἀποστάσιον."
γυναῖκα,γυνή,—,—,—,—,feminine,accusative,singular,noun,Matthew 5:32,ἐγὼ δὲ λέγω ὑμῖν ὅτι πᾶς ὁ ἀπολύων τὴν,"αὐτοῦ παρεκτὸς λόγου πορνείας ποιεῖ αὐτὴν μοιχευθῆναι, καὶ ὃς ἐὰν ἀπολελυμένην γαμήσῃ, μοιχᾶται."
γυναῖκα,γυνή,—,—,—,—,feminine,accusative,singular,noun,Matthew 14:3,Ὁ γὰρ Ἡρῴδης  κρατήσας τὸν Ἰωάννην ἔδησεν [αὐτὸν] καὶ ἐν φυλακῇ ἀπέθετο διὰ Ἡρῳδιάδα τὴν,Φιλίππου τοῦ ἀδελφοῦ αὐτοῦ·
γυναῖκα,γυνή,—,—,—,—,feminine,accusative,singular,noun,Matthew 18:25,μὴ ἔχοντος δὲ αὐτοῦ ἀποδοῦναι ἐκέλευσεν αὐτὸν ὁ κύριος πραθῆναι καὶ τὴν,"καὶ τὰ τέκνα καὶ πάντα ὅσα ἔχει, καὶ ἀποδοθῆναι."
γυναῖκα,γυνή,—,—,—,—,feminine,accusative,singular,noun,Matthew 19:3,Καὶ προσῆλθον αὐτῷ  Φαρισαῖοι πειράζοντες αὐτὸν καὶ λέγοντες ·  εἰ ἔξεστιν ἀνθρώπῳ ἀπολῦσαι τὴν,αὐτοῦ κατὰ πᾶσαν αἰτίαν;
γυναῖκα,γυνή,—,—,—,—,feminine,accusative,singular,noun,Matthew 19:9,λέγω δὲ ὑμῖν ὅτι ὃς ἂν ἀπολύσῃ τὴν,αὐτοῦ μὴ ἐπὶ πορνείᾳ καὶ γαμήσῃ ἄλλην μοιχᾶται.
γυναῖκα,γυνή,—,—,—,—,feminine,accusative,singular,noun,Matthew 22:24,"λέγοντες· διδάσκαλε, Μωϋσῆς εἶπεν· ἐάν τις ἀποθάνῃ μὴ ἔχων τέκνα, ἐπιγαμβρεύσει ὁ ἀδελφὸς αὐτοῦ τὴν",αὐτοῦ καὶ ἀναστήσει σπέρμα τῷ ἀδελφῷ αὐτοῦ.
γυναῖκα,γυνή,—,—,—,—,feminine,accusative,singular,noun,Matthew 22:25,"ἦσαν δὲ παρʼ ἡμῖν ἑπτὰ ἀδελφοί· καὶ ὁ πρῶτος γήμας ἐτελεύτησεν, καὶ μὴ ἔχων σπέρμα ἀφῆκεν τὴν",αὐτοῦ τῷ ἀδελφῷ αὐτοῦ·
γυναῖκα,γυνή,—,—,—,—,feminine,accusative,singular,noun,Mark 6:17,Αὐτὸς γὰρ ὁ Ἡρῴδης ἀποστείλας ἐκράτησεν τὸν Ἰωάννην καὶ ἔδησεν αὐτὸν ἐν φυλακῇ διὰ Ἡρῳδιάδα τὴν,"Φιλίππου τοῦ ἀδελφοῦ αὐτοῦ, ὅτι αὐτὴν ἐγάμησεν·"
γυναῖκα,γυνή,—,—,—,—,feminine,accusative,singular,noun,Mark 6:18,ἔλεγεν γὰρ ὁ Ἰωάννης τῷ Ἡρῴδῃ ὅτι οὐκ ἔξεστίν σοι ἔχειν τὴν,τοῦ ἀδελφοῦ σου.
γυναῖκα,γυνή,—,—,—,—,feminine,accusative,singular,noun,Mark 10:2,Καὶ προσελθόντες Φαρισαῖοι ἐπηρώτων αὐτὸν εἰ ἔξεστιν ἀνδρὶ,"ἀπολῦσαι, πειράζοντες αὐτόν."
γυναῖκα,γυνή,—,—,—,—,feminine,accusative,singular,noun,Mark 10:7,ἕνεκεν τούτου καταλείψει ἄνθρωπος τὸν πατέρα αὐτοῦ καὶ τὴν μητέρα [καὶ προσκολληθήσεται πρὸς τὴν,"αὐτοῦ],"
γυναῖκα,γυνή,—,—,—,—,feminine,accusative,singular,noun,Mark 10:11,καὶ λέγει αὐτοῖς· ὃς ἂν ἀπολύσῃ τὴν,αὐτοῦ καὶ γαμήσῃ ἄλλην μοιχᾶται ἐπʼ αὐτήν·
γυναῖκα,γυνή,—,—,—,—,feminine,accusative,singular,noun,Mark 12:19,"διδάσκαλε, Μωϋσῆς ἔγραψεν ἡμῖν ὅτι ἐάν τινος ἀδελφὸς ἀποθάνῃ καὶ καταλίπῃ","καὶ μὴ ἀφῇ τέκνον, ἵνα λάβῃ ὁ ἀδελφὸς αὐτοῦ τὴν γυναῖκα  καὶ ἐξαναστήσῃ σπέρμα τῷ ἀδελφῷ αὐτοῦ."
γυναῖκα,γυνή,—,—,—,—,feminine,accusative,singular,noun,Mark 12:19,"καταλίπῃ γυναῖκα καὶ μὴ ἀφῇ τέκνον, ἵνα λάβῃ ὁ ἀδελφὸς αὐτοῦ τὴν",καὶ ἐξαναστήσῃ σπέρμα τῷ ἀδελφῷ αὐτοῦ.
γυναῖκα,γυνή,—,—,—,—,feminine,accusative,singular,noun,Mark 12:20,ἑπτὰ ἀδελφοὶ ἦσαν· καὶ ὁ πρῶτος ἔλαβεν,καὶ ἀποθνῄσκων οὐκ ἀφῆκεν σπέρμα·
