Result,Lemma (Greek),Tense (Logos Greek),Voice (Logos Greek),Mood (Logos Greek),Person (Logos Greek),Gender (Logos Greek),Case (Logos Greek),Number (Logos Greek),Part of Speech,Reference,Previous Context,Next Context
καλέσεις,καλέω,future,active,indicative,second person,—,—,singular,verb,Matthew 1:21,"τέξεται δὲ υἱόν, καὶ",τὸ ὄνομα αὐτοῦ Ἰησοῦν· αὐτὸς γὰρ σώσει τὸν λαὸν αὐτοῦ ἀπὸ τῶν ἁμαρτιῶν αὐτῶν.
καλέσουσιν,καλέω,future,active,indicative,third person,—,—,plural,verb,Matthew 1:23,"ἰδοὺ ἡ παρθένος ἐν γαστρὶ ἕξει καὶ τέξεται υἱόν,        καὶ","τὸ ὄνομα αὐτοῦ Ἐμμανουήλ,  ὅ ἐστιν μεθερμηνευόμενον μεθʼ ἡμῶν ὁ θεός."
ἐκάλεσεν,καλέω,aorist,active,indicative,third person,—,—,singular,verb,Matthew 1:25,καὶ οὐκ ἐγίνωσκεν αὐτὴν ἕως οὗ ἔτεκεν υἱόν· καὶ,τὸ ὄνομα αὐτοῦ Ἰησοῦν.
καλέσας,καλέω,aorist,active,participle,—,masculine,nominative,singular,verb,Matthew 2:7,Τότε Ἡρῴδης λάθρᾳ,"τοὺς μάγους ἠκρίβωσεν παρʼ αὐτῶν τὸν χρόνον τοῦ φαινομένου ἀστέρος,"
ἐκάλεσα,καλέω,aorist,active,indicative,first person,—,—,singular,verb,Matthew 2:15,ἵνα πληρωθῇ τὸ ῥηθὲν ὑπὸ κυρίου διὰ τοῦ προφήτου λέγοντος·        ἐξ Αἰγύπτου,τὸν υἱόν μου.
κληθήσεται,καλέω,future,passive,indicative,third person,—,—,singular,verb,Matthew 2:23,καὶ ἐλθὼν κατῴκησεν εἰς πόλιν λεγομένην Ναζαρέτ· ὅπως πληρωθῇ τὸ ῥηθὲν διὰ τῶν προφητῶν ὅτι Ναζωραῖος,.
ἐκάλεσεν,καλέω,aorist,active,indicative,third person,—,—,singular,verb,Matthew 4:21,"τῷ πλοίῳ μετὰ Ζεβεδαίου τοῦ πατρὸς αὐτῶν καταρτίζοντας τὰ δίκτυα αὐτῶν, καὶ",αὐτούς.
κληθήσονται,καλέω,future,passive,indicative,third person,—,—,plural,verb,Matthew 5:9,"μακάριοι οἱ εἰρηνοποιοί,        ὅτι αὐτοὶ υἱοὶ θεοῦ",.
κληθήσεται,καλέω,future,passive,indicative,third person,—,—,singular,verb,Matthew 5:19,"ὃς ἐὰν οὖν λύσῃ μίαν τῶν ἐντολῶν τούτων τῶν ἐλαχίστων καὶ διδάξῃ οὕτως τοὺς ἀνθρώπους, ἐλάχιστος","ἐν τῇ βασιλείᾳ τῶν οὐρανῶν· ὃς δʼ ἂν ποιήσῃ καὶ διδάξῃ, οὗτος μέγας"
κληθήσεται,καλέω,future,passive,indicative,third person,—,—,singular,verb,Matthew 5:19,"τῇ βασιλείᾳ τῶν οὐρανῶν· ὃς δʼ ἂν ποιήσῃ καὶ διδάξῃ, οὗτος μέγας",ἐν τῇ βασιλείᾳ τῶν οὐρανῶν.
καλέσαι,καλέω,aorist,active,infinitive,—,—,—,—,verb,Matthew 9:13,πορευθέντες δὲ μάθετε τί ἐστιν· ἔλεος θέλω καὶ οὐ θυσίαν· οὐ γὰρ ἦλθον,δικαίους ἀλλʼ ἁμαρτωλούς.
κάλεσον,καλέω,aorist,active,imperative,second person,—,—,singular,verb,Matthew 20:8,Ὀψίας δὲ γενομένης λέγει ὁ κύριος τοῦ ἀμπελῶνος τῷ ἐπιτρόπῳ αὐτοῦ·,τοὺς ἐργάτας καὶ ἀπόδος αὐτοῖς τὸν μισθὸν ἀρξάμενος ἀπὸ τῶν ἐσχάτων ἕως τῶν πρώτων.
κληθήσεται,καλέω,future,passive,indicative,third person,—,—,singular,verb,Matthew 21:13,καὶ λέγει αὐτοῖς· γέγραπται·        ὁ οἶκός μου οἶκος προσευχῆς,",           ὑμεῖς δὲ αὐτὸν ποιεῖτε σπήλαιον λῃστῶν."
καλέσαι,καλέω,aorist,active,infinitive,—,—,—,—,verb,Matthew 22:3,καὶ ἀπέστειλεν τοὺς δούλους αὐτοῦ,"τοὺς κεκλημένους εἰς τοὺς γάμους, καὶ οὐκ ἤθελον ἐλθεῖν."
κεκλημένους,καλέω,perfect,passive,participle,—,masculine,accusative,plural,verb,Matthew 22:3,καὶ ἀπέστειλεν τοὺς δούλους αὐτοῦ καλέσαι τοὺς,"εἰς τοὺς γάμους, καὶ οὐκ ἤθελον ἐλθεῖν."
κεκλημένοις,καλέω,perfect,passive,participle,—,masculine,dative,plural,verb,Matthew 22:4,πάλιν ἀπέστειλεν ἄλλους δούλους λέγων· εἴπατε τοῖς,"· ἰδοὺ τὸ ἄριστόν μου ἡτοίμακα, οἱ ταῦροί μου καὶ τὰ σιτιστὰ τεθυμένα καὶ"
κεκλημένοι,καλέω,perfect,passive,participle,—,masculine,nominative,plural,verb,Matthew 22:8,"τότε λέγει τοῖς δούλοις αὐτοῦ· ὁ μὲν γάμος ἕτοιμός ἐστιν, οἱ δὲ",οὐκ ἦσαν ἄξιοι·
καλέσατε,καλέω,aorist,active,imperative,second person,—,—,plural,verb,Matthew 22:9,πορεύεσθε οὖν ἐπὶ τὰς διεξόδους τῶν ὁδῶν καὶ ὅσους ἐὰν εὕρητε,εἰς τοὺς γάμους.
καλεῖ,καλέω,present,active,indicative,third person,—,—,singular,verb,Matthew 22:43,λέγει αὐτοῖς· πῶς οὖν Δαυὶδ ἐν πνεύματι,αὐτὸν κύριον λέγων·
καλεῖ,καλέω,present,active,indicative,third person,—,—,singular,verb,Matthew 22:45,εἰ οὖν Δαυὶδ,"αὐτὸν κύριον, πῶς υἱὸς αὐτοῦ ἐστιν;"
καλεῖσθαι,καλέω,present,passive,infinitive,—,—,—,—,verb,Matthew 23:7,καὶ τοὺς ἀσπασμοὺς ἐν ταῖς ἀγοραῖς καὶ,ὑπὸ τῶν ἀνθρώπων ῥαββί.
κληθῆτε,καλέω,aorist,passive,subjunctive,second person,—,—,plural,verb,Matthew 23:8,Ὑμεῖς δὲ μὴ,"ῥαββί· εἷς γάρ ἐστιν ὑμῶν ὁ διδάσκαλος , πάντες δὲ ὑμεῖς ἀδελφοί ἐστε."
καλέσητε,καλέω,aorist,active,subjunctive,second person,—,—,plural,verb,Matthew 23:9,καὶ πατέρα μὴ,"ὑμῶν ἐπὶ τῆς γῆς, εἷς γάρ ἐστιν ὑμῶν ὁ πατὴρ ὁ οὐράνιος."
κληθῆτε,καλέω,aorist,passive,subjunctive,second person,—,—,plural,verb,Matthew 23:10,μηδὲ,"καθηγηταί, ὅτι καθηγητὴς ὑμῶν ἐστιν εἷς ὁ Χριστός."
ἐκάλεσεν,καλέω,aorist,active,indicative,third person,—,—,singular,verb,Matthew 25:14,Ὥσπερ γὰρ ἄνθρωπος ἀποδημῶν,"τοὺς ἰδίους δούλους καὶ παρέδωκεν αὐτοῖς τὰ ὑπάρχοντα αὐτοῦ,"
ἐκλήθη,καλέω,aorist,passive,indicative,third person,—,—,singular,verb,Matthew 27:8,διὸ,ὁ ἀγρὸς ἐκεῖνος ἀγρὸς αἵματος ἕως τῆς σήμερον.
ἐκάλεσεν,καλέω,aorist,active,indicative,third person,—,—,singular,verb,Mark 1:20,καὶ εὐθὺς,αὐτούς. καὶ ἀφέντες τὸν πατέρα αὐτῶν Ζεβεδαῖον ἐν τῷ πλοίῳ μετὰ τῶν μισθωτῶν ἀπῆλθον ὀπίσω αὐτοῦ.
καλέσαι,καλέω,aorist,active,infinitive,—,—,—,—,verb,Mark 2:17,οὐ χρείαν ἔχουσιν οἱ ἰσχύοντες ἰατροῦ ἀλλʼ οἱ κακῶς ἔχοντες· οὐκ ἦλθον,δικαίους ἀλλʼ ἁμαρτωλούς.
καλοῦντες,καλέω,present,active,participle,—,masculine,nominative,plural,verb,Mark 3:31,Καὶ ἔρχεται ἡ μήτηρ αὐτοῦ καὶ οἱ ἀδελφοὶ αὐτοῦ καὶ ἔξω στήκοντες ἀπέστειλαν πρὸς αὐτὸν,αὐτόν.
κληθήσεται,καλέω,future,passive,indicative,third person,—,—,singular,verb,Mark 11:17,καὶ ἐδίδασκεν καὶ ἔλεγεν αὐτοῖς· οὐ γέγραπται ὅτι      ὁ οἶκός μου οἶκος προσευχῆς,πᾶσιν τοῖς ἔθνεσιν;  ὑμεῖς δὲ πεποιήκατε αὐτὸν σπήλαιον λῃστῶν.
καλέσεις,καλέω,future,active,indicative,second person,—,—,singular,verb,Luke 1:13,"ἡ δέησίς σου,        καὶ ἡ γυνή σου Ἐλισάβετ γεννήσει υἱόν σοι        καὶ",τὸ ὄνομα αὐτοῦ Ἰωάννην.
καλέσεις,καλέω,future,active,indicative,second person,—,—,singular,verb,Luke 1:31,καὶ ἰδοὺ συλλήμψῃ ἐν γαστρὶ καὶ τέξῃ υἱὸν      καὶ,τὸ ὄνομα αὐτοῦ Ἰησοῦν.
κληθήσεται,καλέω,future,passive,indicative,third person,—,—,singular,verb,Luke 1:32,οὗτος ἔσται μέγας καὶ υἱὸς ὑψίστου,"καὶ δώσει αὐτῷ κύριος ὁ θεὸς τὸν θρόνον Δαυὶδ τοῦ πατρὸς αὐτοῦ,"
κληθήσεται,καλέω,future,passive,indicative,third person,—,—,singular,verb,Luke 1:35,ἐπὶ σὲ        καὶ δύναμις ὑψίστου ἐπισκιάσει σοι·      διὸ καὶ τὸ γεννώμενον  ἅγιον,υἱὸς θεοῦ.
καλουμένῃ,καλέω,present,passive,participle,—,feminine,dative,singular,verb,Luke 1:36,συνείληφεν υἱὸν ἐν γήρει αὐτῆς καὶ οὗτος μὴν ἕκτος ἐστὶν αὐτῇ τῇ,στείρᾳ·
ἐκάλουν,καλέω,imperfect,active,indicative,third person,—,—,plural,verb,Luke 1:59,Καὶ ἐγένετο ἐν τῇ ἡμέρᾳ τῇ ὀγδόῃ ἦλθον περιτεμεῖν τὸ παιδίον καὶ,αὐτὸ ἐπὶ τῷ ὀνόματι τοῦ πατρὸς αὐτοῦ Ζαχαρίαν.
κληθήσεται,καλέω,future,passive,indicative,third person,—,—,singular,verb,Luke 1:60,"καὶ ἀποκριθεῖσα ἡ μήτηρ αὐτοῦ εἶπεν· οὐχί, ἀλλὰ",Ἰωάννης.
καλεῖται,καλέω,present,passive,indicative,third person,—,—,singular,verb,Luke 1:61,καὶ εἶπαν πρὸς αὐτὴν ὅτι οὐδείς ἐστιν ἐκ τῆς συγγενείας σου ὃς,τῷ ὀνόματι τούτῳ.
καλεῖσθαι,καλέω,present,passive,infinitive,—,—,—,—,verb,Luke 1:62,ἐνένευον δὲ τῷ πατρὶ αὐτοῦ τὸ τί ἂν θέλοι,αὐτό.
κληθήσῃ,καλέω,future,passive,indicative,second person,—,—,singular,verb,Luke 1:76,"Καὶ σὺ δέ, παιδίον, προφήτης ὑψίστου","·           προπορεύσῃ γὰρ ἐνώπιον κυρίου ἑτοιμάσαι ὁδοὺς αὐτοῦ,"
καλεῖται,καλέω,present,passive,indicative,third person,—,—,singular,verb,Luke 2:4,Ἀνέβη δὲ καὶ Ἰωσὴφ ἀπὸ τῆς Γαλιλαίας ἐκ πόλεως Ναζαρὲθ εἰς τὴν Ἰουδαίαν εἰς πόλιν Δαυὶδ ἥτις,"Βηθλέεμ, διὰ τὸ εἶναι αὐτὸν ἐξ οἴκου καὶ πατριᾶς Δαυίδ,"
ἐκλήθη,καλέω,aorist,passive,indicative,third person,—,—,singular,verb,Luke 2:21,Καὶ ὅτε ἐπλήσθησαν ἡμέραι ὀκτὼ τοῦ περιτεμεῖν αὐτὸν καὶ,"τὸ ὄνομα αὐτοῦ Ἰησοῦς, τὸ κληθὲν ὑπὸ τοῦ ἀγγέλου πρὸ τοῦ συλλημφθῆναι αὐτὸν ἐν τῇ κοιλίᾳ."
κληθὲν,καλέω,aorist,passive,participle,—,neuter,nominative,singular,verb,Luke 2:21,"Καὶ ὅτε ἐπλήσθησαν ἡμέραι ὀκτὼ τοῦ περιτεμεῖν αὐτὸν καὶ ἐκλήθη τὸ ὄνομα αὐτοῦ Ἰησοῦς, τὸ",ὑπὸ τοῦ ἀγγέλου πρὸ τοῦ συλλημφθῆναι αὐτὸν ἐν τῇ κοιλίᾳ.
κληθήσεται,καλέω,future,passive,indicative,third person,—,—,singular,verb,Luke 2:23,καθὼς γέγραπται ἐν νόμῳ κυρίου ὅτι πᾶν ἄρσεν διανοῖγον μήτραν ἅγιον τῷ κυρίῳ,","
καλέσαι,καλέω,aorist,active,infinitive,—,—,—,—,verb,Luke 5:32,οὐκ ἐλήλυθα,δικαίους ἀλλʼ ἁμαρτωλοὺς εἰς μετάνοιαν.
καλούμενον,καλέω,present,passive,participle,—,masculine,accusative,singular,verb,Luke 6:15,καὶ Μαθθαῖον καὶ Θωμᾶν  καὶ Ἰάκωβον Ἁλφαίου καὶ Σίμωνα τὸν,ζηλωτὴν
καλεῖτε,καλέω,present,active,indicative,second person,—,—,plural,verb,Luke 6:46,Τί δέ με,"· κύριε κύριε, καὶ οὐ ποιεῖτε ἃ λέγω;"
καλουμένην,καλέω,present,passive,participle,—,feminine,accusative,singular,verb,Luke 7:11,Καὶ ἐγένετο ἐν τῷ ἑξῆς ἐπορεύθη εἰς πόλιν,Ναῒν καὶ συνεπορεύοντο αὐτῷ οἱ μαθηταὶ αὐτοῦ  καὶ ὄχλος πολύς.
καλέσας,καλέω,aorist,active,participle,—,masculine,nominative,singular,verb,Luke 7:39,ἰδὼν δὲ ὁ Φαρισαῖος ὁ,"αὐτὸν εἶπεν ἐν ἑαυτῷ λέγων· οὗτος εἰ ἦν  προφήτης, ἐγίνωσκεν ἂν τίς καὶ"
καλουμένη,καλέω,present,passive,participle,—,feminine,nominative,singular,verb,Luke 8:2,"καὶ γυναῖκές τινες αἳ ἦσαν τεθεραπευμέναι ἀπὸ πνευμάτων πονηρῶν καὶ ἀσθενειῶν, Μαρία ἡ","Μαγδαληνή, ἀφʼ ἧς δαιμόνια ἑπτὰ ἐξεληλύθει,"
καλουμένην,καλέω,present,passive,participle,—,feminine,accusative,singular,verb,Luke 9:10,Καὶ ὑποστρέψαντες οἱ ἀπόστολοι διηγήσαντο αὐτῷ ὅσα ἐποίησαν. Καὶ παραλαβὼν αὐτοὺς ὑπεχώρησεν κατʼ ἰδίαν εἰς πόλιν,Βηθσαϊδά.
καλουμένη,καλέω,present,passive,participle,—,feminine,nominative,singular,verb,Luke 10:39,καὶ τῇδε ἦν ἀδελφὴ,"Μαριάμ, [ἣ] καὶ παρακαθεσθεῖσα πρὸς τοὺς πόδας τοῦ κυρίου ἤκουεν τὸν λόγον αὐτοῦ."
κεκλημένους,καλέω,perfect,passive,participle,—,masculine,accusative,plural,verb,Luke 14:7,Ἔλεγεν δὲ πρὸς τοὺς,"παραβολήν, ἐπέχων πῶς τὰς πρωτοκλισίας ἐξελέγοντο, λέγων πρὸς αὐτούς·"
κληθῇς,καλέω,aorist,passive,subjunctive,second person,—,—,singular,verb,Luke 14:8,ὅταν,"ὑπό τινος εἰς γάμους, μὴ κατακλιθῇς εἰς τὴν πρωτοκλισίαν, μήποτε ἐντιμότερός σου ᾖ κεκλημένος ὑπʼ αὐτοῦ,"
κεκλημένος,καλέω,perfect,passive,participle,—,masculine,nominative,singular,verb,Luke 14:8,"ὅταν κληθῇς ὑπό τινος εἰς γάμους, μὴ κατακλιθῇς εἰς τὴν πρωτοκλισίαν, μήποτε ἐντιμότερός σου ᾖ","ὑπʼ αὐτοῦ,"
καλέσας,καλέω,aorist,active,participle,—,masculine,nominative,singular,verb,Luke 14:9,καὶ ἐλθὼν ὁ σὲ καὶ αὐτὸν,"ἐρεῖ σοι· δὸς τούτῳ τόπον, καὶ τότε ἄρξῃ μετὰ αἰσχύνης τὸν ἔσχατον τόπον κατέχειν."
κληθῇς,καλέω,aorist,passive,subjunctive,second person,—,—,singular,verb,Luke 14:10,ἀλλʼ ὅταν,", πορευθεὶς ἀνάπεσε εἰς τὸν ἔσχατον τόπον, ἵνα ὅταν ἔλθῃ ὁ κεκληκώς σε ἐρεῖ"
κεκληκώς,καλέω,perfect,active,participle,—,masculine,nominative,singular,verb,Luke 14:10,"ἀλλʼ ὅταν κληθῇς, πορευθεὶς ἀνάπεσε εἰς τὸν ἔσχατον τόπον, ἵνα ὅταν ἔλθῃ ὁ","σε ἐρεῖ σοι· φίλε, προσανάβηθι ἀνώτερον· τότε ἔσται σοι δόξα ἐνώπιον πάντων τῶν συνανακειμένων σοι."
κεκληκότι,καλέω,perfect,active,participle,—,masculine,dative,singular,verb,Luke 14:12,Ἔλεγεν δὲ καὶ τῷ,"αὐτόν· ὅταν ποιῇς ἄριστον ἢ δεῖπνον, μὴ φώνει τοὺς φίλους σου μηδὲ τοὺς"
κάλει,καλέω,present,active,imperative,second person,—,—,singular,verb,Luke 14:13,"ἀλλʼ ὅταν δοχὴν ποιῇς,","πτωχούς, ἀναπείρους, χωλούς, τυφλούς·"
ἐκάλεσεν,καλέω,aorist,active,indicative,third person,—,—,singular,verb,Luke 14:16,"Ὁ δὲ εἶπεν αὐτῷ· ἄνθρωπός τις ἐποίει δεῖπνον μέγα, καὶ",πολλοὺς
κεκλημένοις,καλέω,perfect,passive,participle,—,masculine,dative,plural,verb,Luke 14:17,καὶ ἀπέστειλεν τὸν δοῦλον αὐτοῦ τῇ ὥρᾳ τοῦ δείπνου εἰπεῖν τοῖς,"· ἔρχεσθε, ὅτι ἤδη ἕτοιμά ἐστιν."
κεκλημένων,καλέω,perfect,passive,participle,—,masculine,genitive,plural,verb,Luke 14:24,λέγω γὰρ ὑμῖν ὅτι οὐδεὶς τῶν ἀνδρῶν ἐκείνων τῶν,γεύσεταί μου τοῦ δείπνου.
κληθῆναι,καλέω,aorist,passive,infinitive,—,—,—,—,verb,Luke 15:19,οὐκέτι εἰμὶ ἄξιος,υἱός σου· ποίησόν με ὡς ἕνα τῶν μισθίων σου.
κληθῆναι,καλέω,aorist,passive,infinitive,—,—,—,—,verb,Luke 15:21,"εἶπεν δὲ ὁ υἱὸς αὐτῷ· πάτερ, ἥμαρτον εἰς τὸν οὐρανὸν καὶ ἐνώπιόν σου, οὐκέτι εἰμὶ ἄξιος",υἱός σου.
καλούμενος,καλέω,present,passive,participle,—,masculine,nominative,singular,verb,Luke 19:2,Καὶ ἰδοὺ ἀνὴρ ὀνόματι,"Ζακχαῖος, καὶ αὐτὸς ἦν ἀρχιτελώνης καὶ αὐτὸς πλούσιος·"
καλέσας,καλέω,aorist,active,participle,—,masculine,nominative,singular,verb,Luke 19:13,—,δὲ δέκα δούλους ἑαυτοῦ ἔδωκεν αὐτοῖς δέκα μνᾶς καὶ εἶπεν πρὸς αὐτούς· πραγματεύσασθε ἐν ᾧ ἔρχομαι.
καλούμενον,καλέω,present,passive,participle,—,neuter,accusative,singular,verb,Luke 19:29,Καὶ ἐγένετο ὡς ἤγγισεν εἰς Βηθφαγὴ καὶ Βηθανίαν πρὸς τὸ ὄρος τὸ,"Ἐλαιῶν, ἀπέστειλεν δύο τῶν μαθητῶν"
καλεῖ,καλέω,present,active,indicative,third person,—,—,singular,verb,Luke 20:44,Δαυὶδ οὖν κύριον αὐτὸν,", καὶ πῶς αὐτοῦ υἱός ἐστιν;"
καλούμενον,καλέω,present,passive,participle,—,neuter,accusative,singular,verb,Luke 21:37,"Ἦν δὲ τὰς ἡμέρας ἐν τῷ ἱερῷ διδάσκων, τὰς δὲ νύκτας ἐξερχόμενος ηὐλίζετο εἰς τὸ ὄρος τὸ",Ἐλαιῶν·
καλούμενον,καλέω,present,passive,participle,—,masculine,accusative,singular,verb,Luke 22:3,Εἰσῆλθεν δὲ σατανᾶς εἰς Ἰούδαν τὸν,"Ἰσκαριώτην, ὄντα ἐκ τοῦ ἀριθμοῦ τῶν δώδεκα·"
καλοῦνται,καλέω,present,passive,indicative,third person,—,—,plural,verb,Luke 22:25,ὁ δὲ εἶπεν αὐτοῖς· οἱ βασιλεῖς τῶν ἐθνῶν κυριεύουσιν αὐτῶν καὶ οἱ ἐξουσιάζοντες αὐτῶν εὐεργέται,.
καλούμενον,καλέω,present,passive,participle,—,masculine,accusative,singular,verb,Luke 23:33,Καὶ ὅτε ἦλθον ἐπὶ τὸν τόπον τὸν,"Κρανίον, ἐκεῖ ἐσταύρωσαν αὐτὸν  καὶ τοὺς κακούργους , ὃν μὲν ἐκ δεξιῶν ὃν δὲ ἐξ ἀριστερῶν."
κληθήσῃ,καλέω,future,passive,indicative,second person,—,—,singular,verb,John 1:42,"ἤγαγεν αὐτὸν πρὸς τὸν Ἰησοῦν. ἐμβλέψας αὐτῷ ὁ Ἰησοῦς εἶπεν· σὺ εἶ Σίμων ὁ υἱὸς Ἰωάννου, σὺ","Κηφᾶς, ὃ ἑρμηνεύεται Πέτρος."
ἐκλήθη,καλέω,aorist,passive,indicative,third person,—,—,singular,verb,John 2:2,—,δὲ καὶ ὁ Ἰησοῦς καὶ οἱ μαθηταὶ αὐτοῦ εἰς τὸν γάμον.
καλουμένου,καλέω,present,passive,participle,—,neuter,genitive,singular,verb,Acts 1:12,Τότε ὑπέστρεψαν εἰς Ἰερουσαλὴμ ἀπὸ ὄρους τοῦ,"Ἐλαιῶνος, ὅ ἐστιν ἐγγὺς Ἰερουσαλὴμ σαββάτου ἔχον ὁδόν."
κληθῆναι,καλέω,aorist,passive,infinitive,—,—,—,—,verb,Acts 1:19,"καὶ γνωστὸν ἐγένετο πᾶσιν τοῖς κατοικοῦσιν Ἰερουσαλήμ, ὥστε","τὸ χωρίον ἐκεῖνο τῇ ἰδίᾳ διαλέκτῳ αὐτῶν Ἁκελδαμάχ, τοῦτʼ ἔστιν χωρίον αἵματος."
καλούμενον,καλέω,present,passive,participle,—,masculine,accusative,singular,verb,Acts 1:23,"Καὶ  ἔστησαν δύο, Ἰωσὴφ τὸν","Βαρσαββᾶν ὃς ἐπεκλήθη Ἰοῦστος, καὶ Μαθθίαν."
καλουμένῃ,καλέω,present,passive,participle,—,feminine,dative,singular,verb,Acts 3:11,Κρατοῦντος δὲ αὐτοῦ τὸν Πέτρον καὶ τὸν Ἰωάννην συνέδραμεν πᾶς ὁ λαὸς πρὸς αὐτοὺς ἐπὶ τῇ στοᾷ τῇ,Σολομῶντος ἔκθαμβοι.
καλέσαντες,καλέω,aorist,active,participle,—,masculine,nominative,plural,verb,Acts 4:18,Καὶ,αὐτοὺς παρήγγειλαν τὸ καθόλου μὴ φθέγγεσθαι μηδὲ διδάσκειν ἐπὶ τῷ ὀνόματι τοῦ Ἰησοῦ.
καλουμένου,καλέω,present,passive,participle,—,masculine,genitive,singular,verb,Acts 7:58,καὶ ἐκβαλόντες ἔξω τῆς πόλεως ἐλιθοβόλουν. καὶ οἱ μάρτυρες ἀπέθεντο τὰ ἱμάτια αὐτῶν παρὰ τοὺς πόδας νεανίου,"Σαύλου,"
καλουμένη,καλέω,present,passive,participle,—,feminine,nominative,singular,verb,Acts 8:10,ᾧ προσεῖχον πάντες ἀπὸ μικροῦ ἕως μεγάλου λέγοντες· οὗτός ἐστιν ἡ δύναμις τοῦ θεοῦ ἡ,μεγάλη.
καλουμένην,καλέω,present,passive,participle,—,feminine,accusative,singular,verb,Acts 9:11,ὁ δὲ κύριος πρὸς αὐτόν· ἀναστὰς πορεύθητι ἐπὶ τὴν ῥύμην τὴν,Εὐθεῖαν καὶ ζήτησον ἐν οἰκίᾳ Ἰούδα Σαῦλον ὀνόματι Ταρσέα· ἰδοὺ γὰρ προσεύχεται
καλουμένης,καλέω,present,passive,participle,—,feminine,genitive,singular,verb,Acts 10:1,"Ἀνὴρ δέ τις  ἐν Καισαρείᾳ ὀνόματι Κορνήλιος, ἑκατοντάρχης ἐκ σπείρης τῆς","Ἰταλικῆς,"
καλούμενος,καλέω,present,passive,participle,—,masculine,nominative,singular,verb,Acts 13:1,Ἦσαν δὲ  ἐν Ἀντιοχείᾳ κατὰ τὴν οὖσαν ἐκκλησίαν προφῆται καὶ διδάσκαλοι ὅ τε Βαρναβᾶς καὶ Συμεὼν ὁ,"Νίγερ καὶ Λούκιος ὁ Κυρηναῖος, Μαναήν τε Ἡρῴδου τοῦ τετραάρχου σύντροφος καὶ Σαῦλος."
ἐκάλουν,καλέω,imperfect,active,indicative,third person,—,—,plural,verb,Acts 14:12,—,"τε τὸν Βαρναβᾶν Δία, τὸν δὲ Παῦλον Ἑρμῆν, ἐπειδὴ αὐτὸς ἦν ὁ ἡγούμενος τοῦ λόγου."
καλούμενον,καλέω,present,passive,participle,—,masculine,accusative,singular,verb,Acts 15:22,"ἐξ αὐτῶν πέμψαι εἰς Ἀντιόχειαν σὺν τῷ Παύλῳ καὶ Βαρναβᾷ, Ἰούδαν τὸν","Βαρσαββᾶν καὶ Σιλᾶν, ἄνδρας ἡγουμένους ἐν τοῖς ἀδελφοῖς,"
καλούμενον,καλέω,present,passive,participle,—,masculine,accusative,singular,verb,Acts 15:37,Βαρναβᾶς δὲ ἐβούλετο συμπαραλαβεῖν καὶ τὸν Ἰωάννην τὸν,Μᾶρκον·
κληθέντος,καλέω,aorist,passive,participle,—,masculine,genitive,singular,verb,Acts 24:2,—,δὲ αὐτοῦ ἤρξατο κατηγορεῖν ὁ Τέρτυλλος λέγων· πολλῆς εἰρήνης τυγχάνοντες διὰ σοῦ καὶ
