Result,Lemma (Greek),Tense (Logos Greek),Voice (Logos Greek),Mood (Logos Greek),Person (Logos Greek),Gender (Logos Greek),Case (Logos Greek),Number (Logos Greek),Part of Speech,Reference,Previous Context,Next Context
ἠρώτουν,ἐρωτάω,imperfect,active,indicative,third person,—,—,plural,verb,Matthew 15:23,ὁ δὲ οὐκ ἀπεκρίθη αὐτῇ λόγον. καὶ προσελθόντες οἱ μαθηταὶ αὐτοῦ,"αὐτὸν λέγοντες· ἀπόλυσον αὐτήν, ὅτι κράζει ὄπισθεν ἡμῶν."
ἠρώτα,ἐρωτάω,imperfect,active,indicative,third person,—,—,singular,verb,Matthew 16:13,Ἐλθὼν δὲ ὁ Ἰησοῦς εἰς τὰ μέρη Καισαρείας τῆς Φιλίππου,τοὺς μαθητὰς αὐτοῦ λέγων· τίνα  λέγουσιν οἱ ἄνθρωποι εἶναι τὸν υἱὸν τοῦ ἀνθρώπου;
ἐρωτᾷς,ἐρωτάω,present,active,indicative,second person,—,—,singular,verb,Matthew 19:17,ὁ δὲ εἶπεν αὐτῷ· τί με,"περὶ τοῦ ἀγαθοῦ; εἷς ἐστιν ὁ ἀγαθός · εἰ δὲ θέλεις εἰς τὴν ζωὴν εἰσελθεῖν, τήρησον τὰς ἐντολάς."
ἐρωτήσω,ἐρωτάω,future,active,indicative,first person,—,—,singular,verb,Matthew 21:24,ἀποκριθεὶς δὲ ὁ Ἰησοῦς εἶπεν αὐτοῖς·,"ὑμᾶς κἀγὼ λόγον ἕνα, ὃν ἐὰν εἴπητέ μοι κἀγὼ ὑμῖν ἐρῶ ἐν ποίᾳ ἐξουσίᾳ ταῦτα ποιῶ·"
ἠρώτων,ἐρωτάω,imperfect,active,indicative,third person,—,—,plural,verb,Mark 4:10,"Καὶ ὅτε ἐγένετο κατὰ μόνας,",αὐτὸν οἱ περὶ αὐτὸν σὺν τοῖς δώδεκα τὰς παραβολάς.
ἠρώτα,ἐρωτάω,imperfect,active,indicative,third person,—,—,singular,verb,Mark 7:26,"ἡ δὲ γυνὴ ἦν Ἑλληνίς, Συροφοινίκισσα τῷ γένει· καὶ",αὐτὸν ἵνα τὸ δαιμόνιον ἐκβάλῃ ἐκ τῆς θυγατρὸς αὐτῆς.
ἠρώτα,ἐρωτάω,imperfect,active,indicative,third person,—,—,singular,verb,Mark 8:5,καὶ,αὐτούς· πόσους ἔχετε ἄρτους; οἱ δὲ εἶπαν· ἑπτά.
ἠρώτησαν,ἐρωτάω,aorist,active,indicative,third person,—,—,plural,verb,Luke 4:38,τὴν οἰκίαν Σίμωνος . πενθερὰ δὲ τοῦ Σίμωνος ἦν συνεχομένη πυρετῷ μεγάλῳ καὶ,αὐτὸν περὶ αὐτῆς.
ἠρώτησεν,ἐρωτάω,aorist,active,indicative,third person,—,—,singular,verb,Luke 5:3,"ἐμβὰς δὲ εἰς ἓν τῶν πλοίων, ὃ ἦν  Σίμωνος,",αὐτὸν ἀπὸ τῆς γῆς ἐπαναγαγεῖν ὀλίγον· καθίσας δὲ ἐκ τοῦ πλοίου ἐδίδασκεν τοὺς ὄχλους.
ἐρωτῶν,ἐρωτάω,present,active,participle,—,masculine,nominative,singular,verb,Luke 7:3,ἀκούσας δὲ περὶ τοῦ Ἰησοῦ ἀπέστειλεν πρὸς αὐτὸν πρεσβυτέρους τῶν Ἰουδαίων,αὐτὸν ὅπως ἐλθὼν διασώσῃ τὸν δοῦλον αὐτοῦ.
Ἠρώτα,ἐρωτάω,imperfect,active,indicative,third person,—,—,singular,verb,Luke 7:36,—,"δέ τις αὐτὸν τῶν Φαρισαίων ἵνα φάγῃ μετʼ αὐτοῦ, καὶ εἰσελθὼν εἰς τὸν οἶκον τοῦ Φαρισαίου κατεκλίθη."
ἠρώτησεν,ἐρωτάω,aorist,active,indicative,third person,—,—,singular,verb,Luke 8:37,καὶ,"αὐτὸν ἅπαν τὸ πλῆθος τῆς περιχώρου τῶν Γερασηνῶν ἀπελθεῖν ἀπʼ αὐτῶν, ὅτι φόβῳ"
ἐρωτῆσαι,ἐρωτάω,aorist,active,infinitive,—,—,—,—,verb,Luke 9:45,"οἱ δὲ ἠγνόουν τὸ ῥῆμα τοῦτο καὶ ἦν παρακεκαλυμμένον ἀπʼ αὐτῶν ἵνα μὴ αἴσθωνται αὐτό, καὶ ἐφοβοῦντο",αὐτὸν περὶ τοῦ ῥήματος τούτου.
ἐρωτᾷ,ἐρωτάω,present,active,indicative,third person,—,—,singular,verb,Luke 11:37,Ἐν δὲ τῷ λαλῆσαι,αὐτὸν Φαρισαῖος  ὅπως ἀριστήσῃ παρʼ αὐτῷ· εἰσελθὼν δὲ ἀνέπεσεν.
ἐρωτῶ,ἐρωτάω,present,active,indicative,first person,—,—,singular,verb,Luke 14:18,καὶ ἤρξαντο ἀπὸ μιᾶς πάντες παραιτεῖσθαι. ὁ πρῶτος εἶπεν αὐτῷ· ἀγρὸν ἠγόρασα καὶ ἔχω ἀνάγκην ἐξελθὼν ἰδεῖν αὐτόν·,"σε, ἔχε με παρῃτημένον."
ἐρωτῶ,ἐρωτάω,present,active,indicative,first person,—,—,singular,verb,Luke 14:19,καὶ ἕτερος εἶπεν· ζεύγη βοῶν ἠγόρασα πέντε καὶ πορεύομαι δοκιμάσαι αὐτά·,"σε, ἔχε με παρῃτημένον."
ἐρωτᾷ,ἐρωτάω,present,active,indicative,third person,—,—,singular,verb,Luke 14:32,"εἰ δὲ μή γε, ἔτι αὐτοῦ πόρρω ὄντος πρεσβείαν ἀποστείλας",τὰ πρὸς εἰρήνην.
ἐρωτῶ,ἐρωτάω,present,active,indicative,first person,—,—,singular,verb,Luke 16:27,εἶπεν δέ·,"σε οὖν, πάτερ , ἵνα πέμψῃς αὐτὸν εἰς τὸν οἶκον τοῦ πατρός μου,"
ἐρωτᾷ,ἐρωτάω,present,active,subjunctive,third person,—,—,singular,verb,Luke 19:31,καὶ ἐάν τις ὑμᾶς,· διὰ τί λύετε; οὕτως ἐρεῖτε· ὅτι ὁ κύριος αὐτοῦ χρείαν ἔχει.
ἐρωτήσω,ἐρωτάω,future,active,indicative,first person,—,—,singular,verb,Luke 20:3,ἀποκριθεὶς δὲ εἶπεν πρὸς αὐτούς·,"ὑμᾶς κἀγὼ λόγον, καὶ εἴπατέ μοι·"
ἐρωτήσω,ἐρωτάω,aorist,active,subjunctive,first person,—,—,singular,verb,Luke 22:68,ἐὰν δὲ,", οὐ μὴ ἀποκριθῆτε."
ἠρώτησεν,ἐρωτάω,aorist,active,indicative,third person,—,—,singular,verb,Luke 23:3,ὁ δὲ Πιλᾶτος,αὐτὸν λέγων· σὺ εἶ ὁ βασιλεὺς τῶν Ἰουδαίων; ὁ δὲ ἀποκριθεὶς αὐτῷ ἔφη· σὺ λέγεις.
ἐρωτήσωσιν,ἐρωτάω,aorist,active,subjunctive,third person,—,—,plural,verb,John 1:19,ὅτε ἀπέστειλαν [πρὸς αὐτὸν] οἱ Ἰουδαῖοι ἐξ Ἱεροσολύμων ἱερεῖς καὶ Λευίτας ἵνα,αὐτόν· σὺ τίς εἶ;
ἠρώτησαν,ἐρωτάω,aorist,active,indicative,third person,—,—,plural,verb,John 1:21,καὶ,αὐτόν· τί οὖν; σὺ Ἠλίας εἶ; καὶ λέγει· οὐκ εἰμί. ὁ προφήτης εἶ σύ; καὶ ἀπεκρίθη· οὔ.
ἠρώτησαν,ἐρωτάω,aorist,active,indicative,third person,—,—,plural,verb,John 1:25,καὶ,αὐτὸν καὶ εἶπαν αὐτῷ· τί οὖν βαπτίζεις εἰ σὺ οὐκ εἶ ὁ χριστὸς
ἠρώτων,ἐρωτάω,imperfect,active,indicative,third person,—,—,plural,verb,John 4:31,Ἐν τῷ μεταξὺ,"αὐτὸν οἱ μαθηταὶ λέγοντες· ῥαββί, φάγε."
ἠρώτων,ἐρωτάω,imperfect,active,indicative,third person,—,—,plural,verb,John 4:40,"ὡς οὖν ἦλθον πρὸς αὐτὸν οἱ Σαμαρῖται,",αὐτὸν μεῖναι παρʼ αὐτοῖς· καὶ ἔμεινεν ἐκεῖ δύο ἡμέρας.
ἠρώτα,ἐρωτάω,imperfect,active,indicative,third person,—,—,singular,verb,John 4:47,οὗτος ἀκούσας ὅτι Ἰησοῦς ἥκει ἐκ τῆς Ἰουδαίας εἰς τὴν Γαλιλαίαν ἀπῆλθεν πρὸς αὐτὸν καὶ,"ἵνα καταβῇ καὶ ἰάσηται αὐτοῦ τὸν υἱόν, ἤμελλεν γὰρ ἀποθνῄσκειν."
ἠρώτησαν,ἐρωτάω,aorist,active,indicative,third person,—,—,plural,verb,John 5:12,—,αὐτόν· τίς ἐστιν ὁ ἄνθρωπος ὁ εἰπών σοι· ἆρον  καὶ περιπάτει;
ἐρωτῶντες,ἐρωτάω,present,active,participle,—,masculine,nominative,plural,verb,John 8:7,ὡς δὲ ἐπέμενον,"αὐτόν, ἀνέκυψεν καὶ εἶπεν αὐτοῖς· ὁ ἀναμάρτητος ὑμῶν πρῶτος ἐπʼ αὐτὴν βαλέτω λίθον."
ἠρώτησαν,ἐρωτάω,aorist,active,indicative,third person,—,—,plural,verb,John 9:2,καὶ,"αὐτὸν οἱ μαθηταὶ αὐτοῦ λέγοντες· ῥαββί, τίς ἥμαρτεν, οὗτος ἢ οἱ γονεῖς αὐτοῦ, ἵνα τυφλὸς γεννηθῇ;"
ἠρώτων,ἐρωτάω,imperfect,active,indicative,third person,—,—,plural,verb,John 9:15,πάλιν οὖν,αὐτὸν καὶ οἱ Φαρισαῖοι πῶς ἀνέβλεψεν. ὁ δὲ εἶπεν αὐτοῖς· πηλὸν ἐπέθηκέν μου
ἠρώτησαν,ἐρωτάω,aorist,active,indicative,third person,—,—,plural,verb,John 9:19,καὶ,"αὐτοὺς λέγοντες· οὗτός ἐστιν ὁ υἱὸς ὑμῶν, ὃν ὑμεῖς λέγετε ὅτι τυφλὸς ἐγεννήθη; πῶς οὖν βλέπει ἄρτι;"
ἐρωτήσατε,ἐρωτάω,aorist,active,imperative,second person,—,—,plural,verb,John 9:21,"πῶς δὲ νῦν βλέπει οὐκ οἴδαμεν, ἢ τίς ἤνοιξεν αὐτοῦ τοὺς ὀφθαλμοὺς ἡμεῖς οὐκ οἴδαμεν· αὐτὸν",", ἡλικίαν ἔχει, αὐτὸς περὶ ἑαυτοῦ λαλήσει."
ἠρώτων,ἐρωτάω,imperfect,active,indicative,third person,—,—,plural,verb,John 12:21,οὗτοι οὖν προσῆλθον Φιλίππῳ τῷ ἀπὸ Βηθσαϊδὰ τῆς Γαλιλαίας καὶ,"αὐτὸν λέγοντες· κύριε, θέλομεν τὸν Ἰησοῦν ἰδεῖν."
ἐρωτήσω,ἐρωτάω,future,active,indicative,first person,—,—,singular,verb,John 14:16,κἀγὼ,"τὸν πατέρα καὶ ἄλλον παράκλητον δώσει ὑμῖν, ἵνα μεθʼ ὑμῶν εἰς τὸν αἰῶνα ᾖ,"
ἐρωτᾷ,ἐρωτάω,present,active,indicative,third person,—,—,singular,verb,John 16:5,"νῦν δὲ ὑπάγω πρὸς τὸν πέμψαντά με, καὶ οὐδεὶς ἐξ ὑμῶν",με· ποῦ ὑπάγεις;
ἐρωτᾶν,ἐρωτάω,present,active,infinitive,—,—,—,—,verb,John 16:19,Ἔγνω [ὁ] Ἰησοῦς ὅτι ἤθελον αὐτὸν,", καὶ εἶπεν αὐτοῖς· περὶ τούτου ζητεῖτε μετʼ ἀλλήλων ὅτι εἶπον· μικρὸν καὶ οὐ"
ἐρωτήσετε,ἐρωτάω,future,active,indicative,second person,—,—,plural,verb,John 16:23,Καὶ ἐν ἐκείνῃ τῇ ἡμέρᾳ ἐμὲ οὐκ,"οὐδέν.  ἀμὴν ἀμὴν λέγω ὑμῖν, ἄν τι αἰτήσητε τὸν πατέρα ἐν τῷ ὀνόματί μου δώσει ὑμῖν."
ἐρωτήσω,ἐρωτάω,future,active,indicative,first person,—,—,singular,verb,John 16:26,"ἐν ἐκείνῃ τῇ ἡμέρᾳ ἐν τῷ ὀνόματί μου αἰτήσεσθε, καὶ οὐ λέγω ὑμῖν ὅτι ἐγὼ",τὸν πατέρα περὶ ὑμῶν·
ἐρωτᾷ,ἐρωτάω,present,active,subjunctive,third person,—,—,singular,verb,John 16:30,νῦν οἴδαμεν ὅτι οἶδας πάντα καὶ οὐ χρείαν ἔχεις ἵνα τίς σε,· ἐν τούτῳ πιστεύομεν ὅτι ἀπὸ θεοῦ ἐξῆλθες.
ἐρωτῶ,ἐρωτάω,present,active,indicative,first person,—,—,singular,verb,John 17:9,Ἐγὼ περὶ αὐτῶν,", οὐ περὶ τοῦ κόσμου ἐρωτῶ ἀλλὰ περὶ ὧν δέδωκάς μοι, ὅτι σοί εἰσιν,"
ἐρωτῶ,ἐρωτάω,present,active,indicative,first person,—,—,singular,verb,John 17:9,"Ἐγὼ περὶ αὐτῶν ἐρωτῶ, οὐ περὶ τοῦ κόσμου","ἀλλὰ περὶ ὧν δέδωκάς μοι, ὅτι σοί εἰσιν,"
ἐρωτῶ,ἐρωτάω,present,active,indicative,first person,—,—,singular,verb,John 17:15,οὐκ,"ἵνα ἄρῃς αὐτοὺς ἐκ τοῦ κόσμου, ἀλλʼ ἵνα τηρήσῃς αὐτοὺς ἐκ τοῦ πονηροῦ."
ἐρωτῶ,ἐρωτάω,present,active,indicative,first person,—,—,singular,verb,John 17:20,Οὐ περὶ τούτων δὲ,"μόνον, ἀλλὰ καὶ περὶ τῶν πιστευόντων διὰ τοῦ λόγου αὐτῶν εἰς ἐμέ,"
ἠρώτησεν,ἐρωτάω,aorist,active,indicative,third person,—,—,singular,verb,John 18:19,Ὁ οὖν ἀρχιερεὺς,τὸν Ἰησοῦν περὶ τῶν μαθητῶν αὐτοῦ καὶ περὶ τῆς διδαχῆς αὐτοῦ.
ἐρωτᾷς,ἐρωτάω,present,active,indicative,second person,—,—,singular,verb,John 18:21,τί με,; ἐρώτησον τοὺς ἀκηκοότας τί ἐλάλησα αὐτοῖς· ἴδε οὗτοι οἴδασιν ἃ εἶπον ἐγώ.
ἐρώτησον,ἐρωτάω,aorist,active,imperative,second person,—,—,singular,verb,John 18:21,τί με ἐρωτᾷς;,τοὺς ἀκηκοότας τί ἐλάλησα αὐτοῖς· ἴδε οὗτοι οἴδασιν ἃ εἶπον ἐγώ.
ἠρώτησαν,ἐρωτάω,aorist,active,indicative,third person,—,—,plural,verb,John 19:31,"σώματα ἐν τῷ σαββάτῳ, ἦν γὰρ μεγάλη ἡ ἡμέρα ἐκείνου τοῦ σαββάτου,",τὸν Πιλᾶτον ἵνα κατεαγῶσιν αὐτῶν τὰ σκέλη καὶ ἀρθῶσιν.
ἠρώτησεν,ἐρωτάω,aorist,active,indicative,third person,—,—,singular,verb,John 19:38,Μετὰ δὲ ταῦτα,"τὸν Πιλᾶτον  Ἰωσὴφ [ὁ] ἀπὸ Ἁριμαθαίας, ὢν μαθητὴς τοῦ Ἰησοῦ κεκρυμμένος δὲ διὰ"
ἠρώτων,ἐρωτάω,imperfect,active,indicative,third person,—,—,plural,verb,Acts 1:6,Οἱ μὲν οὖν συνελθόντες,"αὐτὸν λέγοντες· κύριε, εἰ ἐν τῷ χρόνῳ τούτῳ ἀποκαθιστάνεις τὴν βασιλείαν τῷ Ἰσραήλ;"
ἠρώτα,ἐρωτάω,imperfect,active,indicative,third person,—,—,singular,verb,Acts 3:3,"ὃς ἰδὼν Πέτρον καὶ Ἰωάννην μέλλοντας εἰσιέναι εἰς τὸ ἱερόν,",ἐλεημοσύνην λαβεῖν.
ἠρώτησαν,ἐρωτάω,aorist,active,indicative,third person,—,—,plural,verb,Acts 10:48,προσέταξεν δὲ αὐτοὺς ἐν τῷ ὀνόματι Ἰησοῦ Χριστοῦ βαπτισθῆναι. τότε,αὐτὸν ἐπιμεῖναι ἡμέρας τινάς.
ἠρώτων,ἐρωτάω,imperfect,active,indicative,third person,—,—,plural,verb,Acts 16:39,καὶ ἐλθόντες παρεκάλεσαν αὐτοὺς καὶ ἐξαγαγόντες,ἀπελθεῖν ἀπὸ τῆς πόλεως.
ἐρωτώντων,ἐρωτάω,present,active,participle,—,masculine,genitive,plural,verb,Acts 18:20,—,"δὲ αὐτῶν ἐπὶ πλείονα χρόνον μεῖναι  οὐκ ἐπένευσεν,"
ἠρώτησεν,ἐρωτάω,aorist,active,indicative,third person,—,—,singular,verb,Acts 23:18,ὁ μὲν οὖν παραλαβὼν αὐτὸν ἤγαγεν πρὸς τὸν χιλίαρχον καὶ φησίν· ὁ δέσμιος Παῦλος προσκαλεσάμενός με,τοῦτον τὸν νεανίσκον ἀγαγεῖν πρὸς σὲ ἔχοντά τι λαλῆσαί σοι.
ἐρωτῆσαί,ἐρωτάω,aorist,active,infinitive,—,—,—,—,verb,Acts 23:20,εἶπεν δὲ ὅτι οἱ Ἰουδαῖοι συνέθεντο τοῦ,σε ὅπως αὔριον τὸν Παῦλον καταγάγῃς εἰς τὸ συνέδριον ὡς μέλλον τι ἀκριβέστερον πυνθάνεσθαι περὶ αὐτοῦ.
ἐρωτῶ,ἐρωτάω,present,active,indicative,first person,—,—,singular,verb,Philippians 4:3,ναὶ,"καὶ σέ, γνήσιε σύζυγε, συλλαμβάνου αὐταῖς, αἵτινες ἐν τῷ εὐαγγελίῳ συνήθλησάν μοι μετὰ"
ἐρωτῶμεν,ἐρωτάω,present,active,indicative,first person,—,—,plural,verb,1 Thessalonians 4:1,"Λοιπὸν οὖν, ἀδελφοί,","ὑμᾶς καὶ παρακαλοῦμεν ἐν κυρίῳ Ἰησοῦ, ἵνα καθὼς παρελάβετε παρʼ ἡμῶν τὸ πῶς"
Ἐρωτῶμεν,ἐρωτάω,present,active,indicative,first person,—,—,plural,verb,1 Thessalonians 5:12,—,"δὲ ὑμᾶς, ἀδελφοί, εἰδέναι τοὺς κοπιῶντας ἐν ὑμῖν καὶ προϊσταμένους ὑμῶν ἐν κυρίῳ καὶ νουθετοῦντας ὑμᾶς"
Ἐρωτῶμεν,ἐρωτάω,present,active,indicative,first person,—,—,plural,verb,2 Thessalonians 2:1,—,"δὲ ὑμᾶς, ἀδελφοί, ὑπὲρ τῆς παρουσίας τοῦ κυρίου ἡμῶν Ἰησοῦ Χριστοῦ καὶ ἡμῶν ἐπισυναγωγῆς ἐπʼ αὐτὸν"
ἐρωτήσῃ,ἐρωτάω,aorist,active,subjunctive,third person,—,—,singular,verb,1 John 5:16,μὴ πρὸς θάνατον. ἔστιν ἁμαρτία πρὸς θάνατον· οὐ περὶ ἐκείνης λέγω ἵνα,.
ἐρωτῶ,ἐρωτάω,present,active,indicative,first person,—,—,singular,verb,2 John 5,καὶ νῦν,"σε, κυρία, οὐχ ὡς ἐντολὴν γράφων σοι καινὴν ἀλλʼ ἣν εἴχομεν ἀπʼ ἀρχῆς, ἵνα ἀγαπῶμεν ἀλλήλους."
