Result,Lemma (Greek),Tense (Logos Greek),Voice (Logos Greek),Mood (Logos Greek),Person (Logos Greek),Gender (Logos Greek),Case (Logos Greek),Number (Logos Greek),Part of Speech,Reference,Previous Context,Next Context
πονηρά,πονηρός,—,—,—,—,neuter,accusative,plural,adjective,Matthew 12:35,"ὁ ἀγαθὸς ἄνθρωπος ἐκ τοῦ ἀγαθοῦ θησαυροῦ  ἐκβάλλει  ἀγαθά, καὶ ὁ πονηρὸς ἄνθρωπος ἐκ τοῦ πονηροῦ θησαυροῦ  ἐκβάλλει",.
πονηρά,πονηρός,—,—,—,—,feminine,nominative,singular,adjective,Luke 11:29,Τῶν δὲ ὄχλων ἐπαθροιζομένων ἤρξατο λέγειν· ἡ γενεὰ αὕτη γενεὰ,"ἐστιν· σημεῖον ζητεῖ, καὶ σημεῖον οὐ δοθήσεται αὐτῇ εἰ μὴ τὸ σημεῖον Ἰωνᾶ."
πονηρά,πονηρός,—,—,—,—,neuter,nominative,plural,adjective,John 7:7,"οὐ δύναται ὁ κόσμος μισεῖν ὑμᾶς, ἐμὲ δὲ μισεῖ, ὅτι ἐγὼ μαρτυρῶ περὶ αὐτοῦ ὅτι τὰ ἔργα αὐτοῦ",ἐστιν.
πονηρά,πονηρός,—,—,—,—,feminine,nominative,singular,adjective,James 4:16,νῦν δὲ καυχᾶσθε ἐν ταῖς ἀλαζονείαις ὑμῶν· πᾶσα καύχησις τοιαύτη,ἐστιν.
πονηρέ,πονηρός,—,—,—,—,masculine,vocative,singular,adjective,Matthew 18:32,Τότε προσκαλεσάμενος αὐτὸν ὁ κύριος αὐτοῦ λέγει αὐτῷ· δοῦλε,", πᾶσαν τὴν ὀφειλὴν ἐκείνην ἀφῆκά σοι, ἐπεὶ παρεκάλεσάς με·"
πονηραί,πονηρός,—,—,—,—,feminine,nominative,plural,adjective,Ephesians 5:16,"ἐξαγοραζόμενοι τὸν καιρόν, ὅτι αἱ ἡμέραι",εἰσιν.
πονηραί,πονηρός,—,—,—,—,feminine,nominative,plural,adjective,1 Timothy 6:4,"τετύφωται, μηδὲν ἐπιστάμενος, ἀλλὰ νοσῶν περὶ ζητήσεις καὶ λογομαχίας, ἐξ ὧν γίνεται φθόνος ἔρις βλασφημίαι, ὑπόνοιαι",","
πονηροί,πονηρός,—,—,—,—,masculine,nominative,plural,adjective,Matthew 15:19,ἐκ γὰρ τῆς καρδίας ἐξέρχονται διαλογισμοὶ,", φόνοι, μοιχεῖαι, πορνεῖαι, κλοπαί, ψευδομαρτυρίαι, βλασφημίαι."
πονηρούς,πονηρός,—,—,—,—,masculine,accusative,plural,adjective,Matthew 22:10,"καὶ ἐξελθόντες οἱ δοῦλοι ἐκεῖνοι εἰς τὰς ὁδοὺς συνήγαγον πάντας οὓς εὗρον,",τε καὶ ἀγαθούς· καὶ ἐπλήσθη ὁ γάμος  ἀνακειμένων.
πονηρούς,πονηρός,—,—,—,—,masculine,accusative,plural,adjective,Luke 6:35,"καὶ ἔσεσθε υἱοὶ ὑψίστου, ὅτι αὐτὸς χρηστός ἐστιν ἐπὶ τοὺς ἀχαρίστους καὶ",.
πονηροὶ,πονηρός,—,—,—,—,masculine,nominative,plural,adjective,Matthew 7:11,εἰ οὖν ὑμεῖς,"ὄντες οἴδατε δόματα ἀγαθὰ διδόναι τοῖς τέκνοις ὑμῶν, πόσῳ μᾶλλον ὁ πατὴρ ὑμῶν"
πονηροὶ,πονηρός,—,—,—,—,masculine,nominative,plural,adjective,Matthew 12:34,"γεννήματα ἐχιδνῶν, πῶς δύνασθε ἀγαθὰ λαλεῖν",ὄντες; ἐκ γὰρ τοῦ περισσεύματος τῆς καρδίας τὸ στόμα λαλεῖ.
πονηροὶ,πονηρός,—,—,—,—,masculine,nominative,plural,adjective,Luke 11:13,εἰ οὖν ὑμεῖς,"ὑπάρχοντες οἴδατε δόματα ἀγαθὰ διδόναι τοῖς τέκνοις ὑμῶν, πόσῳ μᾶλλον ὁ πατὴρ [ὁ"
πονηροὶ,πονηρός,—,—,—,—,masculine,nominative,plural,adjective,2 Timothy 3:13,—,δὲ ἄνθρωποι καὶ γόητες προκόψουσιν ἐπὶ τὸ χεῖρον πλανῶντες καὶ πλανώμενοι.
πονηροὺς,πονηρός,—,—,—,—,masculine,accusative,plural,adjective,Matthew 5:45,"ὅπως γένησθε υἱοὶ τοῦ πατρὸς ὑμῶν τοῦ ἐν οὐρανοῖς, ὅτι τὸν ἥλιον αὐτοῦ ἀνατέλλει ἐπὶ",καὶ ἀγαθοὺς καὶ βρέχει ἐπὶ δικαίους καὶ ἀδίκους.
πονηροὺς,πονηρός,—,—,—,—,masculine,accusative,plural,adjective,Matthew 7:17,"Οὕτως πᾶν δένδρον ἀγαθὸν καρποὺς καλοὺς ποιεῖ, τὸ δὲ σαπρὸν δένδρον καρποὺς",ποιεῖ.
πονηροὺς,πονηρός,—,—,—,—,masculine,accusative,plural,adjective,Matthew 7:18,οὐ δύναται δένδρον ἀγαθὸν καρποὺς,ποιεῖν οὐδὲ δένδρον σαπρὸν καρποὺς καλοὺς ποιεῖν.
πονηροὺς,πονηρός,—,—,—,—,masculine,accusative,plural,adjective,Matthew 13:49,οὕτως ἔσται ἐν τῇ συντελείᾳ τοῦ αἰῶνος· ἐξελεύσονται οἱ ἄγγελοι καὶ ἀφοριοῦσιν τοὺς,ἐκ μέσου τῶν δικαίων
πονηροὺς,πονηρός,—,—,—,—,masculine,accusative,plural,adjective,Acts 17:5,Ζηλώσαντες δὲ οἱ Ἰουδαῖοι καὶ προσλαβόμενοι τῶν ἀγοραίων ἄνδρας τινὰς,καὶ ὀχλοποιήσαντες ἐθορύβουν τὴν πόλιν καὶ ἐπιστάντες τῇ οἰκίᾳ Ἰάσονος ἐζήτουν αὐτοὺς προαγαγεῖν εἰς τὸν δῆμον·
πονηροῖς,πονηρός,—,—,—,—,neuter,dative,plural,adjective,Colossians 1:21,Καὶ ὑμᾶς ποτε ὄντας ἀπηλλοτριωμένους καὶ ἐχθροὺς τῇ διανοίᾳ ἐν τοῖς ἔργοις τοῖς,","
πονηροῖς,πονηρός,—,—,—,—,neuter,dative,plural,adjective,2 John 11,ὁ λέγων γὰρ αὐτῷ χαίρειν κοινωνεῖ τοῖς ἔργοις αὐτοῦ τοῖς,.
πονηροῖς,πονηρός,—,—,—,—,masculine,dative,plural,adjective,3 John 10,"διὰ τοῦτο, ἐὰν ἔλθω, ὑπομνήσω αὐτοῦ τὰ ἔργα ἃ ποιεῖ λόγοις","φλυαρῶν  ἡμᾶς, καὶ μὴ ἀρκούμενος ἐπὶ τούτοις οὔτε αὐτὸς ἐπιδέχεται τοὺς ἀδελφοὺς καὶ"
πονηροῦ,πονηρός,—,—,—,—,masculine,genitive,singular,adjective,Matthew 5:37,"ἔστω δὲ ὁ λόγος ὑμῶν ναὶ ναί, οὒ οὔ· τὸ δὲ περισσὸν τούτων ἐκ τοῦ",ἐστιν.
πονηροῦ,πονηρός,—,—,—,—,masculine,genitive,singular,adjective,Matthew 6:13,"καὶ μὴ εἰσενέγκῃς ἡμᾶς εἰς πειρασμόν,        ἀλλὰ ῥῦσαι ἡμᾶς ἀπὸ τοῦ",.
πονηροῦ,πονηρός,—,—,—,—,masculine,genitive,singular,adjective,Matthew 12:35,"ὁ ἀγαθὸς ἄνθρωπος ἐκ τοῦ ἀγαθοῦ θησαυροῦ  ἐκβάλλει  ἀγαθά, καὶ ὁ πονηρὸς ἄνθρωπος ἐκ τοῦ",θησαυροῦ  ἐκβάλλει  πονηρά.
πονηροῦ,πονηρός,—,—,—,—,masculine,genitive,singular,adjective,Matthew 13:38,εἰσιν οἱ υἱοὶ τῆς βασιλείας· τὰ δὲ ζιζάνιά εἰσιν οἱ υἱοὶ τοῦ,","
πονηροῦ,πονηρός,—,—,—,—,masculine,genitive,singular,adjective,Luke 6:45,"ὁ ἀγαθὸς ἄνθρωπος ἐκ τοῦ ἀγαθοῦ θησαυροῦ τῆς καρδίας  προφέρει τὸ ἀγαθόν, καὶ ὁ πονηρὸς ἐκ τοῦ",προφέρει τὸ πονηρόν· ἐκ γὰρ περισσεύματος καρδίας λαλεῖ τὸ στόμα αὐτοῦ.
πονηροῦ,πονηρός,—,—,—,—,masculine,genitive,singular,adjective,John 17:15,"οὐκ ἐρωτῶ ἵνα ἄρῃς αὐτοὺς ἐκ τοῦ κόσμου, ἀλλʼ ἵνα τηρήσῃς αὐτοὺς ἐκ τοῦ",.
πονηροῦ,πονηρός,—,—,—,—,neuter,genitive,singular,adjective,1 Thessalonians 5:22,ἀπὸ παντὸς εἴδους,ἀπέχεσθε.
πονηροῦ,πονηρός,—,—,—,—,masculine,genitive,singular,adjective,2 Thessalonians 3:3,"Πιστὸς δέ ἐστιν ὁ κύριος, ὃς στηρίξει ὑμᾶς καὶ φυλάξει ἀπὸ τοῦ",.
πονηροῦ,πονηρός,—,—,—,—,neuter,genitive,singular,adjective,2 Timothy 4:18,ῥύσεταί με ὁ κύριος ἀπὸ παντὸς ἔργου,"καὶ σώσει εἰς τὴν βασιλείαν αὐτοῦ τὴν ἐπουράνιον· ᾧ ἡ δόξα εἰς τοὺς αἰῶνας τῶν αἰώνων, ἀμήν."
πονηροῦ,πονηρός,—,—,—,—,masculine,genitive,singular,adjective,1 John 3:12,οὐ καθὼς Κάϊν ἐκ τοῦ,ἦν καὶ ἔσφαξεν τὸν ἀδελφὸν αὐτοῦ· καὶ χάριν τίνος ἔσφαξεν αὐτόν; ὅτι τὰ
πονηροῦ,πονηρός,—,—,—,—,masculine,genitive,singular,adjective,Galatians 1:4,"τοῦ δόντος ἑαυτὸν ὑπὲρ τῶν ἁμαρτιῶν ἡμῶν, ὅπως ἐξέληται ἡμᾶς ἐκ τοῦ αἰῶνος τοῦ ἐνεστῶτος","κατὰ τὸ θέλημα τοῦ θεοῦ καὶ πατρὸς ἡμῶν,"
πονηροῦ,πονηρός,—,—,—,—,masculine,genitive,singular,adjective,Ephesians 6:16,"ἐν πᾶσιν ἀναλαβόντες τὸν θυρεὸν τῆς πίστεως, ἐν ᾧ δυνήσεσθε πάντα τὰ βέλη τοῦ",[τὰ] πεπυρωμένα σβέσαι·
πονηρόν,πονηρός,—,—,—,—,neuter,accusative,singular,adjective,Luke 6:45,"καρδίας  προφέρει τὸ ἀγαθόν, καὶ ὁ πονηρὸς ἐκ τοῦ πονηροῦ  προφέρει τὸ",· ἐκ γὰρ περισσεύματος καρδίας λαλεῖ τὸ στόμα αὐτοῦ.
πονηρόν,πονηρός,—,—,—,—,neuter,nominative,singular,adjective,Acts 18:14,ὁ Γαλλίων πρὸς τοὺς Ἰουδαίους· εἰ μὲν ἦν ἀδίκημά τι ἢ ῥᾳδιούργημα,", ὦ  Ἰουδαῖοι, κατὰ λόγον ἂν ἀνεσχόμην ὑμῶν,"
πονηρόν,πονηρός,—,—,—,—,neuter,accusative,singular,adjective,Acts 28:21,Ἰουδαίας οὔτε παραγενόμενός τις τῶν ἀδελφῶν ἀπήγγειλεν ἢ ἐλάλησέν τι περὶ σοῦ,.
πονηρόν,πονηρός,—,—,—,—,neuter,accusative,singular,adjective,Romans 12:9,Ἡ ἀγάπη ἀνυπόκριτος. ἀποστυγοῦντες τὸ,", κολλώμενοι τῷ ἀγαθῷ,"
πονηρόν,πονηρός,—,—,—,—,masculine,accusative,singular,adjective,1 John 2:13,"γράφω ὑμῖν, πατέρες, ὅτι ἐγνώκατε τὸν ἀπʼ ἀρχῆς.      γράφω ὑμῖν, νεανίσκοι, ὅτι νενικήκατε τὸν",.
πονηρόν,πονηρός,—,—,—,—,masculine,accusative,singular,adjective,1 John 2:14,ἐστε καὶ ὁ λόγος τοῦ θεοῦ ἐν ὑμῖν μένει καὶ νενικήκατε τὸν,.
πονηρόν,πονηρός,—,—,—,—,neuter,nominative,singular,adjective,Acts 19:16,καὶ ἐφαλόμενος ὁ ἄνθρωπος ἐπʼ αὐτοὺς ἐν ᾧ ἦν τὸ πνεῦμα τὸ,", κατακυριεύσας ἀμφοτέρων ἴσχυσεν κατʼ αὐτῶν ὥστε γυμνοὺς καὶ τετραυματισμένους ἐκφυγεῖν ἐκ τοῦ οἴκου ἐκείνου."
πονηρός,πονηρός,—,—,—,—,masculine,nominative,singular,adjective,Mark 7:22,"μοιχεῖαι, πλεονεξίαι, πονηρίαι, δόλος, ἀσέλγεια, ὀφθαλμὸς",", βλασφημία, ὑπερηφανία, ἀφροσύνη·"
πονηρός,πονηρός,—,—,—,—,masculine,nominative,singular,adjective,Matthew 20:15,[ἢ] οὐκ ἔξεστίν μοι ὃ θέλω ποιῆσαι ἐν τοῖς ἐμοῖς; ἢ ὁ ὀφθαλμός σου,ἐστιν ὅτι ἐγὼ ἀγαθός εἰμι;
πονηρότερα,πονηρός,—,—,—,—,neuter,accusative,plural,adjective,Matthew 12:45,τότε πορεύεται καὶ παραλαμβάνει μεθʼ ἑαυτοῦ ἑπτὰ ἕτερα πνεύματα,ἑαυτοῦ καὶ εἰσελθόντα κατοικεῖ ἐκεῖ· καὶ γίνεται τὰ ἔσχατα τοῦ ἀνθρώπου ἐκείνου χείρονα
πονηρότερα,πονηρός,—,—,—,—,neuter,accusative,plural,adjective,Luke 11:26,τότε πορεύεται καὶ παραλαμβάνει ἕτερα πνεύματα,ἑαυτοῦ ἑπτὰ καὶ εἰσελθόντα κατοικεῖ ἐκεῖ· καὶ γίνεται τὰ ἔσχατα τοῦ ἀνθρώπου ἐκείνου χείρονα τῶν πρώτων.
πονηρὰ,πονηρός,—,—,—,—,neuter,accusative,plural,adjective,Matthew 9:4,καὶ ἰδὼν ὁ Ἰησοῦς τὰς ἐνθυμήσεις αὐτῶν εἶπεν· ἱνατί  ἐνθυμεῖσθε,ἐν ταῖς καρδίαις ὑμῶν;
πονηρὰ,πονηρός,—,—,—,—,feminine,nominative,singular,adjective,Matthew 12:39,ὁ δὲ ἀποκριθεὶς εἶπεν αὐτοῖς· γενεὰ,"καὶ μοιχαλὶς σημεῖον ἐπιζητεῖ, καὶ σημεῖον οὐ δοθήσεται αὐτῇ εἰ μὴ τὸ σημεῖον Ἰωνᾶ τοῦ προφήτου."
πονηρὰ,πονηρός,—,—,—,—,feminine,nominative,singular,adjective,Matthew 16:4,γενεὰ,"καὶ μοιχαλὶς σημεῖον ἐπιζητεῖ, καὶ σημεῖον οὐ δοθήσεται αὐτῇ εἰ μὴ τὸ σημεῖον"
πονηρὰ,πονηρός,—,—,—,—,neuter,nominative,plural,adjective,Mark 7:23,πάντα ταῦτα τὰ,ἔσωθεν ἐκπορεύεται καὶ κοινοῖ τὸν ἄνθρωπον.
πονηρὰ,πονηρός,—,—,—,—,neuter,nominative,plural,adjective,John 3:19,ἠγάπησαν οἱ ἄνθρωποι μᾶλλον τὸ σκότος ἢ τὸ φῶς· ἦν γὰρ αὐτῶν,τὰ ἔργα.
πονηρὰ,πονηρός,—,—,—,—,feminine,nominative,singular,adjective,Hebrews 3:12,"Βλέπετε, ἀδελφοί, μήποτε ἔσται ἔν τινι ὑμῶν καρδία","ἀπιστίας ἐν τῷ ἀποστῆναι ἀπὸ θεοῦ ζῶντος,"
πονηρὰ,πονηρός,—,—,—,—,neuter,nominative,plural,adjective,1 John 3:12,τὸν ἀδελφὸν αὐτοῦ· καὶ χάριν τίνος ἔσφαξεν αὐτόν; ὅτι τὰ ἔργα αὐτοῦ,"ἦν, τὰ δὲ τοῦ ἀδελφοῦ αὐτοῦ δίκαια."
πονηρὰ,πονηρός,—,—,—,—,neuter,accusative,plural,adjective,Acts 19:12,"ἢ σιμικίνθια καὶ ἀπαλλάσσεσθαι ἀπʼ αὐτῶν τὰς νόσους, τά τε πνεύματα τὰ",ἐκπορεύεσθαι.
πονηρὰ,πονηρός,—,—,—,—,neuter,accusative,plural,adjective,Acts 19:13,Ἐπεχείρησαν δέ τινες καὶ τῶν περιερχομένων Ἰουδαίων ἐξορκιστῶν ὀνομάζειν ἐπὶ τοὺς ἔχοντας τὰ πνεύματα τὰ,τὸ ὄνομα τοῦ κυρίου Ἰησοῦ λέγοντες· ὁρκίζω ὑμᾶς τὸν Ἰησοῦν ὃν Παῦλος κηρύσσει.
πονηρὲ,πονηρός,—,—,—,—,masculine,vocative,singular,adjective,Matthew 25:26,Ἀποκριθεὶς δὲ ὁ κύριος αὐτοῦ εἶπεν αὐτῷ·,"δοῦλε καὶ ὀκνηρέ, ᾔδεις ὅτι θερίζω ὅπου οὐκ ἔσπειρα καὶ συνάγω ὅθεν οὐ διεσκόρπισα;"
πονηρὲ,πονηρός,—,—,—,—,masculine,vocative,singular,adjective,Luke 19:22,"λέγει αὐτῷ· ἐκ τοῦ στόματός σου κρινῶ σε,","δοῦλε. ᾔδεις ὅτι ἐγὼ ἄνθρωπος αὐστηρός εἰμι, αἴρων ὃ οὐκ ἔθηκα καὶ θερίζων ὃ οὐκ ἔσπειρα;"
πονηρὸν,πονηρός,—,—,—,—,neuter,accusative,singular,adjective,Matthew 5:11,μακάριοί ἐστε        ὅταν ὀνειδίσωσιν ὑμᾶς καὶ διώξωσιν καὶ εἴπωσιν πᾶν,καθʼ ὑμῶν [ψευδόμενοι] ἕνεκεν ἐμοῦ.
πονηρὸν,πονηρός,—,—,—,—,neuter,accusative,singular,adjective,Luke 6:22,καὶ ὅταν ἀφορίσωσιν ὑμᾶς καὶ ὀνειδίσωσιν καὶ ἐκβάλωσιν τὸ ὄνομα ὑμῶν ὡς,ἕνεκα τοῦ υἱοῦ τοῦ ἀνθρώπου·
πονηρὸν,πονηρός,—,—,—,—,masculine,accusative,singular,adjective,1 Corinthians 5:13,τοὺς δὲ ἔξω ὁ θεὸς κρινεῖ. ἐξάρατε τὸν,ἐξ ὑμῶν αὐτῶν.
πονηρὸν,πονηρός,—,—,—,—,neuter,nominative,singular,adjective,Revelation 16:2,"Καὶ ἀπῆλθεν ὁ πρῶτος καὶ ἐξέχεεν τὴν φιάλην αὐτοῦ εἰς τὴν γῆν, καὶ ἐγένετο ἕλκος κακὸν καὶ",ἐπὶ τοὺς ἀνθρώπους τοὺς ἔχοντας τὸ χάραγμα τοῦ θηρίου καὶ τοὺς προσκυνοῦντας τῇ εἰκόνι αὐτοῦ.
πονηρὸν,πονηρός,—,—,—,—,neuter,nominative,singular,adjective,Acts 19:15,ἀποκριθὲν δὲ τὸ πνεῦμα τὸ,"εἶπεν αὐτοῖς· τὸν [μὲν] Ἰησοῦν γινώσκω καὶ τὸν Παῦλον ἐπίσταμαι, ὑμεῖς δὲ τίνες ἐστέ;"
πονηρὸς,πονηρός,—,—,—,—,masculine,nominative,singular,adjective,Matthew 6:23,ἐὰν δὲ ὁ ὀφθαλμός σου,"ᾖ, ὅλον τὸ σῶμά σου σκοτεινὸν ἔσται. εἰ οὖν τὸ φῶς τὸ ἐν"
πονηρὸς,πονηρός,—,—,—,—,masculine,nominative,singular,adjective,Matthew 12:35,"ὁ ἀγαθὸς ἄνθρωπος ἐκ τοῦ ἀγαθοῦ θησαυροῦ  ἐκβάλλει  ἀγαθά, καὶ ὁ",ἄνθρωπος ἐκ τοῦ πονηροῦ θησαυροῦ  ἐκβάλλει  πονηρά.
πονηρὸς,πονηρός,—,—,—,—,masculine,nominative,singular,adjective,Matthew 13:19,παντὸς ἀκούοντος τὸν λόγον τῆς βασιλείας καὶ μὴ συνιέντος ἔρχεται ὁ,"καὶ ἁρπάζει τὸ ἐσπαρμένον ἐν τῇ καρδίᾳ αὐτοῦ, οὗτός ἐστιν ὁ παρὰ τὴν ὁδὸν σπαρείς."
πονηρὸς,πονηρός,—,—,—,—,masculine,nominative,singular,adjective,Luke 6:45,"ὁ ἀγαθὸς ἄνθρωπος ἐκ τοῦ ἀγαθοῦ θησαυροῦ τῆς καρδίας  προφέρει τὸ ἀγαθόν, καὶ ὁ",ἐκ τοῦ πονηροῦ  προφέρει τὸ πονηρόν· ἐκ γὰρ περισσεύματος καρδίας λαλεῖ τὸ στόμα αὐτοῦ.
πονηρὸς,πονηρός,—,—,—,—,masculine,nominative,singular,adjective,Luke 11:34,"σου ἁπλοῦς ᾖ, καὶ ὅλον τὸ σῶμά σου φωτεινόν ἐστιν· ἐπὰν δὲ","ᾖ, καὶ τὸ σῶμά σου σκοτεινόν."
πονηρὸς,πονηρός,—,—,—,—,masculine,nominative,singular,adjective,1 John 5:18,"οὐχ ἁμαρτάνει, ἀλλʼ ὁ γεννηθεὶς ἐκ τοῦ θεοῦ τηρεῖ ἑαυτὸν καὶ ὁ",οὐχ ἅπτεται αὐτοῦ.
πονηρᾶς,πονηρός,—,—,—,—,feminine,genitive,singular,adjective,Hebrews 10:22,προσερχώμεθα μετὰ ἀληθινῆς καρδίας ἐν πληροφορίᾳ πίστεως ῥεραντισμένοι τὰς καρδίας ἀπὸ συνειδήσεως,καὶ λελουσμένοι τὸ σῶμα ὕδατι καθαρῷ·
πονηρᾷ,πονηρός,—,—,—,—,feminine,dative,singular,adjective,Matthew 12:45,ἀνθρώπου ἐκείνου χείρονα τῶν πρώτων. οὕτως ἔσται καὶ τῇ γενεᾷ ταύτῃ τῇ,.
πονηρᾷ,πονηρός,—,—,—,—,feminine,dative,singular,adjective,Ephesians 6:13,"διὰ τοῦτο ἀναλάβετε τὴν πανοπλίαν τοῦ θεοῦ, ἵνα δυνηθῆτε ἀντιστῆναι ἐν τῇ ἡμέρᾳ τῇ",καὶ ἅπαντα κατεργασάμενοι στῆναι.
πονηρῶν,πονηρός,—,—,—,—,neuter,genitive,plural,adjective,Luke 3:19,περὶ Ἡρῳδιάδος τῆς γυναικὸς  τοῦ ἀδελφοῦ αὐτοῦ καὶ περὶ πάντων ὧν ἐποίησεν,"ὁ Ἡρῴδης,"
πονηρῶν,πονηρός,—,—,—,—,neuter,genitive,plural,adjective,Acts 25:18,περὶ οὗ σταθέντες οἱ κατήγοροι οὐδεμίαν αἰτίαν ἔφερον ὧν ἐγὼ ὑπενόουν,","
πονηρῶν,πονηρός,—,—,—,—,masculine,genitive,plural,adjective,2 Thessalonians 3:2,καὶ ἵνα ῥυσθῶμεν ἀπὸ τῶν ἀτόπων καὶ,ἀνθρώπων· οὐ γὰρ πάντων ἡ πίστις.
πονηρῶν,πονηρός,—,—,—,—,masculine,genitive,plural,adjective,James 2:4,καὶ οὐ διεκρίθητε ἐν ἑαυτοῖς καὶ ἐγένεσθε κριταὶ διαλογισμῶν,;
πονηρῶν,πονηρός,—,—,—,—,neuter,genitive,plural,adjective,Luke 7:21,ἐν ἐκείνῃ τῇ ὥρᾳ ἐθεράπευσεν πολλοὺς ἀπὸ νόσων καὶ μαστίγων καὶ πνευμάτων,καὶ τυφλοῖς πολλοῖς ἐχαρίσατο βλέπειν.
πονηρῶν,πονηρός,—,—,—,—,neuter,genitive,plural,adjective,Luke 8:2,καὶ γυναῖκές τινες αἳ ἦσαν τεθεραπευμέναι ἀπὸ πνευμάτων,"καὶ ἀσθενειῶν, Μαρία ἡ καλουμένη Μαγδαληνή, ἀφʼ ἧς δαιμόνια ἑπτὰ ἐξεληλύθει,"
πονηρῷ,πονηρός,—,—,—,—,masculine,dative,singular,adjective,Matthew 5:39,ἐγὼ δὲ λέγω ὑμῖν μὴ ἀντιστῆναι τῷ,"· ἀλλʼ ὅστις σε ῥαπίζει εἰς τὴν δεξιὰν σιαγόνα [σου], στρέψον αὐτῷ καὶ τὴν ἄλλην·"
πονηρῷ,πονηρός,—,—,—,—,masculine,dative,singular,adjective,1 John 5:19,οἴδαμεν ὅτι ἐκ τοῦ θεοῦ ἐσμεν καὶ ὁ κόσμος ὅλος ἐν τῷ,κεῖται.
