Result,Lemma (Greek),Tense (Logos Greek),Voice (Logos Greek),Mood (Logos Greek),Person (Logos Greek),Gender (Logos Greek),Case (Logos Greek),Number (Logos Greek),Part of Speech,Reference,Previous Context,Next Context
ἑαυτοῦ,ἑαυτοῦ,—,—,—,third person,masculine,genitive,singular,pronoun,Revelation 10:7,"ὅταν μέλλῃ σαλπίζειν, καὶ ἐτελέσθη τὸ μυστήριον τοῦ θεοῦ, ὡς εὐηγγέλισεν τοὺς",δούλους τοὺς προφήτας.  Καὶ
ἑαυτοῦ,ἑαυτοῦ,—,—,—,third person,"neuter, masculine",genitive,singular,pronoun,Matthew 12:45,τότε πορεύεται καὶ παραλαμβάνει μεθʼ,ἑπτὰ ἕτερα πνεύματα πονηρότερα ἑαυτοῦ καὶ εἰσελθόντα κατοικεῖ ἐκεῖ· καὶ γίνεται τὰ ἔσχατα
ἑαυτοῦ,ἑαυτοῦ,—,—,—,third person,"neuter, masculine",genitive,singular,pronoun,Matthew 12:45,τότε πορεύεται καὶ παραλαμβάνει μεθʼ ἑαυτοῦ ἑπτὰ ἕτερα πνεύματα πονηρότερα,καὶ εἰσελθόντα κατοικεῖ ἐκεῖ· καὶ γίνεται τὰ ἔσχατα τοῦ ἀνθρώπου ἐκείνου χείρονα τῶν
ἑαυτόν,ἑαυτοῦ,—,—,—,third person,masculine,accusative,singular,pronoun,Luke 23:35,"Καὶ εἱστήκει ὁ λαὸς θεωρῶν.  ἐξεμυκτήριζον δὲ καὶ οἱ ἄρχοντες λέγοντες· ἄλλους ἔσωσεν, σωσάτω",", εἰ οὗτός ἐστιν ὁ χριστὸς τοῦ θεοῦ ὁ ἐκλεκτός."
ἑαυτόν,ἑαυτοῦ,—,—,—,third person,masculine,accusative,singular,pronoun,John 8:22,ἔλεγον οὖν οἱ Ἰουδαῖοι· μήτι ἀποκτενεῖ,", ὅτι λέγει· ὅπου ἐγὼ ὑπάγω ὑμεῖς οὐ δύνασθε ἐλθεῖν;"
ἑαυτόν,ἑαυτοῦ,—,—,—,third person,masculine,accusative,singular,pronoun,John 13:4,ἐγείρεται ἐκ τοῦ δείπνου καὶ τίθησιν τὰ ἱμάτια καὶ λαβὼν λέντιον διέζωσεν,·
ἑαυτόν,ἑαυτοῦ,—,—,—,third person,masculine,accusative,singular,pronoun,Acts 5:36,πρὸ γὰρ τούτων τῶν ἡμερῶν ἀνέστη Θευδᾶς λέγων εἶναί τινα,", ᾧ προσεκλίθη ἀνδρῶν ἀριθμὸς ὡς τετρακοσίων· ὃς ἀνῃρέθη , καὶ πάντες ὅσοι ἐπείθοντο αὐτῷ"
ἑαυτόν,ἑαυτοῦ,—,—,—,third person,masculine,accusative,singular,pronoun,Galatians 6:3,"εἰ γὰρ δοκεῖ τις εἶναί τι μηδὲν ὤν, φρεναπατᾷ",.
ἑαυτόν,ἑαυτοῦ,—,—,—,third person,masculine,accusative,singular,pronoun,Ephesians 5:33,"πλὴν καὶ ὑμεῖς οἱ καθʼ ἕνα, ἕκαστος τὴν ἑαυτοῦ γυναῖκα οὕτως ἀγαπάτω ὡς",", ἡ δὲ γυνὴ ἵνα φοβῆται τὸν ἄνδρα."
ἑαυτόν,ἑαυτοῦ,—,—,—,third person,masculine,accusative,singular,pronoun,Hebrews 9:25,οὐδʼ ἵνα πολλάκις προσφέρῃ,", ὥσπερ ὁ ἀρχιερεὺς εἰσέρχεται εἰς τὰ ἅγια  κατʼ ἐνιαυτὸν ἐν αἵματι ἀλλοτρίῳ,"
ἑαυτόν,ἑαυτοῦ,—,—,—,third person,masculine,accusative,singular,pronoun,1 John 3:3,καὶ πᾶς ὁ ἔχων τὴν ἐλπίδα ταύτην ἐπʼ αὐτῷ ἁγνίζει,", καθὼς ἐκεῖνος ἁγνός ἐστιν."
ἑαυτὰ,ἑαυτοῦ,—,—,—,second person,neuter,accusative,plural,pronoun,1 John 5:21,"Τεκνία, φυλάξατε",ἀπὸ τῶν εἰδώλων.
ἑαυτὰς,ἑαυτοῦ,—,—,—,second person,feminine,accusative,plural,pronoun,Luke 23:28,"στραφεὶς δὲ πρὸς αὐτὰς [ὁ] Ἰησοῦς εἶπεν· θυγατέρες Ἰερουσαλήμ, μὴ κλαίετε ἐπʼ ἐμέ· πλὴν ἐφʼ","κλαίετε καὶ ἐπὶ τὰ τέκνα ὑμῶν,"
ἑαυτὰς,ἑαυτοῦ,—,—,—,third person,feminine,accusative,plural,pronoun,1 Peter 3:5,οὕτως γάρ ποτε καὶ αἱ ἅγιαι γυναῖκες αἱ ἐλπίζουσαι εἰς θεὸν ἐκόσμουν,"ὑποτασσόμεναι τοῖς ἰδίοις ἀνδράσιν,"
ἑαυτὴν,ἑαυτοῦ,—,—,—,third person,feminine,accusative,singular,pronoun,Mark 3:24,καὶ ἐὰν βασιλεία ἐφʼ,"μερισθῇ, οὐ δύναται σταθῆναι ἡ βασιλεία ἐκείνη·"
ἑαυτὴν,ἑαυτοῦ,—,—,—,third person,feminine,accusative,singular,pronoun,Mark 3:25,καὶ ἐὰν οἰκία ἐφʼ,"μερισθῇ, οὐ δυνήσεται ἡ οἰκία ἐκείνη σταθῆναι."
ἑαυτὴν,ἑαυτοῦ,—,—,—,third person,feminine,accusative,singular,pronoun,Luke 1:24,Μετὰ δὲ ταύτας τὰς ἡμέρας συνέλαβεν Ἐλισάβετ ἡ γυνὴ αὐτοῦ καὶ περιέκρυβεν,μῆνας πέντε λέγουσα
ἑαυτὴν,ἑαυτοῦ,—,—,—,third person,feminine,accusative,singular,pronoun,Luke 11:17,αὐτὸς δὲ εἰδὼς αὐτῶν τὰ διανοήματα εἶπεν αὐτοῖς· πᾶσα βασιλεία ἐφʼ,διαμερισθεῖσα ἐρημοῦται καὶ οἶκος ἐπὶ οἶκον πίπτει.
ἑαυτὴν,ἑαυτοῦ,—,—,—,third person,feminine,accusative,singular,pronoun,Revelation 2:20,"ἀλλʼ ἔχω κατὰ σοῦ  ὅτι ἀφεῖς τὴν γυναῖκα  Ἰεζάβελ, ἡ λέγουσα",προφῆτιν  καὶ διδάσκει καὶ πλανᾷ τοὺς ἐμοὺς δούλους πορνεῦσαι καὶ φαγεῖν εἰδωλόθυτα.
ἑαυτὴν,ἑαυτοῦ,—,—,—,third person,feminine,accusative,singular,pronoun,Revelation 19:7,"αὐτῷ,      ὅτι ἦλθεν ὁ γάμος τοῦ ἀρνίου  καὶ ἡ γυνὴ αὐτοῦ ἡτοίμασεν",""
ἑαυτὸν,ἑαυτοῦ,—,—,—,third person,masculine,accusative,singular,pronoun,Matthew 12:26,"καὶ εἰ ὁ σατανᾶς τὸν σατανᾶν ἐκβάλλει, ἐφʼ",ἐμερίσθη· πῶς οὖν σταθήσεται ἡ βασιλεία αὐτοῦ;
ἑαυτὸν,ἑαυτοῦ,—,—,—,third person,masculine,accusative,singular,pronoun,Matthew 16:24,"Τότε ὁ Ἰησοῦς εἶπεν τοῖς μαθηταῖς αὐτοῦ· εἴ τις θέλει ὀπίσω μου ἐλθεῖν, ἀπαρνησάσθω",καὶ ἀράτω τὸν σταυρὸν αὐτοῦ καὶ ἀκολουθείτω μοι.
ἑαυτὸν,ἑαυτοῦ,—,—,—,third person,masculine,accusative,singular,pronoun,Matthew 18:4,ὅστις οὖν ταπεινώσει,"ὡς τὸ παιδίον τοῦτο, οὗτός ἐστιν ὁ μείζων ἐν τῇ βασιλείᾳ τῶν οὐρανῶν."
ἑαυτὸν,ἑαυτοῦ,—,—,—,third person,masculine,accusative,singular,pronoun,Matthew 23:12,ὅστις δὲ ὑψώσει,ταπεινωθήσεται καὶ ὅστις ταπεινώσει ἑαυτὸν ὑψωθήσεται.
ἑαυτὸν,ἑαυτοῦ,—,—,—,third person,masculine,accusative,singular,pronoun,Matthew 23:12,ὅστις δὲ ὑψώσει ἑαυτὸν ταπεινωθήσεται καὶ ὅστις ταπεινώσει,ὑψωθήσεται.
ἑαυτὸν,ἑαυτοῦ,—,—,—,third person,masculine,accusative,singular,pronoun,Matthew 27:42,"ἄλλους ἔσωσεν,","οὐ δύναται σῶσαι*· βασιλεὺς Ἰσραήλ ἐστιν, καταβάτω νῦν ἀπὸ τοῦ σταυροῦ καὶ πιστεύσομεν ἐπʼ αὐτόν."
ἑαυτὸν,ἑαυτοῦ,—,—,—,third person,masculine,accusative,singular,pronoun,Mark 3:26,καὶ εἰ ὁ σατανᾶς ἀνέστη ἐφʼ,"καὶ ἐμερίσθη, οὐ δύναται στῆναι ἀλλὰ τέλος ἔχει."
ἑαυτὸν,ἑαυτοῦ,—,—,—,third person,masculine,accusative,singular,pronoun,Mark 5:5,καὶ διὰ παντὸς νυκτὸς καὶ ἡμέρας ἐν τοῖς μνήμασιν καὶ ἐν τοῖς ὄρεσιν ἦν κράζων καὶ κατακόπτων,λίθοις.
ἑαυτὸν,ἑαυτοῦ,—,—,—,third person,masculine,accusative,singular,pronoun,Mark 8:34,"Καὶ προσκαλεσάμενος τὸν ὄχλον σὺν τοῖς μαθηταῖς αὐτοῦ εἶπεν αὐτοῖς· εἴ τις θέλει ὀπίσω μου ἀκολουθεῖν, ἀπαρνησάσθω",καὶ ἀράτω τὸν σταυρὸν αὐτοῦ καὶ ἀκολουθείτω μοι.
ἑαυτὸν,ἑαυτοῦ,—,—,—,third person,masculine,accusative,singular,pronoun,Mark 12:33,συνέσεως καὶ ἐξ ὅλης τῆς ἰσχύος καὶ τὸ ἀγαπᾶν τὸν πλησίον ὡς,περισσότερόν ἐστιν πάντων τῶν ὁλοκαυτωμάτων καὶ  θυσιῶν.
ἑαυτὸν,ἑαυτοῦ,—,—,—,third person,masculine,accusative,singular,pronoun,Mark 15:31,"ὁμοίως καὶ οἱ ἀρχιερεῖς ἐμπαίζοντες πρὸς ἀλλήλους μετὰ τῶν γραμματέων ἔλεγον· ἄλλους ἔσωσεν,",οὐ δύναται σῶσαι·
ἑαυτὸν,ἑαυτοῦ,—,—,—,third person,masculine,accusative,singular,pronoun,Luke 9:23,"Ἔλεγεν δὲ πρὸς πάντας· εἴ τις θέλει ὀπίσω μου ἔρχεσθαι, ἀρνησάσθω",καὶ ἀράτω τὸν σταυρὸν αὐτοῦ καθʼ ἡμέραν καὶ ἀκολουθείτω μοι.
ἑαυτὸν,ἑαυτοῦ,—,—,—,third person,masculine,accusative,singular,pronoun,Luke 9:25,τί γὰρ ὠφελεῖται ἄνθρωπος κερδήσας τὸν κόσμον ὅλον,δὲ ἀπολέσας ἢ ζημιωθείς;
ἑαυτὸν,ἑαυτοῦ,—,—,—,third person,masculine,accusative,singular,pronoun,Luke 10:29,ὁ δὲ θέλων δικαιῶσαι,εἶπεν πρὸς τὸν Ἰησοῦν· καὶ τίς ἐστίν μου πλησίον;
ἑαυτὸν,ἑαυτοῦ,—,—,—,third person,masculine,accusative,singular,pronoun,Luke 11:18,εἰ δὲ καὶ ὁ σατανᾶς ἐφʼ,"διεμερίσθη, πῶς σταθήσεται ἡ βασιλεία αὐτοῦ; ὅτι λέγετε ἐν Βεελζεβοὺλ ἐκβάλλειν με τὰ δαιμόνια."
ἑαυτὸν,ἑαυτοῦ,—,—,—,third person,masculine,accusative,singular,pronoun,Luke 14:11,ὅτι πᾶς ὁ ὑψῶν,"ταπεινωθήσεται, καὶ ὁ ταπεινῶν ἑαυτὸν ὑψωθήσεται."
ἑαυτὸν,ἑαυτοῦ,—,—,—,third person,masculine,accusative,singular,pronoun,Luke 14:11,"ὅτι πᾶς ὁ ὑψῶν ἑαυτὸν ταπεινωθήσεται, καὶ ὁ ταπεινῶν",ὑψωθήσεται.
ἑαυτὸν,ἑαυτοῦ,—,—,—,third person,masculine,accusative,singular,pronoun,Luke 15:17,εἰς,"δὲ ἐλθὼν ἔφη· πόσοι μίσθιοι τοῦ πατρός μου περισσεύονται ἄρτων, ἐγὼ δὲ λιμῷ ὧδε ἀπόλλυμαι."
ἑαυτὸν,ἑαυτοῦ,—,—,—,third person,masculine,accusative,singular,pronoun,Luke 18:11,ὁ Φαρισαῖος σταθεὶς πρὸς,"ταῦτα προσηύχετο· ὁ θεός, εὐχαριστῶ σοι ὅτι οὐκ εἰμὶ ὥσπερ οἱ λοιποὶ τῶν"
ἑαυτὸν,ἑαυτοῦ,—,—,—,third person,masculine,accusative,singular,pronoun,Luke 18:14,"λέγω ὑμῖν, κατέβη οὗτος δεδικαιωμένος εἰς τὸν οἶκον αὐτοῦ παρʼ ἐκεῖνον· ὅτι πᾶς ὁ ὑψῶν","ταπεινωθήσεται, ὁ δὲ ταπεινῶν ἑαυτὸν ὑψωθήσεται."
ἑαυτὸν,ἑαυτοῦ,—,—,—,third person,masculine,accusative,singular,pronoun,Luke 18:14,"αὐτοῦ παρʼ ἐκεῖνον· ὅτι πᾶς ὁ ὑψῶν ἑαυτὸν ταπεινωθήσεται, ὁ δὲ ταπεινῶν",ὑψωθήσεται.
ἑαυτὸν,ἑαυτοῦ,—,—,—,third person,masculine,accusative,singular,pronoun,Luke 23:2,Ἤρξαντο δὲ κατηγορεῖν αὐτοῦ λέγοντες· τοῦτον εὕραμεν διαστρέφοντα τὸ ἔθνος ἡμῶν  καὶ κωλύοντα φόρους Καίσαρι διδόναι  καὶ λέγοντα,χριστὸν βασιλέα εἶναι.
ἑαυτὸν,ἑαυτοῦ,—,—,—,third person,masculine,accusative,singular,pronoun,Luke 24:12,"Ὁ δὲ Πέτρος ἀναστὰς ἔδραμεν ἐπὶ τὸ μνημεῖον καὶ παρακύψας βλέπει τὰ ὀθόνια  μόνα, καὶ ἀπῆλθεν πρὸς",θαυμάζων τὸ γεγονός.
ἑαυτὸν,ἑαυτοῦ,—,—,—,third person,masculine,accusative,singular,pronoun,John 5:18,"μόνον ἔλυεν τὸ σάββατον, ἀλλὰ καὶ πατέρα ἴδιον ἔλεγεν τὸν θεὸν ἴσον",ποιῶν τῷ θεῷ.
ἑαυτὸν,ἑαυτοῦ,—,—,—,third person,masculine,accusative,singular,pronoun,John 11:33,"Ἰησοῦς οὖν ὡς εἶδεν αὐτὴν κλαίουσαν καὶ τοὺς συνελθόντας αὐτῇ Ἰουδαίους κλαίοντας, ἐνεβριμήσατο τῷ πνεύματι καὶ ἐτάραξεν",⸅
ἑαυτὸν,ἑαυτοῦ,—,—,—,third person,masculine,accusative,singular,pronoun,John 19:7,"ἀπεκρίθησαν αὐτῷ οἱ Ἰουδαῖοι· ἡμεῖς νόμον ἔχομεν καὶ κατὰ τὸν νόμον  ὀφείλει ἀποθανεῖν, ὅτι υἱὸν θεοῦ",ἐποίησεν.
ἑαυτὸν,ἑαυτοῦ,—,—,—,third person,masculine,accusative,singular,pronoun,John 19:12,"λέγοντες· ἐὰν τοῦτον ἀπολύσῃς, οὐκ εἶ φίλος τοῦ Καίσαρος· πᾶς ὁ βασιλέα",ποιῶν ἀντιλέγει τῷ Καίσαρι.
ἑαυτὸν,ἑαυτοῦ,—,—,—,third person,masculine,accusative,singular,pronoun,John 21:1,Μετὰ ταῦτα ἐφανέρωσεν,πάλιν ὁ Ἰησοῦς τοῖς μαθηταῖς  ἐπὶ τῆς θαλάσσης τῆς Τιβεριάδος· ἐφανέρωσεν δὲ οὕτως.
ἑαυτὸν,ἑαυτοῦ,—,—,—,third person,masculine,accusative,singular,pronoun,John 21:7,"ὅτι ὁ κύριός ἐστιν τὸν ἐπενδύτην διεζώσατο, ἦν γὰρ γυμνός, καὶ ἔβαλεν","εἰς τὴν θάλασσαν,"
ἑαυτὸν,ἑαυτοῦ,—,—,—,third person,masculine,accusative,singular,pronoun,Acts 1:3,Οἷς καὶ παρέστησεν,"ζῶντα μετὰ τὸ παθεῖν αὐτὸν ἐν πολλοῖς τεκμηρίοις, διʼ ἡμερῶν τεσσεράκοντα ὀπτανόμενος αὐτοῖς"
ἑαυτὸν,ἑαυτοῦ,—,—,—,third person,masculine,accusative,singular,pronoun,Acts 8:9,"τῇ πόλει μαγεύων καὶ ἐξιστάνων τὸ ἔθνος τῆς Σαμαρείας, λέγων εἶναί τινα","μέγαν,"
ἑαυτὸν,ἑαυτοῦ,—,—,—,third person,masculine,accusative,singular,pronoun,Acts 16:27,"ἔξυπνος δὲ γενόμενος ὁ δεσμοφύλαξ  καὶ ἰδὼν ἀνεῳγμένας τὰς θύρας τῆς φυλακῆς, σπασάμενος [τὴν] μάχαιραν ἤμελλεν",ἀναιρεῖν νομίζων ἐκπεφευγέναι τοὺς δεσμίους.
ἑαυτὸν,ἑαυτοῦ,—,—,—,third person,masculine,accusative,singular,pronoun,Acts 19:31,"τινὲς δὲ καὶ τῶν Ἀσιαρχῶν, ὄντες αὐτῷ φίλοι, πέμψαντες πρὸς αὐτὸν παρεκάλουν μὴ δοῦναι",εἰς τὸ θέατρον.
ἑαυτὸν,ἑαυτοῦ,—,—,—,third person,masculine,accusative,singular,pronoun,Acts 25:4,"ὁ μὲν οὖν Φῆστος ἀπεκρίθη τηρεῖσθαι τὸν Παῦλον εἰς Καισάρειαν,",δὲ μέλλειν ἐν τάχει ἐκπορεύεσθαι·
ἑαυτὸν,ἑαυτοῦ,—,—,—,third person,masculine,accusative,singular,pronoun,Acts 28:16,"Ὅτε δὲ εἰσήλθομεν εἰς  Ῥώμην, ἐπετράπη τῷ Παύλῳ μένειν καθʼ",σὺν τῷ φυλάσσοντι αὐτὸν στρατιώτῃ.
ἑαυτὸν,ἑαυτοῦ,—,—,—,third person,masculine,accusative,singular,pronoun,Romans 14:22,σὺ πίστιν [ἣν] ἔχεις κατὰ σεαυτὸν ἔχε ἐνώπιον τοῦ θεοῦ. μακάριος ὁ μὴ κρίνων,ἐν ᾧ δοκιμάζει·
ἑαυτὸν,ἑαυτοῦ,—,—,—,third person,masculine,accusative,singular,pronoun,1 Corinthians 3:18,Μηδεὶς,"ἐξαπατάτω·  εἴ τις δοκεῖ σοφὸς εἶναι ἐν ὑμῖν ἐν τῷ αἰῶνι τούτῳ, μωρὸς γενέσθω, ἵνα γένηται σοφός."
ἑαυτὸν,ἑαυτοῦ,—,—,—,third person,masculine,accusative,singular,pronoun,1 Corinthians 11:28,δοκιμαζέτω δὲ ἄνθρωπος,καὶ οὕτως ἐκ τοῦ ἄρτου ἐσθιέτω καὶ ἐκ τοῦ ποτηρίου πινέτω·
ἑαυτὸν,ἑαυτοῦ,—,—,—,third person,masculine,accusative,singular,pronoun,1 Corinthians 14:4,ὁ λαλῶν γλώσσῃ,οἰκοδομεῖ· ὁ δὲ προφητεύων ἐκκλησίαν  οἰκοδομεῖ.
ἑαυτὸν,ἑαυτοῦ,—,—,—,third person,masculine,accusative,singular,pronoun,2 Corinthians 10:18,οὐ γὰρ ὁ,"συνιστάνων, ἐκεῖνός ἐστιν δόκιμος, ἀλλʼ ὃν ὁ κύριος συνίστησιν."
ἑαυτὸν,ἑαυτοῦ,—,—,—,third person,masculine,accusative,singular,pronoun,Galatians 1:4,τοῦ δόντος,"ὑπὲρ τῶν ἁμαρτιῶν ἡμῶν, ὅπως ἐξέληται ἡμᾶς ἐκ τοῦ αἰῶνος τοῦ ἐνεστῶτος πονηροῦ"
ἑαυτὸν,ἑαυτοῦ,—,—,—,third person,masculine,accusative,singular,pronoun,Galatians 2:12,"πρὸ τοῦ γὰρ ἐλθεῖν τινας ἀπὸ Ἰακώβου μετὰ τῶν ἐθνῶν συνήσθιεν· ὅτε δὲ ἦλθον, ὑπέστελλεν καὶ ἀφώριζεν",φοβούμενος τοὺς ἐκ περιτομῆς.
ἑαυτὸν,ἑαυτοῦ,—,—,—,third person,masculine,accusative,singular,pronoun,Galatians 2:20,πίστει ζῶ τῇ τοῦ υἱοῦ τοῦ θεοῦ τοῦ ἀγαπήσαντός με καὶ παραδόντος,ὑπὲρ ἐμοῦ.
ἑαυτὸν,ἑαυτοῦ,—,—,—,third person,masculine,accusative,singular,pronoun,Galatians 6:4,"τὸ δὲ ἔργον ἑαυτοῦ δοκιμαζέτω ἕκαστος, καὶ τότε εἰς",μόνον τὸ καύχημα ἕξει καὶ οὐκ εἰς τὸν ἕτερον·
ἑαυτὸν,ἑαυτοῦ,—,—,—,third person,masculine,accusative,singular,pronoun,Ephesians 5:2,"καὶ περιπατεῖτε ἐν ἀγάπῃ, καθὼς καὶ ὁ Χριστὸς ἠγάπησεν ἡμᾶς καὶ παρέδωκεν",ὑπὲρ ἡμῶν προσφορὰν καὶ θυσίαν τῷ θεῷ εἰς ὀσμὴν εὐωδίας.
ἑαυτὸν,ἑαυτοῦ,—,—,—,third person,masculine,accusative,singular,pronoun,Ephesians 5:25,"Οἱ ἄνδρες, ἀγαπᾶτε τὰς γυναῖκας, καθὼς καὶ ὁ Χριστὸς ἠγάπησεν τὴν ἐκκλησίαν καὶ","παρέδωκεν ὑπὲρ αὐτῆς,"
ἑαυτὸν,ἑαυτοῦ,—,—,—,third person,masculine,accusative,singular,pronoun,Ephesians 5:28,οὕτως ὀφείλουσιν [καὶ] οἱ ἄνδρες ἀγαπᾶν τὰς ἑαυτῶν γυναῖκας ὡς τὰ ἑαυτῶν σώματα. ὁ ἀγαπῶν τὴν ἑαυτοῦ γυναῖκα,ἀγαπᾷ.
ἑαυτὸν,ἑαυτοῦ,—,—,—,third person,masculine,accusative,singular,pronoun,Philippians 2:7,ἀλλʼ,"ἐκένωσεν           μορφὴν δούλου λαβών,        ἐν ὁμοιώματι ἀνθρώπων γενόμενος·           καὶ σχήματι εὑρεθεὶς ὡς ἄνθρωπος"
ἑαυτὸν,ἑαυτοῦ,—,—,—,third person,masculine,accusative,singular,pronoun,Philippians 2:8,ἐταπείνωσεν,"γενόμενος ὑπήκοος μέχρι θανάτου,           θανάτου δὲ σταυροῦ."
ἑαυτὸν,ἑαυτοῦ,—,—,—,third person,masculine,accusative,singular,pronoun,2 Thessalonians 2:4,"θεὸν ἢ σέβασμα, ὥστε αὐτὸν εἰς τὸν ναὸν τοῦ θεοῦ  καθίσαι ἀποδεικνύντα",ὅτι ἐστὶν θεός.
ἑαυτὸν,ἑαυτοῦ,—,—,—,third person,masculine,accusative,singular,pronoun,1 Timothy 2:6,ὁ δοὺς,"ἀντίλυτρον ὑπὲρ πάντων,        τὸ μαρτύριον καιροῖς ἰδίοις."
ἑαυτὸν,ἑαυτοῦ,—,—,—,third person,masculine,accusative,singular,pronoun,2 Timothy 2:13,"εἰ ἀπιστοῦμεν, ἐκεῖνος πιστὸς μένει,        ἀρνήσασθαι γὰρ",οὐ δύναται.
ἑαυτὸν,ἑαυτοῦ,—,—,—,third person,masculine,accusative,singular,pronoun,2 Timothy 2:21,ἐὰν οὖν τις ἐκκαθάρῃ,"ἀπὸ τούτων, ἔσται σκεῦος εἰς τιμήν, ἡγιασμένον,  εὔχρηστον τῷ δεσπότῃ, εἰς πᾶν ἔργον ἀγαθὸν ἡτοιμασμένον."
ἑαυτὸν,ἑαυτοῦ,—,—,—,third person,masculine,accusative,singular,pronoun,Titus 2:14,ὃς ἔδωκεν,"ὑπὲρ ἡμῶν, ἵνα λυτρώσηται ἡμᾶς ἀπὸ πάσης ἀνομίας καὶ καθαρίσῃ ἑαυτῷ λαὸν περιούσιον, ζηλωτὴν καλῶν ἔργων."
ἑαυτὸν,ἑαυτοῦ,—,—,—,third person,masculine,accusative,singular,pronoun,Hebrews 5:5,Οὕτως καὶ ὁ Χριστὸς οὐχ,"ἐδόξασεν γενηθῆναι ἀρχιερέα ἀλλʼ ὁ λαλήσας πρὸς αὐτόν·      υἱός μου εἶ σύ, ἐγὼ σήμερον γεγέννηκά σε·"
ἑαυτὸν,ἑαυτοῦ,—,—,—,third person,masculine,accusative,singular,pronoun,Hebrews 7:27,ἰδίων ἁμαρτιῶν θυσίας ἀναφέρειν ἔπειτα τῶν τοῦ λαοῦ· τοῦτο γὰρ ἐποίησεν ἐφάπαξ,ἀνενέγκας.
ἑαυτὸν,ἑαυτοῦ,—,—,—,third person,masculine,accusative,singular,pronoun,Hebrews 9:14,"πόσῳ μᾶλλον τὸ αἷμα τοῦ Χριστοῦ, ὃς διὰ πνεύματος αἰωνίου","προσήνεγκεν ἄμωμον τῷ θεῷ, καθαριεῖ τὴν συνείδησιν ἡμῶν ἀπὸ νεκρῶν ἔργων εἰς τὸ λατρεύειν θεῷ ζῶντι."
ἑαυτὸν,ἑαυτοῦ,—,—,—,third person,masculine,accusative,singular,pronoun,Hebrews 12:3,ἀναλογίσασθε γὰρ τὸν τοιαύτην ὑπομεμενηκότα ὑπὸ τῶν ἁμαρτωλῶν εἰς,"ἀντιλογίαν, ἵνα μὴ κάμητε ταῖς ψυχαῖς ὑμῶν ἐκλυόμενοι."
ἑαυτὸν,ἑαυτοῦ,—,—,—,third person,masculine,accusative,singular,pronoun,James 1:24,κατενόησεν γὰρ,καὶ ἀπελήλυθεν καὶ εὐθέως ἐπελάθετο ὁποῖος ἦν.
ἑαυτὸν,ἑαυτοῦ,—,—,—,third person,masculine,accusative,singular,pronoun,James 1:27,"πατρὶ αὕτη ἐστίν, ἐπισκέπτεσθαι ὀρφανοὺς καὶ χήρας ἐν τῇ θλίψει αὐτῶν, ἄσπιλον",τηρεῖν ἀπὸ τοῦ κόσμου.
ἑαυτὸν,ἑαυτοῦ,—,—,—,third person,masculine,accusative,singular,pronoun,1 John 5:18,"Οἴδαμεν ὅτι πᾶς ὁ γεγεννημένος ἐκ τοῦ θεοῦ οὐχ ἁμαρτάνει, ἀλλʼ ὁ γεννηθεὶς ἐκ τοῦ θεοῦ τηρεῖ",καὶ ὁ πονηρὸς οὐχ ἅπτεται αὐτοῦ.
ἑαυτῆς,ἑαυτοῦ,—,—,—,third person,feminine,genitive,singular,pronoun,Matthew 6:34,"Μὴ οὖν μεριμνήσητε εἰς τὴν αὔριον, ἡ γὰρ αὔριον μεριμνήσει",· ἀρκετὸν τῇ ἡμέρᾳ ἡ κακία αὐτῆς.
ἑαυτῆς,ἑαυτοῦ,—,—,—,third person,feminine,genitive,singular,pronoun,Matthew 12:25,Εἰδὼς δὲ τὰς ἐνθυμήσεις αὐτῶν εἶπεν αὐτοῖς· πᾶσα βασιλεία μερισθεῖσα καθʼ,ἐρημοῦται καὶ πᾶσα πόλις ἢ οἰκία μερισθεῖσα καθʼ ἑαυτῆς οὐ σταθήσεται.
ἑαυτῆς,ἑαυτοῦ,—,—,—,third person,feminine,genitive,singular,pronoun,Matthew 12:25,βασιλεία μερισθεῖσα καθʼ ἑαυτῆς ἐρημοῦται καὶ πᾶσα πόλις ἢ οἰκία μερισθεῖσα καθʼ,οὐ σταθήσεται.
