Result,Lemma (Greek),Tense (Logos Greek),Voice (Logos Greek),Mood (Logos Greek),Person (Logos Greek),Gender (Logos Greek),Case (Logos Greek),Number (Logos Greek),Part of Speech,Reference,Previous Context,Next Context
ἑαυτῆς,ἑαυτοῦ,—,—,—,third person,feminine,genitive,singular,pronoun,Luke 13:34,"πρὸς αὐτήν, ποσάκις ἠθέλησα ἐπισυνάξαι τὰ τέκνα σου ὃν τρόπον ὄρνις τὴν","νοσσιὰν ὑπὸ τὰς πτέρυγας, καὶ οὐκ ἠθελήσατε."
ἑαυτῆς,ἑαυτοῦ,—,—,—,third person,feminine,genitive,singular,pronoun,1 Corinthians 13:5,"οὐκ ἀσχημονεῖ, οὐ ζητεῖ τὰ",", οὐ παροξύνεται, οὐ λογίζεται τὸ κακόν,"
ἑαυτῆς,ἑαυτοῦ,—,—,—,third person,feminine,genitive,singular,pronoun,1 Thessalonians 2:7,"δυνάμενοι ἐν βάρει εἶναι ὡς Χριστοῦ ἀπόστολοι, ἀλλʼ ἐγενήθημεν νήπιοι ἐν μέσῳ ὑμῶν. ὡς ἐὰν τροφὸς θάλπῃ τὰ","τέκνα,"
ἑαυτῇ,ἑαυτοῦ,—,—,—,third person,feminine,dative,singular,pronoun,Matthew 9:21,ἔλεγεν γὰρ ἐν,· ἐὰν μόνον ἅψωμαι τοῦ ἱματίου αὐτοῦ σωθήσομαι.
ἑαυτῇ,ἑαυτοῦ,—,—,—,third person,feminine,dative,singular,pronoun,Acts 7:21,ἐκτεθέντος δὲ αὐτοῦ  ἀνείλατο αὐτὸν ἡ θυγάτηρ Φαραὼ καὶ ἀνεθρέψατο αὐτὸν,εἰς υἱόν.
ἑαυτῶν,ἑαυτοῦ,—,—,—,third person,masculine,genitive,plural,pronoun,Matthew 8:22,ὁ δὲ Ἰησοῦς λέγει αὐτῷ· ἀκολούθει μοι καὶ ἄφες τοὺς νεκροὺς θάψαι τοὺς,νεκρούς.
ἑαυτῶν,ἑαυτοῦ,—,—,—,third person,masculine,genitive,plural,pronoun,Matthew 15:30,καὶ προσῆλθον αὐτῷ ὄχλοι πολλοὶ ἔχοντες μεθʼ,"χωλούς, τυφλούς, κυλλούς, κωφούς, καὶ ἑτέρους πολλοὺς καὶ ἔρριψαν αὐτοὺς παρὰ τοὺς πόδας αὐτοῦ, καὶ ἐθεράπευσεν αὐτούς ·"
ἑαυτῶν,ἑαυτοῦ,—,—,—,third person,masculine,genitive,plural,pronoun,Matthew 18:31,ἰδόντες οὖν οἱ σύνδουλοι αὐτοῦ τὰ γενόμενα ἐλυπήθησαν σφόδρα καὶ ἐλθόντες διεσάφησαν τῷ κυρίῳ,πάντα τὰ γενόμενα.
ἑαυτῶν,ἑαυτοῦ,—,—,—,third person,masculine,genitive,plural,pronoun,Matthew 21:8,ὁ δὲ πλεῖστος ὄχλος ἔστρωσαν,"τὰ ἱμάτια ἐν τῇ ὁδῷ, ἄλλοι δὲ ἔκοπτον κλάδους ἀπὸ τῶν δένδρων καὶ ἐστρώννυον ἐν τῇ ὁδῷ."
ἑαυτῶν,ἑαυτοῦ,—,—,—,third person,masculine,genitive,plural,pronoun,Matthew 26:11,πάντοτε γὰρ τοὺς πτωχοὺς ἔχετε μεθʼ,", ἐμὲ δὲ οὐ πάντοτε ἔχετε·"
ἑαυτῶν,ἑαυτοῦ,—,—,—,third person,masculine,genitive,plural,pronoun,Mark 8:14,Καὶ ἐπελάθοντο λαβεῖν ἄρτους καὶ εἰ μὴ ἕνα ἄρτον οὐκ εἶχον μεθʼ,ἐν τῷ πλοίῳ.
ἑαυτῶν,ἑαυτοῦ,—,—,—,third person,masculine,genitive,plural,pronoun,Mark 9:8,καὶ ἐξάπινα περιβλεψάμενοι οὐκέτι οὐδένα εἶδον ἀλλὰ τὸν Ἰησοῦν μόνον μεθʼ,.
ἑαυτῶν,ἑαυτοῦ,—,—,—,second person,masculine,genitive,plural,pronoun,Mark 14:7,πάντοτε γὰρ τοὺς πτωχοὺς ἔχετε μεθʼ,"καὶ ὅταν θέλητε δύνασθε αὐτοῖς εὖ ποιῆσαι, ἐμὲ δὲ οὐ πάντοτε ἔχετε."
ἑαυτῶν,ἑαυτοῦ,—,—,—,third person,masculine,genitive,plural,pronoun,Luke 2:39,"Καὶ ὡς ἐτέλεσαν πάντα τὰ κατὰ τὸν νόμον κυρίου, ἐπέστρεψαν εἰς τὴν Γαλιλαίαν εἰς  πόλιν",Ναζαρέθ.
ἑαυτῶν,ἑαυτοῦ,—,—,—,third person,masculine,genitive,plural,pronoun,Luke 9:60,εἶπεν δὲ αὐτῷ· ἄφες τοὺς νεκροὺς θάψαι τοὺς,"νεκρούς, σὺ δὲ ἀπελθὼν διάγγελλε τὴν βασιλείαν τοῦ θεοῦ."
ἑαυτῶν,ἑαυτοῦ,—,—,—,third person,masculine,genitive,plural,pronoun,Luke 12:36,καὶ ὑμεῖς ὅμοιοι ἀνθρώποις προσδεχομένοις τὸν κύριον,"πότε ἀναλύσῃ ἐκ τῶν γάμων, ἵνα ἐλθόντος καὶ κρούσαντος εὐθέως ἀνοίξωσιν αὐτῷ."
ἑαυτῶν,ἑαυτοῦ,—,—,—,second person,masculine,genitive,plural,pronoun,Luke 12:57,Τί δὲ καὶ ἀφʼ,οὐ κρίνετε τὸ δίκαιον;
ἑαυτῶν,ἑαυτοῦ,—,—,—,third person,masculine,genitive,plural,pronoun,Luke 16:8,αἰῶνος τούτου φρονιμώτεροι ὑπὲρ τοὺς υἱοὺς τοῦ φωτὸς εἰς τὴν γενεὰν τὴν,εἰσιν.
ἑαυτῶν,ἑαυτοῦ,—,—,—,second person,masculine,genitive,plural,pronoun,Luke 21:30,"ὅταν προβάλωσιν ἤδη, βλέποντες ἀφʼ",γινώσκετε ὅτι ἤδη ἐγγὺς τὸ θέρος ἐστίν·
ἑαυτῶν,ἑαυτοῦ,—,—,—,second person,masculine,genitive,plural,pronoun,John 12:8,τοὺς πτωχοὺς γὰρ πάντοτε ἔχετε μεθʼ,", ἐμὲ δὲ οὐ πάντοτε ἔχετε."
ἑαυτῶν,ἑαυτοῦ,—,—,—,third person,masculine,genitive,plural,pronoun,Acts 21:23,τοῦτο οὖν ποίησον ὅ σοι λέγομεν· εἰσὶν ἡμῖν ἄνδρες τέσσαρες εὐχὴν ἔχοντες ἐφʼ,.
ἑαυτῶν,ἑαυτοῦ,—,—,—,third person,masculine,genitive,plural,pronoun,Romans 16:4,οἵτινες ὑπὲρ τῆς ψυχῆς μου τὸν,"τράχηλον ὑπέθηκαν, οἷς οὐκ ἐγὼ μόνος εὐχαριστῶ ἀλλὰ καὶ πᾶσαι αἱ ἐκκλησίαι τῶν ἐθνῶν,"
ἑαυτῶν,ἑαυτοῦ,—,—,—,third person,masculine,genitive,plural,pronoun,Romans 16:18,οἱ γὰρ τοιοῦτοι τῷ κυρίῳ ἡμῶν Χριστῷ οὐ δουλεύουσιν ἀλλὰ τῇ,"κοιλίᾳ, καὶ διὰ τῆς χρηστολογίας καὶ εὐλογίας ἐξαπατῶσιν τὰς καρδίας τῶν ἀκάκων."
ἑαυτῶν,ἑαυτοῦ,—,—,—,second person,masculine,genitive,plural,pronoun,1 Corinthians 6:7,Ἤδη μὲν [οὖν] ὅλως ἥττημα ὑμῖν ἐστιν ὅτι κρίματα ἔχετε μεθʼ,. διὰ τί οὐχὶ μᾶλλον ἀδικεῖσθε; διὰ τί οὐχὶ μᾶλλον ἀποστερεῖσθε;
ἑαυτῶν,ἑαυτοῦ,—,—,—,second person,masculine,genitive,plural,pronoun,1 Corinthians 6:19,"ἐν ὑμῖν ἁγίου πνεύματός ἐστιν οὗ ἔχετε ἀπὸ θεοῦ, καὶ οὐκ ἐστὲ",;
ἑαυτῶν,ἑαυτοῦ,—,—,—,first person,masculine,genitive,plural,pronoun,2 Corinthians 3:5,οὐχ ὅτι ἀφʼ,"ἱκανοί ἐσμεν λογίσασθαί τι ὡς ἐξ ἑαυτῶν, ἀλλʼ ἡ ἱκανότης ἡμῶν ἐκ τοῦ θεοῦ,"
ἑαυτῶν,ἑαυτοῦ,—,—,—,first person,masculine,genitive,plural,pronoun,2 Corinthians 3:5,οὐχ ὅτι ἀφʼ ἑαυτῶν ἱκανοί ἐσμεν λογίσασθαί τι ὡς ἐξ,", ἀλλʼ ἡ ἱκανότης ἡμῶν ἐκ τοῦ θεοῦ,"
ἑαυτῶν,ἑαυτοῦ,—,—,—,third person,masculine,genitive,plural,pronoun,Ephesians 5:28,οὕτως ὀφείλουσιν [καὶ] οἱ ἄνδρες ἀγαπᾶν τὰς,γυναῖκας ὡς τὰ ἑαυτῶν σώματα. ὁ ἀγαπῶν τὴν ἑαυτοῦ γυναῖκα ἑαυτὸν ἀγαπᾷ.
ἑαυτῶν,ἑαυτοῦ,—,—,—,third person,masculine,genitive,plural,pronoun,Ephesians 5:28,οὕτως ὀφείλουσιν [καὶ] οἱ ἄνδρες ἀγαπᾶν τὰς ἑαυτῶν γυναῖκας ὡς τὰ,σώματα. ὁ ἀγαπῶν τὴν ἑαυτοῦ γυναῖκα ἑαυτὸν ἀγαπᾷ.
ἑαυτῶν,ἑαυτοῦ,—,—,—,second person,masculine,genitive,plural,pronoun,Philippians 2:3,μηδὲν κατʼ ἐριθείαν μηδὲ κατὰ κενοδοξίαν ἀλλὰ τῇ ταπεινοφροσύνῃ ἀλλήλους ἡγούμενοι  ὑπερέχοντας,","
ἑαυτῶν,ἑαυτοῦ,—,—,—,second person,masculine,genitive,plural,pronoun,Philippians 2:4,μὴ τὰ,ἕκαστος σκοποῦντες ἀλλὰ [καὶ] τὰ ἑτέρων ἕκαστοι.
ἑαυτῶν,ἑαυτοῦ,—,—,—,second person,masculine,genitive,plural,pronoun,Philippians 2:12,"νῦν πολλῷ μᾶλλον ἐν τῇ ἀπουσίᾳ μου, μετὰ φόβου καὶ τρόμου τὴν",σωτηρίαν κατεργάζεσθε·
ἑαυτῶν,ἑαυτοῦ,—,—,—,third person,masculine,genitive,plural,pronoun,Philippians 2:21,οἱ πάντες γὰρ τὰ,"ζητοῦσιν, οὐ τὰ Ἰησοῦ Χριστοῦ."
ἑαυτῶν,ἑαυτοῦ,—,—,—,first person,masculine,genitive,plural,pronoun,1 Thessalonians 2:8,οὕτως ὁμειρόμενοι ὑμῶν εὐδοκοῦμεν μεταδοῦναι ὑμῖν οὐ μόνον τὸ εὐαγγέλιον τοῦ θεοῦ ἀλλὰ καὶ τὰς,"ψυχάς, διότι ἀγαπητοὶ ἡμῖν ἐγενήθητε."
ἑαυτῶν,ἑαυτοῦ,—,—,—,third person,masculine,genitive,plural,pronoun,2 Thessalonians 3:12,"τοῖς δὲ τοιούτοις παραγγέλλομεν καὶ παρακαλοῦμεν ἐν κυρίῳ Ἰησοῦ Χριστῷ, ἵνα μετὰ ἡσυχίας ἐργαζόμενοι τὸν",ἄρτον ἐσθίωσιν.
ἑαυτῶν,ἑαυτοῦ,—,—,—,first person,masculine,genitive,plural,pronoun,Hebrews 10:25,μὴ ἐγκαταλείποντες τὴν ἐπισυναγωγὴν,", καθὼς ἔθος τισίν, ἀλλὰ παρακαλοῦντες, καὶ τοσούτῳ μᾶλλον ὅσῳ βλέπετε ἐγγίζουσαν τὴν ἡμέραν."
ἑαυτῶν,ἑαυτοῦ,—,—,—,third person,masculine,genitive,plural,pronoun,Jude 6,ἀγγέλους τε τοὺς μὴ τηρήσαντας τὴν,"ἀρχὴν ἀλλʼ ἀπολιπόντας τὸ ἴδιον οἰκητήριον εἰς κρίσιν μεγάλης ἡμέρας δεσμοῖς  ἀϊδίοις ὑπὸ ζόφον τετήρηκεν,"
ἑαυτῶν,ἑαυτοῦ,—,—,—,third person,neuter,genitive,plural,pronoun,Jude 13,κύματα ἄγρια θαλάσσης ἐπαφρίζοντα τὰς,"αἰσχύνας, ἀστέρες πλανῆται οἷς ὁ ζόφος τοῦ σκότους εἰς αἰῶνα τετήρηται."
ἑαυτῶν,ἑαυτοῦ,—,—,—,third person,masculine,genitive,plural,pronoun,Jude 16,οὗτοί εἰσιν γογγυσταὶ μεμψίμοιροι κατὰ τὰς ἐπιθυμίας,"πορευόμενοι, καὶ τὸ στόμα αὐτῶν λαλεῖ ὑπέρογκα, θαυμάζοντες πρόσωπα ὠφελείας χάριν."
ἑαυτῶν,ἑαυτοῦ,—,—,—,third person,masculine,genitive,plural,pronoun,Jude 18,ὅτι ἔλεγον ὑμῖν ἐπʼ ἐσχάτου χρόνου ἔσονται ἐμπαῖκται κατὰ τὰς,ἐπιθυμίας πορευόμενοι τῶν ἀσεβειῶν.
ἑαυτῶν,ἑαυτοῦ,—,—,—,third person,feminine,genitive,plural,pronoun,Revelation 10:3,"καὶ ἔκραξεν φωνῇ μεγάλῃ ὥσπερ λέων μυκᾶται. καὶ ὅτε ἔκραξεν, ἐλάλησαν αἱ ἑπτὰ βρονταὶ τὰς",φωνάς.
ἑαυτῶν,ἑαυτοῦ,—,—,—,third person,"feminine, masculine",genitive,plural,pronoun,Matthew 25:1,"Τότε ὁμοιωθήσεται ἡ βασιλεία τῶν οὐρανῶν δέκα παρθένοις, αἵτινες λαβοῦσαι τὰς λαμπάδας",ἐξῆλθον εἰς ὑπάντησιν τοῦ νυμφίου.
ἑαυτῶν,ἑαυτοῦ,—,—,—,third person,"feminine, masculine",genitive,plural,pronoun,Matthew 25:3,αἱ γὰρ μωραὶ λαβοῦσαι τὰς λαμπάδας αὐτῶν οὐκ ἔλαβον μεθʼ,ἔλαιον.
ἑαυτῶν,ἑαυτοῦ,—,—,—,third person,"feminine, masculine",genitive,plural,pronoun,Matthew 25:4,αἱ δὲ φρόνιμοι ἔλαβον ἔλαιον ἐν τοῖς ἀγγείοις  μετὰ τῶν λαμπάδων,.
ἑαυτῶν,ἑαυτοῦ,—,—,—,third person,"feminine, masculine",genitive,plural,pronoun,Matthew 25:7,τότε ἠγέρθησαν πᾶσαι αἱ παρθένοι ἐκεῖναι καὶ ἐκόσμησαν τὰς λαμπάδας,.
ἑαυτῷ,ἑαυτοῦ,—,—,—,third person,masculine,dative,singular,pronoun,Matthew 13:21,οὐκ ἔχει δὲ ῥίζαν ἐν,"ἀλλὰ πρόσκαιρός ἐστιν, γενομένης δὲ θλίψεως ἢ διωγμοῦ διὰ τὸν λόγον εὐθὺς σκανδαλίζεται."
ἑαυτῷ,ἑαυτοῦ,—,—,—,third person,masculine,dative,singular,pronoun,Mark 5:30,καὶ εὐθὺς ὁ Ἰησοῦς ἐπιγνοὺς ἐν,τὴν ἐξ αὐτοῦ δύναμιν ἐξελθοῦσαν ἐπιστραφεὶς ἐν τῷ ὄχλῳ ἔλεγεν· τίς μου ἥψατο τῶν ἱματίων;
ἑαυτῷ,ἑαυτοῦ,—,—,—,third person,masculine,dative,singular,pronoun,Luke 7:39,ἰδὼν δὲ ὁ Φαρισαῖος ὁ καλέσας αὐτὸν εἶπεν ἐν,"λέγων· οὗτος εἰ ἦν  προφήτης, ἐγίνωσκεν ἂν τίς καὶ ποταπὴ ἡ γυνὴ ἥτις"
ἑαυτῷ,ἑαυτοῦ,—,—,—,third person,masculine,dative,singular,pronoun,Luke 9:47,ὁ δὲ Ἰησοῦς εἰδὼς τὸν διαλογισμὸν τῆς καρδίας αὐτῶν ἐπιλαβόμενος παιδίον ἔστησεν αὐτὸ παρʼ,""
ἑαυτῷ,ἑαυτοῦ,—,—,—,third person,masculine,dative,singular,pronoun,Luke 12:17,καὶ διελογίζετο ἐν,"λέγων· τί ποιήσω, ὅτι οὐκ ἔχω ποῦ συνάξω τοὺς καρπούς μου;"
ἑαυτῷ,ἑαυτοῦ,—,—,—,third person,masculine,dative,singular,pronoun,Luke 12:21,οὕτως ὁ θησαυρίζων,καὶ μὴ εἰς θεὸν πλουτῶν.
ἑαυτῷ,ἑαυτοῦ,—,—,—,third person,masculine,dative,singular,pronoun,Luke 16:3,εἶπεν δὲ ἐν,"ὁ οἰκονόμος· τί ποιήσω, ὅτι ὁ κύριός μου ἀφαιρεῖται τὴν οἰκονομίαν ἀπʼ ἐμοῦ"
ἑαυτῷ,ἑαυτοῦ,—,—,—,third person,masculine,dative,singular,pronoun,Luke 18:4,καὶ οὐκ ἤθελεν ἐπὶ χρόνον. μετὰ δὲ ταῦτα εἶπεν ἐν,"· εἰ καὶ τὸν θεὸν οὐ φοβοῦμαι οὐδὲ ἄνθρωπον ἐντρέπομαι,"
ἑαυτῷ,ἑαυτοῦ,—,—,—,third person,masculine,dative,singular,pronoun,Luke 19:12,εἶπεν οὖν· ἄνθρωπός τις εὐγενὴς ἐπορεύθη εἰς χώραν μακρὰν λαβεῖν,βασιλείαν καὶ ὑποστρέψαι.
ἑαυτῷ,ἑαυτοῦ,—,—,—,third person,masculine,dative,singular,pronoun,John 5:26,ὥσπερ γὰρ ὁ πατὴρ ἔχει ζωὴν ἐν,", οὕτως καὶ τῷ υἱῷ ἔδωκεν ζωὴν ἔχειν ἐν ἑαυτῷ."
ἑαυτῷ,ἑαυτοῦ,—,—,—,third person,masculine,dative,singular,pronoun,John 5:26,"ὥσπερ γὰρ ὁ πατὴρ ἔχει ζωὴν ἐν ἑαυτῷ, οὕτως καὶ τῷ υἱῷ ἔδωκεν ζωὴν ἔχειν ἐν",.
ἑαυτῷ,ἑαυτοῦ,—,—,—,third person,masculine,dative,singular,pronoun,John 6:61,εἰδὼς δὲ ὁ Ἰησοῦς ἐν,ὅτι γογγύζουσιν περὶ τούτου οἱ μαθηταὶ αὐτοῦ εἶπεν αὐτοῖς· τοῦτο ὑμᾶς σκανδαλίζει;
ἑαυτῷ,ἑαυτοῦ,—,—,—,third person,masculine,dative,singular,pronoun,John 11:38,Ἰησοῦς οὖν πάλιν ἐμβριμώμενος ἐν,ἔρχεται εἰς τὸ μνημεῖον· ἦν δὲ σπήλαιον καὶ λίθος ἐπέκειτο ἐπʼ αὐτῷ.
ἑαυτῷ,ἑαυτοῦ,—,—,—,third person,masculine,dative,singular,pronoun,John 19:17,καὶ βαστάζων,"τὸν σταυρὸν ἐξῆλθεν εἰς τὸν λεγόμενον Κρανίου Τόπον, ὃ λέγεται Ἑβραϊστὶ Γολγοθα,"
ἑαυτῷ,ἑαυτοῦ,—,—,—,third person,masculine,dative,singular,pronoun,Acts 10:17,Ὡς δὲ ἐν,"διηπόρει ὁ Πέτρος τί ἂν εἴη τὸ ὅραμα ὃ εἶδεν,  ἰδοὺ οἱ ἄνδρες"
ἑαυτῷ,ἑαυτοῦ,—,—,—,third person,masculine,dative,singular,pronoun,Acts 12:11,Καὶ ὁ Πέτρος ἐν,γενόμενος εἶπεν· νῦν οἶδα ἀληθῶς ὅτι ἐξαπέστειλεν [ὁ] κύριος τὸν ἄγγελον αὐτοῦ καὶ
ἑαυτῷ,ἑαυτοῦ,—,—,—,third person,masculine,dative,singular,pronoun,Romans 14:7,οὐδεὶς γὰρ ἡμῶν,ζῇ καὶ οὐδεὶς ἑαυτῷ ἀποθνῄσκει·
ἑαυτῷ,ἑαυτοῦ,—,—,—,third person,masculine,dative,singular,pronoun,Romans 14:7,οὐδεὶς γὰρ ἡμῶν ἑαυτῷ ζῇ καὶ οὐδεὶς,ἀποθνῄσκει·
ἑαυτῷ,ἑαυτοῦ,—,—,—,third person,masculine,dative,singular,pronoun,Romans 15:3,καὶ γὰρ ὁ Χριστὸς οὐχ,"ἤρεσεν, ἀλλὰ καθὼς γέγραπται· οἱ ὀνειδισμοὶ τῶν ὀνειδιζόντων σε ἐπέπεσαν ἐπʼ ἐμέ."
ἑαυτῷ,ἑαυτοῦ,—,—,—,third person,masculine,dative,singular,pronoun,1 Corinthians 11:29,ὁ γὰρ ἐσθίων καὶ πίνων  κρίμα,ἐσθίει καὶ πίνει μὴ διακρίνων τὸ σῶμα.
ἑαυτῷ,ἑαυτοῦ,—,—,—,third person,masculine,dative,singular,pronoun,1 Corinthians 14:28,"ἐὰν δὲ μὴ ᾖ διερμηνευτής, σιγάτω ἐν ἐκκλησίᾳ,",δὲ λαλείτω καὶ τῷ θεῷ.
ἑαυτῷ,ἑαυτοῦ,—,—,—,third person,masculine,dative,singular,pronoun,1 Corinthians 16:2,κατὰ μίαν σαββάτου ἕκαστος ὑμῶν παρʼ,"τιθέτω θησαυρίζων ὅ τι ἐὰν εὐοδῶται, ἵνα μὴ ὅταν ἔλθω τότε λογεῖαι γίνωνται."
ἑαυτῷ,ἑαυτοῦ,—,—,—,third person,masculine,dative,singular,pronoun,2 Corinthians 5:18,τὰ δὲ πάντα ἐκ τοῦ θεοῦ τοῦ καταλλάξαντος ἡμᾶς,"διὰ Χριστοῦ καὶ δόντος ἡμῖν τὴν διακονίαν τῆς καταλλαγῆς,"
ἑαυτῷ,ἑαυτοῦ,—,—,—,third person,masculine,dative,singular,pronoun,2 Corinthians 5:19,ὡς ὅτι θεὸς ἦν ἐν Χριστῷ κόσμον καταλλάσσων,", μὴ λογιζόμενος αὐτοῖς τὰ παραπτώματα αὐτῶν καὶ θέμενος ἐν ἡμῖν τὸν λόγον τῆς καταλλαγῆς."
ἑαυτῷ,ἑαυτοῦ,—,—,—,third person,masculine,dative,singular,pronoun,2 Corinthians 10:7,Τὰ κατὰ πρόσωπον βλέπετε. εἴ τις πέποιθεν,"Χριστοῦ  εἶναι, τοῦτο λογιζέσθω πάλιν ἐφʼ ἑαυτοῦ, ὅτι καθὼς αὐτὸς Χριστοῦ, οὕτως καὶ ἡμεῖς."
ἑαυτῷ,ἑαυτοῦ,—,—,—,third person,masculine,dative,singular,pronoun,Ephesians 5:27,ἵνα παραστήσῃ αὐτὸς,"ἔνδοξον τὴν ἐκκλησίαν, μὴ ἔχουσαν σπίλον ἢ ῥυτίδα ἤ τι τῶν τοιούτων, ἀλλʼ"
ἑαυτῷ,ἑαυτοῦ,—,—,—,third person,masculine,dative,singular,pronoun,Titus 2:14,"ὃς ἔδωκεν ἑαυτὸν ὑπὲρ ἡμῶν, ἵνα λυτρώσηται ἡμᾶς ἀπὸ πάσης ἀνομίας καὶ καθαρίσῃ","λαὸν περιούσιον, ζηλωτὴν καλῶν ἔργων."
ἑαυτῷ,ἑαυτοῦ,—,—,—,third person,masculine,dative,singular,pronoun,Hebrews 5:4,καὶ οὐχ,τις λαμβάνει τὴν τιμὴν ἀλλὰ καλούμενος ὑπὸ τοῦ θεοῦ καθώσπερ καὶ Ἀαρών.
Ἑαυτοὺς,ἑαυτοῦ,—,—,—,second person,masculine,accusative,plural,pronoun,2 Corinthians 13:5,—,"πειράζετε εἰ ἐστὲ ἐν τῇ πίστει, ἑαυτοὺς δοκιμάζετε· ἢ οὐκ ἐπιγινώσκετε ἑαυτοὺς ὅτι"
