Resource,Reference,Previous Context,Result,Next Context,Lemma (Greek),Louw-Nida,Root,Part of Speech,Adverb/particle Type (Logos Greek)
NA28,Matthew 18:20,οὗ γάρ εἰσιν δύο ἢ τρεῖς συνηγμένοι εἰς τὸ,ἐμὸν,"ὄνομα, ἐκεῖ εἰμι ἐν μέσῳ αὐτῶν.",ἐμός,Louw Nida 92.2,εγω,"adjective, pronoun",—
NA28,Matthew 20:15,[ἢ] οὐκ ἔξεστίν μοι ὃ θέλω ποιῆσαι ἐν τοῖς,ἐμοῖς,; ἢ ὁ ὀφθαλμός σου πονηρός ἐστιν ὅτι ἐγὼ ἀγαθός εἰμι;,ἐμός,Louw Nida 92.2,εγω,"pronoun, adjective",—
NA28,Matthew 20:23,"λέγει αὐτοῖς·  τὸ μὲν ποτήριόν μου πίεσθε, τὸ δὲ καθίσαι ἐκ δεξιῶν μου καὶ ἐξ εὐωνύμων  οὐκ ἔστιν",ἐμὸν,"[τοῦτο] δοῦναι, ἀλλʼ οἷς ἡτοίμασται ὑπὸ τοῦ πατρός μου.",ἐμός,Louw Nida 92.2,εγω,"pronoun, adjective",—
NA28,Matthew 25:27,"ἔδει σε οὖν βαλεῖν τὰ ἀργύριά μου τοῖς τραπεζίταις, καὶ ἐλθὼν ἐγὼ ἐκομισάμην ἂν τὸ",ἐμὸν,σὺν τόκῳ.,ἐμός,Louw Nida 92.2,εγω,"pronoun, adjective",—
NA28,Mark 8:38,ὃς γὰρ ἐὰν ἐπαισχυνθῇ με καὶ τοὺς,ἐμοὺς,"λόγους ἐν τῇ γενεᾷ ταύτῃ τῇ μοιχαλίδι καὶ ἁμαρτωλῷ, καὶ ὁ υἱὸς τοῦ",ἐμός,Louw Nida 92.2,εγω,"adjective, pronoun",—
NA28,Mark 10:40,τὸ δὲ καθίσαι ἐκ δεξιῶν μου ἢ ἐξ εὐωνύμων οὐκ ἔστιν,ἐμὸν,"δοῦναι, ἀλλʼ οἷς ἡτοίμασται.",ἐμός,Louw Nida 92.2,εγω,"adjective, pronoun",—
NA28,Luke 9:26,ὃς γὰρ ἂν ἐπαισχυνθῇ με καὶ τοὺς,ἐμοὺς,"λόγους, τοῦτον ὁ υἱὸς τοῦ ἀνθρώπου ἐπαισχυνθήσεται, ὅταν ἔλθῃ ἐν τῇ δόξῃ αὐτοῦ",ἐμός,Louw Nida 92.2,εγω,"adjective, pronoun",—
NA28,Luke 15:31,"ὁ δὲ εἶπεν αὐτῷ· τέκνον, σὺ πάντοτε μετʼ ἐμοῦ εἶ, καὶ πάντα τὰ",ἐμὰ,σά ἐστιν·,ἐμός,Louw Nida 92.2,εγω,"pronoun, adjective",—
NA28,Luke 22:19,ἐστιν τὸ σῶμά μου τὸ ὑπὲρ ὑμῶν διδόμενον· τοῦτο ποιεῖτε εἰς τὴν,ἐμὴν,ἀνάμνησιν.,ἐμός,Louw Nida 92.2,εγω,"adjective, pronoun",—
NA28,John 3:29,χαρᾷ χαίρει διὰ τὴν φωνὴν τοῦ νυμφίου. αὕτη οὖν ἡ χαρὰ ἡ,ἐμὴ,πεπλήρωται.,ἐμός,Louw Nida 92.2,εγω,"pronoun, adjective",—
NA28,John 4:34,λέγει αὐτοῖς ὁ Ἰησοῦς·,ἐμὸν,βρῶμά ἐστιν ἵνα ποιήσω τὸ θέλημα τοῦ πέμψαντός με καὶ τελειώσω αὐτοῦ τὸ ἔργον.,ἐμός,Louw Nida 92.2,εγω,"adjective, pronoun",—
NA28,John 5:30,"Οὐ δύναμαι ἐγὼ ποιεῖν ἀπʼ ἐμαυτοῦ οὐδέν· καθὼς ἀκούω κρίνω, καὶ ἡ κρίσις ἡ",ἐμὴ,"δικαία ἐστίν,  ὅτι οὐ ζητῶ τὸ θέλημα τὸ ἐμὸν ἀλλὰ τὸ θέλημα τοῦ πέμψαντός με.",ἐμός,Louw Nida 92.2,εγω,"pronoun, adjective",—
NA28,John 5:30,"ἡ κρίσις ἡ ἐμὴ δικαία ἐστίν,  ὅτι οὐ ζητῶ τὸ θέλημα τὸ",ἐμὸν,ἀλλὰ τὸ θέλημα τοῦ πέμψαντός με.,ἐμός,Louw Nida 92.2,εγω,"pronoun, adjective",—
NA28,John 5:47,"εἰ δὲ τοῖς ἐκείνου γράμμασιν οὐ πιστεύετε, πῶς τοῖς",ἐμοῖς,ῥήμασιν πιστεύσετε;,ἐμός,Louw Nida 92.2,εγω,"adjective, pronoun",—
NA28,John 6:38,ὅτι καταβέβηκα ἀπὸ τοῦ οὐρανοῦ οὐχ ἵνα ποιῶ τὸ θέλημα τὸ,ἐμὸν,ἀλλὰ τὸ θέλημα τοῦ πέμψαντός με.,ἐμός,Louw Nida 92.2,εγω,"pronoun, adjective",—
NA28,John 7:6,λέγει οὖν αὐτοῖς ὁ Ἰησοῦς· ὁ καιρὸς ὁ,ἐμὸς,"οὔπω πάρεστιν, ὁ δὲ καιρὸς ὁ ὑμέτερος πάντοτέ ἐστιν ἕτοιμος.",ἐμός,Louw Nida 92.2,εγω,"pronoun, adjective",—
NA28,John 7:8,"ὑμεῖς ἀνάβητε εἰς τὴν ἑορτήν· ἐγὼ οὐκ ἀναβαίνω εἰς τὴν ἑορτὴν ταύτην, ὅτι ὁ",ἐμὸς,καιρὸς οὔπω πεπλήρωται.,ἐμός,Louw Nida 92.2,εγω,"adjective, pronoun",—
NA28,John 7:16,ἀπεκρίθη οὖν αὐτοῖς [ὁ] Ἰησοῦς καὶ εἶπεν· ἡ,ἐμὴ,διδαχὴ οὐκ ἔστιν ἐμὴ ἀλλὰ τοῦ πέμψαντός με·,ἐμός,Louw Nida 92.2,εγω,"adjective, pronoun",—
NA28,John 7:16,ἀπεκρίθη οὖν αὐτοῖς [ὁ] Ἰησοῦς καὶ εἶπεν· ἡ ἐμὴ διδαχὴ οὐκ ἔστιν,ἐμὴ,ἀλλὰ τοῦ πέμψαντός με·,ἐμός,Louw Nida 92.2,εγω,"adjective, pronoun",—
NA28,John 8:16,"καὶ ἐὰν κρίνω δὲ ἐγώ, ἡ κρίσις ἡ",ἐμὴ,"ἀληθινή ἐστιν, ὅτι μόνος οὐκ εἰμί, ἀλλʼ ἐγὼ καὶ ὁ πέμψας με πατήρ.",ἐμός,Louw Nida 92.2,εγω,"pronoun, adjective",—
NA28,John 8:31,Ἔλεγεν οὖν ὁ Ἰησοῦς πρὸς τοὺς πεπιστευκότας αὐτῷ Ἰουδαίους· ἐὰν ὑμεῖς μείνητε ἐν τῷ λόγῳ τῷ,ἐμῷ,", ἀληθῶς μαθηταί μού ἐστε",ἐμός,Louw Nida 92.2,εγω,"pronoun, adjective",—
NA28,John 8:37,"Οἶδα ὅτι σπέρμα Ἀβραάμ ἐστε· ἀλλὰ ζητεῖτέ με ἀποκτεῖναι, ὅτι ὁ λόγος ὁ",ἐμὸς,οὐ χωρεῖ ἐν ὑμῖν.,ἐμός,Louw Nida 92.2,εγω,"pronoun, adjective",—
NA28,John 8:43,διὰ τί τὴν λαλιὰν τὴν,ἐμὴν,οὐ γινώσκετε; ὅτι οὐ δύνασθε ἀκούειν τὸν λόγον τὸν ἐμόν.,ἐμός,Louw Nida 92.2,εγω,"pronoun, adjective",—
NA28,John 8:43,διὰ τί τὴν λαλιὰν τὴν ἐμὴν οὐ γινώσκετε; ὅτι οὐ δύνασθε ἀκούειν τὸν λόγον τὸν,ἐμόν,.,ἐμός,Louw Nida 92.2,εγω,"pronoun, adjective",—
NA28,John 8:51,"ἀμὴν ἀμὴν λέγω ὑμῖν, ἐάν τις τὸν",ἐμὸν,"λόγον τηρήσῃ, θάνατον οὐ μὴ θεωρήσῃ εἰς τὸν αἰῶνα.",ἐμός,Louw Nida 92.2,εγω,"adjective, pronoun",—
NA28,John 8:56,Ἀβραὰμ ὁ πατὴρ ὑμῶν ἠγαλλιάσατο ἵνα ἴδῃ τὴν ἡμέραν τὴν,ἐμήν,", καὶ εἶδεν καὶ ἐχάρη.",ἐμός,Louw Nida 92.2,εγω,"pronoun, adjective",—
NA28,John 10:14,Ἐγώ εἰμι ὁ ποιμὴν ὁ καλὸς καὶ γινώσκω τὰ,ἐμὰ,"καὶ γινώσκουσίν με τὰ ἐμά,",ἐμός,Louw Nida 92.2,εγω,"pronoun, adjective",—
NA28,John 10:14,Ἐγώ εἰμι ὁ ποιμὴν ὁ καλὸς καὶ γινώσκω τὰ ἐμὰ καὶ γινώσκουσίν με τὰ,ἐμά,",",ἐμός,Louw Nida 92.2,εγω,"pronoun, adjective",—
NA28,John 10:26,"ἀλλʼ ὑμεῖς οὐ πιστεύετε, ὅτι οὐκ ἐστὲ ἐκ τῶν προβάτων τῶν",ἐμῶν,.,ἐμός,Louw Nida 92.2,εγω,"pronoun, adjective",—
NA28,John 10:27,τὰ πρόβατα τὰ,ἐμὰ,"τῆς φωνῆς μου ἀκούουσιν, κἀγὼ γινώσκω αὐτὰ καὶ ἀκολουθοῦσίν μοι,",ἐμός,Louw Nida 92.2,εγω,"pronoun, adjective",—
NA28,John 12:26,"ἐὰν ἐμοί τις διακονῇ, ἐμοὶ ἀκολουθείτω, καὶ ὅπου εἰμὶ ἐγὼ ἐκεῖ καὶ ὁ διάκονος ὁ",ἐμὸς,ἔσται· ἐάν τις ἐμοὶ διακονῇ τιμήσει αὐτὸν ὁ πατήρ.,ἐμός,Louw Nida 92.2,εγω,"pronoun, adjective",—
NA28,John 14:15,"Ἐὰν ἀγαπᾶτέ με, τὰς ἐντολὰς τὰς",ἐμὰς,τηρήσετε·,ἐμός,Louw Nida 92.2,εγω,"pronoun, adjective",—
NA28,John 14:24,ὁ μὴ ἀγαπῶν με τοὺς λόγους *μου οὐ τηρεῖ· καὶ ὁ λόγος  ὃν ἀκούετε οὐκ ἔστιν,ἐμὸς,ἀλλὰ τοῦ πέμψαντός με πατρός.,ἐμός,Louw Nida 92.2,εγω,"adjective, pronoun",—
NA28,John 14:27,"Εἰρήνην ἀφίημι ὑμῖν, εἰρήνην τὴν",ἐμὴν,δίδωμι ὑμῖν· οὐ καθὼς ὁ κόσμος δίδωσιν ἐγὼ δίδωμι ὑμῖν. μὴ ταρασσέσθω ὑμῶν ἡ καρδία μηδὲ δειλιάτω.,ἐμός,Louw Nida 92.2,εγω,"pronoun, adjective",—
NA28,John 15:9,"Καθὼς ἠγάπησέν με ὁ πατήρ, κἀγὼ ὑμᾶς ἠγάπησα· μείνατε ἐν τῇ ἀγάπῃ τῇ",ἐμῇ,.,ἐμός,Louw Nida 92.2,εγω,"pronoun, adjective",—
NA28,John 15:11,Ταῦτα λελάληκα ὑμῖν ἵνα ἡ χαρὰ ἡ,ἐμὴ,ἐν ὑμῖν ᾖ καὶ ἡ χαρὰ ὑμῶν πληρωθῇ.,ἐμός,Louw Nida 92.2,εγω,"pronoun, adjective",—
NA28,John 15:12,Αὕτη ἐστὶν ἡ ἐντολὴ ἡ,ἐμή,", ἵνα ἀγαπᾶτε ἀλλήλους καθὼς ἠγάπησα ὑμᾶς.",ἐμός,Louw Nida 92.2,εγω,"pronoun, adjective",—
NA28,John 16:15,πάντα ὅσα ἔχει ὁ πατὴρ,ἐμά,ἐστιν· διὰ τοῦτο εἶπον  ὅτι ἐκ τοῦ ἐμοῦ λαμβάνει καὶ ἀναγγελεῖ ὑμῖν.,ἐμός,Louw Nida 92.2,εγω,"adjective, pronoun",—
NA28,John 17:10,καὶ τὰ,ἐμὰ,"πάντα σά ἐστιν καὶ τὰ σὰ ἐμά, καὶ δεδόξασμαι ἐν αὐτοῖς.",ἐμός,Louw Nida 92.2,εγω,"pronoun, adjective",—
NA28,John 17:10,καὶ τὰ ἐμὰ πάντα σά ἐστιν καὶ τὰ σὰ,ἐμά,", καὶ δεδόξασμαι ἐν αὐτοῖς.",ἐμός,Louw Nida 92.2,εγω,"adjective, pronoun",—
NA28,John 17:13,νῦν δὲ πρὸς σὲ ἔρχομαι καὶ ταῦτα λαλῶ ἐν τῷ κόσμῳ ἵνα ἔχωσιν τὴν χαρὰν τὴν,ἐμὴν,πεπληρωμένην ἐν ἑαυτοῖς.,ἐμός,Louw Nida 92.2,εγω,"pronoun, adjective",—
NA28,John 17:24,"Πάτερ, ὃ δέδωκάς μοι, θέλω ἵνα ὅπου εἰμὶ ἐγὼ κἀκεῖνοι ὦσιν μετʼ ἐμοῦ, ἵνα θεωρῶσιν τὴν δόξαν τὴν",ἐμήν,", ἣν δέδωκάς μοι ὅτι ἠγάπησάς με πρὸ καταβολῆς κόσμου.",ἐμός,Louw Nida 92.2,εγω,"pronoun, adjective",—
NA28,John 18:36,ἀπεκρίθη Ἰησοῦς· ἡ βασιλεία ἡ,ἐμὴ,οὐκ ἔστιν ἐκ τοῦ κόσμου τούτου· εἰ ἐκ τοῦ κόσμου τούτου ἦν ἡ,ἐμός,Louw Nida 92.2,εγω,"pronoun, adjective",—
NA28,John 18:36,τοῦ κόσμου τούτου· εἰ ἐκ τοῦ κόσμου τούτου ἦν ἡ βασιλεία ἡ,ἐμή,", οἱ ὑπηρέται οἱ ἐμοὶ ἠγωνίζοντο [ἂν] ἵνα μὴ παραδοθῶ τοῖς Ἰουδαίοις· νῦν δὲ",ἐμός,Louw Nida 92.2,εγω,"pronoun, adjective",—
NA28,John 18:36,ἠγωνίζοντο [ἂν] ἵνα μὴ παραδοθῶ τοῖς Ἰουδαίοις· νῦν δὲ ἡ βασιλεία ἡ,ἐμὴ,οὐκ ἔστιν ἐντεῦθεν.,ἐμός,Louw Nida 92.2,εγω,"pronoun, adjective",—
NA28,Romans 3:7,εἰ δὲ ἡ ἀλήθεια τοῦ θεοῦ ἐν τῷ,ἐμῷ,"ψεύσματι ἐπερίσσευσεν εἰς τὴν δόξαν αὐτοῦ, τί ἔτι κἀγὼ ὡς ἁμαρτωλὸς κρίνομαι;",ἐμός,Louw Nida 92.2,εγω,"adjective, pronoun",—
NA28,Romans 10:1,"Ἀδελφοί, ἡ μὲν εὐδοκία τῆς",ἐμῆς,καρδίας καὶ ἡ δέησις πρὸς τὸν θεὸν ὑπὲρ αὐτῶν εἰς σωτηρίαν.,ἐμός,Louw Nida 92.2,εγω,"adjective, pronoun",—
NA28,1 Corinthians 1:15,ἵνα μή τις εἴπῃ ὅτι εἰς τὸ,ἐμὸν,ὄνομα ἐβαπτίσθητε.,ἐμός,Louw Nida 92.2,εγω,"adjective, pronoun",—
NA28,1 Corinthians 7:40,"μακαριωτέρα δέ ἐστιν ἐὰν οὕτως μείνῃ, κατὰ τὴν",ἐμὴν,γνώμην· δοκῶ δὲ κἀγὼ πνεῦμα θεοῦ ἔχειν.,ἐμός,Louw Nida 92.2,εγω,"adjective, pronoun",—
NA28,1 Corinthians 9:3,Ἡ,ἐμὴ,ἀπολογία τοῖς ἐμὲ ἀνακρίνουσίν ἐστιν αὕτη.,ἐμός,Louw Nida 92.2,εγω,"adjective, pronoun",—
NA28,1 Corinthians 11:24,καὶ εὐχαριστήσας ἔκλασεν καὶ εἶπεν· τοῦτό μού ἐστιν τὸ σῶμα τὸ ὑπὲρ ὑμῶν · τοῦτο ποιεῖτε εἰς τὴν,ἐμὴν,ἀνάμνησιν.,ἐμός,Louw Nida 92.2,εγω,"adjective, pronoun",—
NA28,1 Corinthians 11:25,ὡσαύτως καὶ τὸ ποτήριον μετὰ τὸ δειπνῆσαι λέγων· τοῦτο τὸ ποτήριον ἡ καινὴ διαθήκη ἐστὶν ἐν τῷ,ἐμῷ,"αἵματι· τοῦτο ποιεῖτε, ὁσάκις ἐὰν πίνητε, εἰς τὴν ἐμὴν ἀνάμνησιν.",ἐμός,Louw Nida 92.2,εγω,"adjective, pronoun",—
NA28,1 Corinthians 11:25,"ἐστὶν ἐν τῷ ἐμῷ αἵματι· τοῦτο ποιεῖτε, ὁσάκις ἐὰν πίνητε, εἰς τὴν",ἐμὴν,ἀνάμνησιν.,ἐμός,Louw Nida 92.2,εγω,"adjective, pronoun",—
NA28,1 Corinthians 16:18,ἀνέπαυσαν γὰρ τὸ,ἐμὸν,πνεῦμα καὶ τὸ ὑμῶν. ἐπιγινώσκετε οὖν τοὺς τοιούτους.,ἐμός,Louw Nida 92.2,εγω,"adjective, pronoun",—
NA28,1 Corinthians 16:21,Ὁ ἀσπασμὸς τῇ,ἐμῇ,χειρὶ Παύλου.,ἐμός,Louw Nida 92.2,εγω,"adjective, pronoun",—
NA28,2 Corinthians 1:23,Ἐγὼ δὲ μάρτυρα τὸν θεὸν ἐπικαλοῦμαι ἐπὶ τὴν,ἐμὴν,"ψυχήν, ὅτι φειδόμενος ὑμῶν οὐκέτι ἦλθον εἰς Κόρινθον.",ἐμός,Louw Nida 92.2,εγω,"adjective, pronoun",—
NA28,2 Corinthians 2:3,"σχῶ ἀφʼ ὧν ἔδει με χαίρειν, πεποιθὼς ἐπὶ πάντας ὑμᾶς ὅτι ἡ",ἐμὴ,χαρὰ πάντων ὑμῶν ἐστιν.,ἐμός,Louw Nida 92.2,εγω,"adjective, pronoun",—
NA28,2 Corinthians 8:23,"εἴτε ὑπὲρ Τίτου, κοινωνὸς",ἐμὸς,"καὶ εἰς ὑμᾶς συνεργός· εἴτε ἀδελφοὶ ἡμῶν, ἀπόστολοι ἐκκλησιῶν, δόξα Χριστοῦ.",ἐμός,Louw Nida 92.2,εγω,"adjective, pronoun",—
NA28,Galatians 1:13,Ἠκούσατε γὰρ τὴν,ἐμὴν,"ἀναστροφήν ποτε ἐν τῷ Ἰουδαϊσμῷ, ὅτι καθʼ ὑπερβολὴν ἐδίωκον τὴν ἐκκλησίαν τοῦ θεοῦ καὶ ἐπόρθουν αὐτήν,",ἐμός,Louw Nida 92.2,εγω,"adjective, pronoun",—
NA28,Galatians 6:11,Ἴδετε πηλίκοις ὑμῖν γράμμασιν ἔγραψα τῇ,ἐμῇ,χειρί.,ἐμός,Louw Nida 92.2,εγω,"adjective, pronoun",—
NA28,Philippians 1:26,ἵνα τὸ καύχημα ὑμῶν περισσεύῃ ἐν Χριστῷ Ἰησοῦ ἐν ἐμοὶ διὰ τῆς,ἐμῆς,παρουσίας πάλιν πρὸς ὑμᾶς.,ἐμός,Louw Nida 92.2,εγω,"adjective, pronoun",—
NA28,Philippians 3:9,"καὶ εὑρεθῶ ἐν αὐτῷ, μὴ ἔχων",ἐμὴν,"δικαιοσύνην τὴν ἐκ νόμου ἀλλὰ τὴν διὰ πίστεως Χριστοῦ, τὴν ἐκ θεοῦ δικαιοσύνην ἐπὶ τῇ πίστει,",ἐμός,Louw Nida 92.2,εγω,"adjective, pronoun",—
NA28,Colossians 4:18,Ὁ ἀσπασμὸς τῇ,ἐμῇ,χειρὶ Παύλου. μνημονεύετέ μου τῶν δεσμῶν. ἡ χάρις μεθʼ ὑμῶν.,ἐμός,Louw Nida 92.2,εγω,"adjective, pronoun",—
NA28,2 Thessalonians 3:17,Ὁ ἀσπασμὸς τῇ,ἐμῇ,"χειρὶ Παύλου, ὅ ἐστιν σημεῖον ἐν πάσῃ ἐπιστολῇ· οὕτως γράφω.",ἐμός,Louw Nida 92.2,εγω,"adjective, pronoun",—
NA28,Philemon 12,"ὃν ἀνέπεμψά σοι, αὐτόν, τοῦτʼ ἔστιν τὰ",ἐμὰ,σπλάγχνα·,ἐμός,Louw Nida 92.2,εγω,"adjective, pronoun",—
NA28,Philemon 19,ἐγὼ Παῦλος ἔγραψα τῇ,ἐμῇ,"χειρί, ἐγὼ ἀποτίσω· ἵνα μὴ λέγω σοι ὅτι καὶ σεαυτόν μοι προσοφείλεις.",ἐμός,Louw Nida 92.2,εγω,"adjective, pronoun",—
NA28,2 Peter 1:15,σπουδάσω δὲ καὶ ἑκάστοτε ἔχειν ὑμᾶς μετὰ τὴν,ἐμὴν,ἔξοδον τὴν τούτων μνήμην ποιεῖσθαι.,ἐμός,Louw Nida 92.2,εγω,"adjective, pronoun",—
NA28,3 John 4,"μειζοτέραν τούτων οὐκ ἔχω χαράν, ἵνα ἀκούω τὰ",ἐμὰ,τέκνα ἐν ἀληθείᾳ περιπατοῦντα.,ἐμός,Louw Nida 92.2,εγω,"adjective, pronoun",—
