Result,Lemma (Greek),Tense (Logos Greek),Voice (Logos Greek),Mood (Logos Greek),Person (Logos Greek),Number (Logos Greek),Reference,Previous Context,Next Context
βλέπεις,βλέπω,present,active,indicative,second person,singular,Mark 12:14,"καὶ ἐλθόντες λέγουσιν αὐτῷ· διδάσκαλε, οἴδαμεν ὅτι ἀληθὴς εἶ καὶ οὐ μέλει σοι περὶ οὐδενός· οὐ γὰρ","εἰς πρόσωπον ἀνθρώπων, ἀλλʼ ἐπʼ ἀληθείας τὴν ὁδὸν τοῦ θεοῦ διδάσκεις· ἔξεστιν δοῦναι"
βλέπεις,βλέπω,present,active,indicative,second person,singular,Matthew 7:3,Τί δὲ,"τὸ κάρφος τὸ ἐν τῷ ὀφθαλμῷ τοῦ ἀδελφοῦ σου, τὴν δὲ ἐν τῷ"
βλέπεις,βλέπω,present,active,indicative,second person,singular,Mark 5:31,καὶ ἔλεγον αὐτῷ οἱ μαθηταὶ αὐτοῦ·,τὸν ὄχλον συνθλίβοντά σε καὶ λέγεις· τίς μου ἥψατο;
βλέπεις,βλέπω,present,active,indicative,second person,singular,Mark 8:23,"εἰς τὰ ὄμματα αὐτοῦ, ἐπιθεὶς τὰς χεῖρας αὐτῷ ἐπηρώτα αὐτόν· εἴ τι",;
βλέπεις,βλέπω,present,active,indicative,second person,singular,Mark 13:2,καὶ ὁ Ἰησοῦς εἶπεν αὐτῷ·,ταύτας τὰς μεγάλας οἰκοδομάς; οὐ μὴ ἀφεθῇ ὧδε λίθος ἐπὶ λίθον ὃς οὐ μὴ καταλυθῇ.
βλέπεις,βλέπω,present,active,indicative,second person,singular,Luke 6:41,Τί δὲ,"τὸ κάρφος τὸ ἐν τῷ ὀφθαλμῷ τοῦ ἀδελφοῦ σου, τὴν δὲ δοκὸν τὴν"
βλέπεις,βλέπω,present,active,indicative,second person,singular,Luke 7:44,καὶ στραφεὶς πρὸς τὴν γυναῖκα τῷ Σίμωνι ἔφη·,"ταύτην τὴν γυναῖκα; εἰσῆλθόν σου εἰς τὴν οἰκίαν, ὕδωρ μοι ἐπὶ πόδας οὐκ"
βλέπεις,βλέπω,present,active,indicative,second person,singular,James 2:22,—,"ὅτι ἡ πίστις συνήργει τοῖς ἔργοις αὐτοῦ καὶ ἐκ τῶν ἔργων  ἡ πίστις ἐτελειώθη,"
βλέπεις,βλέπω,present,active,indicative,second person,singular,Revelation 1:11,λεγούσης·  ὃ,"γράψον εἰς βιβλίον καὶ πέμψον ταῖς ἑπτὰ ἐκκλησίαις, εἰς Ἔφεσον καὶ εἰς Σμύρναν"
βλέπειν,βλέπω,present,active,infinitive,—,—,Matthew 12:22,"Τότε προσηνέχθη αὐτῷ δαιμονιζόμενος τυφλὸς καὶ κωφός, καὶ ἐθεράπευσεν αὐτόν, ὥστε τὸν κωφὸν λαλεῖν καὶ",.
βλέπειν,βλέπω,present,active,infinitive,—,—,Luke 7:21,ἐν ἐκείνῃ τῇ ὥρᾳ ἐθεράπευσεν πολλοὺς ἀπὸ νόσων καὶ μαστίγων καὶ πνευμάτων πονηρῶν καὶ τυφλοῖς πολλοῖς ἐχαρίσατο,.
βλέπειν,βλέπω,present,active,infinitive,—,—,Acts 8:6,προσεῖχον δὲ οἱ ὄχλοι τοῖς λεγομένοις ὑπὸ τοῦ Φιλίππου ὁμοθυμαδὸν ἐν τῷ ἀκούειν αὐτοὺς καὶ,τὰ σημεῖα ἃ ἐποίει.
βλέπειν,βλέπω,present,active,infinitive,—,—,Acts 12:9,καὶ ἐξελθὼν ἠκολούθει καὶ οὐκ ᾔδει ὅτι ἀληθές ἐστιν τὸ γινόμενον διὰ τοῦ ἀγγέλου· ἐδόκει δὲ ὅραμα,.
βλέπειν,βλέπω,present,active,infinitive,—,—,Romans 11:8,"καθὼς γέγραπται·      ἔδωκεν αὐτοῖς ὁ θεὸς πνεῦμα κατανύξεως,      ὀφθαλμοὺς τοῦ μὴ","καὶ ὦτα τοῦ μὴ ἀκούειν,        ἕως τῆς σήμερον ἡμέρας."
βλέπειν,βλέπω,present,active,infinitive,—,—,Romans 11:10,σκοτισθήτωσαν οἱ ὀφθαλμοὶ αὐτῶν τοῦ μὴ,καὶ τὸν νῶτον αὐτῶν διὰ παντὸς σύγκαμψον.
βλέπειν,βλέπω,present,active,infinitive,—,—,Revelation 1:12,Καὶ  ἐπέστρεψα,"τὴν φωνὴν ἥτις ἐλάλει μετʼ ἐμοῦ, καὶ ἐπιστρέψας εἶδον ἑπτὰ λυχνίας χρυσᾶς"
βλέπειν,βλέπω,present,active,infinitive,—,—,Revelation 5:3,καὶ οὐδεὶς ἐδύνατο ἐν τῷ οὐρανῷ  οὐδὲ ἐπὶ τῆς γῆς  οὐδὲ ὑποκάτω τῆς γῆς ἀνοῖξαι τὸ βιβλίον οὔτε,αὐτό.
βλέπειν,βλέπω,present,active,infinitive,—,—,Revelation 5:4,"καὶ ἔκλαιον πολύ, ὅτι οὐδεὶς ἄξιος εὑρέθη ἀνοῖξαι  τὸ βιβλίον οὔτε",αὐτό.
βλέπειν,βλέπω,present,active,infinitive,—,—,Revelation 9:20,"ἀργυρᾶ καὶ τὰ χαλκᾶ καὶ τὰ λίθινα καὶ τὰ ξύλινα, ἃ οὔτε","δύνανται οὔτε ἀκούειν οὔτε περιπατεῖν,"
βλέπει,βλέπω,present,active,indicative,third person,singular,Luke 24:12,Ὁ δὲ Πέτρος ἀναστὰς ἔδραμεν ἐπὶ τὸ μνημεῖον καὶ παρακύψας,"τὰ ὀθόνια  μόνα, καὶ ἀπῆλθεν πρὸς ἑαυτὸν θαυμάζων τὸ γεγονός."
βλέπει,βλέπω,present,active,indicative,third person,singular,John 1:29,Τῇ ἐπαύριον,τὸν Ἰησοῦν ἐρχόμενον πρὸς αὐτὸν καὶ λέγει· ἴδε ὁ ἀμνὸς τοῦ θεοῦ ὁ
βλέπει,βλέπω,present,active,indicative,third person,singular,John 9:19,"καὶ ἠρώτησαν αὐτοὺς λέγοντες· οὗτός ἐστιν ὁ υἱὸς ὑμῶν, ὃν ὑμεῖς λέγετε ὅτι τυφλὸς ἐγεννήθη; πῶς οὖν",ἄρτι;
βλέπει,βλέπω,present,active,indicative,third person,singular,John 9:21,πῶς δὲ νῦν,"οὐκ οἴδαμεν, ἢ τίς ἤνοιξεν αὐτοῦ τοὺς ὀφθαλμοὺς ἡμεῖς οὐκ οἴδαμεν· αὐτὸν ἐρωτήσατε"
βλέπει,βλέπω,present,active,indicative,third person,singular,John 11:9,"περιπατῇ ἐν τῇ ἡμέρᾳ, οὐ προσκόπτει, ὅτι τὸ φῶς τοῦ κόσμου τούτου",·
βλέπει,βλέπω,present,active,indicative,third person,singular,John 20:1,Τῇ δὲ μιᾷ τῶν σαββάτων Μαρία ἡ Μαγδαληνὴ ἔρχεται πρωῒ σκοτίας ἔτι οὔσης εἰς τὸ μνημεῖον καὶ,τὸν λίθον ἠρμένον  ἐκ τοῦ μνημείου.
βλέπει,βλέπω,present,active,indicative,third person,singular,John 20:5,καὶ παρακύψας,"κείμενα τὰ ὀθόνια, οὐ μέντοι  εἰσῆλθεν."
βλέπει,βλέπω,present,active,indicative,third person,singular,John 21:20,Ἐπιστραφεὶς  ὁ Πέτρος,"τὸν μαθητὴν ὃν ἠγάπα ὁ Ἰησοῦς ἀκολουθοῦντα, ὃς καὶ ἀνέπεσεν ἐν τῷ δείπνῳ"
βλέπει,βλέπω,present,active,indicative,third person,singular,Romans 8:24,τῇ γὰρ ἐλπίδι ἐσώθημεν· ἐλπὶς δὲ βλεπομένη οὐκ ἔστιν ἐλπίς· ὃ γὰρ,τίς ἐλπίζει;
βλέπει,βλέπω,present,active,indicative,third person,singular,2 Corinthians 12:6,"ἀλήθειαν γὰρ ἐρῶ· φείδομαι δέ, μή τις εἰς ἐμὲ λογίσηται ὑπὲρ ὃ",με ἢ ἀκούει [τι] ἐξ ἐμοῦ
βλέπε,βλέπω,present,active,imperative,second person,singular,Colossians 4:17,καὶ εἴπατε Ἀρχίππῳ·,"τὴν διακονίαν ἣν παρέλαβες ἐν κυρίῳ, ἵνα αὐτὴν πληροῖς."
Βλέπετε,βλέπω,present,active,imperative,second person,plural,Mark 13:9,—,δὲ ὑμεῖς ἑαυτούς· παραδώσουσιν ὑμᾶς εἰς συνέδρια καὶ εἰς συναγωγὰς δαρήσεσθε καὶ ἐπὶ
Βλέπετε,βλέπω,present,active,imperative,second person,plural,Mark 13:33,—,", ἀγρυπνεῖτε· οὐκ οἴδατε γὰρ πότε ὁ καιρός ἐστιν."
Βλέπετε,βλέπω,present,active,imperative,second person,plural,Luke 8:18,—,"οὖν πῶς ἀκούετε· ὃς ἂν γὰρ ἔχῃ, δοθήσεται αὐτῷ· καὶ ὃς ἂν μὴ"
Βλέπετε,βλέπω,present,active,indicative,second person,plural,1 Corinthians 1:26,—,"γὰρ τὴν κλῆσιν ὑμῶν, ἀδελφοί, ὅτι οὐ πολλοὶ σοφοὶ κατὰ σάρκα, οὐ πολλοὶ δυνατοί, οὐ πολλοὶ εὐγενεῖς·"
Βλέπετε,βλέπω,present,active,imperative,second person,plural,Ephesians 5:15,—,"οὖν ἀκριβῶς πῶς περιπατεῖτε μὴ ὡς ἄσοφοι ἀλλʼ ὡς σοφοί,"
Βλέπετε,βλέπω,present,active,imperative,second person,plural,Philippians 3:2,—,"τοὺς κύνας, βλέπετε τοὺς κακοὺς ἐργάτας, βλέπετε τὴν κατατομήν."
Βλέπετε,βλέπω,present,active,imperative,second person,plural,Colossians 2:8,—,μή τις ⸉ὑμᾶς ἔσται ὁ συλαγωγῶν διὰ τῆς φιλοσοφίας καὶ κενῆς ἀπάτης κατὰ
Βλέπετε,βλέπω,present,active,imperative,second person,plural,Hebrews 3:12,—,", ἀδελφοί, μήποτε ἔσται ἔν τινι ὑμῶν καρδία πονηρὰ ἀπιστίας ἐν τῷ ἀποστῆναι ἀπὸ θεοῦ ζῶντος,"
Βλέπετε,βλέπω,present,active,imperative,second person,plural,Hebrews 12:25,—,μὴ παραιτήσησθε τὸν λαλοῦντα· εἰ γὰρ ἐκεῖνοι οὐκ ἐξέφυγον ἐπὶ γῆς παραιτησάμενοι τὸν
