Result,Lemma (Greek),Tense (Logos Greek),Voice (Logos Greek),Mood (Logos Greek),Person (Logos Greek),Gender (Logos Greek),Case (Logos Greek),Number (Logos Greek),Part of Speech,Reference,Previous Context,Next Context
πληρωθῇ,πληρόω,aorist,passive,subjunctive,third person,—,—,singular,verb,Matthew 1:22,τοῦτο δὲ ὅλον γέγονεν ἵνα,τὸ ῥηθὲν ὑπὸ  κυρίου διὰ  τοῦ προφήτου λέγοντος·
πληρωθῇ,πληρόω,aorist,passive,subjunctive,third person,—,—,singular,verb,Matthew 2:15,καὶ ἦν ἐκεῖ ἕως τῆς τελευτῆς Ἡρῴδου· ἵνα,τὸ ῥηθὲν ὑπὸ κυρίου διὰ τοῦ προφήτου λέγοντος·        ἐξ Αἰγύπτου ἐκάλεσα τὸν υἱόν μου.
ἐπληρώθη,πληρόω,aorist,passive,indicative,third person,—,—,singular,verb,Matthew 2:17,τότε,τὸ ῥηθὲν  διὰ Ἰερεμίου τοῦ προφήτου λέγοντος·
πληρωθῇ,πληρόω,aorist,passive,subjunctive,third person,—,—,singular,verb,Matthew 2:23,καὶ ἐλθὼν κατῴκησεν εἰς πόλιν λεγομένην Ναζαρέτ· ὅπως,τὸ ῥηθὲν διὰ τῶν προφητῶν ὅτι Ναζωραῖος κληθήσεται.
πληρῶσαι,πληρόω,aorist,active,infinitive,—,—,—,—,verb,Matthew 3:15,"ἀποκριθεὶς δὲ ὁ Ἰησοῦς εἶπεν πρὸς αὐτόν· ἄφες ἄρτι, οὕτως γὰρ πρέπον ἐστὶν ἡμῖν",πᾶσαν δικαιοσύνην. τότε ἀφίησιν αὐτόν.
πληρωθῇ,πληρόω,aorist,passive,subjunctive,third person,—,—,singular,verb,Matthew 4:14,ἵνα,τὸ ῥηθὲν διὰ Ἠσαΐου τοῦ προφήτου λέγοντος·
πληρῶσαι,πληρόω,aorist,active,infinitive,—,—,—,—,verb,Matthew 5:17,Μὴ νομίσητε ὅτι ἦλθον καταλῦσαι τὸν νόμον ἢ τοὺς προφήτας· οὐκ ἦλθον καταλῦσαι ἀλλὰ,.
πληρωθῇ,πληρόω,aorist,passive,subjunctive,third person,—,—,singular,verb,Matthew 8:17,ὅπως,τὸ ῥηθὲν διὰ Ἠσαΐου τοῦ προφήτου λέγοντος·        αὐτὸς τὰς ἀσθενείας ἡμῶν ἔλαβεν        καὶ τὰς νόσους ἐβάστασεν.
πληρωθῇ,πληρόω,aorist,passive,subjunctive,third person,—,—,singular,verb,Matthew 12:17,ἵνα,τὸ ῥηθὲν διὰ Ἠσαΐου τοῦ προφήτου λέγοντος·
πληρωθῇ,πληρόω,aorist,passive,subjunctive,third person,—,—,singular,verb,Matthew 13:35,ὅπως,"τὸ ῥηθὲν διὰ  τοῦ προφήτου λέγοντος·        ἀνοίξω ἐν παραβολαῖς τὸ στόμα μου,           ἐρεύξομαι κεκρυμμένα ἀπὸ καταβολῆς [κόσμου]."
ἐπληρώθη,πληρόω,aorist,passive,indicative,third person,—,—,singular,verb,Matthew 13:48,ἣν ὅτε,"ἀναβιβάσαντες ἐπὶ τὸν αἰγιαλὸν καὶ καθίσαντες συνέλεξαν τὰ καλὰ εἰς ἄγγη, τὰ δὲ σαπρὰ ἔξω ἔβαλον."
πληρωθῇ,πληρόω,aorist,passive,subjunctive,third person,—,—,singular,verb,Matthew 21:4,τοῦτο δὲ  γέγονεν ἵνα,τὸ ῥηθὲν διὰ τοῦ προφήτου λέγοντος·
πληρώσατε,πληρόω,aorist,active,imperative,second person,—,—,plural,verb,Matthew 23:32,καὶ ὑμεῖς,τὸ μέτρον τῶν πατέρων ὑμῶν.
πληρωθῶσιν,πληρόω,aorist,passive,subjunctive,third person,—,—,plural,verb,Matthew 26:54,πῶς οὖν,αἱ γραφαὶ ὅτι οὕτως δεῖ γενέσθαι;
πληρωθῶσιν,πληρόω,aorist,passive,subjunctive,third person,—,—,plural,verb,Matthew 26:56,τοῦτο δὲ ὅλον γέγονεν ἵνα,αἱ γραφαὶ τῶν προφητῶν. Τότε οἱ μαθηταὶ  πάντες ἀφέντες αὐτὸν ἔφυγον.
ἐπληρώθη,πληρόω,aorist,passive,indicative,third person,—,—,singular,verb,Matthew 27:9,τότε,"τὸ ῥηθὲν διὰ Ἰερεμίου τοῦ προφήτου λέγοντος· καὶ ἔλαβον τὰ τριάκοντα ἀργύρια, τὴν"
πεπλήρωται,πληρόω,perfect,passive,indicative,third person,—,—,singular,verb,Mark 1:15,καὶ λέγων ὅτι,ὁ καιρὸς καὶ ἤγγικεν ἡ βασιλεία τοῦ θεοῦ· μετανοεῖτε καὶ πιστεύετε ἐν τῷ εὐαγγελίῳ.
πληρωθῶσιν,πληρόω,aorist,passive,subjunctive,third person,—,—,plural,verb,Mark 14:49,καθʼ ἡμέραν ἤμην πρὸς ὑμᾶς ἐν τῷ ἱερῷ διδάσκων καὶ οὐκ ἐκρατήσατέ με· ἀλλʼ ἵνα,αἱ γραφαί.
πληρωθήσονται,πληρόω,future,passive,indicative,third person,—,—,plural,verb,Luke 1:20,"ἧς ἡμέρας γένηται ταῦτα, ἀνθʼ ὧν οὐκ ἐπίστευσας τοῖς λόγοις μου, οἵτινες",εἰς τὸν καιρὸν αὐτῶν.
πληρούμενον,πληρόω,present,passive,participle,—,neuter,nominative,singular,verb,Luke 2:40,Τὸ δὲ παιδίον ηὔξανεν καὶ ἐκραταιοῦτο,"σοφίᾳ, καὶ χάρις θεοῦ ἦν ἐπʼ αὐτό."
πληρωθήσεται,πληρόω,future,passive,indicative,third person,—,—,singular,verb,Luke 3:5,πᾶσα φάραγξ,"καὶ πᾶν ὄρος καὶ βουνὸς ταπεινωθήσεται,        καὶ ἔσται τὰ σκολιὰ εἰς εὐθεῖαν           καὶ"
πεπλήρωται,πληρόω,perfect,passive,indicative,third person,—,—,singular,verb,Luke 4:21,ἤρξατο δὲ λέγειν πρὸς αὐτοὺς ὅτι σήμερον,ἡ γραφὴ αὕτη ἐν τοῖς ὠσὶν ὑμῶν.
ἐπλήρωσεν,πληρόω,aorist,active,indicative,third person,—,—,singular,verb,Luke 7:1,Ἐπειδὴ,"πάντα τὰ ῥήματα αὐτοῦ εἰς τὰς ἀκοὰς τοῦ λαοῦ, εἰσῆλθεν εἰς Καφαρναούμ."
πληροῦν,πληρόω,present,active,infinitive,—,—,—,—,verb,Luke 9:31,"οἳ ὀφθέντες ἐν δόξῃ ἔλεγον τὴν ἔξοδον αὐτοῦ, ἣν ἤμελλεν",ἐν Ἰερουσαλήμ.
πληρωθῶσιν,πληρόω,aorist,passive,subjunctive,third person,—,—,plural,verb,Luke 21:24,"καὶ πεσοῦνται στόματι μαχαίρης καὶ αἰχμαλωτισθήσονται εἰς τὰ ἔθνη πάντα, καὶ Ἰερουσαλὴμ ἔσται πατουμένη ὑπὸ ἐθνῶν, ἄχρι οὗ",καιροὶ ἐθνῶν.
πληρωθῇ,πληρόω,aorist,passive,subjunctive,third person,—,—,singular,verb,Luke 22:16,λέγω γὰρ ὑμῖν ὅτι οὐ μὴ φάγω αὐτὸ ἕως ὅτου,ἐν τῇ βασιλείᾳ τοῦ θεοῦ.
πληρωθῆναι,πληρόω,aorist,passive,infinitive,—,—,—,—,verb,Luke 24:44,"Εἶπεν δὲ πρὸς αὐτούς· οὗτοι οἱ λόγοι μου οὓς ἐλάλησα πρὸς ὑμᾶς ἔτι ὢν σὺν ὑμῖν, ὅτι δεῖ",πάντα τὰ γεγραμμένα ἐν τῷ νόμῳ Μωϋσέως καὶ τοῖς προφήταις καὶ ψαλμοῖς περὶ ἐμοῦ.
πεπλήρωται,πληρόω,perfect,passive,indicative,third person,—,—,singular,verb,John 3:29,χαίρει διὰ τὴν φωνὴν τοῦ νυμφίου. αὕτη οὖν ἡ χαρὰ ἡ ἐμὴ,.
πεπλήρωται,πληρόω,perfect,passive,indicative,third person,—,—,singular,verb,John 7:8,"ὑμεῖς ἀνάβητε εἰς τὴν ἑορτήν· ἐγὼ οὐκ ἀναβαίνω εἰς τὴν ἑορτὴν ταύτην, ὅτι ὁ ἐμὸς καιρὸς οὔπω",.
ἐπληρώθη,πληρόω,aorist,passive,indicative,third person,—,—,singular,verb,John 12:3,Ἰησοῦ καὶ ἐξέμαξεν ταῖς θριξὶν αὐτῆς τοὺς πόδας αὐτοῦ·  ἡ δὲ οἰκία,ἐκ τῆς ὀσμῆς τοῦ μύρου.
πληρωθῇ,πληρόω,aorist,passive,subjunctive,third person,—,—,singular,verb,John 12:38,ἵνα ὁ λόγος Ἠσαΐου τοῦ προφήτου,"ὃν εἶπεν·        κύριε, τίς ἐπίστευσεν τῇ ἀκοῇ ἡμῶν;           καὶ ὁ βραχίων κυρίου τίνι ἀπεκαλύφθη;"
πληρωθῇ,πληρόω,aorist,passive,subjunctive,third person,—,—,singular,verb,John 13:18,Οὐ περὶ πάντων ὑμῶν λέγω· ἐγὼ οἶδα τίνας ἐξελεξάμην· ἀλλʼ ἵνα ἡ γραφὴ,· ὁ τρώγων μου τὸν ἄρτον ἐπῆρεν ἐπʼ ἐμὲ τὴν πτέρναν αὐτοῦ.
πληρωθῇ,πληρόω,aorist,passive,subjunctive,third person,—,—,singular,verb,John 15:11,Ταῦτα λελάληκα ὑμῖν ἵνα ἡ χαρὰ ἡ ἐμὴ ἐν ὑμῖν ᾖ καὶ ἡ χαρὰ ὑμῶν,.
πληρωθῇ,πληρόω,aorist,passive,subjunctive,third person,—,—,singular,verb,John 15:25,ἀλλʼ ἵνα,ὁ λόγος ὁ ἐν τῷ νόμῳ αὐτῶν γεγραμμένος ὅτι ἐμίσησάν με δωρεάν.
πεπλήρωκεν,πληρόω,perfect,active,indicative,third person,—,—,singular,verb,John 16:6,ἀλλʼ ὅτι ταῦτα λελάληκα ὑμῖν ἡ λύπη,ὑμῶν τὴν καρδίαν.
πεπληρωμένη,πληρόω,perfect,passive,participle,—,feminine,nominative,singular,verb,John 16:24,"ἕως ἄρτι οὐκ ᾐτήσατε οὐδὲν ἐν τῷ ὀνόματί μου· αἰτεῖτε καὶ λήμψεσθε, ἵνα ἡ χαρὰ ὑμῶν ᾖ",.
πληρωθῇ,πληρόω,aorist,passive,subjunctive,third person,—,—,singular,verb,John 17:12,"ἐξ αὐτῶν ἀπώλετο εἰ μὴ ὁ υἱὸς τῆς ἀπωλείας, ἵνα ἡ γραφὴ",.
πεπληρωμένην,πληρόω,perfect,passive,participle,—,feminine,accusative,singular,verb,John 17:13,νῦν δὲ πρὸς σὲ ἔρχομαι καὶ ταῦτα λαλῶ ἐν τῷ κόσμῳ ἵνα ἔχωσιν τὴν χαρὰν τὴν ἐμὴν,ἐν ἑαυτοῖς.
πληρωθῇ,πληρόω,aorist,passive,subjunctive,third person,—,—,singular,verb,John 18:9,ἵνα,ὁ λόγος ὃν εἶπεν ὅτι οὓς δέδωκάς μοι οὐκ ἀπώλεσα ἐξ αὐτῶν οὐδένα.
πληρωθῇ,πληρόω,aorist,passive,subjunctive,third person,—,—,singular,verb,John 18:32,ἵνα ὁ λόγος τοῦ Ἰησοῦ,ὃν εἶπεν σημαίνων ποίῳ θανάτῳ ἤμελλεν ἀποθνῄσκειν.
πληρωθῇ,πληρόω,aorist,passive,subjunctive,third person,—,—,singular,verb,John 19:24,"εἶπαν οὖν πρὸς ἀλλήλους· μὴ σχίσωμεν αὐτόν, ἀλλὰ λάχωμεν περὶ αὐτοῦ τίνος ἔσται· ἵνα ἡ γραφὴ",[ἡ λέγουσα]·        διεμερίσαντο τὰ ἱμάτιά μου ἑαυτοῖς           καὶ ἐπὶ τὸν ἱματισμόν μου ἔβαλον
πληρωθῇ,πληρόω,aorist,passive,subjunctive,third person,—,—,singular,verb,John 19:36,ἐγένετο γὰρ ταῦτα ἵνα ἡ γραφὴ,· ὀστοῦν οὐ συντριβήσεται αὐτοῦ.
πληρωθῆναι,πληρόω,aorist,passive,infinitive,—,—,—,—,verb,Acts 1:16,"ἄνδρες ἀδελφοί, ἔδει",τὴν γραφὴν  ἣν προεῖπεν τὸ πνεῦμα τὸ ἅγιον διὰ στόματος Δαυὶδ περὶ Ἰούδα
ἐπλήρωσεν,πληρόω,aorist,active,indicative,third person,—,—,singular,verb,Acts 2:2,καὶ  ἐγένετο ἄφνω ἐκ τοῦ οὐρανοῦ ἦχος ὥσπερ φερομένης πνοῆς βιαίας καὶ,ὅλον τὸν οἶκον οὗ ἦσαν καθήμενοι
πληρώσεις,πληρόω,future,active,indicative,second person,—,—,singular,verb,Acts 2:28,"ἐγνώρισάς μοι ὁδοὺς ζωῆς,",με εὐφροσύνης μετὰ τοῦ προσώπου σου.
ἐπλήρωσεν,πληρόω,aorist,active,indicative,third person,—,—,singular,verb,Acts 3:18,"ὁ δὲ θεός, ἃ προκατήγγειλεν διὰ στόματος πάντων τῶν προφητῶν παθεῖν τὸν χριστὸν αὐτοῦ,",οὕτως.
ἐπλήρωσεν,πληρόω,aorist,active,indicative,third person,—,—,singular,verb,Acts 5:3,"εἶπεν δὲ ὁ Πέτρος· Ἁνανία, διὰ τί","ὁ σατανᾶς τὴν καρδίαν σου, ψεύσασθαί σε τὸ πνεῦμα τὸ ἅγιον καὶ νοσφίσασθαι"
πεπληρώκατε,πληρόω,perfect,active,indicative,second person,—,—,plural,verb,Acts 5:28,"λέγων· [οὐ] παραγγελίᾳ παρηγγείλαμεν ὑμῖν μὴ διδάσκειν ἐπὶ τῷ ὀνόματι τούτῳ, καὶ ἰδοὺ",τὴν Ἰερουσαλὴμ τῆς διδαχῆς ὑμῶν καὶ βούλεσθε ἐπαγαγεῖν ἐφʼ ἡμᾶς τὸ αἷμα τοῦ ἀνθρώπου τούτου.
ἐπληροῦτο,πληρόω,imperfect,passive,indicative,third person,—,—,singular,verb,Acts 7:23,Ὡς δὲ,"αὐτῷ τεσσερακονταετὴς χρόνος, ἀνέβη ἐπὶ τὴν καρδίαν αὐτοῦ ἐπισκέψασθαι τοὺς ἀδελφοὺς αὐτοῦ τοὺς υἱοὺς Ἰσραήλ."
πληρωθέντων,πληρόω,aorist,passive,participle,—,neuter,genitive,plural,verb,Acts 7:30,Καὶ,ἐτῶν τεσσεράκοντα ὤφθη αὐτῷ ἐν τῇ ἐρήμῳ τοῦ ὄρους Σινᾶ ἄγγελος  ἐν φλογὶ πυρὸς βάτου.
ἐπληροῦντο,πληρόω,imperfect,passive,indicative,third person,—,—,plural,verb,Acts 9:23,Ὡς δὲ,"ἡμέραι ἱκαναί, συνεβουλεύσαντο οἱ Ἰουδαῖοι ἀνελεῖν αὐτόν·"
πληρώσαντες,πληρόω,aorist,active,participle,—,masculine,nominative,plural,verb,Acts 12:25,Βαρναβᾶς δὲ καὶ Σαῦλος  ὑπέστρεψαν εἰς Ἰερουσαλὴμ,"τὴν διακονίαν, συμπαραλαβόντες Ἰωάννην τὸν ἐπικληθέντα Μᾶρκον."
ἐπλήρου,πληρόω,imperfect,active,indicative,third person,—,—,singular,verb,Acts 13:25,ὡς δὲ,"Ἰωάννης τὸν δρόμον, ἔλεγεν· τί ἐμὲ ὑπονοεῖτε εἶναι; οὐκ εἰμὶ ἐγώ· ἀλλʼ ἰδοὺ"
ἐπλήρωσαν,πληρόω,aorist,active,indicative,third person,—,—,plural,verb,Acts 13:27,ἀγνοήσαντες καὶ τὰς φωνὰς τῶν προφητῶν τὰς κατὰ πᾶν σάββατον ἀναγινωσκομένας  κρίναντες,","
ἐπληροῦντο,πληρόω,imperfect,passive,indicative,third person,—,—,plural,verb,Acts 13:52,οἵ τε μαθηταὶ,χαρᾶς καὶ πνεύματος ἁγίου.
ἐπλήρωσαν,πληρόω,aorist,active,indicative,third person,—,—,plural,verb,Acts 14:26,"κἀκεῖθεν ἀπέπλευσαν εἰς Ἀντιόχειαν, ὅθεν ἦσαν παραδεδομένοι τῇ χάριτι τοῦ θεοῦ εἰς τὸ ἔργον ὃ",.
ἐπληρώθη,πληρόω,aorist,passive,indicative,third person,—,—,singular,verb,Acts 19:21,Ὡς δὲ,"ταῦτα, ἔθετο ὁ Παῦλος ἐν τῷ πνεύματι διελθὼν τὴν Μακεδονίαν καὶ  Ἀχαΐαν πορεύεσθαι"
πληρωθείσης,πληρόω,aorist,passive,participle,—,feminine,genitive,singular,verb,Acts 24:27,Διετίας δὲ,"ἔλαβεν διάδοχον ὁ Φῆλιξ Πόρκιον Φῆστον,  θέλων τε χάριτα καταθέσθαι τοῖς Ἰουδαίοις ὁ"
πεπληρωμένους,πληρόω,perfect,passive,participle,—,masculine,accusative,plural,verb,Romans 1:29,—,"πάσῃ ἀδικίᾳ πονηρίᾳ πλεονεξίᾳ κακίᾳ, μεστοὺς φθόνου φόνου ἔριδος δόλου κακοηθείας, ψιθυριστὰς"
πληρωθῇ,πληρόω,aorist,passive,subjunctive,third person,—,—,singular,verb,Romans 8:4,ἵνα τὸ δικαίωμα τοῦ νόμου,ἐν ἡμῖν τοῖς μὴ κατὰ σάρκα περιπατοῦσιν ἀλλὰ κατὰ πνεῦμα.
πεπλήρωκεν,πληρόω,perfect,active,indicative,third person,—,—,singular,verb,Romans 13:8,Μηδενὶ μηδὲν ὀφείλετε εἰ μὴ τὸ ἀλλήλους ἀγαπᾶν· ὁ γὰρ ἀγαπῶν τὸν ἕτερον νόμον,.
πληρώσαι,πληρόω,aorist,active,optative,third person,—,—,singular,verb,Romans 15:13,Ὁ δὲ θεὸς τῆς ἐλπίδος,"ὑμᾶς πάσης χαρᾶς καὶ εἰρήνης ἐν τῷ πιστεύειν, εἰς τὸ περισσεύειν ὑμᾶς ἐν"
πεπληρωμένοι,πληρόω,perfect,passive,participle,—,masculine,nominative,plural,verb,Romans 15:14,"Πέπεισμαι δέ, ἀδελφοί μου, καὶ αὐτὸς ἐγὼ περὶ ὑμῶν ὅτι καὶ αὐτοὶ μεστοί ἐστε ἀγαθωσύνης,","πάσης [τῆς] γνώσεως, δυνάμενοι καὶ ἀλλήλους νουθετεῖν."
πεπληρωκέναι,πληρόω,perfect,active,infinitive,—,—,—,—,verb,Romans 15:19,"ἐν δυνάμει  σημείων  καὶ τεράτων, ἐν δυνάμει πνεύματος [θεοῦ]· ὥστε με ἀπὸ Ἰερουσαλὴμ καὶ κύκλῳ μέχρι τοῦ Ἰλλυρικοῦ","τὸ εὐαγγέλιον τοῦ Χριστοῦ,"
πεπλήρωμαι,πληρόω,perfect,passive,indicative,first person,—,—,singular,verb,2 Corinthians 7:4,"πολλή μοι παρρησία πρὸς ὑμᾶς, πολλή μοι καύχησις ὑπὲρ ὑμῶν·","τῇ παρακλήσει, ὑπερπερισσεύομαι  τῇ χαρᾷ ἐπὶ πάσῃ τῇ θλίψει ἡμῶν."
πληρωθῇ,πληρόω,aorist,passive,subjunctive,third person,—,—,singular,verb,2 Corinthians 10:6,"καὶ ἐν ἑτοίμῳ ἔχοντες ἐκδικῆσαι πᾶσαν παρακοήν, ὅταν",ὑμῶν ἡ ὑπακοή.
πεπλήρωται,πληρόω,perfect,passive,indicative,third person,—,—,singular,verb,Galatians 5:14,ὁ γὰρ πᾶς νόμος ἐν ἑνὶ λόγῳ,", ἐν τῷ· ἀγαπήσεις τὸν πλησίον σου ὡς σεαυτόν."
πληρουμένου,πληρόω,present,middle,participle,—,masculine,genitive,singular,verb,Ephesians 1:23,"ἥτις ἐστὶν τὸ σῶμα αὐτοῦ, τὸ πλήρωμα τοῦ τὰ πάντα ἐν πᾶσιν",.
πληρωθῆτε,πληρόω,aorist,passive,subjunctive,second person,—,—,plural,verb,Ephesians 3:19,"γνῶναί τε τὴν ὑπερβάλλουσαν τῆς γνώσεως ἀγάπην τοῦ Χριστοῦ, ἵνα",εἰς πᾶν τὸ πλήρωμα τοῦ θεοῦ.
πληρώσῃ,πληρόω,aorist,active,subjunctive,third person,—,—,singular,verb,Ephesians 4:10,"ὁ καταβὰς αὐτός ἐστιν καὶ ὁ ἀναβὰς ὑπεράνω πάντων τῶν οὐρανῶν, ἵνα",τὰ πάντα.
πληροῦσθε,πληρόω,present,passive,imperative,second person,—,—,plural,verb,Ephesians 5:18,"καὶ μὴ μεθύσκεσθε οἴνῳ, ἐν ᾧ ἐστιν ἀσωτία, ἀλλὰ","ἐν πνεύματι,"
πεπληρωμένοι,πληρόω,perfect,passive,participle,—,masculine,nominative,plural,verb,Philippians 1:11,—,καρπὸν δικαιοσύνης τὸν διὰ Ἰησοῦ Χριστοῦ εἰς δόξαν καὶ ἔπαινον θεοῦ.
πληρώσατέ,πληρόω,aorist,active,imperative,second person,—,—,plural,verb,Philippians 2:2,—,"μου τὴν χαρὰν ἵνα τὸ αὐτὸ φρονῆτε, τὴν αὐτὴν ἀγάπην ἔχοντες, σύμψυχοι, τὸ ἓν φρονοῦντες,"
πεπλήρωμαι,πληρόω,perfect,passive,indicative,first person,—,—,singular,verb,Philippians 4:18,ἀπέχω δὲ πάντα καὶ περισσεύω·,"δεξάμενος παρὰ Ἐπαφροδίτου τὰ παρʼ ὑμῶν, ὀσμὴν εὐωδίας, θυσίαν δεκτήν, εὐάρεστον τῷ θεῷ."
πληρώσει,πληρόω,future,active,indicative,third person,—,—,singular,verb,Philippians 4:19,ὁ δὲ θεός μου,πᾶσαν χρείαν ὑμῶν κατὰ τὸ πλοῦτος αὐτοῦ ἐν δόξῃ ἐν Χριστῷ Ἰησοῦ.
πληρωθῆτε,πληρόω,aorist,passive,subjunctive,second person,—,—,plural,verb,Colossians 1:9,"Διὰ τοῦτο καὶ ἡμεῖς, ἀφʼ ἧς ἡμέρας ἠκούσαμεν, οὐ παυόμεθα ὑπὲρ ὑμῶν προσευχόμενοι καὶ αἰτούμενοι, ἵνα","τὴν ἐπίγνωσιν τοῦ θελήματος αὐτοῦ ἐν πάσῃ σοφίᾳ καὶ συνέσει πνευματικῇ,"
πληρῶσαι,πληρόω,aorist,active,infinitive,—,—,—,—,verb,Colossians 1:25,ἧς ἐγενόμην ἐγὼ διάκονος κατὰ τὴν οἰκονομίαν τοῦ θεοῦ τὴν δοθεῖσάν μοι εἰς ὑμᾶς,"τὸν λόγον τοῦ θεοῦ,"
πεπληρωμένοι,πληρόω,perfect,passive,participle,—,masculine,nominative,plural,verb,Colossians 2:10,καὶ ἐστὲ ἐν αὐτῷ,", ὅς ἐστιν ἡ κεφαλὴ πάσης ἀρχῆς καὶ ἐξουσίας."
πληροῖς,πληρόω,present,active,subjunctive,second person,—,—,singular,verb,Colossians 4:17,"καὶ εἴπατε Ἀρχίππῳ· βλέπε τὴν διακονίαν ἣν παρέλαβες ἐν κυρίῳ, ἵνα αὐτὴν",.
πληρώσῃ,πληρόω,aorist,active,subjunctive,third person,—,—,singular,verb,2 Thessalonians 1:11,"Εἰς ὃ καὶ προσευχόμεθα πάντοτε περὶ ὑμῶν, ἵνα ὑμᾶς ἀξιώσῃ τῆς κλήσεως ὁ θεὸς ἡμῶν καὶ","πᾶσαν εὐδοκίαν ἀγαθωσύνης καὶ ἔργον πίστεως ἐν δυνάμει,"
πληρωθῶ,πληρόω,aorist,passive,subjunctive,first person,—,—,singular,verb,2 Timothy 1:4,"ἐπιποθῶν σε ἰδεῖν, μεμνημένος σου τῶν δακρύων, ἵνα χαρᾶς",","
ἐπληρώθη,πληρόω,aorist,passive,indicative,third person,—,—,singular,verb,James 2:23,καὶ,"ἡ γραφὴ ἡ λέγουσα· ἐπίστευσεν δὲ Ἀβραὰμ τῷ θεῷ, καὶ ἐλογίσθη αὐτῷ εἰς"
πεπληρωμένη,πληρόω,perfect,passive,participle,—,feminine,nominative,singular,verb,1 John 1:4,"καὶ ταῦτα γράφομεν ἡμεῖς, ἵνα ἡ χαρὰ ἡμῶν ᾖ",.
πεπληρωμένη,πληρόω,perfect,passive,participle,—,feminine,nominative,singular,verb,2 John 12,"πρὸς ὑμᾶς καὶ στόμα πρὸς στόμα λαλῆσαι, ἵνα ἡ χαρὰ ἡμῶν ᾖ",.
πεπληρωμένα,πληρόω,perfect,passive,participle,—,neuter,accusative,plural,verb,Revelation 3:2,"γίνου γρηγορῶν καὶ στήρισον τὰ λοιπὰ ἃ ἔμελλον ἀποθανεῖν, οὐ γὰρ εὕρηκά σου τὰ ἔργα",ἐνώπιον τοῦ θεοῦ μου.
πληρωθῶσιν,πληρόω,aorist,passive,subjunctive,third person,—,—,plural,verb,Revelation 6:11,"καὶ ἐδόθη αὐτοῖς ἑκάστῳ στολὴ λευκὴ καὶ ἐρρέθη αὐτοῖς ἵνα ἀναπαύσονται ἔτι χρόνον μικρόν, ἕως",καὶ οἱ σύνδουλοι αὐτῶν καὶ οἱ ἀδελφοὶ αὐτῶν  οἱ μέλλοντες ἀποκτέννεσθαι ὡς καὶ αὐτοί.
