Result,Lemma (Greek),Tense (Logos Greek),Voice (Logos Greek),Mood (Logos Greek),Person (Logos Greek),Gender (Logos Greek),Case (Logos Greek),Number (Logos Greek),Part of Speech,Reference,Previous Context,Next Context
ἐξέλθατε,ἐξέρχομαι,aorist,active,imperative,second person,—,—,plural,verb,2 Corinthians 6:17,διὸ,"ἐκ μέσου αὐτῶν        καὶ ἀφορίσθητε, λέγει κύριος,      καὶ ἀκαθάρτου μὴ ἅπτεσθε·        κἀγὼ εἰσδέξομαι ὑμᾶς"
ἐξέλθατε,ἐξέρχομαι,aorist,active,imperative,second person,—,—,plural,verb,Revelation 18:4,Καὶ ἤκουσα ἄλλην φωνὴν ἐκ τοῦ οὐρανοῦ λέγουσαν·,"ὁ λαός μου ἐξ αὐτῆς ἵνα μὴ συγκοινωνήσητε ταῖς ἁμαρτίαις αὐτῆς, καὶ ἐκ"
ἐξέλθητε,ἐξέρχομαι,aorist,active,subjunctive,second person,—,—,plural,verb,Matthew 10:11,"Εἰς ἣν δʼ ἂν πόλιν ἢ κώμην εἰσέλθητε, ἐξετάσατε τίς ἐν αὐτῇ ἄξιός ἐστιν· κἀκεῖ μείνατε ἕως ἂν",.
ἐξέλθητε,ἐξέρχομαι,aorist,active,subjunctive,second person,—,—,plural,verb,Matthew 24:26,"ἐὰν οὖν εἴπωσιν ὑμῖν· ἰδοὺ ἐν τῇ ἐρήμῳ ἐστίν, μὴ","· ἰδοὺ ἐν τοῖς ταμείοις, μὴ πιστεύσητε·"
ἐξέλθητε,ἐξέρχομαι,aorist,active,subjunctive,second person,—,—,plural,verb,Mark 6:10,"καὶ ἔλεγεν αὐτοῖς· ὅπου ἐὰν εἰσέλθητε εἰς οἰκίαν, ἐκεῖ μένετε ἕως ἂν",ἐκεῖθεν.
ἐξέλθῃ,ἐξέρχομαι,aorist,active,subjunctive,third person,—,—,singular,verb,Matthew 12:43,Ὅταν δὲ τὸ ἀκάθαρτον πνεῦμα,"ἀπὸ τοῦ ἀνθρώπου, διέρχεται διʼ ἀνύδρων τόπων ζητοῦν ἀνάπαυσιν καὶ οὐχ εὑρίσκει."
ἐξέλθῃ,ἐξέρχομαι,aorist,active,subjunctive,third person,—,—,singular,verb,Luke 11:24,Ὅταν  τὸ ἀκάθαρτον πνεῦμα,"ἀπὸ τοῦ ἀνθρώπου, διέρχεται διʼ ἀνύδρων τόπων ζητοῦν ἀνάπαυσιν καὶ μὴ εὑρίσκον· [τότε"
ἐξέλθῃ,ἐξέρχομαι,aorist,active,subjunctive,third person,—,—,singular,verb,Revelation 3:12,Ὁ νικῶν ποιήσω αὐτὸν στῦλον ἐν τῷ ναῷ τοῦ θεοῦ μου καὶ ἔξω οὐ μὴ,ἔτι καὶ γράψω ἐπʼ αὐτὸν τὸ ὄνομα τοῦ θεοῦ μου καὶ τὸ ὄνομα
ἐξέλθῃς,ἐξέρχομαι,aorist,active,subjunctive,second person,—,—,singular,verb,Matthew 5:26,"ἀμὴν λέγω σοι, οὐ μὴ","ἐκεῖθεν, ἕως ἂν ἀποδῷς τὸν ἔσχατον κοδράντην."
ἐξέλθῃς,ἐξέρχομαι,aorist,active,subjunctive,second person,—,—,singular,verb,Luke 12:59,"λέγω σοι, οὐ μὴ","ἐκεῖθεν, ἕως  καὶ τὸ ἔσχατον λεπτὸν ἀποδῷς."
ἐξέρχεσθε,ἐξέρχομαι,present,either middle or passive,imperative,second person,—,—,plural,verb,Matthew 25:6,"μέσης δὲ νυκτὸς κραυγὴ γέγονεν· ἰδοὺ ὁ νυμφίος,",εἰς ἀπάντησιν [αὐτοῦ].
ἐξέρχεσθε,ἐξέρχομαι,present,either middle or passive,imperative,second person,—,—,plural,verb,Luke 9:4,"καὶ εἰς ἣν ἂν οἰκίαν εἰσέλθητε, ἐκεῖ μένετε καὶ ἐκεῖθεν",.
ἐξέρχεται,ἐξέρχομαι,present,either middle or passive,indicative,third person,—,—,singular,verb,Matthew 15:18,τὰ δὲ ἐκπορευόμενα ἐκ τοῦ στόματος ἐκ τῆς καρδίας,", κἀκεῖνα κοινοῖ τὸν ἄνθρωπον."
ἐξέρχεται,ἐξέρχομαι,present,either middle or passive,indicative,third person,—,—,singular,verb,Matthew 24:27,ὥσπερ γὰρ ἡ ἀστραπὴ,"ἀπὸ ἀνατολῶν καὶ φαίνεται ἕως δυσμῶν, οὕτως ἔσται ἡ παρουσία τοῦ υἱοῦ τοῦ ἀνθρώπου·"
ἐξέρχεται,ἐξέρχομαι,present,either middle or passive,indicative,third person,—,—,singular,verb,James 3:10,ἐκ τοῦ αὐτοῦ στόματος,"εὐλογία καὶ κατάρα. οὐ χρή, ἀδελφοί μου, ταῦτα οὕτως γίνεσθαι."
ἐξέρχονται,ἐξέρχομαι,present,either middle or passive,indicative,third person,—,—,plural,verb,Matthew 15:19,ἐκ γὰρ τῆς καρδίας,"διαλογισμοὶ πονηροί, φόνοι, μοιχεῖαι, πορνεῖαι, κλοπαί, ψευδομαρτυρίαι, βλασφημίαι."
ἐξέρχονται,ἐξέρχομαι,present,either middle or passive,indicative,third person,—,—,plural,verb,Luke 4:36,λόγος οὗτος ὅτι ἐν ἐξουσίᾳ καὶ δυνάμει ἐπιτάσσει τοῖς ἀκαθάρτοις πνεύμασιν καὶ,;
ἐξήλθατε,ἐξέρχομαι,aorist,active,indicative,second person,—,—,plural,verb,Matthew 11:7,Τούτων δὲ πορευομένων ἤρξατο ὁ Ἰησοῦς λέγειν τοῖς ὄχλοις περὶ Ἰωάννου· τί,εἰς τὴν ἔρημον θεάσασθαι; κάλαμον ὑπὸ ἀνέμου σαλευόμενον;
ἐξήλθατε,ἐξέρχομαι,aorist,active,indicative,second person,—,—,plural,verb,Matthew 11:8,ἀλλὰ τί,ἰδεῖν; ἄνθρωπον ἐν μαλακοῖς  ἠμφιεσμένον; ἰδοὺ οἱ τὰ μαλακὰ φοροῦντες ἐν τοῖς οἴκοις τῶν βασιλέων εἰσίν.
ἐξήλθατε,ἐξέρχομαι,aorist,active,indicative,second person,—,—,plural,verb,Matthew 11:9,ἀλλὰ τί,"ἰδεῖν; προφήτην; ναὶ λέγω ὑμῖν, καὶ περισσότερον προφήτου."
ἐξήλθατε,ἐξέρχομαι,aorist,active,indicative,second person,—,—,plural,verb,Matthew 26:55,Ἐν ἐκείνῃ τῇ ὥρᾳ εἶπεν ὁ Ἰησοῦς τοῖς ὄχλοις· ὡς ἐπὶ λῃστὴν,μετὰ μαχαιρῶν καὶ ξύλων συλλαβεῖν με; καθʼ ἡμέραν ἐν τῷ ἱερῷ ἐκαθεζόμην διδάσκων καὶ οὐκ ἐκρατήσατέ με.
ἐξήλθατε,ἐξέρχομαι,aorist,active,indicative,second person,—,—,plural,verb,Mark 14:48,Καὶ ἀποκριθεὶς ὁ Ἰησοῦς εἶπεν αὐτοῖς· ὡς ἐπὶ λῃστὴν,μετὰ μαχαιρῶν καὶ ξύλων συλλαβεῖν με;
ἐξήλθατε,ἐξέρχομαι,aorist,active,indicative,second person,—,—,plural,verb,Luke 7:24,Ἀπελθόντων δὲ τῶν ἀγγέλων Ἰωάννου ἤρξατο λέγειν πρὸς τοὺς ὄχλους περὶ Ἰωάννου· τί,εἰς τὴν ἔρημον θεάσασθαι; κάλαμον ὑπὸ ἀνέμου σαλευόμενον;
ἐξήλθατε,ἐξέρχομαι,aorist,active,indicative,second person,—,—,plural,verb,Luke 7:25,ἀλλὰ τί,ἰδεῖν; ἄνθρωπον ἐν μαλακοῖς ἱματίοις ἠμφιεσμένον; ἰδοὺ οἱ ἐν ἱματισμῷ ἐνδόξῳ καὶ τρυφῇ
ἐξήλθατε,ἐξέρχομαι,aorist,active,indicative,second person,—,—,plural,verb,Luke 7:26,ἀλλὰ τί,"ἰδεῖν; προφήτην; ναὶ λέγω ὑμῖν, καὶ περισσότερον προφήτου."
ἐξήλθατε,ἐξέρχομαι,aorist,active,indicative,second person,—,—,plural,verb,Luke 22:52,Εἶπεν δὲ Ἰησοῦς πρὸς τοὺς παραγενομένους ἐπʼ αὐτὸν ἀρχιερεῖς καὶ στρατηγοὺς τοῦ ἱεροῦ καὶ πρεσβυτέρους· ὡς ἐπὶ λῃστὴν,μετὰ μαχαιρῶν καὶ ξύλων;
ἐξήλθομεν,ἐξέρχομαι,aorist,active,indicative,first person,—,—,plural,verb,Acts 16:13,τῇ τε ἡμέρᾳ τῶν σαββάτων,"ἔξω τῆς πύλης παρὰ  ποταμὸν οὗ ἐνομίζομεν προσευχὴν εἶναι, καὶ καθίσαντες ἐλαλοῦμεν ταῖς συνελθούσαις γυναιξίν."
ἐξήρχετο,ἐξέρχομαι,imperfect,either middle or passive,indicative,third person,—,—,singular,verb,Luke 4:41,—,δὲ καὶ δαιμόνια ἀπὸ πολλῶν κραυγάζοντα καὶ λέγοντα ὅτι σὺ εἶ  ὁ υἱὸς
ἐξήρχετο,ἐξέρχομαι,imperfect,either middle or passive,indicative,third person,—,—,singular,verb,Luke 6:19,"καὶ πᾶς ὁ ὄχλος ἐζήτουν ἅπτεσθαι αὐτοῦ, ὅτι δύναμις παρʼ αὐτοῦ",καὶ ἰᾶτο πάντας.
ἐξήρχοντο,ἐξέρχομαι,imperfect,either middle or passive,indicative,third person,—,—,plural,verb,John 8:9,οἱ δὲ ἀκούσαντες,εἷς καθʼ εἷς ἀρξάμενοι ἀπὸ τῶν πρεσβυτέρων  καὶ κατελείφθη μόνος καὶ ἡ γυνὴ ἐν μέσῳ οὖσα.
ἐξήρχοντο,ἐξέρχομαι,imperfect,either middle or passive,indicative,third person,—,—,plural,verb,Acts 8:7,πολλοὶ γὰρ τῶν ἐχόντων πνεύματα ἀκάθαρτα βοῶντα φωνῇ μεγάλῃ,", πολλοὶ δὲ παραλελυμένοι καὶ χωλοὶ ἐθεραπεύθησαν·"
ἐξελήλυθεν,ἐξέρχομαι,perfect,active,indicative,third person,—,—,singular,verb,Mark 7:29,"καὶ εἶπεν αὐτῇ· διὰ τοῦτον τὸν λόγον ὕπαγε,",ἐκ τῆς θυγατρός σου τὸ δαιμόνιον.
ἐξελήλυθεν,ἐξέρχομαι,perfect,active,indicative,third person,—,—,singular,verb,1 Thessalonians 1:8,"Ἀχαΐᾳ, ἀλλʼ  ἐν παντὶ τόπῳ ἡ πίστις ὑμῶν ἡ πρὸς τὸν θεὸν",", ὥστε μὴ χρείαν ἔχειν ἡμᾶς λαλεῖν τι."
ἐξελεύσεται,ἐξέρχομαι,future,middle,indicative,third person,—,—,singular,verb,Matthew 2:6,"καὶ σὺ Βηθλέεμ, γῆ Ἰούδα,           οὐδαμῶς ἐλαχίστη εἶ ἐν τοῖς ἡγεμόσιν Ἰούδα        ἐκ σοῦ γὰρ","ἡγούμενος,           ὅστις ποιμανεῖ τὸν λαόν μου τὸν Ἰσραήλ."
ἐξελεύσεται,ἐξέρχομαι,future,middle,indicative,third person,—,—,singular,verb,John 10:9,ἐγώ εἰμι ἡ θύρα· διʼ ἐμοῦ ἐάν τις εἰσέλθῃ σωθήσεται καὶ εἰσελεύσεται καὶ,καὶ νομὴν εὑρήσει.
ἐξελεύσεται,ἐξέρχομαι,future,middle,indicative,third person,—,—,singular,verb,Revelation 20:8,καὶ,"πλανῆσαι  τὰ ἔθνη τὰ ἐν ταῖς τέσσαρσιν γωνίαις τῆς γῆς, τὸν Γὼγ καὶ"
ἐξελεύσονται,ἐξέρχομαι,future,middle,indicative,third person,—,—,plural,verb,Matthew 13:49,οὕτως ἔσται ἐν τῇ συντελείᾳ τοῦ αἰῶνος·,οἱ ἄγγελοι καὶ ἀφοριοῦσιν τοὺς πονηροὺς ἐκ μέσου τῶν δικαίων
ἐξελεύσονται,ἐξέρχομαι,future,middle,indicative,third person,—,—,plural,verb,Acts 7:7,"καὶ τὸ ἔθνος ᾧ ἐὰν δουλεύσουσιν κρινῶ ἐγώ, ὁ θεὸς εἶπεν, καὶ μετὰ ταῦτα",καὶ λατρεύσουσίν μοι ἐν τῷ τόπῳ τούτῳ.
ἐξεληλυθυῖαν,ἐξέρχομαι,perfect,active,participle,—,feminine,accusative,singular,verb,Luke 8:46,"ὁ δὲ Ἰησοῦς εἶπεν· ἥψατό μού τις, ἐγὼ γὰρ ἔγνων δύναμιν",ἀπʼ ἐμοῦ.
ἐξεληλυθός,ἐξέρχομαι,perfect,active,participle,—,neuter,accusative,singular,verb,Mark 7:30,καὶ ἀπελθοῦσα εἰς τὸν οἶκον αὐτῆς εὗρεν τὸ παιδίον βεβλημένον ἐπὶ τὴν κλίνην καὶ τὸ δαιμόνιον,.
ἐξεληλυθότας,ἐξέρχομαι,perfect,active,participle,—,masculine,accusative,plural,verb,Hebrews 7:5,"ἀποδεκατοῦν τὸν λαὸν κατὰ τὸν νόμον, τοῦτʼ ἔστιν τοὺς ἀδελφοὺς αὐτῶν, καίπερ",ἐκ τῆς ὀσφύος Ἀβραάμ·
ἐξεληλύθασιν,ἐξέρχομαι,perfect,active,indicative,third person,—,—,plural,verb,1 John 4:1,"Ἀγαπητοί, μὴ παντὶ πνεύματι πιστεύετε ἀλλὰ δοκιμάζετε τὰ πνεύματα εἰ ἐκ τοῦ θεοῦ ἐστιν, ὅτι πολλοὶ ψευδοπροφῆται",εἰς τὸν κόσμον.
ἐξεληλύθει,ἐξέρχομαι,pluperfect,active,indicative,third person,—,—,singular,verb,Luke 8:2,"πνευμάτων πονηρῶν καὶ ἀσθενειῶν, Μαρία ἡ καλουμένη Μαγδαληνή, ἀφʼ ἧς δαιμόνια ἑπτὰ",","
ἐξεληλύθει,ἐξέρχομαι,pluperfect,active,indicative,third person,—,—,singular,verb,Luke 8:38,ἐδεῖτο δὲ αὐτοῦ ὁ ἀνὴρ ἀφʼ οὗ,τὰ δαιμόνια εἶναι σὺν αὐτῷ· ἀπέλυσεν δὲ αὐτὸν λέγων·
ἐξελθεῖν,ἐξέρχομαι,aorist,active,infinitive,—,—,—,—,verb,Mark 9:29,καὶ εἶπεν αὐτοῖς· τοῦτο τὸ γένος ἐν οὐδενὶ δύναται,εἰ μὴ ἐν προσευχῇ.
ἐξελθεῖν,ἐξέρχομαι,aorist,active,infinitive,—,—,—,—,verb,Luke 6:12,Ἐγένετο δὲ ἐν ταῖς ἡμέραις ταύταις,"αὐτὸν εἰς τὸ ὄρος προσεύξασθαι, καὶ ἦν διανυκτερεύων ἐν τῇ προσευχῇ τοῦ θεοῦ."
ἐξελθεῖν,ἐξέρχομαι,aorist,active,infinitive,—,—,—,—,verb,Luke 8:29,παρήγγειλεν γὰρ τῷ πνεύματι τῷ ἀκαθάρτῳ,ἀπὸ τοῦ ἀνθρώπου. πολλοῖς γὰρ χρόνοις συνηρπάκει αὐτὸν καὶ ἐδεσμεύετο ἁλύσεσιν καὶ πέδαις
ἐξελθεῖν,ἐξέρχομαι,aorist,active,infinitive,—,—,—,—,verb,John 1:43,Τῇ ἐπαύριον ἠθέλησεν,εἰς τὴν Γαλιλαίαν καὶ εὑρίσκει Φίλιππον. καὶ λέγει αὐτῷ ὁ Ἰησοῦς· ἀκολούθει μοι.
ἐξελθεῖν,ἐξέρχομαι,aorist,active,infinitive,—,—,—,—,verb,Acts 16:3,τοῦτον ἠθέλησεν ὁ Παῦλος σὺν αὐτῷ,", καὶ λαβὼν περιέτεμεν αὐτὸν διὰ τοὺς Ἰουδαίους τοὺς ὄντας ἐν τοῖς τόποις ἐκείνοις"
ἐξελθεῖν,ἐξέρχομαι,aorist,active,infinitive,—,—,—,—,verb,Acts 16:10,"ὡς δὲ τὸ ὅραμα εἶδεν, εὐθέως ἐζητήσαμεν",εἰς Μακεδονίαν συμβιβάζοντες ὅτι προσκέκληται ἡμᾶς ὁ θεὸς εὐαγγελίσασθαι αὐτούς.
ἐξελθεῖν,ἐξέρχομαι,aorist,active,infinitive,—,—,—,—,verb,Acts 16:18,Παῦλος καὶ ἐπιστρέψας τῷ πνεύματι εἶπεν· παραγγέλλω σοι ἐν  ὀνόματι Ἰησοῦ Χριστοῦ,ἀπʼ αὐτῆς· καὶ ἐξῆλθεν αὐτῇ τῇ ὥρᾳ.
ἐξελθεῖν,ἐξέρχομαι,aorist,active,infinitive,—,—,—,—,verb,1 Corinthians 5:10,"τοῖς πλεονέκταις καὶ ἅρπαξιν ἢ εἰδωλολάτραις, ἐπεὶ ὠφείλετε ἄρα ἐκ τοῦ κόσμου",.
ἐξελθεῖν,ἐξέρχομαι,aorist,active,infinitive,—,—,—,—,verb,Hebrews 11:8,Πίστει  καλούμενος Ἀβραὰμ ὑπήκουσεν,"εἰς  τόπον ὃν ἤμελλεν λαμβάνειν εἰς κληρονομίαν, καὶ ἐξῆλθεν μὴ ἐπιστάμενος ποῦ ἔρχεται."
ἐξελθούσῃ,ἐξέρχομαι,aorist,active,participle,—,feminine,dative,singular,verb,Revelation 19:21,καὶ οἱ λοιποὶ ἀπεκτάνθησαν ἐν τῇ ῥομφαίᾳ τοῦ καθημένου ἐπὶ τοῦ ἵππου τῇ,"ἐκ τοῦ στόματος αὐτοῦ, καὶ πάντα τὰ ὄρνεα ἐχορτάσθησαν ἐκ τῶν σαρκῶν αὐτῶν."
ἐξελθοῦσα,ἐξέρχομαι,aorist,active,participle,—,feminine,nominative,singular,verb,Matthew 15:22,καὶ ἰδοὺ γυνὴ Χαναναία ἀπὸ τῶν ὁρίων ἐκείνων,"ἔκραζεν  λέγουσα· ἐλέησόν με, κύριε υἱὸς Δαυίδ· ἡ θυγάτηρ μου κακῶς δαιμονίζεται."
ἐξελθοῦσα,ἐξέρχομαι,aorist,active,participle,—,feminine,nominative,singular,verb,Mark 6:24,καὶ,εἶπεν τῇ μητρὶ αὐτῆς· τί αἰτήσωμαι; ἡ δὲ εἶπεν· τὴν κεφαλὴν Ἰωάννου τοῦ βαπτίζοντος.
ἐξελθοῦσα,ἐξέρχομαι,aorist,active,participle,—,feminine,nominative,singular,verb,Acts 28:3,"Συστρέψαντος δὲ τοῦ Παύλου φρυγάνων τι πλῆθος καὶ ἐπιθέντος ἐπὶ τὴν πυράν, ἔχιδνα ἀπὸ τῆς θέρμης",καθῆψεν τῆς χειρὸς αὐτοῦ.
ἐξελθοῦσαι,ἐξέρχομαι,aorist,active,participle,—,feminine,nominative,plural,verb,Mark 16:8,Καὶ,"ἔφυγον ἀπὸ τοῦ μνημείου, εἶχεν γὰρ αὐτὰς τρόμος καὶ ἔκστασις· καὶ οὐδενὶ οὐδὲν"
ἐξελθοῦσαν,ἐξέρχομαι,aorist,active,participle,—,feminine,accusative,singular,verb,Mark 5:30,καὶ εὐθὺς ὁ Ἰησοῦς ἐπιγνοὺς ἐν ἑαυτῷ τὴν ἐξ αὐτοῦ δύναμιν,ἐπιστραφεὶς ἐν τῷ ὄχλῳ ἔλεγεν· τίς μου ἥψατο τῶν ἱματίων;
ἐξελθόντα,ἐξέρχομαι,aorist,active,participle,—,neuter,nominative,plural,verb,Mark 5:13,καὶ ἐπέτρεψεν αὐτοῖς. καὶ,"τὰ πνεύματα τὰ ἀκάθαρτα εἰσῆλθον εἰς τοὺς χοίρους, καὶ ὥρμησεν ἡ ἀγέλη κατὰ"
ἐξελθόντα,ἐξέρχομαι,aorist,active,participle,—,neuter,nominative,plural,verb,Luke 8:33,—,"δὲ τὰ δαιμόνια ἀπὸ τοῦ ἀνθρώπου εἰσῆλθον εἰς τοὺς χοίρους, καὶ ὥρμησεν ἡ"
ἐξελθόντες,ἐξέρχομαι,aorist,active,participle,—,masculine,nominative,plural,verb,Matthew 8:32,καὶ εἶπεν αὐτοῖς· ὑπάγετε. οἱ δὲ,ἀπῆλθον εἰς τοὺς χοίρους· καὶ ἰδοὺ ὥρμησεν πᾶσα ἡ ἀγέλη  κατὰ τοῦ κρημνοῦ
ἐξελθόντες,ἐξέρχομαι,aorist,active,participle,—,masculine,nominative,plural,verb,Matthew 9:31,οἱ δὲ,διεφήμισαν αὐτὸν ἐν ὅλῃ τῇ γῇ ἐκείνῃ.
ἐξελθόντες,ἐξέρχομαι,aorist,active,participle,—,masculine,nominative,plural,verb,Matthew 22:10,καὶ,"οἱ δοῦλοι ἐκεῖνοι εἰς τὰς ὁδοὺς συνήγαγον πάντας οὓς εὗρον, πονηρούς τε καὶ"
ἐξελθόντες,ἐξέρχομαι,aorist,active,participle,—,masculine,nominative,plural,verb,Matthew 27:53,καὶ,ἐκ τῶν μνημείων μετὰ τὴν ἔγερσιν αὐτοῦ εἰσῆλθον εἰς τὴν ἁγίαν πόλιν καὶ ἐνεφανίσθησαν πολλοῖς.
ἐξελθόντες,ἐξέρχομαι,aorist,active,participle,—,masculine,nominative,plural,verb,Mark 1:29,Καὶ εὐθὺς ἐκ τῆς συναγωγῆς,ἦλθον εἰς τὴν οἰκίαν Σίμωνος καὶ Ἀνδρέου μετὰ Ἰακώβου καὶ Ἰωάννου.
ἐξελθόντες,ἐξέρχομαι,aorist,active,participle,—,masculine,nominative,plural,verb,Mark 3:6,Καὶ,οἱ Φαρισαῖοι εὐθὺς μετὰ τῶν Ἡρῳδιανῶν συμβούλιον ἐδίδουν κατʼ αὐτοῦ ὅπως αὐτὸν ἀπολέσωσιν.
ἐξελθόντες,ἐξέρχομαι,aorist,active,participle,—,masculine,nominative,plural,verb,Mark 6:12,Καὶ,"ἐκήρυξαν ἵνα μετανοῶσιν,"
ἐξελθόντες,ἐξέρχομαι,aorist,active,participle,—,masculine,nominative,plural,verb,Mark 9:30,Κἀκεῖθεν,"παρεπορεύοντο διὰ τῆς Γαλιλαίας, καὶ οὐκ ἤθελεν ἵνα τις γνοῖ·"
ἐξελθόντες,ἐξέρχομαι,aorist,active,participle,—,masculine,nominative,plural,verb,Mark 16:20,ἐκεῖνοι δὲ,"ἐκήρυξαν πανταχοῦ, τοῦ κυρίου συνεργοῦντος καὶ τὸν λόγον βεβαιοῦντος διὰ τῶν ἐπακολουθούντων σημείων."
ἐξελθόντες,ἐξέρχομαι,aorist,active,participle,—,masculine,nominative,plural,verb,Luke 10:10,"εἰς ἣν δʼ ἂν πόλιν εἰσέλθητε καὶ μὴ δέχωνται ὑμᾶς,",εἰς τὰς πλατείας αὐτῆς εἴπατε·
ἐξελθόντες,ἐξέρχομαι,aorist,active,participle,—,masculine,nominative,plural,verb,Acts 12:10,"τὴν σιδηρᾶν τὴν φέρουσαν εἰς τὴν πόλιν, ἥτις αὐτομάτη ἠνοίγη αὐτοῖς καὶ","προῆλθον ῥύμην μίαν, καὶ εὐθέως ἀπέστη ὁ ἄγγελος ἀπʼ αὐτοῦ."
ἐξελθόντες,ἐξέρχομαι,aorist,active,participle,—,masculine,nominative,plural,verb,Acts 15:24,Ἐπειδὴ ἠκούσαμεν ὅτι τινὲς ἐξ ἡμῶν [,"] ἐτάραξαν ὑμᾶς λόγοις ἀνασκευάζοντες τὰς ψυχὰς ὑμῶν  οἷς οὐ διεστειλάμεθα,"
ἐξελθόντες,ἐξέρχομαι,aorist,active,participle,—,masculine,nominative,plural,verb,Acts 16:36,ἀπήγγειλεν δὲ ὁ δεσμοφύλαξ τοὺς λόγους [τούτους] πρὸς τὸν Παῦλον ὅτι ἀπέσταλκαν οἱ στρατηγοὶ ἵνα ἀπολυθῆτε· νῦν οὖν,πορεύεσθε ἐν εἰρήνῃ.
ἐξελθόντες,ἐξέρχομαι,aorist,active,participle,—,masculine,nominative,plural,verb,Acts 16:40,—,δὲ ἀπὸ τῆς φυλακῆς εἰσῆλθον πρὸς τὴν Λυδίαν καὶ ἰδόντες παρεκάλεσαν τοὺς ἀδελφοὺς καὶ ἐξῆλθαν.
ἐξελθόντες,ἐξέρχομαι,aorist,active,participle,—,masculine,nominative,plural,verb,Acts 21:5,"ὅτε δὲ ἐγένετο ἡμᾶς ἐξαρτίσαι τὰς ἡμέρας,","ἐπορευόμεθα προπεμπόντων ἡμᾶς πάντων σὺν γυναιξὶν καὶ τέκνοις ἕως ἔξω τῆς πόλεως, καὶ"
ἐξελθόντες,ἐξέρχομαι,aorist,active,participle,—,masculine,nominative,plural,verb,Acts 21:8,τῇ δὲ ἐπαύριον,"ἤλθομεν εἰς Καισάρειαν καὶ εἰσελθόντες εἰς τὸν οἶκον Φιλίππου τοῦ εὐαγγελιστοῦ, ὄντος ἐκ"
ἐξελθόντες,ἐξέρχομαι,aorist,active,participle,—,masculine,nominative,plural,verb,Hebrews 3:16,τίνες γὰρ ἀκούσαντες παρεπίκραναν; ἀλλʼ οὐ πάντες οἱ,ἐξ Αἰγύπτου διὰ Μωϋσέως;
ἐξελθόντι,ἐξέρχομαι,aorist,active,participle,—,masculine,dative,singular,verb,Luke 8:27,—,δὲ αὐτῷ ἐπὶ τὴν γῆν ὑπήντησεν ἀνήρ τις ἐκ τῆς πόλεως ἔχων δαιμόνια
ἐξελθόντος,ἐξέρχομαι,aorist,active,participle,—,masculine,genitive,singular,verb,Mark 5:2,καὶ,"αὐτοῦ ἐκ τοῦ πλοίου εὐθὺς ὑπήντησεν αὐτῷ ἐκ τῶν μνημείων ἄνθρωπος ἐν πνεύματι ἀκαθάρτῳ,"
ἐξελθόντος,ἐξέρχομαι,aorist,active,participle,—,neuter,genitive,singular,verb,Luke 11:14,Καὶ ἦν ἐκβάλλων δαιμόνιον [καὶ αὐτὸ ἦν] κωφόν· ἐγένετο δὲ τοῦ δαιμονίου,ἐλάλησεν ὁ κωφὸς καὶ ἐθαύμασαν οἱ ὄχλοι.
ἐξελθόντος,ἐξέρχομαι,aorist,active,participle,—,masculine,genitive,singular,verb,Luke 11:53,Κἀκεῖθεν,"αὐτοῦ ἤρξαντο οἱ γραμματεῖς καὶ οἱ Φαρισαῖοι δεινῶς ἐνέχειν καὶ ἀποστοματίζειν αὐτὸν περὶ πλειόνων,"
ἐξελθόντων,ἐξέρχομαι,aorist,active,participle,—,masculine,genitive,plural,verb,Mark 6:54,Καὶ,αὐτῶν ἐκ τοῦ πλοίου εὐθὺς ἐπιγνόντες αὐτὸν
