Result,Lemma (Greek),Tense (Logos Greek),Voice (Logos Greek),Mood (Logos Greek),Person (Logos Greek),Gender (Logos Greek),Case (Logos Greek),Number (Logos Greek),Part of Speech,Reference,Previous Context,Next Context
ἀσπάζεσθαι,ἀσπάζομαι,present,either middle or passive,infinitive,—,—,—,—,verb,Mark 15:18,καὶ ἤρξαντο,"αὐτόν· χαῖρε, βασιλεῦ τῶν Ἰουδαίων·"
ἀσπάζεται,ἀσπάζομαι,present,either middle or passive,indicative,third person,—,—,singular,verb,Romans 16:23,—,ὑμᾶς Γάϊος ὁ ξένος μου καὶ ὅλης τῆς ἐκκλησίας. ἀσπάζεται ὑμᾶς Ἔραστος ὁ
ἀσπάζεται,ἀσπάζομαι,present,either middle or passive,indicative,third person,—,—,singular,verb,Romans 16:23,ἀσπάζεται ὑμᾶς Γάϊος ὁ ξένος μου καὶ ὅλης τῆς ἐκκλησίας.,ὑμᾶς Ἔραστος ὁ οἰκονόμος τῆς πόλεως καὶ Κούαρτος ὁ ἀδελφός.
ἀσπάζεται,ἀσπάζομαι,present,either middle or passive,indicative,third person,—,—,singular,verb,1 Corinthians 16:19,Ἀσπάζονται ὑμᾶς αἱ ἐκκλησίαι τῆς Ἀσίας.,ὑμᾶς ἐν κυρίῳ πολλὰ Ἀκύλας καὶ Πρίσκα σὺν τῇ κατʼ οἶκον αὐτῶν ἐκκλησίᾳ.
ἀσπάζεται,ἀσπάζομαι,present,either middle or passive,indicative,third person,—,—,singular,verb,Colossians 4:12,—,"ὑμᾶς Ἐπαφρᾶς ὁ ἐξ ὑμῶν, δοῦλος Χριστοῦ [Ἰησοῦ], πάντοτε ἀγωνιζόμενος ὑπὲρ ὑμῶν ἐν"
ἀσπάζεται,ἀσπάζομαι,present,either middle or passive,indicative,third person,—,—,singular,verb,Colossians 4:14,—,ὑμᾶς Λουκᾶς ὁ ἰατρὸς ὁ ἀγαπητὸς καὶ Δημᾶς.
ἀσπάζεται,ἀσπάζομαι,present,either middle or passive,indicative,third person,—,—,singular,verb,1 Peter 5:13,—,ὑμᾶς ἡ ἐν Βαβυλῶνι  συνεκλεκτὴ καὶ Μᾶρκος ὁ υἱός μου.
ἀσπάζομαι,ἀσπάζομαι,present,either middle or passive,indicative,first person,—,—,singular,verb,Romans 16:22,—,ὑμᾶς ἐγὼ Τέρτιος ὁ γράψας τὴν ἐπιστολὴν ἐν κυρίῳ.
ἀσπάζονταί,ἀσπάζομαι,present,either middle or passive,indicative,third person,—,—,plural,verb,3 John 15,Εἰρήνη σοι.,σε οἱ φίλοι. ἀσπάζου τοὺς φίλους κατʼ ὄνομα.
ἀσπάζονται,ἀσπάζομαι,present,either middle or passive,indicative,third person,—,—,plural,verb,Romans 16:16,ἀσπάσασθε ἀλλήλους ἐν φιλήματι ἁγίῳ.,ὑμᾶς αἱ ἐκκλησίαι πᾶσαι τοῦ Χριστοῦ.
ἀσπάζονται,ἀσπάζομαι,present,either middle or passive,indicative,third person,—,—,plural,verb,1 Corinthians 16:20,—,ὑμᾶς οἱ ἀδελφοὶ πάντες. Ἀσπάσασθε ἀλλήλους ἐν φιλήματι ἁγίῳ.
ἀσπάζονται,ἀσπάζομαι,present,either middle or passive,indicative,third person,—,—,plural,verb,Philippians 4:21,Ἀσπάσασθε πάντα ἅγιον ἐν Χριστῷ Ἰησοῦ.,ὑμᾶς οἱ σὺν ἐμοὶ ἀδελφοί.
ἀσπάζονται,ἀσπάζομαι,present,either middle or passive,indicative,third person,—,—,plural,verb,Philippians 4:22,—,"ὑμᾶς πάντες οἱ ἅγιοι, μάλιστα δὲ οἱ ἐκ τῆς Καίσαρος οἰκίας."
ἀσπάζου,ἀσπάζομαι,present,either middle or passive,imperative,second person,—,—,singular,verb,3 John 15,Εἰρήνη σοι. ἀσπάζονταί σε οἱ φίλοι.,τοὺς φίλους κατʼ ὄνομα.
ἀσπάσασθε,ἀσπάζομαι,aorist,middle,imperative,second person,—,—,plural,verb,Matthew 10:12,εἰσερχόμενοι δὲ εἰς τὴν οἰκίαν,αὐτήν·
ἀσπάσασθε,ἀσπάζομαι,aorist,middle,imperative,second person,—,—,plural,verb,Romans 16:5,καὶ τὴν κατʼ οἶκον αὐτῶν ἐκκλησίαν.,"Ἐπαίνετον τὸν ἀγαπητόν μου, ὅς ἐστιν ἀπαρχὴ τῆς Ἀσίας εἰς Χριστόν."
ἀσπάσασθε,ἀσπάζομαι,aorist,middle,imperative,second person,—,—,plural,verb,Romans 16:6,—,"Μαρίαν, ἥτις πολλὰ ἐκοπίασεν εἰς ὑμᾶς."
ἀσπάσασθε,ἀσπάζομαι,aorist,middle,imperative,second person,—,—,plural,verb,Romans 16:7,—,"Ἀνδρόνικον καὶ Ἰουνίαν τοὺς συγγενεῖς μου καὶ  συναιχμαλώτους μου, οἵτινές εἰσιν ἐπίσημοι ἐν"
ἀσπάσασθε,ἀσπάζομαι,aorist,middle,imperative,second person,—,—,plural,verb,Romans 16:8,—,Ἀμπλιᾶτον τὸν ἀγαπητόν μου ἐν κυρίῳ.
ἀσπάσασθε,ἀσπάζομαι,aorist,middle,imperative,second person,—,—,plural,verb,Romans 16:9,—,Οὐρβανὸν τὸν συνεργὸν ἡμῶν ἐν Χριστῷ καὶ Στάχυν τὸν ἀγαπητόν μου.
ἀσπάσασθε,ἀσπάζομαι,aorist,middle,imperative,second person,—,—,plural,verb,Romans 16:10,—,Ἀπελλῆν τὸν δόκιμον ἐν Χριστῷ. ἀσπάσασθε τοὺς ἐκ τῶν Ἀριστοβούλου.
ἀσπάσασθε,ἀσπάζομαι,aorist,middle,imperative,second person,—,—,plural,verb,Romans 16:10,ἀσπάσασθε Ἀπελλῆν τὸν δόκιμον ἐν Χριστῷ.,τοὺς ἐκ τῶν Ἀριστοβούλου.
ἀσπάσασθε,ἀσπάζομαι,aorist,middle,imperative,second person,—,—,plural,verb,Romans 16:11,—,Ἡρῳδίωνα τὸν συγγενῆ μου. ἀσπάσασθε τοὺς ἐκ τῶν Ναρκίσσου τοὺς ὄντας ἐν κυρίῳ.
ἀσπάσασθε,ἀσπάζομαι,aorist,middle,imperative,second person,—,—,plural,verb,Romans 16:11,ἀσπάσασθε Ἡρῳδίωνα τὸν συγγενῆ μου.,τοὺς ἐκ τῶν Ναρκίσσου τοὺς ὄντας ἐν κυρίῳ.
ἀσπάσασθε,ἀσπάζομαι,aorist,middle,imperative,second person,—,—,plural,verb,Romans 16:12,—,"Τρύφαιναν καὶ Τρυφῶσαν τὰς κοπιώσας ἐν κυρίῳ. ἀσπάσασθε Περσίδα τὴν ἀγαπητήν, ἥτις πολλὰ ἐκοπίασεν ἐν κυρίῳ."
ἀσπάσασθε,ἀσπάζομαι,aorist,middle,imperative,second person,—,—,plural,verb,Romans 16:12,ἀσπάσασθε Τρύφαιναν καὶ Τρυφῶσαν τὰς κοπιώσας ἐν κυρίῳ.,"Περσίδα τὴν ἀγαπητήν, ἥτις πολλὰ ἐκοπίασεν ἐν κυρίῳ."
ἀσπάσασθε,ἀσπάζομαι,aorist,middle,imperative,second person,—,—,plural,verb,Romans 16:13,—,Ῥοῦφον τὸν ἐκλεκτὸν ἐν κυρίῳ καὶ τὴν μητέρα αὐτοῦ καὶ ἐμοῦ.
ἀσπάσασθε,ἀσπάζομαι,aorist,middle,imperative,second person,—,—,plural,verb,Romans 16:14,—,"Ἀσύγκριτον, Φλέγοντα, Ἑρμῆν, Πατροβᾶν, Ἑρμᾶν καὶ τοὺς σὺν αὐτοῖς ἀδελφούς."
ἀσπάσασθε,ἀσπάζομαι,aorist,middle,imperative,second person,—,—,plural,verb,Romans 16:15,—,"Φιλόλογον καὶ Ἰουλίαν, Νηρέα καὶ τὴν ἀδελφὴν αὐτοῦ, καὶ Ὀλυμπᾶν καὶ τοὺς σὺν αὐτοῖς πάντας ἁγίους."
ἀσπάσασθε,ἀσπάζομαι,aorist,middle,imperative,second person,—,—,plural,verb,Romans 16:16,—,ἀλλήλους ἐν φιλήματι ἁγίῳ. ἀσπάζονται ὑμᾶς αἱ ἐκκλησίαι πᾶσαι τοῦ Χριστοῦ.
ἀσπάσασθε,ἀσπάζομαι,aorist,middle,imperative,second person,—,—,plural,verb,1 Peter 5:14,—,ἀλλήλους ἐν φιλήματι ἀγάπης.  Εἰρήνη ὑμῖν πᾶσιν τοῖς ἐν Χριστῷ.
ἀσπάσησθε,ἀσπάζομαι,aorist,middle,subjunctive,second person,—,—,plural,verb,Matthew 5:47,καὶ ἐὰν,"τοὺς ἀδελφοὺς ὑμῶν μόνον, τί περισσὸν ποιεῖτε; οὐχὶ καὶ οἱ ἐθνικοὶ τὸ αὐτὸ ποιοῦσιν;"
ἀσπάσησθε,ἀσπάζομαι,aorist,middle,subjunctive,second person,—,—,plural,verb,Luke 10:4,"μὴ βαστάζετε βαλλάντιον, μὴ πήραν, μὴ ὑποδήματα, καὶ μηδένα κατὰ τὴν ὁδὸν",.
ἀσπασάμενοι,ἀσπάζομαι,aorist,middle,participle,—,masculine,nominative,plural,verb,Acts 21:7,Ἡμεῖς δὲ τὸν πλοῦν διανύσαντες ἀπὸ Τύρου κατηντήσαμεν εἰς Πτολεμαΐδα καὶ,τοὺς ἀδελφοὺς ἐμείναμεν ἡμέραν μίαν παρʼ αὐτοῖς.
ἀσπασάμενοι,ἀσπάζομαι,aorist,middle,participle,—,masculine,nominative,plural,verb,Acts 25:13,Ἡμερῶν δὲ διαγενομένων τινῶν Ἀγρίππας ὁ βασιλεὺς καὶ Βερνίκη κατήντησαν εἰς Καισάρειαν,τὸν Φῆστον.
ἀσπασάμενοι,ἀσπάζομαι,aorist,middle,participle,—,masculine,nominative,plural,verb,Hebrews 11:13,"Κατὰ πίστιν ἀπέθανον οὗτοι πάντες, μὴ λαβόντες τὰς ἐπαγγελίας ἀλλὰ πόρρωθεν αὐτὰς ἰδόντες καὶ",καὶ ὁμολογήσαντες ὅτι ξένοι καὶ παρεπίδημοί εἰσιν ἐπὶ τῆς γῆς.
ἀσπασάμενος,ἀσπάζομαι,aorist,middle,participle,—,masculine,nominative,singular,verb,Acts 18:22,"καὶ κατελθὼν εἰς Καισάρειαν, ἀναβὰς καὶ",τὴν ἐκκλησίαν κατέβη εἰς Ἀντιόχειαν.
ἀσπασάμενος,ἀσπάζομαι,aorist,middle,participle,—,masculine,nominative,singular,verb,Acts 20:1,"Μετὰ δὲ τὸ παύσασθαι τὸν θόρυβον μεταπεμψάμενος ὁ Παῦλος τοὺς μαθητὰς καὶ παρακαλέσας,",ἐξῆλθεν πορεύεσθαι εἰς Μακεδονίαν.
ἀσπασάμενος,ἀσπάζομαι,aorist,middle,participle,—,masculine,nominative,singular,verb,Acts 21:19,καὶ,"αὐτοὺς ἐξηγεῖτο καθʼ ἓν ἕκαστον, ὧν ἐποίησεν ὁ θεὸς ἐν τοῖς ἔθνεσιν διὰ τῆς διακονίας αὐτοῦ."
ἄσπασαι,ἀσπάζομαι,aorist,middle,imperative,second person,—,—,singular,verb,Titus 3:15,Ἀσπάζονταί σε οἱ μετʼ ἐμοῦ πάντες.,τοὺς φιλοῦντας ἡμᾶς ἐν πίστει.  Ἡ χάρις μετὰ πάντων ὑμῶν.
Ἀσπάζεταί,ἀσπάζομαι,present,either middle or passive,indicative,third person,—,—,singular,verb,2 Timothy 4:21,Σπούδασον πρὸ χειμῶνος ἐλθεῖν.,σε Εὔβουλος καὶ Πούδης καὶ Λίνος καὶ Κλαυδία καὶ οἱ ἀδελφοὶ πάντες.
Ἀσπάζεταί,ἀσπάζομαι,present,either middle or passive,indicative,third person,—,—,singular,verb,Philemon 23,—,"σε Ἐπαφρᾶς ὁ συναιχμάλωτός μου ἐν Χριστῷ Ἰησοῦ,"
Ἀσπάζεταί,ἀσπάζομαι,present,either middle or passive,indicative,third person,—,—,singular,verb,2 John 13,—,σε τὰ τέκνα τῆς ἀδελφῆς σου τῆς ἐκλεκτῆς.
Ἀσπάζεται,ἀσπάζομαι,present,either middle or passive,indicative,third person,—,—,singular,verb,Romans 16:21,—,ὑμᾶς Τιμόθεος ὁ συνεργός μου καὶ Λούκιος καὶ Ἰάσων καὶ Σωσίπατρος οἱ συγγενεῖς μου.
Ἀσπάζεται,ἀσπάζομαι,present,either middle or passive,indicative,third person,—,—,singular,verb,Colossians 4:10,—,ὑμᾶς Ἀρίσταρχος ὁ συναιχμάλωτός μου καὶ Μᾶρκος ὁ ἀνεψιὸς Βαρναβᾶ περὶ οὗ ἐλάβετε
Ἀσπάζονταί,ἀσπάζομαι,present,either middle or passive,indicative,third person,—,—,plural,verb,Titus 3:15,—,σε οἱ μετʼ ἐμοῦ πάντες. ἄσπασαι τοὺς φιλοῦντας ἡμᾶς ἐν πίστει.  Ἡ χάρις μετὰ πάντων ὑμῶν.
Ἀσπάζονται,ἀσπάζομαι,present,either middle or passive,indicative,third person,—,—,plural,verb,1 Corinthians 16:19,—,ὑμᾶς αἱ ἐκκλησίαι τῆς Ἀσίας. ἀσπάζεται ὑμᾶς ἐν κυρίῳ πολλὰ Ἀκύλας καὶ Πρίσκα
Ἀσπάζονται,ἀσπάζομαι,present,either middle or passive,indicative,third person,—,—,plural,verb,2 Corinthians 13:12,Ἀσπάσασθε ἀλλήλους ἐν ἁγίῳ φιλήματι.,ὑμᾶς οἱ ἅγιοι πάντες.
Ἀσπάζονται,ἀσπάζομαι,present,either middle or passive,indicative,third person,—,—,plural,verb,Hebrews 13:24,Ἀσπάσασθε πάντας τοὺς ἡγουμένους ὑμῶν καὶ πάντας τοὺς ἁγίους.,ὑμᾶς οἱ ἀπὸ τῆς Ἰταλίας.
Ἀσπάσασθε,ἀσπάζομαι,aorist,middle,imperative,second person,—,—,plural,verb,Romans 16:3,—,"Πρίσκαν καὶ Ἀκύλαν τοὺς συνεργούς μου ἐν Χριστῷ Ἰησοῦ,"
Ἀσπάσασθε,ἀσπάζομαι,aorist,middle,imperative,second person,—,—,plural,verb,1 Corinthians 16:20,ἀσπάζονται ὑμᾶς οἱ ἀδελφοὶ πάντες.,ἀλλήλους ἐν φιλήματι ἁγίῳ.
Ἀσπάσασθε,ἀσπάζομαι,aorist,middle,imperative,second person,—,—,plural,verb,2 Corinthians 13:12,—,ἀλλήλους ἐν ἁγίῳ φιλήματι. Ἀσπάζονται ὑμᾶς οἱ ἅγιοι πάντες.
Ἀσπάσασθε,ἀσπάζομαι,aorist,middle,imperative,second person,—,—,plural,verb,Philippians 4:21,—,πάντα ἅγιον ἐν Χριστῷ Ἰησοῦ. ἀσπάζονται ὑμᾶς οἱ σὺν ἐμοὶ ἀδελφοί.
Ἀσπάσασθε,ἀσπάζομαι,aorist,middle,imperative,second person,—,—,plural,verb,Colossians 4:15,—,τοὺς ἐν Λαοδικείᾳ ἀδελφοὺς καὶ Νύμφαν καὶ τὴν κατʼ οἶκον αὐτῆς ἐκκλησίαν.
Ἀσπάσασθε,ἀσπάζομαι,aorist,middle,imperative,second person,—,—,plural,verb,1 Thessalonians 5:26,—,τοὺς ἀδελφοὺς πάντας ἐν φιλήματι ἁγίῳ.
Ἀσπάσασθε,ἀσπάζομαι,aorist,middle,imperative,second person,—,—,plural,verb,Hebrews 13:24,—,πάντας τοὺς ἡγουμένους ὑμῶν καὶ πάντας τοὺς ἁγίους. Ἀσπάζονται ὑμᾶς οἱ ἀπὸ τῆς Ἰταλίας.
Ἄσπασαι,ἀσπάζομαι,aorist,middle,imperative,second person,—,—,singular,verb,2 Timothy 4:19,—,Πρίσκαν καὶ Ἀκύλαν καὶ τὸν Ὀνησιφόρου οἶκον.
ἠσπάζοντο,ἀσπάζομαι,imperfect,either middle or passive,indicative,third person,—,—,plural,verb,Mark 9:15,καὶ εὐθὺς πᾶς ὁ ὄχλος ἰδόντες αὐτὸν ἐξεθαμβήθησαν καὶ προστρέχοντες,αὐτόν.
ἠσπάσατο,ἀσπάζομαι,aorist,middle,indicative,third person,—,—,singular,verb,Luke 1:40,καὶ εἰσῆλθεν εἰς τὸν οἶκον Ζαχαρίου καὶ,τὴν Ἐλισάβετ.
