Result,Lemma (Greek),Tense (Logos Greek),Voice (Logos Greek),Mood (Logos Greek),Person (Logos Greek),Gender (Logos Greek),Case (Logos Greek),Number (Logos Greek),Part of Speech,Reference,Previous Context,Next Context
ἀγαπητήν,ἀγαπητός,—,—,—,—,feminine,accusative,singular,adjective,Romans 16:12,ἀσπάσασθε Τρύφαιναν καὶ Τρυφῶσαν τὰς κοπιώσας ἐν κυρίῳ. ἀσπάσασθε Περσίδα τὴν,", ἥτις πολλὰ ἐκοπίασεν ἐν κυρίῳ."
ἀγαπητοί,ἀγαπητός,—,—,—,—,masculine,vocative,plural,adjective,Romans 12:19,"μὴ ἑαυτοὺς ἐκδικοῦντες,",", ἀλλὰ δότε τόπον τῇ ὀργῇ, γέγραπται γάρ· ἐμοὶ ἐκδίκησις, ἐγὼ ἀνταποδώσω, λέγει κύριος."
ἀγαπητοί,ἀγαπητός,—,—,—,—,masculine,vocative,plural,adjective,1 Corinthians 10:14,"Διόπερ,","μου, φεύγετε ἀπὸ τῆς εἰδωλολατρίας."
ἀγαπητοί,ἀγαπητός,—,—,—,—,masculine,vocative,plural,adjective,1 Corinthians 15:58,"Ὥστε, ἀδελφοί μου",", ἑδραῖοι γίνεσθε, ἀμετακίνητοι, περισσεύοντες ἐν τῷ ἔργῳ τοῦ κυρίου πάντοτε, εἰδότες ὅτι ὁ"
ἀγαπητοί,ἀγαπητός,—,—,—,—,masculine,vocative,plural,adjective,2 Corinthians 7:1,"Ταύτας οὖν ἔχοντες τὰς ἐπαγγελίας,",", καθαρίσωμεν ἑαυτοὺς ἀπὸ παντὸς μολυσμοῦ σαρκὸς καὶ πνεύματος, ἐπιτελοῦντες ἁγιωσύνην ἐν φόβῳ θεοῦ."
ἀγαπητοί,ἀγαπητός,—,—,—,—,masculine,vocative,plural,adjective,2 Corinthians 12:19,"Πάλαι δοκεῖτε ὅτι ὑμῖν ἀπολογούμεθα. κατέναντι θεοῦ ἐν Χριστῷ λαλοῦμεν· τὰ δὲ πάντα,",", ὑπὲρ τῆς ὑμῶν οἰκοδομῆς."
ἀγαπητοί,ἀγαπητός,—,—,—,—,masculine,vocative,plural,adjective,Philippians 2:12,"Ὥστε,","μου, καθὼς πάντοτε ὑπηκούσατε, μὴ ὡς ἐν τῇ παρουσίᾳ μου μόνον ἀλλὰ νῦν"
ἀγαπητοί,ἀγαπητός,—,—,—,—,masculine,vocative,plural,adjective,Philippians 4:1,"Ὥστε, ἀδελφοί μου ἀγαπητοὶ καὶ ἐπιπόθητοι, χαρὰ καὶ στέφανός μου, οὕτως στήκετε ἐν κυρίῳ,",.
ἀγαπητοί,ἀγαπητός,—,—,—,—,masculine,vocative,plural,adjective,Hebrews 6:9,"Πεπείσμεθα δὲ περὶ ὑμῶν,",", τὰ κρείσσονα καὶ ἐχόμενα σωτηρίας, εἰ καὶ οὕτως λαλοῦμεν."
ἀγαπητοί,ἀγαπητός,—,—,—,—,masculine,vocative,plural,adjective,James 1:16,"Μὴ πλανᾶσθε, ἀδελφοί μου",.
ἀγαπητοί,ἀγαπητός,—,—,—,—,masculine,vocative,plural,adjective,James 1:19,"Ἴστε, ἀδελφοί μου","· ἔστω δὲ πᾶς ἄνθρωπος ταχὺς εἰς τὸ ἀκοῦσαι, βραδὺς εἰς τὸ λαλῆσαι, βραδὺς εἰς ὀργήν·"
ἀγαπητοί,ἀγαπητός,—,—,—,—,masculine,vocative,plural,adjective,James 2:5,"ἀκούσατε, ἀδελφοί μου",· οὐχ ὁ θεὸς ἐξελέξατο τοὺς πτωχοὺς τῷ κόσμῳ πλουσίους ἐν πίστει καὶ κληρονόμους
ἀγαπητοί,ἀγαπητός,—,—,—,—,masculine,vocative,plural,adjective,2 Peter 3:1,"Ταύτην ἤδη,",", δευτέραν ὑμῖν γράφω ἐπιστολὴν ἐν αἷς διεγείρω ὑμῶν ἐν ὑπομνήσει τὴν εἰλικρινῆ διάνοιαν"
ἀγαπητοί,ἀγαπητός,—,—,—,—,masculine,vocative,plural,adjective,2 Peter 3:8,"Ἓν δὲ τοῦτο μὴ λανθανέτω ὑμᾶς,",", ὅτι μία ἡμέρα παρὰ κυρίῳ ὡς χίλια ἔτη καὶ χίλια ἔτη ὡς ἡμέρα μία."
ἀγαπητοί,ἀγαπητός,—,—,—,—,masculine,vocative,plural,adjective,2 Peter 3:14,"Διό,",", ταῦτα προσδοκῶντες σπουδάσατε ἄσπιλοι καὶ ἀμώμητοι αὐτῷ εὑρεθῆναι ἐν εἰρήνῃ"
ἀγαπητοί,ἀγαπητός,—,—,—,—,masculine,vocative,plural,adjective,2 Peter 3:17,"Ὑμεῖς οὖν,",", προγινώσκοντες φυλάσσεσθε, ἵνα μὴ τῇ τῶν ἀθέσμων πλάνῃ συναπαχθέντες ἐκπέσητε τοῦ ἰδίου στηριγμοῦ,"
ἀγαπητοί,ἀγαπητός,—,—,—,—,masculine,vocative,plural,adjective,Jude 17,"Ὑμεῖς δέ,",", μνήσθητε τῶν ῥημάτων τῶν προειρημένων ὑπὸ τῶν ἀποστόλων τοῦ κυρίου ἡμῶν Ἰησοῦ Χριστοῦ"
ἀγαπητοί,ἀγαπητός,—,—,—,—,masculine,vocative,plural,adjective,Jude 20,"Ὑμεῖς δέ,",", ἐποικοδομοῦντες ἑαυτοὺς τῇ ἁγιωτάτῃ ὑμῶν πίστει, ἐν πνεύματι ἁγίῳ προσευχόμενοι,"
ἀγαπητοὶ,ἀγαπητός,—,—,—,—,masculine,nominative,plural,adjective,Romans 11:28,"κατὰ μὲν τὸ εὐαγγέλιον ἐχθροὶ διʼ ὑμᾶς, κατὰ δὲ τὴν ἐκλογὴν",διὰ τοὺς πατέρας·
ἀγαπητοὶ,ἀγαπητός,—,—,—,—,masculine,nominative,plural,adjective,Philippians 4:1,"Ὥστε, ἀδελφοί μου","καὶ ἐπιπόθητοι, χαρὰ καὶ στέφανός μου, οὕτως στήκετε ἐν κυρίῳ, ἀγαπητοί."
ἀγαπητοὶ,ἀγαπητός,—,—,—,—,masculine,nominative,plural,adjective,1 Thessalonians 2:8,"οὕτως ὁμειρόμενοι ὑμῶν εὐδοκοῦμεν μεταδοῦναι ὑμῖν οὐ μόνον τὸ εὐαγγέλιον τοῦ θεοῦ ἀλλὰ καὶ τὰς ἑαυτῶν ψυχάς, διότι",ἡμῖν ἐγενήθητε.
ἀγαπητοὶ,ἀγαπητός,—,—,—,—,masculine,nominative,plural,adjective,1 Timothy 6:2,"οἱ δὲ πιστοὺς ἔχοντες δεσπότας μὴ καταφρονείτωσαν, ὅτι ἀδελφοί εἰσιν, ἀλλὰ μᾶλλον δουλευέτωσαν, ὅτι πιστοί εἰσιν καὶ",οἱ τῆς εὐεργεσίας ἀντιλαμβανόμενοι.   Ταῦτα δίδασκε καὶ παρακάλει.
ἀγαπητοὶ,ἀγαπητός,—,—,—,—,masculine,vocative,plural,adjective,1 John 3:2,—,"νῦν τέκνα θεοῦ ἐσμεν, καὶ οὔπω ἐφανερώθη τί ἐσόμεθα. οἴδαμεν  ὅτι ἐὰν φανερωθῇ"
ἀγαπητοῖς,ἀγαπητός,—,—,—,—,masculine,dative,plural,adjective,Acts 15:25,ἔδοξεν ἡμῖν γενομένοις ὁμοθυμαδὸν ἐκλεξαμένοις ἄνδρας πέμψαι πρὸς ὑμᾶς σὺν τοῖς,"ἡμῶν Βαρναβᾷ καὶ Παύλῳ,"
ἀγαπητοῖς,ἀγαπητός,—,—,—,—,masculine,dative,plural,adjective,Romans 1:7,πᾶσιν τοῖς οὖσιν ἐν Ῥώμῃ,"θεοῦ, κλητοῖς ἁγίοις, χάρις ὑμῖν καὶ εἰρήνη ἀπὸ θεοῦ πατρὸς ἡμῶν καὶ κυρίου Ἰησοῦ Χριστοῦ."
ἀγαπητοῦ,ἀγαπητός,—,—,—,—,masculine,genitive,singular,adjective,Colossians 1:7,καθὼς  ἐμάθετε ἀπὸ Ἐπαφρᾶ τοῦ,"συνδούλου ἡμῶν, ὅς ἐστιν πιστὸς ὑπὲρ ὑμῶν διάκονος τοῦ Χριστοῦ,"
ἀγαπητόν,ἀγαπητός,—,—,—,—,masculine,accusative,singular,adjective,Mark 12:6,ἔτι ἕνα εἶχεν υἱὸν,·  ἀπέστειλεν αὐτὸν ἔσχατον πρὸς αὐτοὺς λέγων ὅτι ἐντραπήσονται τὸν υἱόν μου.
ἀγαπητόν,ἀγαπητός,—,—,—,—,masculine,accusative,singular,adjective,Luke 20:13,εἶπεν δὲ ὁ κύριος τοῦ ἀμπελῶνος· τί ποιήσω; πέμψω τὸν υἱόν μου τὸν,· ἴσως τοῦτον  ἐντραπήσονται.
ἀγαπητόν,ἀγαπητός,—,—,—,—,masculine,accusative,singular,adjective,Romans 16:5,καὶ τὴν κατʼ οἶκον αὐτῶν ἐκκλησίαν. ἀσπάσασθε Ἐπαίνετον τὸν,"μου, ὅς ἐστιν ἀπαρχὴ τῆς Ἀσίας εἰς Χριστόν."
ἀγαπητόν,ἀγαπητός,—,—,—,—,masculine,accusative,singular,adjective,Romans 16:8,ἀσπάσασθε Ἀμπλιᾶτον τὸν,μου ἐν κυρίῳ.
ἀγαπητόν,ἀγαπητός,—,—,—,—,masculine,accusative,singular,adjective,Romans 16:9,ἀσπάσασθε Οὐρβανὸν τὸν συνεργὸν ἡμῶν ἐν Χριστῷ καὶ Στάχυν τὸν,μου.
ἀγαπητόν,ἀγαπητός,—,—,—,—,masculine,accusative,singular,adjective,Philemon 16,"οὐκέτι ὡς δοῦλον ἀλλʼ ὑπὲρ δοῦλον, ἀδελφὸν",", μάλιστα ἐμοί, πόσῳ δὲ μᾶλλον σοὶ καὶ ἐν σαρκὶ καὶ ἐν κυρίῳ."
ἀγαπητός,ἀγαπητός,—,—,—,—,masculine,nominative,singular,adjective,Matthew 3:17,καὶ ἰδοὺ φωνὴ ἐκ τῶν οὐρανῶν λέγουσα·  οὗτός ἐστιν ὁ υἱός μου ὁ,", ἐν ᾧ εὐδόκησα."
ἀγαπητός,ἀγαπητός,—,—,—,—,masculine,nominative,singular,adjective,Matthew 12:18,"ἰδοὺ ὁ παῖς μου  ὃν ᾑρέτισα,           ὁ",μου εἰς ὃν εὐδόκησεν ἡ ψυχή μου        θήσω τὸ πνεῦμά μου ἐπʼ αὐτόν
ἀγαπητός,ἀγαπητός,—,—,—,—,masculine,nominative,singular,adjective,Matthew 17:5,ἰδοὺ φωνὴ ἐκ τῆς νεφέλης λέγουσα· οὗτός ἐστιν ὁ υἱός μου ὁ,", ἐν ᾧ εὐδόκησα· ἀκούετε αὐτοῦ."
ἀγαπητός,ἀγαπητός,—,—,—,—,masculine,nominative,singular,adjective,Mark 1:11,καὶ φωνὴ ἐγένετο ἐκ τῶν οὐρανῶν σὺ εἶ ὁ υἱός μου ὁ,", ἐν σοὶ εὐδόκησα."
ἀγαπητός,ἀγαπητός,—,—,—,—,masculine,nominative,singular,adjective,Mark 9:7,"καὶ ἐγένετο νεφέλη ἐπισκιάζουσα αὐτοῖς, καὶ ἐγένετο φωνὴ ἐκ τῆς νεφέλης· οὗτός ἐστιν ὁ υἱός μου ὁ",", ἀκούετε αὐτοῦ."
ἀγαπητός,ἀγαπητός,—,—,—,—,masculine,nominative,singular,adjective,Luke 3:22,"αὐτόν, καὶ φωνὴν ἐξ οὐρανοῦ γενέσθαι· σὺ εἶ ὁ υἱός μου ὁ",", ἐν σοὶ εὐδόκησα."
ἀγαπητός,ἀγαπητός,—,—,—,—,masculine,nominative,singular,adjective,2 Peter 1:17,φωνῆς ἐνεχθείσης αὐτῷ τοιᾶσδε ὑπὸ τῆς μεγαλοπρεποῦς δόξης· ὁ υἱός μου ὁ,μου οὗτός ἐστιν εἰς ὃν ἐγὼ εὐδόκησα
ἀγαπητὰ,ἀγαπητός,—,—,—,—,neuter,nominative,plural,adjective,Ephesians 5:1,Γίνεσθε οὖν μιμηταὶ τοῦ θεοῦ ὡς τέκνα,""
ἀγαπητὰ,ἀγαπητός,—,—,—,—,neuter,"accusative, nominative",plural,adjective,1 Corinthians 4:14,Οὐκ ἐντρέπων ὑμᾶς γράφω ταῦτα ἀλλʼ ὡς τέκνα μου,νουθετῶν.
ἀγαπητὸν,ἀγαπητός,—,—,—,—,neuter,"nominative, accusative",singular,adjective,1 Corinthians 4:17,"Διὰ τοῦτο  ἔπεμψα ὑμῖν Τιμόθεον, ὅς ἐστίν μου τέκνον","καὶ πιστὸν ἐν κυρίῳ, ὃς ὑμᾶς ἀναμνήσει τὰς ὁδούς μου τὰς ἐν Χριστῷ"
ἀγαπητὸς,ἀγαπητός,—,—,—,—,masculine,nominative,singular,adjective,Ephesians 6:21,"Ἵνα δὲ εἰδῆτε καὶ ὑμεῖς τὰ κατʼ ἐμέ, τί πράσσω, πάντα γνωρίσει ὑμῖν Τύχικος ὁ","ἀδελφὸς καὶ πιστὸς διάκονος ἐν κυρίῳ,"
ἀγαπητὸς,ἀγαπητός,—,—,—,—,masculine,nominative,singular,adjective,Colossians 4:7,Τὰ κατʼ ἐμὲ πάντα γνωρίσει ὑμῖν Τύχικος ὁ,"ἀδελφὸς καὶ πιστὸς διάκονος καὶ σύνδουλος ἐν κυρίῳ,"
ἀγαπητὸς,ἀγαπητός,—,—,—,—,masculine,nominative,singular,adjective,Colossians 4:14,ἀσπάζεται ὑμᾶς Λουκᾶς ὁ ἰατρὸς ὁ,καὶ Δημᾶς.
ἀγαπητὸς,ἀγαπητός,—,—,—,—,masculine,nominative,singular,adjective,2 Peter 3:15,"καὶ τὴν τοῦ κυρίου ἡμῶν μακροθυμίαν σωτηρίαν ἡγεῖσθε, καθὼς καὶ ὁ","ἡμῶν ἀδελφὸς Παῦλος κατὰ τὴν δοθεῖσαν αὐτῷ σοφίαν ἔγραψεν ὑμῖν,"
ἀγαπητῷ,ἀγαπητός,—,—,—,—,masculine,dative,singular,adjective,Colossians 4:9,σὺν Ὀνησίμῳ τῷ πιστῷ καὶ,"ἀδελφῷ, ὅς ἐστιν ἐξ ὑμῶν· πάντα ὑμῖν γνωρίσουσιν τὰ ὧδε."
ἀγαπητῷ,ἀγαπητός,—,—,—,—,masculine,dative,singular,adjective,Philemon 1,Παῦλος δέσμιος Χριστοῦ Ἰησοῦ καὶ Τιμόθεος ὁ ἀδελφὸς Φιλήμονι τῷ,καὶ συνεργῷ ἡμῶν
ἀγαπητῷ,ἀγαπητός,—,—,—,—,masculine,dative,singular,adjective,3 John 1,Ὁ πρεσβύτερος Γαΐῳ τῷ,", ὃν ἐγὼ ἀγαπῶ ἐν ἀληθείᾳ.  Ἀγαπητέ,"
ἀγαπητῷ,ἀγαπητός,—,—,—,—,"neuter, masculine",dative,singular,adjective,2 Timothy 1:2,Τιμοθέῳ,"τέκνῳ, χάρις ἔλεος εἰρήνη ἀπὸ θεοῦ πατρὸς καὶ Χριστοῦ Ἰησοῦ τοῦ κυρίου ἡμῶν."
Ἀγαπητέ,ἀγαπητός,—,—,—,—,masculine,vocative,singular,adjective,3 John 2,—,", περὶ πάντων εὔχομαί σε εὐοδοῦσθαι καὶ ὑγιαίνειν, καθὼς εὐοδοῦταί σου ἡ ψυχή."
Ἀγαπητέ,ἀγαπητός,—,—,—,—,masculine,vocative,singular,adjective,3 John 5,—,", πιστὸν ποιεῖς ὃ ἐὰν ἐργάσῃ εἰς τοὺς ἀδελφοὺς καὶ τοῦτο ξένους,"
Ἀγαπητέ,ἀγαπητός,—,—,—,—,masculine,vocative,singular,adjective,3 John 11,—,", μὴ μιμοῦ τὸ κακὸν ἀλλὰ τὸ ἀγαθόν. ὁ ἀγαθοποιῶν ἐκ τοῦ θεοῦ ἐστιν"
Ἀγαπητοί,ἀγαπητός,—,—,—,—,masculine,vocative,plural,adjective,1 Peter 2:11,—,", παρακαλῶ ὡς παροίκους καὶ παρεπιδήμους ἀπέχεσθαι τῶν σαρκικῶν ἐπιθυμιῶν αἵτινες στρατεύονται κατὰ τῆς ψυχῆς·"
Ἀγαπητοί,ἀγαπητός,—,—,—,—,masculine,vocative,plural,adjective,1 Peter 4:12,—,", μὴ ξενίζεσθε  τῇ ἐν ὑμῖν πυρώσει πρὸς πειρασμὸν ὑμῖν γινομένῃ ὡς ξένου ὑμῖν συμβαίνοντος,"
Ἀγαπητοί,ἀγαπητός,—,—,—,—,masculine,vocative,plural,adjective,1 John 2:7,—,", οὐκ ἐντολὴν καινὴν γράφω ὑμῖν ἀλλʼ ἐντολὴν παλαιὰν ἣν εἴχετε ἀπʼ ἀρχῆς· ἡ"
Ἀγαπητοί,ἀγαπητός,—,—,—,—,masculine,vocative,plural,adjective,1 John 3:21,—,", ἐὰν ἡ καρδία ἡμῶν μὴ καταγινώσκῃ, παρρησίαν ἔχομεν πρὸς τὸν θεὸν"
Ἀγαπητοί,ἀγαπητός,—,—,—,—,masculine,vocative,plural,adjective,1 John 4:1,—,", μὴ παντὶ πνεύματι πιστεύετε ἀλλὰ δοκιμάζετε τὰ πνεύματα εἰ ἐκ τοῦ θεοῦ ἐστιν"
Ἀγαπητοί,ἀγαπητός,—,—,—,—,masculine,vocative,plural,adjective,1 John 4:7,—,", ἀγαπῶμεν ἀλλήλους,        ὅτι ἡ ἀγάπη ἐκ τοῦ θεοῦ ἐστιν,      καὶ πᾶς ὁ ἀγαπῶν"
Ἀγαπητοί,ἀγαπητός,—,—,—,—,masculine,vocative,plural,adjective,1 John 4:11,—,", εἰ οὕτως ὁ θεὸς ἠγάπησεν ἡμᾶς, καὶ ἡμεῖς ὀφείλομεν ἀλλήλους ἀγαπᾶν."
Ἀγαπητοί,ἀγαπητός,—,—,—,—,masculine,vocative,plural,adjective,Jude 3,—,", πᾶσαν σπουδὴν ποιούμενος  γράφειν ὑμῖν περὶ τῆς κοινῆς ἡμῶν σωτηρίας ἀνάγκην ἔσχον γράψαι"
