Result,Lemma (Greek),Tense (Logos Greek),Voice (Logos Greek),Mood (Logos Greek),Person (Logos Greek),Gender (Logos Greek),Case (Logos Greek),Number (Logos Greek),Part of Speech,Reference,Previous Context,Next Context
εἰς,εἰς,—,—,—,—,—,—,—,preposition,Acts 8:23,—,γὰρ χολὴν πικρίας καὶ σύνδεσμον ἀδικίας ὁρῶ σε ὄντα.
εἰς,εἰς,—,—,—,—,—,—,—,preposition,Acts 8:25,Οἱ μὲν οὖν διαμαρτυράμενοι καὶ λαλήσαντες τὸν λόγον τοῦ κυρίου ὑπέστρεφον,"Ἱεροσόλυμα, πολλάς τε κώμας τῶν Σαμαριτῶν εὐηγγελίζοντο."
εἰς,εἰς,—,—,—,—,—,—,—,preposition,Acts 8:26,ἀνάστηθι καὶ πορεύου κατὰ μεσημβρίαν ἐπὶ τὴν ὁδὸν τὴν καταβαίνουσαν ἀπὸ Ἰερουσαλὴμ,"Γάζαν, αὕτη ἐστὶν ἔρημος."
εἰς,εἰς,—,—,—,—,—,—,—,preposition,Acts 8:27,"βασιλίσσης Αἰθιόπων, ὃς ἦν ἐπὶ πάσης τῆς γάζης αὐτῆς, ὃς ἐληλύθει προσκυνήσων","Ἰερουσαλήμ,"
εἰς,εἰς,—,—,—,—,—,—,—,preposition,Acts 8:38,καὶ ἐκέλευσεν στῆναι τὸ ἅρμα καὶ κατέβησαν ἀμφότεροι,"τὸ ὕδωρ, ὅ τε Φίλιππος καὶ ὁ εὐνοῦχος, καὶ ἐβάπτισεν αὐτόν."
εἰς,εἰς,—,—,—,—,—,—,—,preposition,Acts 8:40,Φίλιππος δὲ εὑρέθη,Ἄζωτον· καὶ διερχόμενος εὐηγγελίζετο τὰς πόλεις πάσας ἕως τοῦ ἐλθεῖν αὐτὸν εἰς Καισάρειαν.
εἰς,εἰς,—,—,—,—,—,—,—,preposition,Acts 8:40,Φίλιππος δὲ εὑρέθη εἰς Ἄζωτον· καὶ διερχόμενος εὐηγγελίζετο τὰς πόλεις πάσας ἕως τοῦ ἐλθεῖν αὐτὸν,Καισάρειαν.
εἰς,εἰς,—,—,—,—,—,—,—,preposition,Acts 9:1,Ὁ δὲ Σαῦλος ἔτι ἐμπνέων ἀπειλῆς καὶ φόνου,"τοὺς μαθητὰς τοῦ κυρίου, προσελθὼν τῷ ἀρχιερεῖ"
εἰς,εἰς,—,—,—,—,—,—,—,preposition,Acts 9:2,ᾐτήσατο παρʼ αὐτοῦ ἐπιστολὰς,"Δαμασκὸν πρὸς τὰς συναγωγάς, ὅπως ἐάν τινας εὕρῃ τῆς ὁδοῦ ὄντας, ἄνδρας τε"
εἰς,εἰς,—,—,—,—,—,—,—,preposition,Acts 9:2,"ἐάν τινας εὕρῃ τῆς ὁδοῦ ὄντας, ἄνδρας τε καὶ γυναῖκας, δεδεμένους ἀγάγῃ",Ἰερουσαλήμ.
εἰς,εἰς,—,—,—,—,—,—,—,preposition,Acts 9:6,ἀλλʼ ἀνάστηθι καὶ εἴσελθε,τὴν πόλιν καὶ λαληθήσεταί σοι ὅ τί σε δεῖ ποιεῖν.
εἰς,εἰς,—,—,—,—,—,—,—,preposition,Acts 9:8,"ἠγέρθη δὲ Σαῦλος ἀπὸ τῆς γῆς, ἀνεῳγμένων δὲ τῶν ὀφθαλμῶν αὐτοῦ οὐδὲν ἔβλεπεν· χειραγωγοῦντες δὲ αὐτὸν εἰσήγαγον",Δαμασκόν.
εἰς,εἰς,—,—,—,—,—,—,—,preposition,Acts 9:17,Ἀπῆλθεν δὲ Ἁνανίας καὶ εἰσῆλθεν,"τὴν οἰκίαν καὶ ἐπιθεὶς ἐπʼ αὐτὸν τὰς χεῖρας εἶπεν· Σαοὺλ ἀδελφέ, ὁ κύριος"
εἰς,εἰς,—,—,—,—,—,—,—,preposition,Acts 9:21,ἐξίσταντο δὲ πάντες οἱ ἀκούοντες καὶ ἔλεγον· οὐχ οὗτός ἐστιν ὁ πορθήσας,"Ἰερουσαλὴμ τοὺς ἐπικαλουμένους τὸ ὄνομα τοῦτο, καὶ ὧδε εἰς τοῦτο ἐληλύθει ἵνα δεδεμένους"
εἰς,εἰς,—,—,—,—,—,—,—,preposition,Acts 9:21,"ἐστιν ὁ πορθήσας εἰς Ἰερουσαλὴμ τοὺς ἐπικαλουμένους τὸ ὄνομα τοῦτο, καὶ ὧδε",τοῦτο ἐληλύθει ἵνα δεδεμένους αὐτοὺς ἀγάγῃ ἐπὶ τοὺς ἀρχιερεῖς;
εἰς,εἰς,—,—,—,—,—,—,—,preposition,Acts 9:26,Παραγενόμενος δὲ,"Ἰερουσαλὴμ ἐπείραζεν κολλᾶσθαι τοῖς μαθηταῖς, καὶ πάντες ἐφοβοῦντο αὐτὸν μὴ πιστεύοντες ὅτι ἐστὶν μαθητής."
εἰς,εἰς,—,—,—,—,—,—,—,preposition,Acts 9:28,καὶ ἦν μετʼ αὐτῶν εἰσπορευόμενος καὶ ἐκπορευόμενος,"Ἰερουσαλήμ, παρρησιαζόμενος ἐν τῷ ὀνόματι τοῦ κυρίου,"
εἰς,εἰς,—,—,—,—,—,—,—,preposition,Acts 9:30,ἐπιγνόντες δὲ οἱ ἀδελφοὶ κατήγαγον αὐτὸν,Καισάρειαν  καὶ ἐξαπέστειλαν αὐτὸν εἰς Ταρσόν.
εἰς,εἰς,—,—,—,—,—,—,—,preposition,Acts 9:30,ἐπιγνόντες δὲ οἱ ἀδελφοὶ κατήγαγον αὐτὸν εἰς Καισάρειαν  καὶ ἐξαπέστειλαν αὐτὸν,Ταρσόν.
εἰς,εἰς,—,—,—,—,—,—,—,preposition,Acts 9:39,ἀναστὰς δὲ Πέτρος συνῆλθεν αὐτοῖς· ὃν παραγενόμενον ἀνήγαγον,τὸ ὑπερῷον καὶ παρέστησαν αὐτῷ πᾶσαι αἱ χῆραι κλαίουσαι καὶ ἐπιδεικνύμεναι χιτῶνας καὶ
εἰς,εἰς,—,—,—,—,—,—,—,preposition,Acts 10:4,κύριε; εἶπεν δὲ αὐτῷ· αἱ προσευχαί σου καὶ αἱ ἐλεημοσύναι σου ἀνέβησαν,μνημόσυνον ἔμπροσθεν τοῦ θεοῦ.
εἰς,εἰς,—,—,—,—,—,—,—,preposition,Acts 10:5,καὶ νῦν πέμψον ἄνδρας,Ἰόππην καὶ μετάπεμψαι Σίμωνά τινα ὃς ἐπικαλεῖται Πέτρος·
εἰς,εἰς,—,—,—,—,—,—,—,preposition,Acts 10:8,καὶ ἐξηγησάμενος ἅπαντα αὐτοῖς ἀπέστειλεν αὐτοὺς,τὴν Ἰόππην.
εἰς,εἰς,—,—,—,—,—,—,—,preposition,Acts 10:16,τοῦτο δὲ ἐγένετο ἐπὶ τρὶς καὶ εὐθὺς ἀνελήμφθη τὸ σκεῦος,τὸν οὐρανόν.
εἰς,εἰς,—,—,—,—,—,—,—,preposition,Acts 10:22,"ὑπὸ ὅλου τοῦ ἔθνους τῶν Ἰουδαίων, ἐχρηματίσθη ὑπὸ ἀγγέλου ἁγίου μεταπέμψασθαί σε",τὸν οἶκον αὐτοῦ καὶ ἀκοῦσαι ῥήματα παρὰ σοῦ.
εἰς,εἰς,—,—,—,—,—,—,—,preposition,Acts 10:24,τῇ δὲ ἐπαύριον εἰσῆλθεν,τὴν Καισάρειαν. ὁ δὲ Κορνήλιος ἦν προσδοκῶν αὐτοὺς συγκαλεσάμενος τοὺς συγγενεῖς αὐτοῦ καὶ τοὺς ἀναγκαίους φίλους.
εἰς,εἰς,—,—,—,—,—,—,—,preposition,Acts 10:32,πέμψον οὖν,"Ἰόππην καὶ μετακάλεσαι Σίμωνα ὃς ἐπικαλεῖται Πέτρος, οὗτος ξενίζεται ἐν οἰκίᾳ Σίμωνος βυρσέως παρὰ θάλασσαν."
εἰς,εἰς,—,—,—,—,—,—,—,preposition,Acts 10:43,τούτῳ πάντες οἱ προφῆται μαρτυροῦσιν ἄφεσιν ἁμαρτιῶν λαβεῖν διὰ τοῦ ὀνόματος αὐτοῦ πάντα τὸν πιστεύοντα,αὐτόν.
εἰς,εἰς,—,—,—,—,—,—,—,preposition,Acts 11:2,Ὅτε δὲ ἀνέβη Πέτρος,"Ἰερουσαλήμ, διεκρίνοντο πρὸς αὐτὸν οἱ ἐκ περιτομῆς"
εἰς,εἰς,—,—,—,—,—,—,—,preposition,Acts 11:6,—,ἣν ἀτενίσας κατενόουν καὶ εἶδον τὰ τετράποδα τῆς γῆς καὶ τὰ θηρία καὶ
εἰς,εἰς,—,—,—,—,—,—,—,preposition,Acts 11:8,"εἶπον δέ· μηδαμῶς, κύριε, ὅτι κοινὸν ἢ ἀκάθαρτον οὐδέποτε εἰσῆλθεν",τὸ στόμα μου.
εἰς,εἰς,—,—,—,—,—,—,—,preposition,Acts 11:10,"τοῦτο δὲ ἐγένετο ἐπὶ τρίς, καὶ ἀνεσπάσθη πάλιν ἅπαντα",τὸν οὐρανόν.
εἰς,εἰς,—,—,—,—,—,—,—,preposition,Acts 11:12,διακρίναντα. ἦλθον δὲ σὺν ἐμοὶ καὶ οἱ ἓξ ἀδελφοὶ οὗτοι καὶ εἰσήλθομεν,τὸν οἶκον τοῦ ἀνδρός.
εἰς,εἰς,—,—,—,—,—,—,—,preposition,Acts 11:13,ἀπήγγειλεν δὲ ἡμῖν πῶς εἶδεν [τὸν] ἄγγελον ἐν τῷ οἴκῳ αὐτοῦ σταθέντα καὶ εἰπόντα· ἀπόστειλον,"Ἰόππην καὶ μετάπεμψαι Σίμωνα τὸν ἐπικαλούμενον Πέτρον,"
εἰς,εἰς,—,—,—,—,—,—,—,preposition,Acts 11:18,Ἀκούσαντες δὲ ταῦτα ἡσύχασαν καὶ ἐδόξασαν τὸν θεὸν λέγοντες· ἄρα καὶ τοῖς ἔθνεσιν ὁ θεὸς τὴν μετάνοιαν,ζωὴν ἔδωκεν.
εἰς,εἰς,—,—,—,—,—,—,—,preposition,Acts 11:20,"Ἦσαν δέ τινες ἐξ αὐτῶν ἄνδρες Κύπριοι καὶ Κυρηναῖοι, οἵτινες ἐλθόντες",Ἀντιόχειαν ἐλάλουν καὶ πρὸς τοὺς Ἑλληνιστὰς εὐαγγελιζόμενοι τὸν κύριον Ἰησοῦν.
εἰς,εἰς,—,—,—,—,—,—,—,preposition,Acts 11:22,Ἠκούσθη δὲ ὁ λόγος,τὰ ὦτα τῆς ἐκκλησίας τῆς οὔσης ἐν Ἰερουσαλὴμ περὶ αὐτῶν καὶ ἐξαπέστειλαν Βαρναβᾶν [διελθεῖν] ἕως Ἀντιοχείας.
εἰς,εἰς,—,—,—,—,—,—,—,preposition,Acts 11:25,Ἐξῆλθεν δὲ,"Ταρσὸν ἀναζητῆσαι Σαῦλον,"
εἰς,εἰς,—,—,—,—,—,—,—,preposition,Acts 11:26,καὶ εὑρὼν ἤγαγεν,Ἀντιόχειαν. ἐγένετο δὲ αὐτοῖς καὶ ἐνιαυτὸν ὅλον συναχθῆναι ἐν τῇ ἐκκλησίᾳ καὶ διδάξαι
εἰς,εἰς,—,—,—,—,—,—,—,preposition,Acts 11:27,Ἐν ταύταις δὲ ταῖς ἡμέραις κατῆλθον ἀπὸ Ἱεροσολύμων προφῆται,Ἀντιόχειαν.
εἰς,εἰς,—,—,—,—,—,—,—,preposition,Acts 11:29,"τῶν δὲ μαθητῶν, καθὼς εὐπορεῖτό τις, ὥρισαν ἕκαστος αὐτῶν",διακονίαν πέμψαι τοῖς κατοικοῦσιν ἐν τῇ Ἰουδαίᾳ ἀδελφοῖς·
εἰς,εἰς,—,—,—,—,—,—,—,preposition,Acts 12:4,ὃν καὶ πιάσας ἔθετο,"φυλακὴν παραδοὺς τέσσαρσιν τετραδίοις στρατιωτῶν φυλάσσειν αὐτόν, βουλόμενος μετὰ τὸ πάσχα ἀναγαγεῖν αὐτὸν τῷ λαῷ."
εἰς,εἰς,—,—,—,—,—,—,—,preposition,Acts 12:10,διελθόντες δὲ πρώτην φυλακὴν καὶ δευτέραν ἦλθαν ἐπὶ τὴν πύλην τὴν σιδηρᾶν τὴν φέρουσαν,"τὴν πόλιν, ἥτις αὐτομάτη ἠνοίγη αὐτοῖς καὶ ἐξελθόντες  προῆλθον ῥύμην μίαν, καὶ εὐθέως"
εἰς,εἰς,—,—,—,—,—,—,—,preposition,Acts 12:17,φυλακῆς εἶπέν τε· ἀπαγγείλατε Ἰακώβῳ καὶ τοῖς ἀδελφοῖς ταῦτα. καὶ ἐξελθὼν ἐπορεύθη,ἕτερον τόπον.
εἰς,εἰς,—,—,—,—,—,—,—,preposition,Acts 12:19,"Ἡρῴδης δὲ ἐπιζητήσας αὐτὸν καὶ μὴ εὑρών, ἀνακρίνας τοὺς φύλακας ἐκέλευσεν ἀπαχθῆναι, καὶ κατελθὼν ἀπὸ τῆς Ἰουδαίας",Καισάρειαν διέτριβεν.
εἰς,εἰς,—,—,—,—,—,—,—,preposition,Acts 12:25,Βαρναβᾶς δὲ καὶ Σαῦλος  ὑπέστρεψαν,"Ἰερουσαλὴμ  πληρώσαντες τὴν διακονίαν, συμπαραλαβόντες Ἰωάννην τὸν ἐπικληθέντα Μᾶρκον."
εἰς,εἰς,—,—,—,—,—,—,—,preposition,Acts 13:2,εἶπεν τὸ πνεῦμα τὸ ἅγιον· ἀφορίσατε δή μοι τὸν Βαρναβᾶν καὶ Σαῦλον,τὸ ἔργον ὃ προσκέκλημαι αὐτούς.
εἰς,εἰς,—,—,—,—,—,—,—,preposition,Acts 13:4,Αὐτοὶ μὲν οὖν ἐκπεμφθέντες ὑπὸ τοῦ ἁγίου πνεύματος κατῆλθον,"Σελεύκειαν, ἐκεῖθέν τε ἀπέπλευσαν εἰς Κύπρον"
εἰς,εἰς,—,—,—,—,—,—,—,preposition,Acts 13:4,"Αὐτοὶ μὲν οὖν ἐκπεμφθέντες ὑπὸ τοῦ ἁγίου πνεύματος κατῆλθον εἰς Σελεύκειαν, ἐκεῖθέν τε ἀπέπλευσαν",Κύπρον
εἰς,εἰς,—,—,—,—,—,—,—,preposition,Acts 13:9,"Σαῦλος δέ, ὁ καὶ Παῦλος, πλησθεὶς πνεύματος ἁγίου ἀτενίσας",αὐτὸν
εἰς,εἰς,—,—,—,—,—,—,—,preposition,Acts 13:13,Ἀναχθέντες δὲ ἀπὸ τῆς Πάφου οἱ περὶ Παῦλον ἦλθον,"Πέργην τῆς Παμφυλίας, Ἰωάννης δὲ ἀποχωρήσας ἀπʼ αὐτῶν ὑπέστρεψεν εἰς Ἱεροσόλυμα."
εἰς,εἰς,—,—,—,—,—,—,—,preposition,Acts 13:13,"Παῦλον ἦλθον εἰς Πέργην τῆς Παμφυλίας, Ἰωάννης δὲ ἀποχωρήσας ἀπʼ αὐτῶν ὑπέστρεψεν",Ἱεροσόλυμα.
εἰς,εἰς,—,—,—,—,—,—,—,preposition,Acts 13:14,Αὐτοὶ δὲ διελθόντες ἀπὸ τῆς Πέργης παρεγένοντο,"Ἀντιόχειαν τὴν Πισιδίαν, καὶ εἰσελθόντες εἰς τὴν συναγωγὴν τῇ ἡμέρᾳ τῶν σαββάτων ἐκάθισαν."
εἰς,εἰς,—,—,—,—,—,—,—,preposition,Acts 13:14,"Αὐτοὶ δὲ διελθόντες ἀπὸ τῆς Πέργης παρεγένοντο εἰς Ἀντιόχειαν τὴν Πισιδίαν, καὶ εἰσελθόντες",τὴν συναγωγὴν τῇ ἡμέρᾳ τῶν σαββάτων ἐκάθισαν.
εἰς,εἰς,—,—,—,—,—,—,—,preposition,Acts 13:22,καὶ μεταστήσας αὐτὸν ἤγειρεν τὸν Δαυὶδ αὐτοῖς,"βασιλέα ᾧ καὶ εἶπεν μαρτυρήσας· εὗρον Δαυὶδ τὸν τοῦ Ἰεσσαί, ἄνδρα κατὰ τὴν"
εἰς,εἰς,—,—,—,—,—,—,—,preposition,Acts 13:29,"ὡς δὲ ἐτέλεσαν πάντα τὰ περὶ αὐτοῦ γεγραμμένα, καθελόντες ἀπὸ τοῦ ξύλου  ἔθηκαν",μνημεῖον.
εἰς,εἰς,—,—,—,—,—,—,—,preposition,Acts 13:31,ὃς ὤφθη ἐπὶ ἡμέρας πλείους τοῖς συναναβᾶσιν αὐτῷ ἀπὸ τῆς Γαλιλαίας,"Ἰερουσαλήμ, οἵτινες [νῦν] εἰσιν μάρτυρες αὐτοῦ πρὸς τὸν λαόν."
εἰς,εἰς,—,—,—,—,—,—,—,preposition,Acts 13:34,ὅτι δὲ ἀνέστησεν αὐτὸν ἐκ νεκρῶν μηκέτι μέλλοντα ὑποστρέφειν,"διαφθοράν, οὕτως εἴρηκεν ὅτι δώσω ὑμῖν τὰ ὅσια Δαυὶδ τὰ πιστά."
εἰς,εἰς,—,—,—,—,—,—,—,preposition,Acts 13:42,Ἐξιόντων δὲ αὐτῶν παρεκάλουν,τὸ μεταξὺ σάββατον λαληθῆναι αὐτοῖς τὰ ῥήματα ταῦτα.
εἰς,εἰς,—,—,—,—,—,—,—,preposition,Acts 13:46,"ἀπωθεῖσθε αὐτὸν καὶ οὐκ ἀξίους κρίνετε ἑαυτοὺς τῆς αἰωνίου ζωῆς, ἰδοὺ στρεφόμεθα",τὰ ἔθνη.
εἰς,εἰς,—,—,—,—,—,—,—,preposition,Acts 13:47,οὕτως γὰρ ἐντέταλται ἡμῖν ὁ κύριος·      τέθεικά σε,φῶς ἐθνῶν        τοῦ εἶναί σε εἰς σωτηρίαν ἕως ἐσχάτου τῆς γῆς.
εἰς,εἰς,—,—,—,—,—,—,—,preposition,Acts 13:47,οὕτως γὰρ ἐντέταλται ἡμῖν ὁ κύριος·      τέθεικά σε εἰς φῶς ἐθνῶν        τοῦ εἶναί σε,σωτηρίαν ἕως ἐσχάτου τῆς γῆς.
εἰς,εἰς,—,—,—,—,—,—,—,preposition,Acts 13:48,Ἀκούοντα δὲ τὰ ἔθνη ἔχαιρον καὶ ἐδόξαζον τὸν λόγον τοῦ κυρίου καὶ ἐπίστευσαν ὅσοι ἦσαν τεταγμένοι,ζωὴν αἰώνιον·
εἰς,εἰς,—,—,—,—,—,—,—,preposition,Acts 13:51,οἱ δὲ ἐκτιναξάμενοι τὸν κονιορτὸν τῶν ποδῶν ἐπʼ αὐτοὺς ἦλθον,"Ἰκόνιον,"
εἰς,εἰς,—,—,—,—,—,—,—,preposition,Acts 14:1,Ἐγένετο δὲ ἐν Ἰκονίῳ κατὰ τὸ αὐτὸ εἰσελθεῖν αὐτοὺς,τὴν συναγωγὴν τῶν Ἰουδαίων καὶ λαλῆσαι οὕτως  ὥστε πιστεῦσαι Ἰουδαίων τε καὶ Ἑλλήνων πολὺ πλῆθος.
εἰς,εἰς,—,—,—,—,—,—,—,preposition,Acts 14:6,συνιδόντες κατέφυγον,"τὰς πόλεις τῆς Λυκαονίας  Λύστραν καὶ Δέρβην καὶ τὴν περίχωρον,"
εἰς,εἰς,—,—,—,—,—,—,—,preposition,Acts 14:14,Ἀκούσαντες δὲ οἱ ἀπόστολοι Βαρναβᾶς καὶ Παῦλος διαρρήξαντες τὰ ἱμάτια αὐτῶν ἐξεπήδησαν,τὸν ὄχλον κράζοντες
εἰς,εἰς,—,—,—,—,—,—,—,preposition,Acts 14:20,κυκλωσάντων δὲ τῶν μαθητῶν αὐτὸν  ἀναστὰς εἰσῆλθεν,τὴν πόλιν. Καὶ τῇ ἐπαύριον ἐξῆλθεν σὺν τῷ Βαρναβᾷ εἰς Δέρβην.
εἰς,εἰς,—,—,—,—,—,—,—,preposition,Acts 14:20,κυκλωσάντων δὲ τῶν μαθητῶν αὐτὸν  ἀναστὰς εἰσῆλθεν εἰς τὴν πόλιν. Καὶ τῇ ἐπαύριον ἐξῆλθεν σὺν τῷ Βαρναβᾷ,Δέρβην.
εἰς,εἰς,—,—,—,—,—,—,—,preposition,Acts 14:21,εὐαγγελισάμενοί τε τὴν πόλιν ἐκείνην καὶ μαθητεύσαντες ἱκανοὺς ὑπέστρεψαν,τὴν Λύστραν καὶ εἰς Ἰκόνιον καὶ εἰς Ἀντιόχειαν
εἰς,εἰς,—,—,—,—,—,—,—,preposition,Acts 14:21,εὐαγγελισάμενοί τε τὴν πόλιν ἐκείνην καὶ μαθητεύσαντες ἱκανοὺς ὑπέστρεψαν εἰς τὴν Λύστραν καὶ,Ἰκόνιον καὶ εἰς Ἀντιόχειαν
εἰς,εἰς,—,—,—,—,—,—,—,preposition,Acts 14:21,εὐαγγελισάμενοί τε τὴν πόλιν ἐκείνην καὶ μαθητεύσαντες ἱκανοὺς ὑπέστρεψαν εἰς τὴν Λύστραν καὶ εἰς Ἰκόνιον καὶ,Ἀντιόχειαν
εἰς,εἰς,—,—,—,—,—,—,—,preposition,Acts 14:22,"ἐπιστηρίζοντες τὰς ψυχὰς τῶν μαθητῶν, παρακαλοῦντες ἐμμένειν τῇ πίστει καὶ ὅτι διὰ πολλῶν θλίψεων δεῖ ἡμᾶς εἰσελθεῖν",τὴν βασιλείαν τοῦ θεοῦ.
εἰς,εἰς,—,—,—,—,—,—,—,preposition,Acts 14:23,"χειροτονήσαντες δὲ αὐτοῖς κατʼ ἐκκλησίαν πρεσβυτέρους, προσευξάμενοι μετὰ νηστειῶν παρέθεντο αὐτοὺς τῷ κυρίῳ",ὃν πεπιστεύκεισαν.
εἰς,εἰς,—,—,—,—,—,—,—,preposition,Acts 14:24,Καὶ διελθόντες τὴν Πισιδίαν ἦλθον,τὴν Παμφυλίαν
εἰς,εἰς,—,—,—,—,—,—,—,preposition,Acts 14:25,καὶ λαλήσαντες ἐν Πέργῃ τὸν λόγον  κατέβησαν,Ἀττάλειαν
εἰς,εἰς,—,—,—,—,—,—,—,preposition,Acts 14:26,κἀκεῖθεν ἀπέπλευσαν,"Ἀντιόχειαν, ὅθεν ἦσαν παραδεδομένοι τῇ χάριτι τοῦ θεοῦ εἰς τὸ ἔργον ὃ ἐπλήρωσαν."
εἰς,εἰς,—,—,—,—,—,—,—,preposition,Acts 14:26,"κἀκεῖθεν ἀπέπλευσαν εἰς Ἀντιόχειαν, ὅθεν ἦσαν παραδεδομένοι τῇ χάριτι τοῦ θεοῦ",τὸ ἔργον ὃ ἐπλήρωσαν.
εἰς,εἰς,—,—,—,—,—,—,—,preposition,Acts 15:2,καὶ Βαρναβᾶν καί τινας ἄλλους ἐξ αὐτῶν πρὸς τοὺς ἀποστόλους καὶ πρεσβυτέρους,Ἰερουσαλὴμ  περὶ τοῦ ζητήματος τούτου.
εἰς,εἰς,—,—,—,—,—,—,—,preposition,Acts 15:4,παραγενόμενοι δὲ,"Ἰερουσαλὴμ παρεδέχθησαν ἀπὸ τῆς ἐκκλησίας καὶ τῶν ἀποστόλων καὶ τῶν πρεσβυτέρων, ἀνήγγειλάν τε"
εἰς,εἰς,—,—,—,—,—,—,—,preposition,Acts 15:22,Τότε ἔδοξεν τοῖς ἀποστόλοις καὶ τοῖς πρεσβυτέροις σὺν ὅλῃ τῇ ἐκκλησίᾳ ἐκλεξαμένους ἄνδρας ἐξ αὐτῶν πέμψαι,"Ἀντιόχειαν σὺν τῷ Παύλῳ καὶ Βαρναβᾷ, Ἰούδαν τὸν καλούμενον Βαρσαββᾶν καὶ Σιλᾶν, ἄνδρας ἡγουμένους ἐν τοῖς ἀδελφοῖς,"
εἰς,εἰς,—,—,—,—,—,—,—,preposition,Acts 15:30,Οἱ μὲν οὖν ἀπολυθέντες  κατῆλθον,"Ἀντιόχειαν, καὶ συναγαγόντες τὸ πλῆθος ἐπέδωκαν τὴν ἐπιστολήν."
εἰς,εἰς,—,—,—,—,—,—,—,preposition,Acts 15:38,"Παῦλος δὲ ἠξίου, τὸν ἀποστάντα ἀπʼ αὐτῶν ἀπὸ Παμφυλίας καὶ μὴ συνελθόντα αὐτοῖς",τὸ ἔργον  μὴ συμπαραλαμβάνειν τοῦτον.
εἰς,εἰς,—,—,—,—,—,—,—,preposition,Acts 15:39,"ἐγένετο δὲ παροξυσμὸς ὥστε ἀποχωρισθῆναι αὐτοὺς ἀπʼ ἀλλήλων, τόν τε Βαρναβᾶν παραλαβόντα τὸν Μᾶρκον ἐκπλεῦσαι","Κύπρον,"
εἰς,εἰς,—,—,—,—,—,—,—,preposition,Acts 16:1,Κατήντησεν δὲ [καὶ],"Δέρβην καὶ εἰς Λύστραν. καὶ ἰδοὺ μαθητής τις ἦν ἐκεῖ ὀνόματι Τιμόθεος, υἱὸς"
εἰς,εἰς,—,—,—,—,—,—,—,preposition,Acts 16:1,Κατήντησεν δὲ [καὶ] εἰς Δέρβην καὶ,"Λύστραν. καὶ ἰδοὺ μαθητής τις ἦν ἐκεῖ ὀνόματι Τιμόθεος, υἱὸς γυναικὸς Ἰουδαίας πιστῆς, πατρὸς δὲ Ἕλληνος,"
εἰς,εἰς,—,—,—,—,—,—,—,preposition,Acts 16:7,ἐλθόντες δὲ κατὰ τὴν Μυσίαν ἐπείραζον,"τὴν Βιθυνίαν πορευθῆναι, καὶ οὐκ εἴασεν αὐτοὺς τὸ πνεῦμα Ἰησοῦ·"
εἰς,εἰς,—,—,—,—,—,—,—,preposition,Acts 16:8,παρελθόντες δὲ τὴν Μυσίαν κατέβησαν,Τρῳάδα.
εἰς,εἰς,—,—,—,—,—,—,—,preposition,Acts 16:9,"ὤφθη,  ἀνὴρ Μακεδών τις ἦν ἑστὼς καὶ παρακαλῶν αὐτὸν καὶ λέγων· διαβὰς",Μακεδονίαν βοήθησον ἡμῖν.
εἰς,εἰς,—,—,—,—,—,—,—,preposition,Acts 16:10,"ὡς δὲ τὸ ὅραμα εἶδεν, εὐθέως ἐζητήσαμεν ἐξελθεῖν",Μακεδονίαν συμβιβάζοντες ὅτι προσκέκληται ἡμᾶς ὁ θεὸς εὐαγγελίσασθαι αὐτούς.
εἰς,εἰς,—,—,—,—,—,—,—,preposition,Acts 16:11,Ἀναχθέντες δὲ ἀπὸ Τρῳάδος εὐθυδρομήσαμεν,"Σαμοθρᾴκην, τῇ δὲ ἐπιούσῃ εἰς Νέαν πόλιν"
εἰς,εἰς,—,—,—,—,—,—,—,preposition,Acts 16:11,"Ἀναχθέντες δὲ ἀπὸ Τρῳάδος εὐθυδρομήσαμεν εἰς Σαμοθρᾴκην, τῇ δὲ ἐπιούσῃ",Νέαν πόλιν
