Result,Lemma (Greek),Tense (Logos Greek),Voice (Logos Greek),Mood (Logos Greek),Person (Logos Greek),Gender (Logos Greek),Case (Logos Greek),Number (Logos Greek),Part of Speech,Reference,Previous Context,Next Context
παρʼ,παρά,—,—,—,—,—,—,—,preposition,Matthew 2:4,καὶ συναγαγὼν πάντας τοὺς ἀρχιερεῖς καὶ γραμματεῖς τοῦ λαοῦ ἐπυνθάνετο,αὐτῶν ποῦ ὁ χριστὸς γεννᾶται.
παρʼ,παρά,—,—,—,—,—,—,—,preposition,Matthew 2:7,Τότε Ἡρῴδης λάθρᾳ καλέσας τοὺς μάγους ἠκρίβωσεν,"αὐτῶν τὸν χρόνον τοῦ φαινομένου ἀστέρος,"
παρʼ,παρά,—,—,—,—,—,—,—,preposition,Matthew 8:10,"ἀκούσας δὲ ὁ Ἰησοῦς ἐθαύμασεν καὶ εἶπεν τοῖς ἀκολουθοῦσιν· ἀμὴν λέγω ὑμῖν,",οὐδενὶ τοσαύτην πίστιν ἐν τῷ Ἰσραὴλ εὗρον.
παρʼ,παρά,—,—,—,—,—,—,—,preposition,Matthew 22:25,ἦσαν δὲ,"ἡμῖν ἑπτὰ ἀδελφοί· καὶ ὁ πρῶτος γήμας ἐτελεύτησεν, καὶ μὴ ἔχων σπέρμα ἀφῆκεν"
παρʼ,παρά,—,—,—,—,—,—,—,preposition,Mark 3:21,καὶ ἀκούσαντες οἱ,αὐτοῦ ἐξῆλθον κρατῆσαι αὐτόν· ἔλεγον γὰρ ὅτι ἐξέστη.
παρʼ,παρά,—,—,—,—,—,—,—,preposition,Mark 5:26,καὶ πολλὰ παθοῦσα ὑπὸ πολλῶν ἰατρῶν καὶ δαπανήσασα τὰ,"αὐτῆς πάντα καὶ μηδὲν ὠφεληθεῖσα ἀλλὰ μᾶλλον εἰς τὸ χεῖρον ἐλθοῦσα,"
παρʼ,παρά,—,—,—,—,—,—,—,preposition,Mark 8:11,"Καὶ ἐξῆλθον οἱ Φαρισαῖοι καὶ ἤρξαντο συζητεῖν αὐτῷ, ζητοῦντες","αὐτοῦ σημεῖον ἀπὸ τοῦ οὐρανοῦ, πειράζοντες αὐτόν."
παρʼ,παρά,—,—,—,—,—,—,—,preposition,Mark 16:9,"Ἀναστὰς δὲ πρωῒ πρώτῃ σαββάτου ἐφάνη πρῶτον Μαρίᾳ τῇ Μαγδαληνῇ,",ἧς ἐκβεβλήκει ἑπτὰ δαιμόνια.
παρʼ,παρά,—,—,—,—,—,—,—,preposition,Luke 6:19,"καὶ πᾶς ὁ ὄχλος ἐζήτουν ἅπτεσθαι αὐτοῦ, ὅτι δύναμις",αὐτοῦ ἐξήρχετο καὶ ἰᾶτο πάντας.
παρʼ,παρά,—,—,—,—,—,—,—,preposition,Luke 6:34,καὶ ἐὰν δανίσητε,"ὧν ἐλπίζετε λαβεῖν, ποία ὑμῖν χάρις [ἐστίν]; καὶ  ἁμαρτωλοὶ ἁμαρτωλοῖς δανίζουσιν ἵνα ἀπολάβωσιν τὰ ἴσα."
παρʼ,παρά,—,—,—,—,—,—,—,preposition,Luke 9:47,ὁ δὲ Ἰησοῦς εἰδὼς τὸν διαλογισμὸν τῆς καρδίας αὐτῶν ἐπιλαβόμενος παιδίον ἔστησεν αὐτὸ,ἑαυτῷ
παρʼ,παρά,—,—,—,—,—,—,—,preposition,Luke 10:7,ἐν αὐτῇ δὲ τῇ οἰκίᾳ μένετε ἐσθίοντες καὶ πίνοντες τὰ,αὐτῶν· ἄξιος γὰρ ὁ ἐργάτης τοῦ μισθοῦ αὐτοῦ. μὴ μεταβαίνετε ἐξ οἰκίας εἰς οἰκίαν.
παρʼ,παρά,—,—,—,—,—,—,—,preposition,Luke 11:16,ἕτεροι δὲ πειράζοντες σημεῖον ἐξ οὐρανοῦ ἐζήτουν,αὐτοῦ.
παρʼ,παρά,—,—,—,—,—,—,—,preposition,Luke 11:37,Ἐν δὲ τῷ λαλῆσαι ἐρωτᾷ αὐτὸν Φαρισαῖος  ὅπως ἀριστήσῃ,αὐτῷ· εἰσελθὼν δὲ ἀνέπεσεν.
παρʼ,παρά,—,—,—,—,—,—,—,preposition,Luke 12:48,"ὁ δὲ μὴ γνούς, ποιήσας δὲ ἄξια πληγῶν δαρήσεται ὀλίγας. παντὶ δὲ ᾧ ἐδόθη πολύ, πολὺ ζητηθήσεται","αὐτοῦ, καὶ ᾧ παρέθεντο πολύ, περισσότερον αἰτήσουσιν αὐτόν."
παρʼ,παρά,—,—,—,—,—,—,—,preposition,Luke 18:14,"λέγω ὑμῖν, κατέβη οὗτος δεδικαιωμένος εἰς τὸν οἶκον αὐτοῦ","ἐκεῖνον· ὅτι πᾶς ὁ ὑψῶν ἑαυτὸν ταπεινωθήσεται, ὁ δὲ ταπεινῶν ἑαυτὸν ὑψωθήσεται."
παρʼ,παρά,—,—,—,—,—,—,—,preposition,John 1:39,λέγει αὐτοῖς· ἔρχεσθε καὶ ὄψεσθε. ἦλθαν οὖν καὶ εἶδαν ποῦ μένει καὶ,αὐτῷ ἔμειναν τὴν ἡμέραν ἐκείνην· ὥρα ἦν ὡς δεκάτη.
παρʼ,παρά,—,—,—,—,—,—,—,preposition,John 4:9,λέγει οὖν αὐτῷ ἡ γυνὴ ἡ Σαμαρῖτις· πῶς σὺ Ἰουδαῖος ὢν,ἐμοῦ πεῖν αἰτεῖς γυναικὸς Σαμαρίτιδος οὔσης; οὐ γὰρ συγχρῶνται Ἰουδαῖοι Σαμαρίταις.
παρʼ,παρά,—,—,—,—,—,—,—,preposition,John 4:40,"ὡς οὖν ἦλθον πρὸς αὐτὸν οἱ Σαμαρῖται, ἠρώτων αὐτὸν μεῖναι",αὐτοῖς· καὶ ἔμεινεν ἐκεῖ δύο ἡμέρας.
παρʼ,παρά,—,—,—,—,—,—,—,preposition,John 4:52,ἐπύθετο οὖν τὴν ὥραν,αὐτῶν ἐν ᾗ κομψότερον ἔσχεν· εἶπαν οὖν αὐτῷ ὅτι ἐχθὲς ὥραν ἑβδόμην ἀφῆκεν αὐτὸν ὁ πυρετός.
παρʼ,παρά,—,—,—,—,—,—,—,preposition,John 7:29,"ἐγὼ  οἶδα αὐτόν, ὅτι",αὐτοῦ εἰμι κἀκεῖνός με ἀπέστειλεν.
παρʼ,παρά,—,—,—,—,—,—,—,preposition,John 7:51,μὴ ὁ νόμος ἡμῶν κρίνει τὸν ἄνθρωπον ἐὰν μὴ ἀκούσῃ πρῶτον,αὐτοῦ καὶ γνῷ τί ποιεῖ;
παρʼ,παρά,—,—,—,—,—,—,—,preposition,John 8:26,"πολλὰ ἔχω περὶ ὑμῶν λαλεῖν καὶ κρίνειν, ἀλλʼ ὁ πέμψας με ἀληθής ἐστιν, κἀγὼ ἃ ἤκουσα",αὐτοῦ ταῦτα λαλῶ εἰς τὸν κόσμον.
παρʼ,παρά,—,—,—,—,—,—,—,preposition,John 14:17,"δύναται λαβεῖν, ὅτι οὐ θεωρεῖ αὐτὸ οὐδὲ γινώσκει· ὑμεῖς  γινώσκετε αὐτό, ὅτι",ὑμῖν μένει καὶ ἐν ὑμῖν ἔσται.
παρʼ,παρά,—,—,—,—,—,—,—,preposition,John 14:23,καὶ ὁ πατήρ μου ἀγαπήσει αὐτὸν καὶ πρὸς αὐτὸν ἐλευσόμεθα καὶ μονὴν,αὐτῷ ποιησόμεθα.
παρʼ,παρά,—,—,—,—,—,—,—,preposition,John 14:25,Ταῦτα λελάληκα ὑμῖν,ὑμῖν μένων·
παρʼ,παρά,—,—,—,—,—,—,—,preposition,Acts 3:5,ὁ δὲ ἐπεῖχεν αὐτοῖς προσδοκῶν τι,αὐτῶν λαβεῖν.
παρʼ,παρά,—,—,—,—,—,—,—,preposition,Acts 9:2,ᾐτήσατο,"αὐτοῦ ἐπιστολὰς εἰς Δαμασκὸν πρὸς τὰς συναγωγάς, ὅπως ἐάν τινας εὕρῃ τῆς ὁδοῦ"
παρʼ,παρά,—,—,—,—,—,—,—,preposition,Acts 18:3,καὶ διὰ τὸ ὁμότεχνον εἶναι ἔμενεν,"αὐτοῖς, καὶ ἠργάζετο· ἦσαν γὰρ σκηνοποιοὶ τῇ τέχνῃ."
παρʼ,παρά,—,—,—,—,—,—,—,preposition,Acts 21:7,Ἡμεῖς δὲ τὸν πλοῦν διανύσαντες ἀπὸ Τύρου κατηντήσαμεν εἰς Πτολεμαΐδα καὶ ἀσπασάμενοι τοὺς ἀδελφοὺς ἐμείναμεν ἡμέραν μίαν,αὐτοῖς.
παρʼ,παρά,—,—,—,—,—,—,—,preposition,Acts 21:8,"εἰσελθόντες εἰς τὸν οἶκον Φιλίππου τοῦ εὐαγγελιστοῦ, ὄντος ἐκ τῶν ἑπτά, ἐμείναμεν",αὐτῷ.
παρʼ,παρά,—,—,—,—,—,—,—,preposition,Acts 21:16,"συνῆλθον δὲ καὶ τῶν μαθητῶν ἀπὸ Καισαρείας σὺν ἡμῖν, ἄγοντες","ᾧ ξενισθῶμεν  Μνάσωνί τινι Κυπρίῳ, ἀρχαίῳ μαθητῇ."
παρʼ,παρά,—,—,—,—,—,—,—,preposition,Acts 22:5,"ὡς καὶ ὁ ἀρχιερεὺς  μαρτυρεῖ μοι καὶ πᾶν τὸ πρεσβυτέριον,","ὧν καὶ ἐπιστολὰς δεξάμενος πρὸς τοὺς ἀδελφοὺς εἰς Δαμασκὸν ἐπορευόμην, ἄξων καὶ τοὺς"
παρʼ,παρά,—,—,—,—,—,—,—,preposition,Acts 24:8,—,οὗ δυνήσῃ αὐτὸς ἀνακρίνας περὶ πάντων τούτων ἐπιγνῶναι ὧν ἡμεῖς κατηγοροῦμεν αὐτοῦ.
παρʼ,παρά,—,—,—,—,—,—,—,preposition,Acts 26:8,τί ἄπιστον κρίνεται,ὑμῖν εἰ ὁ θεὸς νεκροὺς ἐγείρει;
παρʼ,παρά,—,—,—,—,—,—,—,preposition,Acts 28:14,οὗ εὑρόντες ἀδελφοὺς παρεκλήθημεν,αὐτοῖς ἐπιμεῖναι ἡμέρας ἑπτά· καὶ οὕτως εἰς τὴν Ῥώμην ἤλθαμεν.
παρʼ,παρά,—,—,—,—,—,—,—,preposition,Romans 4:18,Ὃς,ἐλπίδα ἐπʼ ἐλπίδι ἐπίστευσεν εἰς τὸ γενέσθαι αὐτὸν πατέρα πολλῶν ἐθνῶν κατὰ τὸ
παρʼ,παρά,—,—,—,—,—,—,—,preposition,Romans 11:25,"Οὐ γὰρ θέλω ὑμᾶς ἀγνοεῖν, ἀδελφοί, τὸ μυστήριον τοῦτο, ἵνα μὴ ἦτε [","] ἑαυτοῖς φρόνιμοι, ὅτι πώρωσις ἀπὸ μέρους τῷ Ἰσραὴλ γέγονεν ἄχρι οὗ τὸ πλήρωμα τῶν ἐθνῶν εἰσέλθῃ"
παρʼ,παρά,—,—,—,—,—,—,—,preposition,Romans 11:27,καὶ αὕτη αὐτοῖς ἡ,"ἐμοῦ διαθήκη,           ὅταν ἀφέλωμαι τὰς ἁμαρτίας αὐτῶν."
παρʼ,παρά,—,—,—,—,—,—,—,preposition,Romans 12:3,Λέγω γὰρ διὰ τῆς χάριτος  τῆς δοθείσης μοι παντὶ τῷ ὄντι ἐν ὑμῖν μὴ ὑπερφρονεῖν,"ὃ δεῖ φρονεῖν ἀλλὰ φρονεῖν εἰς τὸ σωφρονεῖν, ἑκάστῳ ὡς ὁ θεὸς ἐμέρισεν μέτρον πίστεως."
παρʼ,παρά,—,—,—,—,—,—,—,preposition,Romans 12:16,"τὸ αὐτὸ εἰς ἀλλήλους φρονοῦντες, μὴ τὰ ὑψηλὰ φρονοῦντες ἀλλὰ τοῖς ταπεινοῖς συναπαγόμενοι. μὴ γίνεσθε φρόνιμοι",ἑαυτοῖς.
παρʼ,παρά,—,—,—,—,—,—,—,preposition,Romans 14:5,Ὃς μὲν [γὰρ] κρίνει ἡμέραν,"ἡμέραν, ὃς δὲ κρίνει πᾶσαν ἡμέραν· ἕκαστος ἐν τῷ ἰδίῳ νοῒ πληροφορείσθω."
παρʼ,παρά,—,—,—,—,—,—,—,preposition,1 Corinthians 16:2,κατὰ μίαν σαββάτου ἕκαστος ὑμῶν,"ἑαυτῷ τιθέτω θησαυρίζων ὅ τι ἐὰν εὐοδῶται, ἵνα μὴ ὅταν ἔλθω τότε λογεῖαι γίνωνται."
παρʼ,παρά,—,—,—,—,—,—,—,preposition,2 Corinthians 1:17,"τοῦτο οὖν βουλόμενος μήτι ἄρα τῇ ἐλαφρίᾳ ἐχρησάμην; ἢ ἃ βουλεύομαι κατὰ σάρκα βουλεύομαι, ἵνα ᾖ",ἐμοὶ τὸ ναὶ ναὶ καὶ τὸ οὒ οὔ;
παρʼ,παρά,—,—,—,—,—,—,—,preposition,Galatians 1:8,ἀλλὰ καὶ ἐὰν ἡμεῖς ἢ ἄγγελος ἐξ οὐρανοῦ εὐαγγελίζηται [ὑμῖν],"ὃ εὐηγγελισάμεθα ὑμῖν, ἀνάθεμα ἔστω."
παρʼ,παρά,—,—,—,—,—,—,—,preposition,Galatians 1:9,ὡς προειρήκαμεν καὶ ἄρτι πάλιν λέγω· εἴ τις ὑμᾶς εὐαγγελίζεται,"ὃ παρελάβετε, ἀνάθεμα ἔστω."
παρʼ,παρά,—,—,—,—,—,—,—,preposition,Ephesians 6:9,αὐτῶν καὶ ὑμῶν ὁ κύριός ἐστιν ἐν οὐρανοῖς καὶ προσωπολημψία οὐκ ἔστιν,αὐτῷ.
παρʼ,παρά,—,—,—,—,—,—,—,preposition,Philippians 4:18,ἀπέχω δὲ πάντα καὶ περισσεύω· πεπλήρωμαι  δεξάμενος παρὰ Ἐπαφροδίτου τὰ,"ὑμῶν, ὀσμὴν εὐωδίας, θυσίαν δεκτήν, εὐάρεστον τῷ θεῷ."
παρʼ,παρά,—,—,—,—,—,—,—,preposition,Colossians 4:16,καὶ ὅταν ἀναγνωσθῇ,"ὑμῖν ἡ ἐπιστολή, ποιήσατε ἵνα καὶ ἐν τῇ Λαοδικέων ἐκκλησίᾳ ἀναγνωσθῇ, καὶ τὴν"
παρʼ,παρά,—,—,—,—,—,—,—,preposition,1 Thessalonians 2:13,"Καὶ διὰ τοῦτο καὶ ἡμεῖς εὐχαριστοῦμεν τῷ θεῷ ἀδιαλείπτως, ὅτι παραλαβόντες λόγον ἀκοῆς",ἡμῶν τοῦ θεοῦ ἐδέξασθε οὐ λόγον ἀνθρώπων ἀλλὰ καθώς ἐστιν ἀληθῶς λόγον θεοῦ
παρʼ,παρά,—,—,—,—,—,—,—,preposition,1 Thessalonians 4:1,"Λοιπὸν οὖν, ἀδελφοί, ἐρωτῶμεν ὑμᾶς καὶ παρακαλοῦμεν ἐν κυρίῳ Ἰησοῦ, ἵνα καθὼς παρελάβετε","ἡμῶν τὸ πῶς δεῖ ὑμᾶς περιπατεῖν καὶ ἀρέσκειν θεῷ, καθὼς καὶ περιπατεῖτε, ἵνα περισσεύητε μᾶλλον."
παρʼ,παρά,—,—,—,—,—,—,—,preposition,2 Thessalonians 3:6,ἀπὸ παντὸς ἀδελφοῦ ἀτάκτως περιπατοῦντος καὶ μὴ κατὰ τὴν παράδοσιν ἣν παρελάβοσαν,ἡμῶν.
παρʼ,παρά,—,—,—,—,—,—,—,preposition,2 Timothy 1:13,Ὑποτύπωσιν ἔχε ὑγιαινόντων λόγων ὧν,ἐμοῦ ἤκουσας ἐν πίστει καὶ ἀγάπῃ τῇ ἐν Χριστῷ Ἰησοῦ·
παρʼ,παρά,—,—,—,—,—,—,—,preposition,2 Timothy 2:2,καὶ ἃ ἤκουσας,"ἐμοῦ διὰ πολλῶν μαρτύρων, ταῦτα παράθου πιστοῖς ἀνθρώποις, οἵτινες ἱκανοὶ ἔσονται καὶ ἑτέρους διδάξαι."
παρʼ,παρά,—,—,—,—,—,—,—,preposition,Hebrews 1:4,τοσούτῳ κρείττων γενόμενος τῶν ἀγγέλων      ὅσῳ διαφορώτερον,αὐτοὺς κεκληρονόμηκεν ὄνομα.
παρʼ,παρά,—,—,—,—,—,—,—,preposition,Hebrews 2:7,ἠλάττωσας αὐτὸν βραχύ τι,"ἀγγέλους,        δόξῃ καὶ τιμῇ ἐστεφάνωσας αὐτόν,"
παρʼ,παρά,—,—,—,—,—,—,—,preposition,Hebrews 2:9,τὸν δὲ βραχύ τι,ἀγγέλους ἠλαττωμένον βλέπομεν Ἰησοῦν διὰ τὸ πάθημα τοῦ θανάτου δόξῃ καὶ τιμῇ ἐστεφανωμένον
παρʼ,παρά,—,—,—,—,—,—,—,preposition,James 1:17,"πᾶσα δόσις ἀγαθὴ καὶ πᾶν δώρημα τέλειον ἄνωθέν ἐστιν καταβαῖνον ἀπὸ τοῦ πατρὸς τῶν φώτων,",ᾧ οὐκ ἔνι παραλλαγὴ ἢ τροπῆς ἀποσκίασμα.
παρʼ,παρά,—,—,—,—,—,—,—,preposition,Revelation 2:13,"ἐν ταῖς ἡμέραις  Ἀντιπᾶς ὁ μάρτυς μου ὁ πιστός μου, ὃς ἀπεκτάνθη","ὑμῖν, ὅπου ὁ σατανᾶς κατοικεῖ."
παρʼ,παρά,—,—,—,—,—,—,—,preposition,Revelation 3:18,συμβουλεύω σοι ἀγοράσαι,"ἐμοῦ χρυσίον πεπυρωμένον ἐκ πυρὸς ἵνα πλουτήσῃς, καὶ ἱμάτια λευκὰ ἵνα περιβάλῃ καὶ"
παρά,παρά,—,—,—,—,—,—,—,preposition,Acts 9:43,Ἐγένετο δὲ  ἡμέρας ἱκανὰς μεῖναι ἐν Ἰόππῃ,τινι Σίμωνι βυρσεῖ.
παρά,παρά,—,—,—,—,—,—,—,preposition,Acts 10:6,οὗτος ξενίζεται,"τινι Σίμωνι βυρσεῖ, ᾧ ἐστιν οἰκία παρὰ θάλασσαν."
παρά,παρά,—,—,—,—,—,—,—,preposition,2 Thessalonians 3:8,οὐδὲ δωρεὰν ἄρτον ἐφάγομεν,"τινος, ἀλλʼ ἐν κόπῳ καὶ μόχθῳ νυκτὸς καὶ ἡμέρας ἐργαζόμενοι πρὸς τὸ μὴ ἐπιβαρῆσαί τινα ὑμῶν·"
παρὰ,παρά,—,—,—,—,—,—,—,preposition,Matthew 2:16,"τοῖς ὁρίοις αὐτῆς ἀπὸ διετοῦς καὶ κατωτέρω, κατὰ τὸν χρόνον ὃν ἠκρίβωσεν",τῶν μάγων.
παρὰ,παρά,—,—,—,—,—,—,—,preposition,Matthew 4:18,Περιπατῶν δὲ,"τὴν θάλασσαν τῆς Γαλιλαίας εἶδεν δύο ἀδελφούς, Σίμωνα τὸν λεγόμενον Πέτρον καὶ Ἀνδρέαν"
παρὰ,παρά,—,—,—,—,—,—,—,preposition,Matthew 6:1,"ἀνθρώπων πρὸς τὸ θεαθῆναι αὐτοῖς· εἰ δὲ μή γε, μισθὸν οὐκ ἔχετε",τῷ πατρὶ ὑμῶν τῷ ἐν τοῖς οὐρανοῖς.
παρὰ,παρά,—,—,—,—,—,—,—,preposition,Matthew 13:1,Ἐν  τῇ ἡμέρᾳ ἐκείνῃ ἐξελθὼν ὁ Ἰησοῦς τῆς οἰκίας ἐκάθητο,τὴν θάλασσαν·
παρὰ,παρά,—,—,—,—,—,—,—,preposition,Matthew 13:4,καὶ ἐν τῷ σπείρειν αὐτὸν ἃ μὲν ἔπεσεν,"τὴν ὁδόν, καὶ ἐλθόντα τὰ πετεινὰ   κατέφαγεν αὐτά."
παρὰ,παρά,—,—,—,—,—,—,—,preposition,Matthew 13:19,"πονηρὸς καὶ ἁρπάζει τὸ ἐσπαρμένον ἐν τῇ καρδίᾳ αὐτοῦ, οὗτός ἐστιν ὁ",τὴν ὁδὸν σπαρείς.
παρὰ,παρά,—,—,—,—,—,—,—,preposition,Matthew 15:29,Καὶ μεταβὰς ἐκεῖθεν ὁ Ἰησοῦς ἦλθεν,"τὴν θάλασσαν τῆς Γαλιλαίας, καὶ ἀναβὰς εἰς τὸ ὄρος ἐκάθητο ἐκεῖ."
παρὰ,παρά,—,—,—,—,—,—,—,preposition,Matthew 15:30,"καὶ προσῆλθον αὐτῷ ὄχλοι πολλοὶ ἔχοντες μεθʼ ἑαυτῶν χωλούς, τυφλούς, κυλλούς, κωφούς, καὶ ἑτέρους πολλοὺς καὶ ἔρριψαν αὐτοὺς","τοὺς πόδας αὐτοῦ, καὶ ἐθεράπευσεν αὐτούς ·"
παρὰ,παρά,—,—,—,—,—,—,—,preposition,Matthew 18:19,"ὑμῶν ἐπὶ τῆς γῆς περὶ παντὸς πράγματος οὗ ἐὰν αἰτήσωνται, γενήσεται αὐτοῖς",τοῦ πατρός μου τοῦ ἐν οὐρανοῖς.
παρὰ,παρά,—,—,—,—,—,—,—,preposition,Matthew 19:26,ἐμβλέψας δὲ ὁ Ἰησοῦς εἶπεν αὐτοῖς·,"ἀνθρώποις τοῦτο ἀδύνατόν ἐστιν, παρὰ δὲ θεῷ πάντα δυνατά."
παρὰ,παρά,—,—,—,—,—,—,—,preposition,Matthew 19:26,"ἐμβλέψας δὲ ὁ Ἰησοῦς εἶπεν αὐτοῖς· παρὰ ἀνθρώποις τοῦτο ἀδύνατόν ἐστιν,",δὲ θεῷ πάντα δυνατά.
παρὰ,παρά,—,—,—,—,—,—,—,preposition,Matthew 20:30,καὶ ἰδοὺ δύο τυφλοὶ καθήμενοι,"τὴν ὁδὸν ἀκούσαντες ὅτι Ἰησοῦς παράγει, ἔκραξαν λέγοντες· ἐλέησον ἡμᾶς, [κύριε] υἱὸς Δαυίδ."
παρὰ,παρά,—,—,—,—,—,—,—,preposition,Matthew 21:42,"ταῖς γραφαῖς·        λίθον ὃν ἀπεδοκίμασαν οἱ οἰκοδομοῦντες,           οὗτος ἐγενήθη εἰς κεφαλὴν γωνίας",κυρίου ἐγένετο αὕτη           καὶ ἔστιν θαυμαστὴ ἐν ὀφθαλμοῖς ἡμῶν;
παρὰ,παρά,—,—,—,—,—,—,—,preposition,Matthew 28:15,οἱ δὲ λαβόντες τὰ ἀργύρια ἐποίησαν ὡς ἐδιδάχθησαν. καὶ διεφημίσθη ὁ λόγος οὗτος,Ἰουδαίοις μέχρι τῆς σήμερον [ἡμέρας].
παρὰ,παρά,—,—,—,—,—,—,—,preposition,Mark 1:16,Καὶ παράγων,τὴν θάλασσαν τῆς Γαλιλαίας εἶδεν Σίμωνα καὶ Ἀνδρέαν τὸν ἀδελφὸν Σίμωνος ἀμφιβάλλοντας ἐν
παρὰ,παρά,—,—,—,—,—,—,—,preposition,Mark 2:13,Καὶ ἐξῆλθεν πάλιν,"τὴν θάλασσαν· καὶ πᾶς ὁ ὄχλος ἤρχετο πρὸς αὐτόν, καὶ ἐδίδασκεν αὐτούς."
παρὰ,παρά,—,—,—,—,—,—,—,preposition,Mark 4:1,Καὶ πάλιν ἤρξατο διδάσκειν,"τὴν θάλασσαν· καὶ συνάγεται πρὸς αὐτὸν ὄχλος πλεῖστος, ὥστε αὐτὸν εἰς πλοῖον ἐμβάντα"
παρὰ,παρά,—,—,—,—,—,—,—,preposition,Mark 4:4,καὶ ἐγένετο ἐν τῷ σπείρειν ὃ μὲν ἔπεσεν,"τὴν ὁδόν, καὶ ἦλθεν τὰ πετεινὰ καὶ κατέφαγεν αὐτό."
παρὰ,παρά,—,—,—,—,—,—,—,preposition,Mark 4:15,οὗτοι δέ εἰσιν οἱ,"τὴν ὁδόν· ὅπου σπείρεται ὁ λόγος καὶ ὅταν ἀκούσωσιν, εὐθὺς ἔρχεται ὁ σατανᾶς"
παρὰ,παρά,—,—,—,—,—,—,—,preposition,Mark 5:21,"Καὶ διαπεράσαντος τοῦ Ἰησοῦ [ἐν τῷ πλοίῳ] πάλιν εἰς τὸ πέραν συνήχθη ὄχλος πολὺς ἐπʼ αὐτόν, καὶ ἦν",τὴν θάλασσαν.
παρὰ,παρά,—,—,—,—,—,—,—,preposition,Mark 10:27,ἐμβλέψας αὐτοῖς ὁ Ἰησοῦς λέγει·,"ἀνθρώποις ἀδύνατον, ἀλλʼ οὐ παρὰ θεῷ· πάντα γὰρ δυνατὰ παρὰ τῷ θεῷ."
παρὰ,παρά,—,—,—,—,—,—,—,preposition,Mark 10:27,"ἐμβλέψας αὐτοῖς ὁ Ἰησοῦς λέγει· παρὰ ἀνθρώποις ἀδύνατον, ἀλλʼ οὐ",θεῷ· πάντα γὰρ δυνατὰ παρὰ τῷ θεῷ.
παρὰ,παρά,—,—,—,—,—,—,—,preposition,Mark 10:27,"ἐμβλέψας αὐτοῖς ὁ Ἰησοῦς λέγει· παρὰ ἀνθρώποις ἀδύνατον, ἀλλʼ οὐ παρὰ θεῷ· πάντα γὰρ δυνατὰ",τῷ θεῷ.
παρὰ,παρά,—,—,—,—,—,—,—,preposition,Mark 10:46,"μαθητῶν αὐτοῦ καὶ ὄχλου ἱκανοῦ ὁ υἱὸς Τιμαίου Βαρτιμαῖος,  τυφλὸς προσαίτης, ἐκάθητο",τὴν ὁδόν.
παρὰ,παρά,—,—,—,—,—,—,—,preposition,Mark 12:2,καὶ ἀπέστειλεν πρὸς τοὺς γεωργοὺς τῷ καιρῷ δοῦλον ἵνα,τῶν γεωργῶν λάβῃ ἀπὸ τῶν καρπῶν τοῦ ἀμπελῶνος·
παρὰ,παρά,—,—,—,—,—,—,—,preposition,Mark 12:11,—,κυρίου ἐγένετο αὕτη        καὶ ἔστιν θαυμαστὴ ἐν ὀφθαλμοῖς ἡμῶν;
παρὰ,παρά,—,—,—,—,—,—,—,preposition,Mark 14:43,Καὶ εὐθὺς ἔτι αὐτοῦ λαλοῦντος παραγίνεται  Ἰούδας  εἷς τῶν δώδεκα καὶ μετʼ αὐτοῦ ὄχλος μετὰ μαχαιρῶν καὶ ξύλων,τῶν ἀρχιερέων καὶ τῶν γραμματέων καὶ τῶν πρεσβυτέρων.
παρὰ,παρά,—,—,—,—,—,—,—,preposition,Luke 1:30,"Καὶ εἶπεν ὁ ἄγγελος αὐτῇ·     μὴ φοβοῦ, Μαριάμ, εὗρες γὰρ χάριν",τῷ θεῷ.
παρὰ,παρά,—,—,—,—,—,—,—,preposition,Luke 1:37,ὅτι οὐκ ἀδυνατήσει,τοῦ θεοῦ πᾶν ῥῆμα.
παρὰ,παρά,—,—,—,—,—,—,—,preposition,Luke 1:45,καὶ μακαρία ἡ πιστεύσασα ὅτι ἔσται τελείωσις τοῖς λελαλημένοις αὐτῇ,κυρίου.
παρὰ,παρά,—,—,—,—,—,—,—,preposition,Luke 2:1,Ἐγένετο δὲ ἐν ταῖς ἡμέραις ἐκείναις ἐξῆλθεν δόγμα,Καίσαρος Αὐγούστου ἀπογράφεσθαι πᾶσαν τὴν οἰκουμένην.
