Result,Lemma (Greek),Tense (Logos Greek),Voice (Logos Greek),Mood (Logos Greek),Person (Logos Greek),Gender (Logos Greek),Case (Logos Greek),Number (Logos Greek),Part of Speech,Reference,Previous Context,Next Context
εἰς,εἰς,—,—,—,—,—,—,—,preposition,2 Corinthians 10:1,"τοῦ Χριστοῦ, ὃς κατὰ πρόσωπον μὲν ταπεινὸς ἐν ὑμῖν, ἀπὼν δὲ θαρρῶ",ὑμᾶς·
εἰς,εἰς,—,—,—,—,—,—,—,preposition,2 Corinthians 10:5,"καὶ πᾶν ὕψωμα ἐπαιρόμενον κατὰ τῆς γνώσεως τοῦ θεοῦ, καὶ αἰχμαλωτίζοντες πᾶν νόημα","τὴν ὑπακοὴν τοῦ Χριστοῦ,"
εἰς,εἰς,—,—,—,—,—,—,—,preposition,2 Corinthians 10:8,ἐάν [τε] γὰρ περισσότερόν τι καυχήσωμαι περὶ τῆς ἐξουσίας ἡμῶν ἧς ἔδωκεν ὁ κύριος,"οἰκοδομὴν καὶ οὐκ εἰς καθαίρεσιν ὑμῶν, οὐκ αἰσχυνθήσομαι."
εἰς,εἰς,—,—,—,—,—,—,—,preposition,2 Corinthians 10:8,ἐάν [τε] γὰρ περισσότερόν τι καυχήσωμαι περὶ τῆς ἐξουσίας ἡμῶν ἧς ἔδωκεν ὁ κύριος εἰς οἰκοδομὴν καὶ οὐκ,"καθαίρεσιν ὑμῶν, οὐκ αἰσχυνθήσομαι."
εἰς,εἰς,—,—,—,—,—,—,—,preposition,2 Corinthians 10:13,ἡμεῖς δὲ οὐκ,τὰ ἄμετρα καυχησόμεθα ἀλλὰ κατὰ τὸ μέτρον τοῦ κανόνος οὗ ἐμέρισεν ἡμῖν ὁ
εἰς,εἰς,—,—,—,—,—,—,—,preposition,2 Corinthians 10:14,οὐ γὰρ ὡς μὴ ἐφικνούμενοι,"ὑμᾶς ὑπερεκτείνομεν ἑαυτούς, ἄχρι γὰρ καὶ ὑμῶν ἐφθάσαμεν ἐν τῷ εὐαγγελίῳ τοῦ Χριστοῦ,"
εἰς,εἰς,—,—,—,—,—,—,—,preposition,2 Corinthians 10:15,οὐκ,"τὰ ἄμετρα καυχώμενοι ἐν ἀλλοτρίοις κόποις, ἐλπίδα δὲ ἔχοντες αὐξανομένης τῆς πίστεως ὑμῶν"
εἰς,εἰς,—,—,—,—,—,—,—,preposition,2 Corinthians 10:15,ἔχοντες αὐξανομένης τῆς πίστεως ὑμῶν ἐν ὑμῖν μεγαλυνθῆναι κατὰ τὸν κανόνα ἡμῶν,περισσείαν
εἰς,εἰς,—,—,—,—,—,—,—,preposition,2 Corinthians 10:16,—,"τὰ ὑπερέκεινα ὑμῶν εὐαγγελίσασθαι, οὐκ ἐν ἀλλοτρίῳ κανόνι εἰς τὰ ἕτοιμα καυχήσασθαι."
εἰς,εἰς,—,—,—,—,—,—,—,preposition,2 Corinthians 10:16,"εἰς τὰ ὑπερέκεινα ὑμῶν εὐαγγελίσασθαι, οὐκ ἐν ἀλλοτρίῳ κανόνι",τὰ ἕτοιμα καυχήσασθαι.
εἰς,εἰς,—,—,—,—,—,—,—,preposition,2 Corinthians 11:3,"αὐτοῦ,  φθαρῇ τὰ νοήματα ὑμῶν ἀπὸ τῆς ἁπλότητος [καὶ τῆς ἁγνότητος] τῆς",τὸν Χριστόν.
εἰς,εἰς,—,—,—,—,—,—,—,preposition,2 Corinthians 11:6,"εἰ δὲ καὶ ἰδιώτης τῷ λόγῳ, ἀλλʼ οὐ τῇ γνώσει, ἀλλʼ ἐν παντὶ φανερώσαντες ἐν πᾶσιν",ὑμᾶς.
εἰς,εἰς,—,—,—,—,—,—,—,preposition,2 Corinthians 11:10,ἔστιν ἀλήθεια Χριστοῦ ἐν ἐμοὶ ὅτι ἡ καύχησις αὕτη οὐ φραγήσεται,ἐμὲ ἐν τοῖς κλίμασιν τῆς Ἀχαΐας.
εἰς,εἰς,—,—,—,—,—,—,—,preposition,2 Corinthians 11:13,"οἱ γὰρ τοιοῦτοι ψευδαπόστολοι, ἐργάται δόλιοι, μετασχηματιζόμενοι",ἀποστόλους Χριστοῦ.
εἰς,εἰς,—,—,—,—,—,—,—,preposition,2 Corinthians 11:14,καὶ οὐ θαῦμα· αὐτὸς γὰρ ὁ σατανᾶς μετασχηματίζεται,ἄγγελον φωτός.
εἰς,εἰς,—,—,—,—,—,—,—,preposition,2 Corinthians 11:20,"ἀνέχεσθε γὰρ εἴ τις ὑμᾶς καταδουλοῖ, εἴ τις κατεσθίει, εἴ τις λαμβάνει, εἴ τις ἐπαίρεται, εἴ τις",πρόσωπον ὑμᾶς δέρει.
εἰς,εἰς,—,—,—,—,—,—,—,preposition,2 Corinthians 11:31,"ὁ θεὸς  καὶ πατὴρ τοῦ κυρίου Ἰησοῦ οἶδεν, ὁ ὢν εὐλογητὸς","τοὺς αἰῶνας, ὅτι οὐ ψεύδομαι."
εἰς,εἰς,—,—,—,—,—,—,—,preposition,2 Corinthians 12:1,"Καυχᾶσθαι δεῖ, οὐ συμφέρον μέν, ἐλεύσομαι δὲ",ὀπτασίας καὶ ἀποκαλύψεις κυρίου.
εἰς,εἰς,—,—,—,—,—,—,—,preposition,2 Corinthians 12:4,ὅτι ἡρπάγη,τὸν παράδεισον καὶ ἤκουσεν ἄρρητα ῥήματα ἃ οὐκ ἐξὸν ἀνθρώπῳ λαλῆσαι.
εἰς,εἰς,—,—,—,—,—,—,—,preposition,2 Corinthians 12:6,"Ἐὰν γὰρ θελήσω καυχήσασθαι, οὐκ ἔσομαι ἄφρων, ἀλήθειαν γὰρ ἐρῶ· φείδομαι δέ, μή τις",ἐμὲ λογίσηται ὑπὲρ ὃ βλέπει με ἢ ἀκούει [τι] ἐξ ἐμοῦ
εἰς,εἰς,—,—,—,—,—,—,—,preposition,2 Corinthians 13:2,"καὶ ἀπὼν νῦν, τοῖς προημαρτηκόσιν καὶ τοῖς λοιποῖς πᾶσιν, ὅτι ἐὰν ἔλθω","τὸ πάλιν οὐ φείσομαι,"
εἰς,εἰς,—,—,—,—,—,—,—,preposition,2 Corinthians 13:3,"ἐπεὶ δοκιμὴν ζητεῖτε τοῦ ἐν ἐμοὶ λαλοῦντος Χριστοῦ, ὃς",ὑμᾶς οὐκ ἀσθενεῖ ἀλλὰ δυνατεῖ ἐν ὑμῖν.
εἰς,εἰς,—,—,—,—,—,—,—,preposition,2 Corinthians 13:4,"γὰρ ἡμεῖς ἀσθενοῦμεν ἐν αὐτῷ, ἀλλὰ ζήσομεν σὺν αὐτῷ ἐκ δυνάμεως θεοῦ",ὑμᾶς.
εἰς,εἰς,—,—,—,—,—,—,—,preposition,2 Corinthians 13:10,"Διὰ τοῦτο ταῦτα ἀπὼν γράφω, ἵνα παρὼν μὴ ἀποτόμως χρήσωμαι κατὰ τὴν ἐξουσίαν ἣν ὁ κύριος ἔδωκέν μοι",οἰκοδομὴν καὶ οὐκ εἰς καθαίρεσιν.
εἰς,εἰς,—,—,—,—,—,—,—,preposition,2 Corinthians 13:10,κατὰ τὴν ἐξουσίαν ἣν ὁ κύριος ἔδωκέν μοι εἰς οἰκοδομὴν καὶ οὐκ,καθαίρεσιν.
εἰς,εἰς,—,—,—,—,—,—,—,preposition,Galatians 1:5,ᾧ ἡ δόξα,"τοὺς αἰῶνας τῶν αἰώνων, ἀμήν."
εἰς,εἰς,—,—,—,—,—,—,—,preposition,Galatians 1:6,Θαυμάζω ὅτι οὕτως ταχέως μετατίθεσθε ἀπὸ τοῦ καλέσαντος ὑμᾶς ἐν χάριτι [Χριστοῦ],"ἕτερον εὐαγγέλιον,"
εἰς,εἰς,—,—,—,—,—,—,—,preposition,Galatians 1:17,οὐδὲ ἀνῆλθον,"Ἱεροσόλυμα πρὸς τοὺς πρὸ ἐμοῦ ἀποστόλους, ἀλλʼ ἀπῆλθον εἰς Ἀραβίαν καὶ πάλιν ὑπέστρεψα εἰς Δαμασκόν."
εἰς,εἰς,—,—,—,—,—,—,—,preposition,Galatians 1:17,"οὐδὲ ἀνῆλθον εἰς Ἱεροσόλυμα πρὸς τοὺς πρὸ ἐμοῦ ἀποστόλους, ἀλλʼ ἀπῆλθον",Ἀραβίαν καὶ πάλιν ὑπέστρεψα εἰς Δαμασκόν.
εἰς,εἰς,—,—,—,—,—,—,—,preposition,Galatians 1:17,"οὐδὲ ἀνῆλθον εἰς Ἱεροσόλυμα πρὸς τοὺς πρὸ ἐμοῦ ἀποστόλους, ἀλλʼ ἀπῆλθον εἰς Ἀραβίαν καὶ πάλιν ὑπέστρεψα",Δαμασκόν.
εἰς,εἰς,—,—,—,—,—,—,—,preposition,Galatians 1:18,Ἔπειτα μετὰ ἔτη τρία ἀνῆλθον,"Ἱεροσόλυμα ἱστορῆσαι Κηφᾶν καὶ ἐπέμεινα πρὸς αὐτὸν ἡμέρας δεκαπέντε,"
εἰς,εἰς,—,—,—,—,—,—,—,preposition,Galatians 1:21,Ἔπειτα ἦλθον,τὰ κλίματα τῆς Συρίας καὶ τῆς Κιλικίας·
εἰς,εἰς,—,—,—,—,—,—,—,preposition,Galatians 2:1,Ἔπειτα διὰ δεκατεσσάρων ἐτῶν πάλιν ἀνέβην,Ἱεροσόλυμα μετὰ Βαρναβᾶ συμπαραλαβὼν καὶ Τίτον·
εἰς,εἰς,—,—,—,—,—,—,—,preposition,Galatians 2:2,"ὃ κηρύσσω ἐν τοῖς ἔθνεσιν, κατʼ ἰδίαν δὲ τοῖς δοκοῦσιν, μή πως",κενὸν τρέχω ἢ ἔδραμον.
εἰς,εἰς,—,—,—,—,—,—,—,preposition,Galatians 2:8,ὁ γὰρ ἐνεργήσας Πέτρῳ,"ἀποστολὴν τῆς περιτομῆς ἐνήργησεν καὶ ἐμοὶ εἰς τὰ ἔθνη,"
εἰς,εἰς,—,—,—,—,—,—,—,preposition,Galatians 2:8,ὁ γὰρ ἐνεργήσας Πέτρῳ εἰς ἀποστολὴν τῆς περιτομῆς ἐνήργησεν καὶ ἐμοὶ,"τὰ ἔθνη,"
εἰς,εἰς,—,—,—,—,—,—,—,preposition,Galatians 2:9,"οἱ δοκοῦντες στῦλοι εἶναι, δεξιὰς ἔδωκαν ἐμοὶ καὶ Βαρναβᾷ κοινωνίας, ἵνα ἡμεῖς","τὰ ἔθνη, αὐτοὶ δὲ εἰς τὴν περιτομήν·"
εἰς,εἰς,—,—,—,—,—,—,—,preposition,Galatians 2:9,"ἔδωκαν ἐμοὶ καὶ Βαρναβᾷ κοινωνίας, ἵνα ἡμεῖς εἰς τὰ ἔθνη, αὐτοὶ δὲ",τὴν περιτομήν·
εἰς,εἰς,—,—,—,—,—,—,—,preposition,Galatians 2:11,Ὅτε δὲ ἦλθεν Κηφᾶς,"Ἀντιόχειαν, κατὰ πρόσωπον αὐτῷ ἀντέστην, ὅτι κατεγνωσμένος ἦν."
εἰς,εἰς,—,—,—,—,—,—,—,preposition,Galatians 2:16,"εἰδότες [δὲ] ὅτι οὐ δικαιοῦται ἄνθρωπος ἐξ ἔργων νόμου ἐὰν μὴ διὰ πίστεως Ἰησοῦ Χριστοῦ, καὶ ἡμεῖς","Χριστὸν Ἰησοῦν ἐπιστεύσαμεν, ἵνα δικαιωθῶμεν ἐκ πίστεως Χριστοῦ καὶ οὐκ ἐξ ἔργων νόμου"
εἰς,εἰς,—,—,—,—,—,—,—,preposition,Galatians 3:6,"Καθὼς Ἀβραὰμ ἐπίστευσεν τῷ θεῷ, καὶ ἐλογίσθη αὐτῷ",δικαιοσύνην·
εἰς,εἰς,—,—,—,—,—,—,—,preposition,Galatians 3:14,ἵνα,"τὰ ἔθνη ἡ εὐλογία τοῦ Ἀβραὰμ γένηται ἐν Χριστῷ Ἰησοῦ, ἵνα τὴν ἐπαγγελίαν"
εἰς,εἰς,—,—,—,—,—,—,—,preposition,Galatians 3:17,τοῦτο δὲ λέγω· διαθήκην προκεκυρωμένην ὑπὸ τοῦ θεοῦ  ὁ μετὰ τετρακόσια καὶ τριάκοντα ἔτη γεγονὼς νόμος οὐκ ἀκυροῖ,τὸ καταργῆσαι τὴν ἐπαγγελίαν.
εἰς,εἰς,—,—,—,—,—,—,—,preposition,Galatians 3:23,Πρὸ τοῦ δὲ ἐλθεῖν τὴν πίστιν ὑπὸ νόμον ἐφρουρούμεθα συγκλειόμενοι,"τὴν μέλλουσαν πίστιν ἀποκαλυφθῆναι,"
εἰς,εἰς,—,—,—,—,—,—,—,preposition,Galatians 3:24,ὥστε ὁ νόμος παιδαγωγὸς ἡμῶν γέγονεν,"Χριστόν, ἵνα ἐκ πίστεως δικαιωθῶμεν·"
εἰς,εἰς,—,—,—,—,—,—,—,preposition,Galatians 3:27,ὅσοι γὰρ,"Χριστὸν ἐβαπτίσθητε, Χριστὸν ἐνεδύσασθε."
εἰς,εἰς,—,—,—,—,—,—,—,preposition,Galatians 4:6,"Ὅτι δέ ἐστε υἱοί, ἐξαπέστειλεν ὁ θεὸς τὸ πνεῦμα τοῦ υἱοῦ αὐτοῦ",τὰς καρδίας ἡμῶν κρᾶζον· αββα ὁ πατήρ.
εἰς,εἰς,—,—,—,—,—,—,—,preposition,Galatians 4:11,φοβοῦμαι ὑμᾶς μή πως εἰκῇ κεκοπίακα,ὑμᾶς.
εἰς,εἰς,—,—,—,—,—,—,—,preposition,Galatians 4:24,"ἅτινά ἐστιν ἀλληγορούμενα· αὗται γάρ εἰσιν δύο διαθῆκαι, μία μὲν ἀπὸ ὄρους Σινᾶ","δουλείαν γεννῶσα, ἥτις ἐστὶν Ἁγάρ."
εἰς,εἰς,—,—,—,—,—,—,—,preposition,Galatians 5:10,ἐγὼ πέποιθα,"ὑμᾶς ἐν κυρίῳ ὅτι οὐδὲν ἄλλο φρονήσετε· ὁ δὲ ταράσσων ὑμᾶς βαστάσει τὸ κρίμα, ὅστις ἐὰν ᾖ."
εἰς,εἰς,—,—,—,—,—,—,—,preposition,Galatians 5:13,"Ὑμεῖς γὰρ ἐπʼ ἐλευθερίᾳ ἐκλήθητε, ἀδελφοί· μόνον μὴ τὴν ἐλευθερίαν","ἀφορμὴν τῇ σαρκί, ἀλλὰ διὰ τῆς ἀγάπης δουλεύετε ἀλλήλοις."
εἰς,εἰς,—,—,—,—,—,—,—,preposition,Galatians 6:4,"τὸ δὲ ἔργον ἑαυτοῦ δοκιμαζέτω ἕκαστος, καὶ τότε",ἑαυτὸν μόνον τὸ καύχημα ἕξει καὶ οὐκ εἰς τὸν ἕτερον·
εἰς,εἰς,—,—,—,—,—,—,—,preposition,Galatians 6:4,"τὸ δὲ ἔργον ἑαυτοῦ δοκιμαζέτω ἕκαστος, καὶ τότε εἰς ἑαυτὸν μόνον τὸ καύχημα ἕξει καὶ οὐκ",τὸν ἕτερον·
εἰς,εἰς,—,—,—,—,—,—,—,preposition,Galatians 6:8,ὅτι ὁ σπείρων,"τὴν σάρκα ἑαυτοῦ ἐκ τῆς σαρκὸς θερίσει φθοράν, ὁ δὲ σπείρων εἰς τὸ"
εἰς,εἰς,—,—,—,—,—,—,—,preposition,Galatians 6:8,"ὅτι ὁ σπείρων εἰς τὴν σάρκα ἑαυτοῦ ἐκ τῆς σαρκὸς θερίσει φθοράν, ὁ δὲ σπείρων",τὸ πνεῦμα ἐκ τοῦ πνεύματος θερίσει ζωὴν αἰώνιον.
εἰς,εἰς,—,—,—,—,—,—,—,preposition,Ephesians 1:5,προορίσας ἡμᾶς,"υἱοθεσίαν διὰ Ἰησοῦ Χριστοῦ εἰς αὐτόν, κατὰ τὴν εὐδοκίαν τοῦ θελήματος αὐτοῦ,"
εἰς,εἰς,—,—,—,—,—,—,—,preposition,Ephesians 1:5,προορίσας ἡμᾶς εἰς υἱοθεσίαν διὰ Ἰησοῦ Χριστοῦ,"αὐτόν, κατὰ τὴν εὐδοκίαν τοῦ θελήματος αὐτοῦ,"
εἰς,εἰς,—,—,—,—,—,—,—,preposition,Ephesians 1:6,—,ἔπαινον δόξης τῆς χάριτος αὐτοῦ ἧς ἐχαρίτωσεν ἡμᾶς ἐν τῷ ἠγαπημένῳ.
εἰς,εἰς,—,—,—,—,—,—,—,preposition,Ephesians 1:8,ἧς ἐπερίσσευσεν,"ἡμᾶς, ἐν πάσῃ σοφίᾳ καὶ φρονήσει,"
εἰς,εἰς,—,—,—,—,—,—,—,preposition,Ephesians 1:10,—,"οἰκονομίαν τοῦ πληρώματος τῶν καιρῶν, ἀνακεφαλαιώσασθαι τὰ πάντα ἐν τῷ Χριστῷ, τὰ ἐπὶ"
εἰς,εἰς,—,—,—,—,—,—,—,preposition,Ephesians 1:12,—,τὸ εἶναι ἡμᾶς εἰς ἔπαινον δόξης αὐτοῦ τοὺς προηλπικότας ἐν τῷ Χριστῷ.
εἰς,εἰς,—,—,—,—,—,—,—,preposition,Ephesians 1:12,εἰς τὸ εἶναι ἡμᾶς,ἔπαινον δόξης αὐτοῦ τοὺς προηλπικότας ἐν τῷ Χριστῷ.
εἰς,εἰς,—,—,—,—,—,—,—,preposition,Ephesians 1:14,"ὅ ἐστιν ἀρραβὼν τῆς κληρονομίας ἡμῶν,","ἀπολύτρωσιν τῆς περιποιήσεως, εἰς ἔπαινον τῆς δόξης αὐτοῦ."
εἰς,εἰς,—,—,—,—,—,—,—,preposition,Ephesians 1:14,"ὅ ἐστιν ἀρραβὼν τῆς κληρονομίας ἡμῶν, εἰς ἀπολύτρωσιν τῆς περιποιήσεως,",ἔπαινον τῆς δόξης αὐτοῦ.
εἰς,εἰς,—,—,—,—,—,—,—,preposition,Ephesians 1:15,Διὰ τοῦτο κἀγὼ ἀκούσας τὴν καθʼ ὑμᾶς πίστιν ἐν τῷ κυρίῳ Ἰησοῦ καὶ τὴν ἀγάπην τὴν,πάντας τοὺς ἁγίους
εἰς,εἰς,—,—,—,—,—,—,—,preposition,Ephesians 1:18,πεφωτισμένους τοὺς ὀφθαλμοὺς τῆς καρδίας [ὑμῶν],"τὸ εἰδέναι ὑμᾶς τίς ἐστιν ἡ ἐλπὶς τῆς κλήσεως αὐτοῦ,  τίς ὁ πλοῦτος"
εἰς,εἰς,—,—,—,—,—,—,—,preposition,Ephesians 1:19,καὶ τί τὸ ὑπερβάλλον μέγεθος τῆς δυνάμεως αὐτοῦ,ἡμᾶς τοὺς πιστεύοντας κατὰ τὴν ἐνέργειαν τοῦ κράτους τῆς ἰσχύος αὐτοῦ.
εἰς,εἰς,—,—,—,—,—,—,—,preposition,Ephesians 2:15,"τὸν νόμον τῶν ἐντολῶν ἐν δόγμασιν καταργήσας, ἵνα τοὺς δύο κτίσῃ ἐν αὐτῷ",ἕνα καινὸν ἄνθρωπον ποιῶν εἰρήνην
εἰς,εἰς,—,—,—,—,—,—,—,preposition,Ephesians 2:21,ἐν ᾧ πᾶσα  οἰκοδομὴ συναρμολογουμένη αὔξει,"ναὸν ἅγιον ἐν κυρίῳ,"
εἰς,εἰς,—,—,—,—,—,—,—,preposition,Ephesians 2:22,ἐν ᾧ καὶ ὑμεῖς συνοικοδομεῖσθε,κατοικητήριον τοῦ θεοῦ ἐν πνεύματι.
εἰς,εἰς,—,—,—,—,—,—,—,preposition,Ephesians 3:2,— εἴ γε ἠκούσατε τὴν οἰκονομίαν τῆς χάριτος τοῦ θεοῦ τῆς δοθείσης μοι,"ὑμᾶς,"
εἰς,εἰς,—,—,—,—,—,—,—,preposition,Ephesians 3:16,ἵνα δῷ ὑμῖν κατὰ τὸ πλοῦτος τῆς δόξης αὐτοῦ δυνάμει κραταιωθῆναι διὰ τοῦ πνεύματος αὐτοῦ,"τὸν ἔσω ἄνθρωπον,"
εἰς,εἰς,—,—,—,—,—,—,—,preposition,Ephesians 3:19,"γνῶναί τε τὴν ὑπερβάλλουσαν τῆς γνώσεως ἀγάπην τοῦ Χριστοῦ, ἵνα πληρωθῆτε",πᾶν τὸ πλήρωμα τοῦ θεοῦ.
εἰς,εἰς,—,—,—,—,—,—,—,preposition,Ephesians 3:21,αὐτῷ ἡ δόξα ἐν τῇ ἐκκλησίᾳ καὶ ἐν Χριστῷ Ἰησοῦ,"πάσας τὰς γενεὰς τοῦ αἰῶνος τῶν αἰώνων, ἀμήν."
εἰς,εἰς,—,—,—,—,—,—,—,preposition,Ephesians 4:8,διὸ λέγει·        ἀναβὰς,"ὕψος ᾐχμαλώτευσεν αἰχμαλωσίαν,         ἔδωκεν δόματα τοῖς ἀνθρώποις."
εἰς,εἰς,—,—,—,—,—,—,—,preposition,Ephesians 4:9,"τὸ δὲ ἀνέβη τί ἐστιν, εἰ μὴ ὅτι καὶ κατέβη",τὰ κατώτερα [μέρη] τῆς γῆς;
εἰς,εἰς,—,—,—,—,—,—,—,preposition,Ephesians 4:12,πρὸς τὸν καταρτισμὸν τῶν ἁγίων,"ἔργον διακονίας, εἰς οἰκοδομὴν τοῦ σώματος τοῦ Χριστοῦ,"
εἰς,εἰς,—,—,—,—,—,—,—,preposition,Ephesians 4:12,"πρὸς τὸν καταρτισμὸν τῶν ἁγίων εἰς ἔργον διακονίας,","οἰκοδομὴν τοῦ σώματος τοῦ Χριστοῦ,"
εἰς,εἰς,—,—,—,—,—,—,—,preposition,Ephesians 4:13,μέχρι καταντήσωμεν οἱ πάντες,"τὴν ἑνότητα τῆς πίστεως καὶ τῆς ἐπιγνώσεως τοῦ υἱοῦ τοῦ θεοῦ, εἰς ἄνδρα"
εἰς,εἰς,—,—,—,—,—,—,—,preposition,Ephesians 4:13,"μέχρι καταντήσωμεν οἱ πάντες εἰς τὴν ἑνότητα τῆς πίστεως καὶ τῆς ἐπιγνώσεως τοῦ υἱοῦ τοῦ θεοῦ,","ἄνδρα τέλειον, εἰς μέτρον ἡλικίας τοῦ πληρώματος τοῦ Χριστοῦ,"
εἰς,εἰς,—,—,—,—,—,—,—,preposition,Ephesians 4:13,"τῆς πίστεως καὶ τῆς ἐπιγνώσεως τοῦ υἱοῦ τοῦ θεοῦ, εἰς ἄνδρα τέλειον,","μέτρον ἡλικίας τοῦ πληρώματος τοῦ Χριστοῦ,"
εἰς,εἰς,—,—,—,—,—,—,—,preposition,Ephesians 4:15,ἀληθεύοντες δὲ ἐν ἀγάπῃ αὐξήσωμεν,"αὐτὸν τὰ πάντα, ὅς ἐστιν ἡ κεφαλή, Χριστός,"
εἰς,εἰς,—,—,—,—,—,—,—,preposition,Ephesians 4:16,κατʼ ἐνέργειαν ἐν μέτρῳ ἑνὸς ἑκάστου μέρους τὴν αὔξησιν τοῦ σώματος ποιεῖται,οἰκοδομὴν ἑαυτοῦ ἐν ἀγάπῃ.
εἰς,εἰς,—,—,—,—,—,—,—,preposition,Ephesians 4:19,οἵτινες ἀπηλγηκότες ἑαυτοὺς παρέδωκαν τῇ ἀσελγείᾳ,ἐργασίαν ἀκαθαρσίας πάσης ἐν πλεονεξίᾳ.
εἰς,εἰς,—,—,—,—,—,—,—,preposition,Ephesians 4:30,"καὶ μὴ λυπεῖτε τὸ πνεῦμα τὸ ἅγιον τοῦ θεοῦ, ἐν ᾧ ἐσφραγίσθητε",ἡμέραν ἀπολυτρώσεως.
εἰς,εἰς,—,—,—,—,—,—,—,preposition,Ephesians 4:32,γίνεσθε [δὲ],"ἀλλήλους χρηστοί, εὔσπλαγχνοι, χαριζόμενοι ἑαυτοῖς, καθὼς καὶ ὁ θεὸς ἐν Χριστῷ ἐχαρίσατο ὑμῖν."
εἰς,εἰς,—,—,—,—,—,—,—,preposition,Ephesians 5:2,ἠγάπησεν ἡμᾶς καὶ παρέδωκεν ἑαυτὸν ὑπὲρ ἡμῶν προσφορὰν καὶ θυσίαν τῷ θεῷ,ὀσμὴν εὐωδίας.
εἰς,εἰς,—,—,—,—,—,—,—,preposition,Ephesians 5:31,"τὴν] μητέρα καὶ προσκολληθήσεται πρὸς τὴν γυναῖκα αὐτοῦ, καὶ ἔσονται οἱ δύο",σάρκα μίαν.
εἰς,εἰς,—,—,—,—,—,—,—,preposition,Ephesians 5:32,τὸ μυστήριον τοῦτο μέγα ἐστίν· ἐγὼ δὲ λέγω,Χριστὸν καὶ εἰς τὴν ἐκκλησίαν.
εἰς,εἰς,—,—,—,—,—,—,—,preposition,Ephesians 5:32,τὸ μυστήριον τοῦτο μέγα ἐστίν· ἐγὼ δὲ λέγω εἰς Χριστὸν καὶ,τὴν ἐκκλησίαν.
εἰς,εἰς,—,—,—,—,—,—,—,preposition,Ephesians 6:18,"Διὰ πάσης προσευχῆς καὶ δεήσεως προσευχόμενοι ἐν παντὶ καιρῷ ἐν πνεύματι, καὶ",αὐτὸ ἀγρυπνοῦντες ἐν πάσῃ προσκαρτερήσει καὶ δεήσει περὶ πάντων τῶν ἁγίων
εἰς,εἰς,—,—,—,—,—,—,—,preposition,Ephesians 6:22,ὃν ἔπεμψα πρὸς ὑμᾶς,"αὐτὸ τοῦτο, ἵνα γνῶτε τὰ περὶ ἡμῶν καὶ παρακαλέσῃ τὰς καρδίας ὑμῶν."
εἰς,εἰς,—,—,—,—,—,—,—,preposition,Philippians 1:5,ἐπὶ τῇ κοινωνίᾳ ὑμῶν,"τὸ εὐαγγέλιον ἀπὸ τῆς πρώτης ἡμέρας ἄχρι τοῦ νῦν,"
εἰς,εἰς,—,—,—,—,—,—,—,preposition,Philippians 1:10,—,"τὸ δοκιμάζειν ὑμᾶς τὰ διαφέροντα, ἵνα ἦτε εἰλικρινεῖς καὶ ἀπρόσκοποι εἰς  ἡμέραν Χριστοῦ,"
εἰς,εἰς,—,—,—,—,—,—,—,preposition,Philippians 1:10,"εἰς τὸ δοκιμάζειν ὑμᾶς τὰ διαφέροντα, ἵνα ἦτε εἰλικρινεῖς καὶ ἀπρόσκοποι","ἡμέραν Χριστοῦ,"
εἰς,εἰς,—,—,—,—,—,—,—,preposition,Philippians 1:11,πεπληρωμένοι καρπὸν δικαιοσύνης τὸν διὰ Ἰησοῦ Χριστοῦ,δόξαν καὶ ἔπαινον θεοῦ.
εἰς,εἰς,—,—,—,—,—,—,—,preposition,Philippians 1:12,"Γινώσκειν δὲ ὑμᾶς βούλομαι, ἀδελφοί, ὅτι τὰ κατʼ ἐμὲ μᾶλλον","προκοπὴν τοῦ εὐαγγελίου ἐλήλυθεν,"
εἰς,εἰς,—,—,—,—,—,—,—,preposition,Philippians 1:16,"οἱ μὲν ἐξ ἀγάπης, εἰδότες ὅτι","ἀπολογίαν τοῦ εὐαγγελίου κεῖμαι,"
εἰς,εἰς,—,—,—,—,—,—,—,preposition,Philippians 1:19,οἶδα γὰρ ὅτι τοῦτό μοι ἀποβήσεται,σωτηρίαν διὰ τῆς ὑμῶν δεήσεως καὶ ἐπιχορηγίας τοῦ πνεύματος Ἰησοῦ Χριστοῦ
