Result,Lemma (Greek),Tense (Logos Greek),Voice (Logos Greek),Mood (Logos Greek),Person (Logos Greek),Gender (Logos Greek),Case (Logos Greek),Number (Logos Greek),Reference,Previous Context,Next Context
τέκνα,τέκνον,—,—,—,—,neuter,accusative,plural,Matthew 2:18,"φωνὴ ἐν Ῥαμὰ ἠκούσθη,            κλαυθμὸς καὶ ὀδυρμὸς πολύς        Ῥαχὴλ κλαίουσα τὰ","αὐτῆς,           καὶ οὐκ ἤθελεν παρακληθῆναι,        ὅτι οὐκ εἰσίν."
τέκνα,τέκνον,—,—,—,—,neuter,accusative,plural,Matthew 3:9,λέγω γὰρ ὑμῖν ὅτι δύναται ὁ θεὸς ἐκ τῶν λίθων τούτων ἐγεῖραι,τῷ Ἀβραάμ.
τέκνοις,τέκνον,—,—,—,—,neuter,dative,plural,Matthew 7:11,εἰ οὖν ὑμεῖς πονηροὶ ὄντες οἴδατε δόματα ἀγαθὰ διδόναι τοῖς,"ὑμῶν, πόσῳ μᾶλλον ὁ πατὴρ ὑμῶν ὁ ἐν τοῖς οὐρανοῖς δώσει ἀγαθὰ τοῖς αἰτοῦσιν αὐτόν."
τέκνον,τέκνον,—,—,—,—,neuter,vocative,singular,Matthew 9:2,"βεβλημένον. καὶ ἰδὼν ὁ Ἰησοῦς τὴν πίστιν αὐτῶν εἶπεν τῷ παραλυτικῷ· θάρσει,",", ἀφίενταί σου αἱ ἁμαρτίαι."
τέκνον,τέκνον,—,—,—,—,neuter,accusative,singular,Matthew 10:21,Παραδώσει δὲ ἀδελφὸς ἀδελφὸν εἰς θάνατον καὶ πατὴρ,", καὶ ἐπαναστήσονται τέκνα ἐπὶ γονεῖς καὶ θανατώσουσιν αὐτούς."
τέκνα,τέκνον,—,—,—,—,neuter,nominative,plural,Matthew 10:21,"Παραδώσει δὲ ἀδελφὸς ἀδελφὸν εἰς θάνατον καὶ πατὴρ τέκνον, καὶ ἐπαναστήσονται",ἐπὶ γονεῖς καὶ θανατώσουσιν αὐτούς.
τέκνων,τέκνον,—,—,—,—,neuter,genitive,plural,Matthew 15:26,ὁ δὲ ἀποκριθεὶς εἶπεν· οὐκ ἔστιν καλὸν λαβεῖν τὸν ἄρτον τῶν,καὶ βαλεῖν τοῖς κυναρίοις.
τέκνα,τέκνον,—,—,—,—,neuter,accusative,plural,Matthew 18:25,μὴ ἔχοντος δὲ αὐτοῦ ἀποδοῦναι ἐκέλευσεν αὐτὸν ὁ κύριος πραθῆναι καὶ τὴν γυναῖκα  καὶ τὰ,"καὶ πάντα ὅσα ἔχει, καὶ ἀποδοθῆναι."
τέκνα,τέκνον,—,—,—,—,neuter,accusative,plural,Matthew 19:29,καὶ πᾶς ὅστις ἀφῆκεν οἰκίας ἢ ἀδελφοὺς ἢ ἀδελφὰς ἢ πατέρα ἢ μητέρα ἢ,"ἢ ἀγροὺς ἕνεκεν τοῦ ὀνόματός μου, ἑκατονταπλασίονα λήμψεται καὶ ζωὴν αἰώνιον κληρονομήσει."
τέκνα,τέκνον,—,—,—,—,neuter,accusative,plural,Matthew 21:28,Τί δὲ ὑμῖν δοκεῖ; ἄνθρωπος  εἶχεν,"δύο. καὶ προσελθὼν τῷ πρώτῳ εἶπεν· τέκνον, ὕπαγε σήμερον ἐργάζου ἐν τῷ ἀμπελῶνι."
τέκνον,τέκνον,—,—,—,—,neuter,vocative,singular,Matthew 21:28,Τί δὲ ὑμῖν δοκεῖ; ἄνθρωπος  εἶχεν τέκνα δύο. καὶ προσελθὼν τῷ πρώτῳ εἶπεν·,", ὕπαγε σήμερον ἐργάζου ἐν τῷ ἀμπελῶνι."
τέκνα,τέκνον,—,—,—,—,neuter,accusative,plural,Matthew 22:24,"λέγοντες· διδάσκαλε, Μωϋσῆς εἶπεν· ἐάν τις ἀποθάνῃ μὴ ἔχων",", ἐπιγαμβρεύσει ὁ ἀδελφὸς αὐτοῦ τὴν γυναῖκα αὐτοῦ καὶ ἀναστήσει σπέρμα τῷ ἀδελφῷ αὐτοῦ."
τέκνα,τέκνον,—,—,—,—,neuter,accusative,plural,Matthew 23:37,"Ἰερουσαλὴμ Ἰερουσαλήμ, ἡ ἀποκτείνουσα τοὺς προφήτας καὶ λιθοβολοῦσα τοὺς ἀπεσταλμένους πρὸς αὐτήν, ποσάκις ἠθέλησα ἐπισυναγαγεῖν τὰ","σου, ὃν τρόπον ὄρνις ἐπισυνάγει τὰ νοσσία αὐτῆς ὑπὸ τὰς πτέρυγας, καὶ οὐκ ἠθελήσατε."
τέκνα,τέκνον,—,—,—,—,neuter,accusative,plural,Matthew 27:25,καὶ ἀποκριθεὶς πᾶς ὁ λαὸς εἶπεν· τὸ αἷμα αὐτοῦ ἐφʼ ἡμᾶς καὶ ἐπὶ τὰ,ἡμῶν.
τέκνον,τέκνον,—,—,—,—,neuter,vocative,singular,Mark 2:5,καὶ ἰδὼν ὁ Ἰησοῦς τὴν πίστιν αὐτῶν λέγει τῷ παραλυτικῷ·,", ἀφίενταί σου αἱ ἁμαρτίαι."
τέκνα,τέκνον,—,—,—,—,neuter,accusative,plural,Mark 7:27,καὶ ἔλεγεν αὐτῇ· ἄφες πρῶτον χορτασθῆναι τὰ,", οὐ γάρ ἐστιν καλὸν λαβεῖν τὸν ἄρτον τῶν τέκνων καὶ τοῖς κυναρίοις βαλεῖν."
τέκνων,τέκνον,—,—,—,—,neuter,genitive,plural,Mark 7:27,"καὶ ἔλεγεν αὐτῇ· ἄφες πρῶτον χορτασθῆναι τὰ τέκνα, οὐ γάρ ἐστιν καλὸν λαβεῖν τὸν ἄρτον τῶν",καὶ τοῖς κυναρίοις βαλεῖν.
τέκνα,τέκνον,—,—,—,—,neuter,vocative,plural,Mark 10:24,Οἱ δὲ μαθηταὶ ἐθαμβοῦντο ἐπὶ τοῖς λόγοις αὐτοῦ. ὁ δὲ Ἰησοῦς πάλιν ἀποκριθεὶς λέγει αὐτοῖς·,", πῶς δύσκολόν ἐστιν  εἰς τὴν βασιλείαν τοῦ θεοῦ εἰσελθεῖν·"
τέκνα,τέκνον,—,—,—,—,neuter,accusative,plural,Mark 10:29,ὃς ἀφῆκεν οἰκίαν ἢ ἀδελφοὺς ἢ ἀδελφὰς ἢ μητέρα ἢ πατέρα  ἢ,"ἢ ἀγροὺς ἕνεκεν ἐμοῦ καὶ ἕνεκεν τοῦ εὐαγγελίου,"
τέκνα,τέκνον,—,—,—,—,neuter,accusative,plural,Mark 10:30,ἐὰν μὴ λάβῃ ἑκατονταπλασίονα νῦν ἐν τῷ καιρῷ τούτῳ οἰκίας καὶ ἀδελφοὺς καὶ ἀδελφὰς καὶ μητέρας καὶ,"καὶ ἀγροὺς μετὰ διωγμῶν, καὶ ἐν τῷ αἰῶνι τῷ ἐρχομένῳ ζωὴν αἰώνιον."
τέκνον,τέκνον,—,—,—,—,neuter,accusative,singular,Mark 12:19,"διδάσκαλε, Μωϋσῆς ἔγραψεν ἡμῖν ὅτι ἐάν τινος ἀδελφὸς ἀποθάνῃ καὶ καταλίπῃ γυναῖκα καὶ μὴ ἀφῇ",", ἵνα λάβῃ ὁ ἀδελφὸς αὐτοῦ τὴν γυναῖκα  καὶ ἐξαναστήσῃ σπέρμα τῷ ἀδελφῷ αὐτοῦ."
τέκνον,τέκνον,—,—,—,—,neuter,accusative,singular,Mark 13:12,Καὶ παραδώσει ἀδελφὸς ἀδελφὸν εἰς θάνατον καὶ πατὴρ,", καὶ ἐπαναστήσονται τέκνα ἐπὶ γονεῖς καὶ θανατώσουσιν αὐτούς·"
τέκνα,τέκνον,—,—,—,—,neuter,nominative,plural,Mark 13:12,"Καὶ παραδώσει ἀδελφὸς ἀδελφὸν εἰς θάνατον καὶ πατὴρ τέκνον, καὶ ἐπαναστήσονται",ἐπὶ γονεῖς καὶ θανατώσουσιν αὐτούς·
τέκνον,τέκνον,—,—,—,—,neuter,nominative,singular,Luke 1:7,καὶ οὐκ ἦν αὐτοῖς,", καθότι ἦν ἡ Ἐλισάβετ στεῖρα, καὶ ἀμφότεροι προβεβηκότες ἐν ταῖς ἡμέραις αὐτῶν ἦσαν."
τέκνα,τέκνον,—,—,—,—,neuter,accusative,plural,Luke 1:17,"καὶ αὐτὸς προελεύσεται ἐνώπιον αὐτοῦ           ἐν πνεύματι καὶ δυνάμει Ἠλίου,        ἐπιστρέψαι καρδίας πατέρων ἐπὶ","καὶ ἀπειθεῖς ἐν φρονήσει δικαίων,           ἑτοιμάσαι κυρίῳ λαὸν κατεσκευασμένον."
τέκνον,τέκνον,—,—,—,—,neuter,vocative,singular,Luke 2:48,"Καὶ ἰδόντες αὐτὸν ἐξεπλάγησαν,  καὶ εἶπεν πρὸς αὐτὸν ἡ μήτηρ αὐτοῦ·",", τί ἐποίησας ἡμῖν οὕτως; ἰδοὺ ὁ πατήρ σου κἀγὼ ὀδυνώμενοι  ἐζητοῦμέν σε."
τέκνα,τέκνον,—,—,—,—,neuter,accusative,plural,Luke 3:8,λέγω γὰρ ὑμῖν ὅτι δύναται ὁ θεὸς ἐκ τῶν λίθων τούτων ἐγεῖραι,τῷ Ἀβραάμ.
τέκνων,τέκνον,—,—,—,—,neuter,genitive,plural,Luke 7:35,καὶ ἐδικαιώθη ἡ σοφία ἀπὸ πάντων τῶν,αὐτῆς.
τέκνοις,τέκνον,—,—,—,—,neuter,dative,plural,Luke 11:13,εἰ οὖν ὑμεῖς πονηροὶ ὑπάρχοντες οἴδατε δόματα ἀγαθὰ διδόναι τοῖς,"ὑμῶν, πόσῳ μᾶλλον ὁ πατὴρ [ὁ] ἐξ οὐρανοῦ δώσει πνεῦμα ἅγιον τοῖς αἰτοῦσιν αὐτόν."
τέκνα,τέκνον,—,—,—,—,neuter,accusative,plural,Luke 13:34,"Ἰερουσαλὴμ Ἰερουσαλήμ, ἡ ἀποκτείνουσα τοὺς προφήτας καὶ λιθοβολοῦσα τοὺς ἀπεσταλμένους πρὸς αὐτήν, ποσάκις ἠθέλησα ἐπισυνάξαι τὰ","σου ὃν τρόπον ὄρνις τὴν ἑαυτῆς νοσσιὰν ὑπὸ τὰς πτέρυγας, καὶ οὐκ ἠθελήσατε."
τέκνα,τέκνον,—,—,—,—,neuter,accusative,plural,Luke 14:26,μισεῖ τὸν πατέρα ἑαυτοῦ καὶ τὴν μητέρα καὶ τὴν γυναῖκα καὶ τὰ,"καὶ τοὺς ἀδελφοὺς καὶ τὰς ἀδελφὰς ἔτι τε καὶ τὴν ψυχὴν ἑαυτοῦ, οὐ δύναται εἶναί μου μαθητής."
τέκνον,τέκνον,—,—,—,—,neuter,vocative,singular,Luke 15:31,ὁ δὲ εἶπεν αὐτῷ·,", σὺ πάντοτε μετʼ ἐμοῦ εἶ, καὶ πάντα τὰ ἐμὰ σά ἐστιν·"
τέκνον,τέκνον,—,—,—,—,neuter,vocative,singular,Luke 16:25,εἶπεν δὲ Ἀβραάμ·,", μνήσθητι ὅτι ἀπέλαβες τὰ ἀγαθά σου ἐν τῇ ζωῇ σου, καὶ Λάζαρος ὁμοίως"
τέκνα,τέκνον,—,—,—,—,neuter,accusative,plural,Luke 18:29,οὐδείς ἐστιν ὃς ἀφῆκεν οἰκίαν ἢ γυναῖκα ἢ ἀδελφοὺς ἢ γονεῖς ἢ,"ἕνεκεν τῆς βασιλείας τοῦ θεοῦ,"
τέκνα,τέκνον,—,—,—,—,neuter,accusative,plural,Luke 19:44,καὶ ἐδαφιοῦσίν σε καὶ τὰ,"σου ἐν σοί,  καὶ οὐκ ἀφήσουσιν λίθον ἐπὶ λίθον ἐν σοί, ἀνθʼ ὧν"
τέκνα,τέκνον,—,—,—,—,neuter,accusative,plural,Luke 20:31,"καὶ ὁ τρίτος ἔλαβεν αὐτήν, ὡσαύτως δὲ καὶ οἱ ἑπτὰ οὐ κατέλιπον",καὶ ἀπέθανον.
τέκνα,τέκνον,—,—,—,—,neuter,accusative,plural,Luke 23:28,"Ἰερουσαλήμ, μὴ κλαίετε ἐπʼ ἐμέ· πλὴν ἐφʼ ἑαυτὰς κλαίετε καὶ ἐπὶ τὰ","ὑμῶν,"
τέκνα,τέκνον,—,—,—,—,neuter,"accusative, nominative",plural,John 1:12,"ὅσοι δὲ ἔλαβον αὐτόν, ἔδωκεν αὐτοῖς ἐξουσίαν","θεοῦ γενέσθαι, τοῖς πιστεύουσιν εἰς τὸ ὄνομα αὐτοῦ,"
τέκνα,τέκνον,—,—,—,—,neuter,nominative,plural,John 8:39,Ἀπεκρίθησαν καὶ εἶπαν αὐτῷ· ὁ πατὴρ ἡμῶν Ἀβραάμ ἐστιν. λέγει  αὐτοῖς ὁ Ἰησοῦς· εἰ,"τοῦ Ἀβραάμ ἐστε, τὰ ἔργα τοῦ Ἀβραὰμ ἐποιεῖτε·"
τέκνα,τέκνον,—,—,—,—,neuter,accusative,plural,John 11:52,καὶ οὐχ ὑπὲρ τοῦ ἔθνους  μόνον ἀλλʼ ἵνα καὶ τὰ,τοῦ θεοῦ τὰ διεσκορπισμένα συναγάγῃ εἰς ἕν.
τέκνοις,τέκνον,—,—,—,—,neuter,dative,plural,Acts 2:39,ὑμῖν γάρ ἐστιν ἡ ἐπαγγελία καὶ τοῖς,"ὑμῶν καὶ πᾶσιν τοῖς εἰς μακράν, ὅσους ἂν προσκαλέσηται κύριος ὁ θεὸς ἡμῶν."
τέκνου,τέκνον,—,—,—,—,neuter,genitive,singular,Acts 7:5,"εἰς κατάσχεσιν αὐτὴν καὶ τῷ σπέρματι αὐτοῦ μετʼ αὐτόν, οὐκ ὄντος αὐτῷ",.
τέκνοις,τέκνον,—,—,—,—,neuter,dative,plural,Acts 13:33,ὅτι ταύτην ὁ θεὸς ἐκπεπλήρωκεν τοῖς,[αὐτῶν] ἡμῖν ἀναστήσας Ἰησοῦν ὡς καὶ ἐν τῷ ψαλμῷ γέγραπται τῷ δευτέρῳ·         υἱός
τέκνοις,τέκνον,—,—,—,—,neuter,dative,plural,Acts 21:5,"ὅτε δὲ ἐγένετο ἡμᾶς ἐξαρτίσαι τὰς ἡμέρας, ἐξελθόντες ἐπορευόμεθα προπεμπόντων ἡμᾶς πάντων σὺν γυναιξὶν καὶ","ἕως ἔξω τῆς πόλεως, καὶ θέντες τὰ γόνατα ἐπὶ τὸν αἰγιαλὸν προσευξάμενοι"
τέκνα,τέκνον,—,—,—,—,neuter,accusative,plural,Acts 21:21,Μωϋσέως τοὺς κατὰ τὰ ἔθνη πάντας Ἰουδαίους λέγων μὴ περιτέμνειν αὐτοὺς τὰ,μηδὲ τοῖς ἔθεσιν περιπατεῖν.
τέκνα,τέκνον,—,—,—,—,neuter,nominative,plural,Romans 8:16,αὐτὸ τὸ πνεῦμα συμμαρτυρεῖ τῷ πνεύματι ἡμῶν ὅτι ἐσμὲν,θεοῦ.
τέκνα,τέκνον,—,—,—,—,neuter,nominative,plural,Romans 8:17,εἰ δὲ,", καὶ κληρονόμοι· κληρονόμοι μὲν θεοῦ, συγκληρονόμοι δὲ Χριστοῦ, εἴπερ συμπάσχομεν ἵνα καὶ συνδοξασθῶμεν."
τέκνων,τέκνον,—,—,—,—,neuter,genitive,plural,Romans 8:21,ὅτι καὶ αὐτὴ ἡ κτίσις ἐλευθερωθήσεται ἀπὸ τῆς δουλείας τῆς φθορᾶς εἰς τὴν ἐλευθερίαν τῆς δόξης τῶν,τοῦ θεοῦ.
τέκνα,τέκνον,—,—,—,—,neuter,nominative,plural,Romans 9:7,οὐδʼ ὅτι εἰσὶν σπέρμα Ἀβραὰμ πάντες,", ἀλλʼ· ἐν Ἰσαὰκ κληθήσεταί σοι σπέρμα."
τέκνα,τέκνον,—,—,—,—,neuter,nominative,plural,Romans 9:8,"τοῦτʼ ἔστιν,  οὐ τὰ",τῆς σαρκὸς ταῦτα τέκνα τοῦ θεοῦ ἀλλὰ τὰ τέκνα τῆς ἐπαγγελίας λογίζεται εἰς σπέρμα.
τέκνα,τέκνον,—,—,—,—,neuter,nominative,plural,Romans 9:8,"τοῦτʼ ἔστιν,  οὐ τὰ τέκνα τῆς σαρκὸς ταῦτα",τοῦ θεοῦ ἀλλὰ τὰ τέκνα τῆς ἐπαγγελίας λογίζεται εἰς σπέρμα.
τέκνα,τέκνον,—,—,—,—,neuter,nominative,plural,Romans 9:8,"τοῦτʼ ἔστιν,  οὐ τὰ τέκνα τῆς σαρκὸς ταῦτα τέκνα τοῦ θεοῦ ἀλλὰ τὰ",τῆς ἐπαγγελίας λογίζεται εἰς σπέρμα.
τέκνα,τέκνον,—,—,—,—,neuter,"accusative, nominative",plural,1 Corinthians 4:14,Οὐκ ἐντρέπων ὑμᾶς γράφω ταῦτα ἀλλʼ ὡς,μου ἀγαπητὰ νουθετῶν.
τέκνον,τέκνον,—,—,—,—,neuter,nominative,singular,1 Corinthians 4:17,"Διὰ τοῦτο  ἔπεμψα ὑμῖν Τιμόθεον, ὅς ἐστίν μου","ἀγαπητὸν καὶ πιστὸν ἐν κυρίῳ, ὃς ὑμᾶς ἀναμνήσει τὰς ὁδούς μου τὰς ἐν"
τέκνα,τέκνον,—,—,—,—,neuter,nominative,plural,1 Corinthians 7:14,καὶ ἡγίασται ἡ γυνὴ ἡ ἄπιστος ἐν τῷ ἀδελφῷ· ἐπεὶ ἄρα τὰ,"ὑμῶν ἀκάθαρτά ἐστιν, νῦν δὲ ἅγιά ἐστιν."
τέκνοις,τέκνον,—,—,—,—,neuter,dative,plural,2 Corinthians 6:13,"τὴν δὲ αὐτὴν ἀντιμισθίαν, ὡς","λέγω, πλατύνθητε καὶ ὑμεῖς."
τέκνα,τέκνον,—,—,—,—,neuter,nominative,plural,2 Corinthians 12:14,καταναρκήσω· οὐ γὰρ ζητῶ τὰ ὑμῶν ἀλλʼ ὑμᾶς. οὐ γὰρ ὀφείλει τὰ,τοῖς γονεῦσιν θησαυρίζειν ἀλλʼ οἱ γονεῖς τοῖς τέκνοις.
τέκνοις,τέκνον,—,—,—,—,neuter,dative,plural,2 Corinthians 12:14,οὐ γὰρ ὀφείλει τὰ τέκνα τοῖς γονεῦσιν θησαυρίζειν ἀλλʼ οἱ γονεῖς τοῖς,.
τέκνα,τέκνον,—,—,—,—,neuter,vocative,plural,Galatians 4:19,—,"μου, οὓς πάλιν ὠδίνω μέχρις οὗ μορφωθῇ Χριστὸς ἐν ὑμῖν·"
τέκνων,τέκνον,—,—,—,—,neuter,genitive,plural,Galatians 4:25,"τὸ δὲ Ἁγὰρ Σινᾶ ὄρος ἐστὶν ἐν τῇ Ἀραβίᾳ· συστοιχεῖ δὲ τῇ νῦν Ἰερουσαλήμ, δουλεύει γὰρ μετὰ τῶν",αὐτῆς.
τέκνα,τέκνον,—,—,—,—,neuter,nominative,plural,Galatians 4:27,"γέγραπται γάρ·           εὐφράνθητι, στεῖρα ἡ οὐ τίκτουσα,             ῥῆξον καὶ βόησον, ἡ οὐκ ὠδίνουσα·           ὅτι πολλὰ τὰ",τῆς ἐρήμου             μᾶλλον ἢ τῆς ἐχούσης τὸν ἄνδρα.
τέκνα,τέκνον,—,—,—,—,neuter,nominative,plural,Galatians 4:28,"Ὑμεῖς δέ, ἀδελφοί, κατὰ Ἰσαὰκ ἐπαγγελίας",ἐστέ.
τέκνα,τέκνον,—,—,—,—,neuter,nominative,plural,Galatians 4:31,"διό, ἀδελφοί, οὐκ ἐσμὲν παιδίσκης",ἀλλὰ τῆς ἐλευθέρας.
τέκνα,τέκνον,—,—,—,—,neuter,nominative,plural,Ephesians 2:3,"σαρκὸς ἡμῶν ποιοῦντες τὰ θελήματα τῆς σαρκὸς καὶ τῶν διανοιῶν, καὶ ἤμεθα",φύσει ὀργῆς ὡς καὶ οἱ λοιποί·
τέκνα,τέκνον,—,—,—,—,neuter,nominative,plural,Ephesians 5:1,Γίνεσθε οὖν μιμηταὶ τοῦ θεοῦ ὡς,ἀγαπητὰ
τέκνα,τέκνον,—,—,—,—,neuter,nominative,plural,Ephesians 5:8,"ἦτε γάρ ποτε σκότος, νῦν δὲ φῶς ἐν κυρίῳ· ὡς",φωτὸς περιπατεῖτε
τέκνα,τέκνον,—,—,—,—,neuter,nominative,plural,Ephesians 6:1,Τὰ,", ὑπακούετε τοῖς γονεῦσιν ὑμῶν [ἐν κυρίῳ]· τοῦτο γάρ ἐστιν δίκαιον."
τέκνα,τέκνον,—,—,—,—,neuter,accusative,plural,Ephesians 6:4,"Καὶ οἱ πατέρες, μὴ παροργίζετε τὰ",ὑμῶν ἀλλʼ ἐκτρέφετε αὐτὰ ἐν παιδείᾳ καὶ νουθεσίᾳ κυρίου.
τέκνα,τέκνον,—,—,—,—,neuter,nominative,plural,Philippians 2:15,"ἵνα γένησθε ἄμεμπτοι καὶ ἀκέραιοι,","θεοῦ ἄμωμα μέσον γενεᾶς σκολιᾶς καὶ διεστραμμένης, ἐν οἷς φαίνεσθε ὡς φωστῆρες ἐν κόσμῳ,"
τέκνον,τέκνον,—,—,—,—,neuter,nominative,singular,Philippians 2:22,"τὴν δὲ δοκιμὴν αὐτοῦ γινώσκετε, ὅτι ὡς πατρὶ",σὺν ἐμοὶ ἐδούλευσεν εἰς τὸ εὐαγγέλιον.
τέκνα,τέκνον,—,—,—,—,neuter,"vocative, nominative",plural,Colossians 3:20,Τὰ,", ὑπακούετε τοῖς γονεῦσιν κατὰ πάντα, τοῦτο γὰρ εὐάρεστόν ἐστιν ἐν κυρίῳ."
τέκνα,τέκνον,—,—,—,—,neuter,accusative,plural,Colossians 3:21,"Οἱ πατέρες, μὴ ἐρεθίζετε τὰ","ὑμῶν, ἵνα μὴ ἀθυμῶσιν."
τέκνα,τέκνον,—,—,—,—,neuter,accusative,plural,1 Thessalonians 2:7,ἀλλʼ ἐγενήθημεν νήπιοι ἐν μέσῳ ὑμῶν. ὡς ἐὰν τροφὸς θάλπῃ τὰ ἑαυτῆς,","
τέκνα,τέκνον,—,—,—,—,neuter,accusative,plural,1 Thessalonians 2:11,"καθάπερ οἴδατε, ὡς ἕνα ἕκαστον ὑμῶν ὡς πατὴρ",ἑαυτοῦ
τέκνῳ,τέκνον,—,—,—,—,neuter,dative,singular,1 Timothy 1:2,Τιμοθέῳ γνησίῳ,"ἐν πίστει, χάρις ἔλεος εἰρήνη ἀπὸ θεοῦ πατρὸς  καὶ Χριστοῦ Ἰησοῦ τοῦ κυρίου ἡμῶν."
τέκνον,τέκνον,—,—,—,—,neuter,vocative,singular,1 Timothy 1:18,"Ταύτην τὴν παραγγελίαν παρατίθεμαί σοι,","Τιμόθεε, κατὰ τὰς προαγούσας ἐπὶ σὲ προφητείας, ἵνα στρατεύῃ ἐν αὐταῖς τὴν καλὴν στρατείαν"
τέκνα,τέκνον,—,—,—,—,neuter,accusative,plural,1 Timothy 3:4,"τοῦ ἰδίου οἴκου καλῶς προϊστάμενον,","ἔχοντα ἐν ὑποταγῇ, μετὰ πάσης σεμνότητος"
τέκνων,τέκνον,—,—,—,—,neuter,genitive,plural,1 Timothy 3:12,"διάκονοι ἔστωσαν μιᾶς γυναικὸς ἄνδρες,",καλῶς προϊστάμενοι καὶ τῶν ἰδίων οἴκων.
τέκνα,τέκνον,—,—,—,—,neuter,accusative,plural,1 Timothy 5:4,εἰ δέ τις χήρα,"ἢ ἔκγονα ἔχει, μανθανέτωσαν πρῶτον τὸν ἴδιον οἶκον εὐσεβεῖν καὶ ἀμοιβὰς ἀποδιδόναι τοῖς"
τέκνῳ,τέκνον,—,—,—,—,neuter,dative,singular,2 Timothy 1:2,Τιμοθέῳ ἀγαπητῷ,", χάρις ἔλεος εἰρήνη ἀπὸ θεοῦ πατρὸς καὶ Χριστοῦ Ἰησοῦ τοῦ κυρίου ἡμῶν."
τέκνον,τέκνον,—,—,—,—,neuter,vocative,singular,2 Timothy 2:1,"Σὺ οὖν,","μου, ἐνδυναμοῦ ἐν τῇ χάριτι τῇ ἐν Χριστῷ Ἰησοῦ,"
τέκνῳ,τέκνον,—,—,—,—,neuter,dative,singular,Titus 1:4,Τίτῳ γνησίῳ,"κατὰ κοινὴν πίστιν, χάρις καὶ εἰρήνη ἀπὸ θεοῦ πατρὸς καὶ Χριστοῦ Ἰησοῦ τοῦ σωτῆρος ἡμῶν."
τέκνα,τέκνον,—,—,—,—,neuter,accusative,plural,Titus 1:6,"εἴ τίς ἐστιν ἀνέγκλητος, μιᾶς γυναικὸς ἀνήρ,","ἔχων πιστά, μὴ ἐν κατηγορίᾳ ἀσωτίας ἢ ἀνυπότακτα."
τέκνου,τέκνον,—,—,—,—,neuter,genitive,singular,Philemon 10,παρακαλῶ σε περὶ τοῦ ἐμοῦ,", ὃν  ἐγέννησα ἐν τοῖς δεσμοῖς, Ὀνήσιμον,"
τέκνα,τέκνον,—,—,—,—,neuter,nominative,plural,1 Peter 1:14,ὡς,"ὑπακοῆς μὴ συσχηματιζόμενοι ταῖς πρότερον ἐν τῇ ἀγνοίᾳ ὑμῶν ἐπιθυμίαις,"
τέκνα,τέκνον,—,—,—,—,neuter,"nominative, accusative",plural,1 Peter 3:6,ὡς Σάρρα ὑπήκουσεν τῷ Ἀβραὰμ κύριον αὐτὸν καλοῦσα ἧς ἐγενήθητε,ἀγαθοποιοῦσαι καὶ μὴ φοβούμεναι μηδεμίαν πτόησιν.
τέκνα,τέκνον,—,—,—,—,neuter,nominative,plural,2 Peter 2:14,"ὀφθαλμοὺς ἔχοντες μεστοὺς μοιχαλίδος καὶ ἀκαταπαύστους ἁμαρτίας, δελεάζοντες ψυχὰς ἀστηρίκτους, καρδίαν γεγυμνασμένην πλεονεξίας ἔχοντες, κατάρας",.
τέκνα,τέκνον,—,—,—,—,neuter,"nominative, accusative",plural,1 John 3:1,"Ἴδετε ποταπὴν ἀγάπην δέδωκεν ἡμῖν ὁ πατήρ, ἵνα","θεοῦ κληθῶμεν, καὶ ἐσμέν. διὰ τοῦτο ὁ κόσμος οὐ γινώσκει ἡμᾶς, ὅτι οὐκ ἔγνω αὐτόν."
τέκνα,τέκνον,—,—,—,—,neuter,nominative,plural,1 John 3:2,ἀγαπητοὶ νῦν,"θεοῦ ἐσμεν, καὶ οὔπω ἐφανερώθη τί ἐσόμεθα. οἴδαμεν  ὅτι ἐὰν φανερωθῇ, ὅμοιοι αὐτῷ"
τέκνα,τέκνον,—,—,—,—,neuter,nominative,plural,1 John 3:10,ἐν τούτῳ φανερά ἐστιν τὰ,τοῦ θεοῦ καὶ τὰ τέκνα τοῦ διαβόλου· πᾶς ὁ μὴ ποιῶν δικαιοσύνην οὐκ
