Result,Lemma (Greek),Tense (Logos Greek),Voice (Logos Greek),Mood (Logos Greek),Person (Logos Greek),Gender (Logos Greek),Case (Logos Greek),Number (Logos Greek),Part of Speech,Reference,Previous Context,Next Context
Κατʼ,κατά,—,—,—,—,—,—,—,preposition,Acts 12:1,—,ἐκεῖνον δὲ τὸν καιρὸν ἐπέβαλεν Ἡρῴδης ὁ βασιλεὺς τὰς χεῖρας κακῶσαί τινας τῶν ἀπὸ τῆς ἐκκλησίας.
Κατὰ,κατά,—,—,—,—,—,—,—,preposition,Matthew 27:15,—,δὲ ἑορτὴν εἰώθει ὁ ἡγεμὼν ἀπολύειν ἕνα τῷ ὄχλῳ δέσμιον ὃν ἤθελον.
Κατὰ,κατά,—,—,—,—,—,—,—,preposition,Mark 15:6,—,δὲ ἑορτὴν ἀπέλυεν αὐτοῖς ἕνα δέσμιον ὃν παρῃτοῦντο.
Κατὰ,κατά,—,—,—,—,—,—,—,preposition,Acts 16:25,—,"δὲ τὸ μεσονύκτιον Παῦλος καὶ Σιλᾶς προσευχόμενοι ὕμνουν τὸν θεόν, ἐπηκροῶντο δὲ αὐτῶν οἱ δέσμιοι."
Κατὰ,κατά,—,—,—,—,—,—,—,preposition,1 Corinthians 3:10,—,"τὴν χάριν τοῦ θεοῦ τὴν δοθεῖσάν μοι ὡς σοφὸς ἀρχιτέκτων θεμέλιον ἔθηκα, ἄλλος"
Κατὰ,κατά,—,—,—,—,—,—,—,preposition,Hebrews 11:13,—,"πίστιν ἀπέθανον οὗτοι πάντες, μὴ λαβόντες τὰς ἐπαγγελίας ἀλλὰ πόρρωθεν αὐτὰς ἰδόντες καὶ"
καθʼ,κατά,—,—,—,—,—,—,—,preposition,Matthew 5:11,μακάριοί ἐστε        ὅταν ὀνειδίσωσιν ὑμᾶς καὶ διώξωσιν καὶ εἴπωσιν πᾶν πονηρὸν,ὑμῶν [ψευδόμενοι] ἕνεκεν ἐμοῦ.
καθʼ,κατά,—,—,—,—,—,—,—,preposition,Matthew 12:25,Εἰδὼς δὲ τὰς ἐνθυμήσεις αὐτῶν εἶπεν αὐτοῖς· πᾶσα βασιλεία μερισθεῖσα,ἑαυτῆς ἐρημοῦται καὶ πᾶσα πόλις ἢ οἰκία μερισθεῖσα καθʼ ἑαυτῆς οὐ σταθήσεται.
καθʼ,κατά,—,—,—,—,—,—,—,preposition,Matthew 12:25,πᾶσα βασιλεία μερισθεῖσα καθʼ ἑαυτῆς ἐρημοῦται καὶ πᾶσα πόλις ἢ οἰκία μερισθεῖσα,ἑαυτῆς οὐ σταθήσεται.
καθʼ,κατά,—,—,—,—,—,—,—,preposition,Matthew 26:55,τοῖς ὄχλοις· ὡς ἐπὶ λῃστὴν ἐξήλθατε μετὰ μαχαιρῶν καὶ ξύλων συλλαβεῖν με;,ἡμέραν ἐν τῷ ἱερῷ ἐκαθεζόμην διδάσκων καὶ οὐκ ἐκρατήσατέ με.
καθʼ,κατά,—,—,—,—,—,—,—,preposition,Mark 9:40,ὃς γὰρ οὐκ ἔστιν,"ἡμῶν, ὑπὲρ ἡμῶν ἐστιν."
καθʼ,κατά,—,—,—,—,—,—,—,preposition,Mark 14:49,—,ἡμέραν ἤμην πρὸς ὑμᾶς ἐν τῷ ἱερῷ διδάσκων καὶ οὐκ ἐκρατήσατέ με· ἀλλʼ ἵνα πληρωθῶσιν αἱ γραφαί.
καθʼ,κατά,—,—,—,—,—,—,—,preposition,Luke 4:14,Καὶ ὑπέστρεψεν ὁ Ἰησοῦς ἐν τῇ δυνάμει τοῦ πνεύματος εἰς τὴν Γαλιλαίαν. καὶ φήμη ἐξῆλθεν,ὅλης τῆς περιχώρου περὶ αὐτοῦ.
καθʼ,κατά,—,—,—,—,—,—,—,preposition,Luke 8:39,ὑπόστρεφε εἰς τὸν οἶκόν σου καὶ διηγοῦ ὅσα σοι ἐποίησεν ὁ θεός. καὶ ἀπῆλθεν,ὅλην τὴν πόλιν κηρύσσων ὅσα ἐποίησεν αὐτῷ ὁ Ἰησοῦς.
καθʼ,κατά,—,—,—,—,—,—,—,preposition,Luke 9:23,"Ἔλεγεν δὲ πρὸς πάντας· εἴ τις θέλει ὀπίσω μου ἔρχεσθαι, ἀρνησάσθω ἑαυτὸν καὶ ἀράτω τὸν σταυρὸν αὐτοῦ",ἡμέραν καὶ ἀκολουθείτω μοι.
καθʼ,κατά,—,—,—,—,—,—,—,preposition,Luke 9:50,εἶπεν δὲ πρὸς αὐτὸν ὁ Ἰησοῦς· μὴ κωλύετε· ὃς γὰρ οὐκ ἔστιν,"ὑμῶν, ὑπὲρ ὑμῶν ἐστιν."
καθʼ,κατά,—,—,—,—,—,—,—,preposition,Luke 11:3,τὸν ἄρτον ἡμῶν τὸν ἐπιούσιον δίδου ἡμῖν τὸ,ἡμέραν·
καθʼ,κατά,—,—,—,—,—,—,—,preposition,Luke 16:19,"Ἄνθρωπος δέ τις ἦν πλούσιος , καὶ ἐνεδιδύσκετο πορφύραν καὶ βύσσον εὐφραινόμενος",ἡμέραν λαμπρῶς.
καθʼ,κατά,—,—,—,—,—,—,—,preposition,Luke 19:47,Καὶ ἦν διδάσκων τὸ,ἡμέραν ἐν τῷ ἱερῷ. οἱ δὲ ἀρχιερεῖς καὶ οἱ γραμματεῖς ἐζήτουν αὐτὸν ἀπολέσαι
καθʼ,κατά,—,—,—,—,—,—,—,preposition,Luke 22:53,—,ἡμέραν ὄντος μου μεθʼ ὑμῶν ἐν τῷ ἱερῷ οὐκ ἐξετείνατε τὰς χεῖρας ἐπʼ
καθʼ,κατά,—,—,—,—,—,—,—,preposition,Luke 23:5,οἱ δὲ ἐπίσχυον λέγοντες ὅτι ἀνασείει τὸν λαὸν διδάσκων,"ὅλης τῆς Ἰουδαίας, καὶ ἀρξάμενος ἀπὸ τῆς Γαλιλαίας ἕως ὧδε."
καθʼ,κατά,—,—,—,—,—,—,—,preposition,John 8:9,οἱ δὲ ἀκούσαντες ἐξήρχοντο εἷς,εἷς ἀρξάμενοι ἀπὸ τῶν πρεσβυτέρων  καὶ κατελείφθη μόνος καὶ ἡ γυνὴ ἐν μέσῳ οὖσα.
καθʼ,κατά,—,—,—,—,—,—,—,preposition,John 21:25,"Ἔστιν δὲ καὶ ἄλλα πολλὰ ἃ ἐποίησεν ὁ Ἰησοῦς, ἅτινα ἐὰν γράφηται","ἕν, οὐδʼ αὐτὸν οἶμαι τὸν κόσμον χωρῆσαι τὰ γραφόμενα βιβλία."
καθʼ,κατά,—,—,—,—,—,—,—,preposition,Acts 2:46,—,"ἡμέραν τε προσκαρτεροῦντες ὁμοθυμαδὸν ἐν τῷ ἱερῷ, κλῶντές τε κατʼ οἶκον ἄρτον, μετελάμβανον"
καθʼ,κατά,—,—,—,—,—,—,—,preposition,Acts 2:47,αἰνοῦντες τὸν θεὸν καὶ ἔχοντες χάριν πρὸς ὅλον τὸν λαόν. ὁ δὲ κύριος προσετίθει τοὺς σῳζομένους,ἡμέραν ἐπὶ τὸ αὐτό.
καθʼ,κατά,—,—,—,—,—,—,—,preposition,Acts 3:2,"καί  τις ἀνὴρ χωλὸς ἐκ κοιλίας μητρὸς αὐτοῦ ὑπάρχων ἐβαστάζετο, ὃν ἐτίθουν",ἡμέραν πρὸς τὴν θύραν τοῦ ἱεροῦ τὴν λεγομένην Ὡραίαν τοῦ αἰτεῖν ἐλεημοσύνην παρὰ
καθʼ,κατά,—,—,—,—,—,—,—,preposition,Acts 9:31,Ἡ μὲν οὖν ἐκκλησία,ὅλης τῆς Ἰουδαίας καὶ Γαλιλαίας καὶ Σαμαρείας εἶχεν εἰρήνην οἰκοδομουμένη καὶ πορευομένη τῷ
καθʼ,κατά,—,—,—,—,—,—,—,preposition,Acts 9:42,γνωστὸν δὲ ἐγένετο,ὅλης τῆς Ἰόππης καὶ ἐπίστευσαν πολλοὶ ἐπὶ τὸν κύριον.
καθʼ,κατά,—,—,—,—,—,—,—,preposition,Acts 10:37,ὑμεῖς οἴδατε τὸ γενόμενον ῥῆμα,"ὅλης τῆς Ἰουδαίας, ἀρξάμενος  ἀπὸ τῆς Γαλιλαίας μετὰ τὸ βάπτισμα ὃ ἐκήρυξεν Ἰωάννης,"
καθʼ,κατά,—,—,—,—,—,—,—,preposition,Acts 15:11,ἀλλὰ διὰ τῆς χάριτος τοῦ κυρίου Ἰησοῦ  πιστεύομεν σωθῆναι,ὃν τρόπον κἀκεῖνοι.
καθʼ,κατά,—,—,—,—,—,—,—,preposition,Acts 16:5,Αἱ μὲν οὖν ἐκκλησίαι ἐστερεοῦντο τῇ πίστει καὶ ἐπερίσσευον τῷ ἀριθμῷ,ἡμέραν.
καθʼ,κατά,—,—,—,—,—,—,—,preposition,Acts 17:11,"οὗτοι δὲ ἦσαν εὐγενέστεροι τῶν ἐν Θεσσαλονίκῃ, οἵτινες ἐδέξαντο τὸν λόγον μετὰ πάσης προθυμίας",ἡμέραν ἀνακρίνοντες τὰς γραφὰς εἰ ἔχοι ταῦτα οὕτως.
καθʼ,κατά,—,—,—,—,—,—,—,preposition,Acts 17:28,"ἐν αὐτῷ γὰρ ζῶμεν καὶ κινούμεθα καὶ ἐσμέν,  ὡς καί τινες τῶν",ὑμᾶς ποιητῶν εἰρήκασιν·             τοῦ γὰρ καὶ γένος ἐσμέν.
καθʼ,κατά,—,—,—,—,—,—,—,preposition,Acts 18:15,εἰ δὲ ζητήματά ἐστιν περὶ λόγου καὶ ὀνομάτων καὶ νόμου τοῦ,"ὑμᾶς, ὄψεσθε αὐτοί· κριτὴς  ἐγὼ τούτων οὐ βούλομαι εἶναι."
καθʼ,κατά,—,—,—,—,—,—,—,preposition,Acts 19:9,"ὡς δέ τινες ἐσκληρύνοντο καὶ ἠπείθουν κακολογοῦντες τὴν ὁδὸν ἐνώπιον τοῦ πλήθους, ἀποστὰς ἀπʼ αὐτῶν ἀφώρισεν τοὺς μαθητὰς",ἡμέραν διαλεγόμενος ἐν τῇ σχολῇ Τυράννου.
καθʼ,κατά,—,—,—,—,—,—,—,preposition,Acts 21:19,καὶ ἀσπασάμενος αὐτοὺς ἐξηγεῖτο,"ἓν ἕκαστον, ὧν ἐποίησεν ὁ θεὸς ἐν τοῖς ἔθνεσιν διὰ τῆς διακονίας αὐτοῦ."
καθʼ,κατά,—,—,—,—,—,—,—,preposition,Acts 24:22,"τὰ περὶ τῆς ὁδοῦ εἴπας·  ὅταν Λυσίας ὁ χιλίαρχος καταβῇ, διαγνώσομαι τὰ",ὑμᾶς·
καθʼ,κατά,—,—,—,—,—,—,—,preposition,Acts 27:25,"διὸ εὐθυμεῖτε, ἄνδρες· πιστεύω γὰρ τῷ θεῷ ὅτι οὕτως ἔσται",ὃν τρόπον λελάληταί μοι.
καθʼ,κατά,—,—,—,—,—,—,—,preposition,Acts 28:16,"Ὅτε δὲ εἰσήλθομεν εἰς  Ῥώμην, ἐπετράπη τῷ Παύλῳ μένειν",ἑαυτὸν  σὺν τῷ φυλάσσοντι αὐτὸν στρατιώτῃ.
καθʼ,κατά,—,—,—,—,—,—,—,preposition,Romans 2:7,τοῖς μὲν,"ὑπομονὴν ἔργου ἀγαθοῦ δόξαν καὶ τιμὴν καὶ ἀφθαρσίαν ζητοῦσιν ζωὴν αἰώνιον,"
καθʼ,κατά,—,—,—,—,—,—,—,preposition,Romans 7:13,"ἁμαρτία, ἵνα φανῇ ἁμαρτία, διὰ τοῦ ἀγαθοῦ μοι κατεργαζομένη θάνατον, ἵνα γένηται",ὑπερβολὴν ἁμαρτωλὸς ἡ ἁμαρτία διὰ τῆς ἐντολῆς.
καθʼ,κατά,—,—,—,—,—,—,—,preposition,Romans 8:31,"Τί οὖν ἐροῦμεν πρὸς ταῦτα; εἰ ὁ θεὸς ὑπὲρ ἡμῶν, τίς",ἡμῶν;
καθʼ,κατά,—,—,—,—,—,—,—,preposition,Romans 12:5,"οὕτως οἱ πολλοὶ ἓν σῶμά ἐσμεν ἐν Χριστῷ, τὸ δὲ",εἷς ἀλλήλων μέλη.
καθʼ,κατά,—,—,—,—,—,—,—,preposition,1 Corinthians 2:1,"Κἀγὼ ἐλθὼν πρὸς ὑμᾶς, ἀδελφοί, ἦλθον οὐ",ὑπεροχὴν λόγου ἢ σοφίας καταγγέλλων ὑμῖν τὸ μυστήριον τοῦ θεοῦ.
καθʼ,κατά,—,—,—,—,—,—,—,preposition,1 Corinthians 12:31,ζηλοῦτε δὲ τὰ χαρίσματα τὰ μείζονα.  Καὶ ἔτι,ὑπερβολὴν ὁδὸν ὑμῖν δείκνυμι.
καθʼ,κατά,—,—,—,—,—,—,—,preposition,1 Corinthians 14:31,δύνασθε γὰρ,"ἕνα πάντες προφητεύειν, ἵνα πάντες μανθάνωσιν καὶ πάντες παρακαλῶνται."
καθʼ,κατά,—,—,—,—,—,—,—,preposition,1 Corinthians 15:31,—,"ἡμέραν ἀποθνῄσκω, νὴ τὴν ὑμετέραν καύχησιν, [ἀδελφοί], ἣν ἔχω ἐν Χριστῷ Ἰησοῦ τῷ κυρίῳ ἡμῶν."
καθʼ,κατά,—,—,—,—,—,—,—,preposition,2 Corinthians 1:8,"Οὐ γὰρ θέλομεν ὑμᾶς ἀγνοεῖν, ἀδελφοί, ὑπὲρ τῆς θλίψεως ἡμῶν τῆς γενομένης  ἐν τῇ Ἀσίᾳ, ὅτι",ὑπερβολὴν ὑπὲρ δύναμιν ἐβαρήθημεν ὥστε ἐξαπορηθῆναι ἡμᾶς καὶ τοῦ ζῆν·
καθʼ,κατά,—,—,—,—,—,—,—,preposition,2 Corinthians 4:17,τὸ γὰρ παραυτίκα  ἐλαφρὸν τῆς θλίψεως ἡμῶν,"ὑπερβολὴν εἰς ὑπερβολὴν αἰώνιον βάρος δόξης κατεργάζεται ἡμῖν,"
καθʼ,κατά,—,—,—,—,—,—,—,preposition,2 Corinthians 11:28,χωρὶς τῶν παρεκτὸς ἡ ἐπίστασίς μοι ἡ,"ἡμέραν, ἡ μέριμνα πασῶν τῶν ἐκκλησιῶν."
καθʼ,κατά,—,—,—,—,—,—,—,preposition,Galatians 1:13,"Ἠκούσατε γὰρ τὴν ἐμὴν ἀναστροφήν ποτε ἐν τῷ Ἰουδαϊσμῷ, ὅτι","ὑπερβολὴν ἐδίωκον τὴν ἐκκλησίαν τοῦ θεοῦ καὶ ἐπόρθουν αὐτήν,"
καθʼ,κατά,—,—,—,—,—,—,—,preposition,Ephesians 1:15,Διὰ τοῦτο κἀγὼ ἀκούσας τὴν,ὑμᾶς πίστιν ἐν τῷ κυρίῳ Ἰησοῦ καὶ τὴν ἀγάπην τὴν εἰς πάντας τοὺς ἁγίους
καθʼ,κατά,—,—,—,—,—,—,—,preposition,Ephesians 5:33,πλὴν καὶ ὑμεῖς οἱ,"ἕνα, ἕκαστος τὴν ἑαυτοῦ γυναῖκα οὕτως ἀγαπάτω ὡς ἑαυτόν, ἡ δὲ γυνὴ ἵνα φοβῆται τὸν ἄνδρα."
καθʼ,κατά,—,—,—,—,—,—,—,preposition,Philippians 4:11,οὐχ ὅτι,"ὑστέρησιν λέγω, ἐγὼ γὰρ ἔμαθον ἐν οἷς εἰμι αὐτάρκης εἶναι."
καθʼ,κατά,—,—,—,—,—,—,—,preposition,Colossians 2:14,ἐξαλείψας τὸ,"ἡμῶν χειρόγραφον τοῖς δόγμασιν ὃ ἦν ὑπεναντίον ἡμῖν, καὶ αὐτὸ ἦρκεν ἐκ τοῦ"
καθʼ,κατά,—,—,—,—,—,—,—,preposition,Hebrews 3:3,"πλείονος γὰρ οὗτος δόξης παρὰ Μωϋσῆν ἠξίωται,",ὅσον πλείονα τιμὴν ἔχει τοῦ οἴκου ὁ κατασκευάσας αὐτόν·
καθʼ,κατά,—,—,—,—,—,—,—,preposition,Hebrews 3:13,ἀλλὰ παρακαλεῖτε ἑαυτοὺς,"ἑκάστην ἡμέραν, ἄχρις οὗ τὸ σήμερον καλεῖται, ἵνα μὴ σκληρυνθῇ τις ἐξ ὑμῶν ἀπάτῃ τῆς ἁμαρτίας —"
καθʼ,κατά,—,—,—,—,—,—,—,preposition,Hebrews 4:15,"οὐ γὰρ ἔχομεν ἀρχιερέα μὴ δυνάμενον συμπαθῆσαι ταῖς ἀσθενείαις ἡμῶν, πεπειρασμένον δὲ κατὰ πάντα",ὁμοιότητα χωρὶς ἁμαρτίας.
καθʼ,κατά,—,—,—,—,—,—,—,preposition,Hebrews 6:13,"Τῷ γὰρ Ἀβραὰμ ἐπαγγειλάμενος ὁ θεός, ἐπεὶ κατʼ οὐδενὸς εἶχεν μείζονος ὀμόσαι, ὤμοσεν",ἑαυτοῦ
καθʼ,κατά,—,—,—,—,—,—,—,preposition,Hebrews 7:20,Καὶ,"ὅσον οὐ χωρὶς ὁρκωμοσίας· οἱ μὲν γὰρ χωρὶς ὁρκωμοσίας εἰσὶν ἱερεῖς γεγονότες,"
καθʼ,κατά,—,—,—,—,—,—,—,preposition,Hebrews 7:27,ὃς οὐκ ἔχει,"ἡμέραν ἀνάγκην, ὥσπερ οἱ ἀρχιερεῖς, πρότερον ὑπὲρ τῶν ἰδίων ἁμαρτιῶν θυσίας ἀναφέρειν ἔπειτα"
καθʼ,κατά,—,—,—,—,—,—,—,preposition,Hebrews 9:9,"ἥτις  παραβολὴ εἰς τὸν καιρὸν τὸν ἐνεστηκότα,","ἣν δῶρά τε καὶ θυσίαι προσφέρονται μὴ δυνάμεναι κατὰ συνείδησιν τελειῶσαι τὸν λατρεύοντα,"
καθʼ,κατά,—,—,—,—,—,—,—,preposition,Hebrews 9:27,καὶ,"ὅσον ἀπόκειται τοῖς ἀνθρώποις ἅπαξ ἀποθανεῖν, μετὰ δὲ τοῦτο κρίσις,"
καθʼ,κατά,—,—,—,—,—,—,—,preposition,Hebrews 10:11,Καὶ πᾶς μὲν ἱερεὺς ἕστηκεν,"ἡμέραν λειτουργῶν καὶ τὰς αὐτὰς πολλάκις προσφέρων θυσίας, αἵτινες οὐδέποτε δύνανται περιελεῖν ἁμαρτίας,"
καθʼ,κατά,—,—,—,—,—,—,—,preposition,James 2:17,"οὕτως καὶ ἡ πίστις, ἐὰν μὴ ἔχῃ ἔργα, νεκρά ἐστιν",ἑαυτήν.
καθʼ,κατά,—,—,—,—,—,—,—,preposition,James 3:9,ἐν αὐτῇ εὐλογοῦμεν τὸν κύριον καὶ πατέρα καὶ ἐν αὐτῇ καταρώμεθα τοὺς ἀνθρώπους τοὺς,ὁμοίωσιν θεοῦ γεγονότας·
καθʼ,κατά,—,—,—,—,—,—,—,preposition,Revelation 4:8,"καὶ τὰ τέσσαρα ζῷα, ἓν","ἓν αὐτῶν ἔχων ἀνὰ πτέρυγας ἕξ, κυκλόθεν καὶ ἔσωθεν γέμουσιν ὀφθαλμῶν, καὶ ἀνάπαυσιν"
κατʼ,κατά,—,—,—,—,—,—,—,preposition,Matthew 1:20,ταῦτα δὲ αὐτοῦ ἐνθυμηθέντος ἰδοὺ ἄγγελος κυρίου,"ὄναρ ἐφάνη αὐτῷ λέγων· Ἰωσὴφ υἱὸς Δαυίδ, μὴ φοβηθῇς παραλαβεῖν Μαρίαν τὴν γυναῖκά"
κατʼ,κατά,—,—,—,—,—,—,—,preposition,Matthew 2:12,Καὶ χρηματισθέντες,"ὄναρ μὴ ἀνακάμψαι πρὸς Ἡρῴδην, διʼ ἄλλης ὁδοῦ ἀνεχώρησαν εἰς τὴν χώραν αὐτῶν."
κατʼ,κατά,—,—,—,—,—,—,—,preposition,Matthew 2:13,Ἀναχωρησάντων δὲ αὐτῶν  ἰδοὺ ἄγγελος κυρίου φαίνεται,ὄναρ τῷ Ἰωσὴφ λέγων· ἐγερθεὶς παράλαβε τὸ παιδίον καὶ τὴν μητέρα αὐτοῦ καὶ
κατʼ,κατά,—,—,—,—,—,—,—,preposition,Matthew 2:19,Τελευτήσαντος δὲ τοῦ Ἡρῴδου ἰδοὺ ἄγγελος κυρίου φαίνεται,ὄναρ τῷ Ἰωσὴφ ἐν Αἰγύπτῳ
κατʼ,κατά,—,—,—,—,—,—,—,preposition,Matthew 2:22,Ἀκούσας δὲ ὅτι Ἀρχέλαος βασιλεύει τῆς Ἰουδαίας ἀντὶ τοῦ πατρὸς αὐτοῦ Ἡρῴδου ἐφοβήθη ἐκεῖ ἀπελθεῖν· χρηματισθεὶς δὲ,"ὄναρ ἀνεχώρησεν εἰς τὰ μέρη τῆς Γαλιλαίας,"
κατʼ,κατά,—,—,—,—,—,—,—,preposition,Matthew 12:14,Ἐξελθόντες δὲ οἱ Φαρισαῖοι συμβούλιον ἔλαβον,αὐτοῦ ὅπως αὐτὸν ἀπολέσωσιν.
κατʼ,κατά,—,—,—,—,—,—,—,preposition,Matthew 12:30,ὁ μὴ ὢν μετʼ ἐμοῦ,"ἐμοῦ ἐστιν, καὶ ὁ μὴ συνάγων μετʼ ἐμοῦ σκορπίζει."
κατʼ,κατά,—,—,—,—,—,—,—,preposition,Matthew 14:13,Ἀκούσας δὲ ὁ Ἰησοῦς ἀνεχώρησεν ἐκεῖθεν ἐν πλοίῳ εἰς ἔρημον τόπον,ἰδίαν· καὶ ἀκούσαντες οἱ ὄχλοι ἠκολούθησαν αὐτῷ πεζῇ ἀπὸ τῶν πόλεων.
κατʼ,κατά,—,—,—,—,—,—,—,preposition,Matthew 14:23,καὶ ἀπολύσας τοὺς ὄχλους ἀνέβη εἰς τὸ ὄρος,ἰδίαν προσεύξασθαι.  ὀψίας δὲ γενομένης μόνος ἦν ἐκεῖ.
κατʼ,κατά,—,—,—,—,—,—,—,preposition,Matthew 17:1,Ἰάκωβον καὶ Ἰωάννην τὸν ἀδελφὸν αὐτοῦ καὶ ἀναφέρει αὐτοὺς εἰς ὄρος ὑψηλὸν,ἰδίαν.
κατʼ,κατά,—,—,—,—,—,—,—,preposition,Matthew 17:19,Τότε προσελθόντες οἱ μαθηταὶ τῷ Ἰησοῦ,ἰδίαν εἶπον· διὰ τί ἡμεῖς οὐκ ἠδυνήθημεν ἐκβαλεῖν αὐτό;
κατʼ,κατά,—,—,—,—,—,—,—,preposition,Matthew 20:17,Καὶ ἀναβαίνων ὁ Ἰησοῦς εἰς Ἱεροσόλυμα παρέλαβεν τοὺς δώδεκα [μαθητὰς],ἰδίαν καὶ ἐν τῇ ὁδῷ εἶπεν αὐτοῖς·
κατʼ,κατά,—,—,—,—,—,—,—,preposition,Matthew 24:3,Καθημένου δὲ αὐτοῦ ἐπὶ τοῦ ὄρους τῶν ἐλαιῶν προσῆλθον αὐτῷ οἱ μαθηταὶ,"ἰδίαν λέγοντες· εἰπὲ ἡμῖν, πότε ταῦτα ἔσται καὶ τί τὸ σημεῖον τῆς σῆς"
κατʼ,κατά,—,—,—,—,—,—,—,preposition,Matthew 27:19,αὐτοῦ λέγουσα· μηδὲν σοὶ καὶ τῷ δικαίῳ ἐκείνῳ· πολλὰ γὰρ ἔπαθον σήμερον,ὄναρ διʼ αὐτόν.
κατʼ,κατά,—,—,—,—,—,—,—,preposition,Mark 1:27,καὶ ἐθαμβήθησαν ἅπαντες ὥστε συζητεῖν πρὸς ἑαυτοὺς λέγοντας· τί ἐστιν τοῦτο; διδαχὴ καινὴ,"ἐξουσίαν· καὶ τοῖς πνεύμασιν τοῖς ἀκαθάρτοις ἐπιτάσσει, καὶ ὑπακούουσιν αὐτῷ."
κατʼ,κατά,—,—,—,—,—,—,—,preposition,Mark 3:6,Καὶ ἐξελθόντες οἱ Φαρισαῖοι εὐθὺς μετὰ τῶν Ἡρῳδιανῶν συμβούλιον ἐδίδουν,αὐτοῦ ὅπως αὐτὸν ἀπολέσωσιν.
κατʼ,κατά,—,—,—,—,—,—,—,preposition,Mark 4:34,"χωρὶς δὲ παραβολῆς οὐκ ἐλάλει αὐτοῖς,",ἰδίαν δὲ τοῖς ἰδίοις μαθηταῖς ἐπέλυεν πάντα.
κατʼ,κατά,—,—,—,—,—,—,—,preposition,Mark 6:31,καὶ λέγει αὐτοῖς·  δεῦτε ὑμεῖς αὐτοὶ,ἰδίαν εἰς ἔρημον τόπον καὶ ἀναπαύσασθε ὀλίγον. ἦσαν γὰρ οἱ ἐρχόμενοι καὶ οἱ
κατʼ,κατά,—,—,—,—,—,—,—,preposition,Mark 6:32,Καὶ ἀπῆλθον ἐν τῷ πλοίῳ εἰς ἔρημον τόπον,ἰδίαν.
κατʼ,κατά,—,—,—,—,—,—,—,preposition,Mark 7:33,καὶ ἀπολαβόμενος αὐτὸν ἀπὸ τοῦ ὄχλου,"ἰδίαν ἔβαλεν τοὺς δακτύλους αὐτοῦ εἰς τὰ ὦτα αὐτοῦ καὶ πτύσας ἥψατο τῆς γλώσσης αὐτοῦ,"
κατʼ,κατά,—,—,—,—,—,—,—,preposition,Mark 9:2,καὶ τὸν Ἰάκωβον καὶ τὸν Ἰωάννην καὶ ἀναφέρει αὐτοὺς εἰς ὄρος ὑψηλὸν,"ἰδίαν μόνους. καὶ  μετεμορφώθη ἔμπροσθεν αὐτῶν,"
κατʼ,κατά,—,—,—,—,—,—,—,preposition,Mark 9:28,Καὶ εἰσελθόντος αὐτοῦ εἰς οἶκον οἱ μαθηταὶ αὐτοῦ,ἰδίαν ἐπηρώτων αὐτόν· ὅτι ἡμεῖς οὐκ ἠδυνήθημεν ἐκβαλεῖν αὐτό;
κατʼ,κατά,—,—,—,—,—,—,—,preposition,Mark 13:3,Καὶ καθημένου αὐτοῦ εἰς τὸ ὄρος τῶν ἐλαιῶν κατέναντι τοῦ ἱεροῦ ἐπηρώτα αὐτὸν,ἰδίαν  Πέτρος καὶ Ἰάκωβος καὶ Ἰωάννης καὶ Ἀνδρέας·
κατʼ,κατά,—,—,—,—,—,—,—,preposition,Mark 14:56,πολλοὶ γὰρ ἐψευδομαρτύρουν,"αὐτοῦ, καὶ ἴσαι αἱ μαρτυρίαι οὐκ ἦσαν."
κατʼ,κατά,—,—,—,—,—,—,—,preposition,Mark 14:57,καί τινες ἀναστάντες ἐψευδομαρτύρουν,αὐτοῦ λέγοντες
κατʼ,κατά,—,—,—,—,—,—,—,preposition,Luke 2:41,Καὶ ἐπορεύοντο οἱ γονεῖς αὐτοῦ,ἔτος εἰς Ἰερουσαλὴμ τῇ ἑορτῇ τοῦ πάσχα.
κατʼ,κατά,—,—,—,—,—,—,—,preposition,Luke 9:10,Καὶ ὑποστρέψαντες οἱ ἀπόστολοι διηγήσαντο αὐτῷ ὅσα ἐποίησαν. Καὶ παραλαβὼν αὐτοὺς ὑπεχώρησεν,ἰδίαν εἰς πόλιν καλουμένην Βηθσαϊδά.
