Result,Lemma (Greek),Tense (Logos Greek),Voice (Logos Greek),Mood (Logos Greek),Person (Logos Greek),Gender (Logos Greek),Case (Logos Greek),Number (Logos Greek),Part of Speech,Reference,Previous Context,Next Context
Εἰς,εἰς,—,—,—,—,—,—,—,preposition,Matthew 10:11,—,"ἣν δʼ ἂν πόλιν ἢ κώμην εἰσέλθητε, ἐξετάσατε τίς ἐν αὐτῇ ἄξιός ἐστιν"
Εἰς,εἰς,—,—,—,—,—,—,—,preposition,2 Thessalonians 1:11,—,"ὃ καὶ προσευχόμεθα πάντοτε περὶ ὑμῶν, ἵνα ὑμᾶς ἀξιώσῃ τῆς κλήσεως ὁ θεὸς"
εἰς,εἰς,—,—,—,—,—,—,—,preposition,Matthew 2:1,"Τοῦ δὲ Ἰησοῦ γεννηθέντος ἐν Βηθλέεμ τῆς Ἰουδαίας ἐν ἡμέραις Ἡρῴδου τοῦ βασιλέως, ἰδοὺ μάγοι ἀπὸ ἀνατολῶν παρεγένοντο",Ἱεροσόλυμα
εἰς,εἰς,—,—,—,—,—,—,—,preposition,Matthew 2:8,καὶ πέμψας αὐτοὺς,"Βηθλέεμ εἶπεν· πορευθέντες ἐξετάσατε ἀκριβῶς περὶ τοῦ παιδίου· ἐπὰν δὲ εὕρητε, ἀπαγγείλατέ μοι"
εἰς,εἰς,—,—,—,—,—,—,—,preposition,Matthew 2:11,καὶ ἐλθόντες,"τὴν οἰκίαν εἶδον τὸ παιδίον μετὰ Μαρίας τῆς μητρὸς αὐτοῦ, καὶ πεσόντες προσεκύνησαν"
εἰς,εἰς,—,—,—,—,—,—,—,preposition,Matthew 2:12,"Καὶ χρηματισθέντες κατʼ ὄναρ μὴ ἀνακάμψαι πρὸς Ἡρῴδην, διʼ ἄλλης ὁδοῦ ἀνεχώρησαν",τὴν χώραν αὐτῶν.
εἰς,εἰς,—,—,—,—,—,—,—,preposition,Matthew 2:13,Ἰωσὴφ λέγων· ἐγερθεὶς παράλαβε τὸ παιδίον καὶ τὴν μητέρα αὐτοῦ καὶ φεῦγε,Αἴγυπτον καὶ ἴσθι ἐκεῖ ἕως ἂν εἴπω σοι· μέλλει γὰρ Ἡρῴδης ζητεῖν τὸ παιδίον τοῦ ἀπολέσαι αὐτό.
εἰς,εἰς,—,—,—,—,—,—,—,preposition,Matthew 2:14,ὁ δὲ ἐγερθεὶς παρέλαβεν τὸ παιδίον καὶ τὴν μητέρα αὐτοῦ νυκτὸς καὶ ἀνεχώρησεν,"Αἴγυπτον,"
εἰς,εἰς,—,—,—,—,—,—,—,preposition,Matthew 2:20,λέγων· ἐγερθεὶς παράλαβε τὸ παιδίον καὶ τὴν μητέρα αὐτοῦ καὶ πορεύου,γῆν Ἰσραήλ· τεθνήκασιν γὰρ οἱ ζητοῦντες τὴν ψυχὴν τοῦ παιδίου.
εἰς,εἰς,—,—,—,—,—,—,—,preposition,Matthew 2:21,ὁ δὲ ἐγερθεὶς παρέλαβεν τὸ παιδίον καὶ τὴν μητέρα αὐτοῦ καὶ εἰσῆλθεν,γῆν Ἰσραήλ.
εἰς,εἰς,—,—,—,—,—,—,—,preposition,Matthew 2:22,τοῦ πατρὸς αὐτοῦ Ἡρῴδου ἐφοβήθη ἐκεῖ ἀπελθεῖν· χρηματισθεὶς δὲ κατʼ ὄναρ ἀνεχώρησεν,"τὰ μέρη τῆς Γαλιλαίας,"
εἰς,εἰς,—,—,—,—,—,—,—,preposition,Matthew 2:23,καὶ ἐλθὼν κατῴκησεν,πόλιν λεγομένην Ναζαρέτ· ὅπως πληρωθῇ τὸ ῥηθὲν διὰ τῶν προφητῶν ὅτι Ναζωραῖος κληθήσεται.
εἰς,εἰς,—,—,—,—,—,—,—,preposition,Matthew 3:10,τῶν δένδρων κεῖται· πᾶν οὖν δένδρον μὴ ποιοῦν καρπὸν καλὸν ἐκκόπτεται καὶ,πῦρ βάλλεται.
εἰς,εἰς,—,—,—,—,—,—,—,preposition,Matthew 3:11,Ἐγὼ μὲν ὑμᾶς βαπτίζω ἐν ὕδατι,"μετάνοιαν, ὁ δὲ ὀπίσω μου ἐρχόμενος ἰσχυρότερός μού ἐστιν, οὗ οὐκ εἰμὶ ἱκανὸς"
εἰς,εἰς,—,—,—,—,—,—,—,preposition,Matthew 3:12,οὗ τὸ πτύον ἐν τῇ χειρὶ αὐτοῦ καὶ διακαθαριεῖ τὴν ἅλωνα αὐτοῦ καὶ συνάξει τὸν σῖτον αὐτοῦ,"τὴν ἀποθήκην, τὸ δὲ ἄχυρον κατακαύσει πυρὶ ἀσβέστῳ."
εἰς,εἰς,—,—,—,—,—,—,—,preposition,Matthew 4:1,Τότε ὁ Ἰησοῦς ἀνήχθη,τὴν ἔρημον ὑπὸ τοῦ πνεύματος πειρασθῆναι ὑπὸ τοῦ διαβόλου.
εἰς,εἰς,—,—,—,—,—,—,—,preposition,Matthew 4:5,Τότε παραλαμβάνει αὐτὸν ὁ διάβολος,τὴν ἁγίαν πόλιν καὶ ἔστησεν αὐτὸν ἐπὶ τὸ πτερύγιον τοῦ ἱεροῦ
εἰς,εἰς,—,—,—,—,—,—,—,preposition,Matthew 4:8,Πάλιν παραλαμβάνει αὐτὸν ὁ διάβολος,ὄρος ὑψηλὸν λίαν καὶ δείκνυσιν αὐτῷ πάσας τὰς βασιλείας τοῦ κόσμου καὶ τὴν δόξαν αὐτῶν
εἰς,εἰς,—,—,—,—,—,—,—,preposition,Matthew 4:12,Ἀκούσας δὲ  ὅτι Ἰωάννης παρεδόθη ἀνεχώρησεν,τὴν Γαλιλαίαν.
εἰς,εἰς,—,—,—,—,—,—,—,preposition,Matthew 4:13,καὶ καταλιπὼν τὴν Ναζαρὰ ἐλθὼν κατῴκησεν,Καφαρναοὺμ τὴν παραθαλασσίαν ἐν ὁρίοις Ζαβουλὼν καὶ Νεφθαλίμ·
εἰς,εἰς,—,—,—,—,—,—,—,preposition,Matthew 4:18,"ἀδελφούς, Σίμωνα τὸν λεγόμενον Πέτρον καὶ Ἀνδρέαν τὸν ἀδελφὸν αὐτοῦ, βάλλοντας ἀμφίβληστρον",τὴν θάλασσαν· ἦσαν γὰρ ἁλιεῖς.
εἰς,εἰς,—,—,—,—,—,—,—,preposition,Matthew 4:24,Καὶ ἀπῆλθεν ἡ ἀκοὴ αὐτοῦ,ὅλην τὴν Συρίαν· καὶ προσήνεγκαν αὐτῷ πάντας τοὺς κακῶς ἔχοντας ποικίλαις νόσοις καὶ
εἰς,εἰς,—,—,—,—,—,—,—,preposition,Matthew 5:1,Ἰδὼν δὲ τοὺς ὄχλους ἀνέβη,"τὸ ὄρος, καὶ καθίσαντος αὐτοῦ προσῆλθαν αὐτῷ οἱ μαθηταὶ αὐτοῦ·"
εἰς,εἰς,—,—,—,—,—,—,—,preposition,Matthew 5:13,"Ὑμεῖς ἐστε τὸ ἅλας τῆς γῆς· ἐὰν δὲ τὸ ἅλας μωρανθῇ, ἐν τίνι ἁλισθήσεται;",οὐδὲν ἰσχύει ἔτι εἰ μὴ βληθὲν ἔξω καταπατεῖσθαι ὑπὸ τῶν ἀνθρώπων.
εἰς,εἰς,—,—,—,—,—,—,—,preposition,Matthew 5:20,"Λέγω γὰρ ὑμῖν ὅτι ἐὰν μὴ περισσεύσῃ ὑμῶν ἡ δικαιοσύνη πλεῖον τῶν γραμματέων καὶ Φαρισαίων, οὐ μὴ εἰσέλθητε",τὴν βασιλείαν τῶν οὐρανῶν.
εἰς,εἰς,—,—,—,—,—,—,—,preposition,Matthew 5:22,"ῥακά, ἔνοχος ἔσται τῷ συνεδρίῳ· ὃς δʼ ἂν εἴπῃ · μωρέ, ἔνοχος ἔσται",τὴν γέενναν τοῦ πυρός.
εἰς,εἰς,—,—,—,—,—,—,—,preposition,Matthew 5:25,σε παραδῷ ὁ ἀντίδικος τῷ κριτῇ καὶ ὁ κριτὴς  τῷ ὑπηρέτῃ καὶ,φυλακὴν βληθήσῃ·
εἰς,εἰς,—,—,—,—,—,—,—,preposition,Matthew 5:29,ἀπόληται ἓν τῶν μελῶν σου καὶ μὴ ὅλον τὸ σῶμά σου βληθῇ,γέενναν.
εἰς,εἰς,—,—,—,—,—,—,—,preposition,Matthew 5:30,ἵνα ἀπόληται ἓν τῶν μελῶν σου καὶ μὴ ὅλον τὸ σῶμά σου,γέενναν ἀπέλθῃ.
εἰς,εἰς,—,—,—,—,—,—,—,preposition,Matthew 5:35,"μήτε ἐν τῇ γῇ, ὅτι ὑποπόδιόν ἐστιν τῶν ποδῶν αὐτοῦ, μήτε","Ἱεροσόλυμα, ὅτι πόλις ἐστὶν τοῦ μεγάλου βασιλέως,"
εἰς,εἰς,—,—,—,—,—,—,—,preposition,Matthew 5:39,ἐγὼ δὲ λέγω ὑμῖν μὴ ἀντιστῆναι τῷ πονηρῷ· ἀλλʼ ὅστις σε ῥαπίζει,"τὴν δεξιὰν σιαγόνα [σου], στρέψον αὐτῷ καὶ τὴν ἄλλην·"
εἰς,εἰς,—,—,—,—,—,—,—,preposition,Matthew 6:6,"σὺ δὲ ὅταν προσεύχῃ, εἴσελθε",τὸ ταμεῖόν σου καὶ κλείσας τὴν θύραν σου πρόσευξαι τῷ πατρί σου τῷ
εἰς,εἰς,—,—,—,—,—,—,—,preposition,Matthew 6:13,καὶ μὴ εἰσενέγκῃς ἡμᾶς,"πειρασμόν,        ἀλλὰ ῥῦσαι ἡμᾶς ἀπὸ τοῦ πονηροῦ."
εἰς,εἰς,—,—,—,—,—,—,—,preposition,Matthew 6:26,ἐμβλέψατε,τὰ πετεινὰ τοῦ οὐρανοῦ ὅτι οὐ σπείρουσιν οὐδὲ θερίζουσιν οὐδὲ συνάγουσιν εἰς  ἀποθήκας
εἰς,εἰς,—,—,—,—,—,—,—,preposition,Matthew 6:26,ἐμβλέψατε εἰς τὰ πετεινὰ τοῦ οὐρανοῦ ὅτι οὐ σπείρουσιν οὐδὲ θερίζουσιν οὐδὲ συνάγουσιν,"ἀποθήκας, καὶ ὁ πατὴρ ὑμῶν ὁ οὐράνιος τρέφει αὐτά· οὐχ ὑμεῖς μᾶλλον διαφέρετε αὐτῶν;"
εἰς,εἰς,—,—,—,—,—,—,—,preposition,Matthew 6:30,εἰ δὲ τὸν χόρτον τοῦ ἀγροῦ σήμερον ὄντα καὶ αὔριον,"κλίβανον βαλλόμενον ὁ θεὸς οὕτως ἀμφιέννυσιν, οὐ πολλῷ μᾶλλον ὑμᾶς, ὀλιγόπιστοι;"
εἰς,εἰς,—,—,—,—,—,—,—,preposition,Matthew 6:34,Μὴ οὖν μεριμνήσητε,"τὴν αὔριον, ἡ γὰρ αὔριον μεριμνήσει ἑαυτῆς· ἀρκετὸν τῇ ἡμέρᾳ ἡ κακία αὐτῆς."
εἰς,εἰς,—,—,—,—,—,—,—,preposition,Matthew 7:13,Εἰσέλθατε διὰ τῆς στενῆς πύλης· ὅτι πλατεῖα ἡ πύλη καὶ εὐρύχωρος ἡ ὁδὸς ἡ ἀπάγουσα,τὴν ἀπώλειαν καὶ πολλοί εἰσιν οἱ εἰσερχόμενοι διʼ αὐτῆς·
εἰς,εἰς,—,—,—,—,—,—,—,preposition,Matthew 7:14,τί στενὴ ἡ πύλη καὶ τεθλιμμένη ἡ ὁδὸς ἡ ἀπάγουσα,τὴν ζωὴν καὶ ὀλίγοι εἰσὶν οἱ εὑρίσκοντες αὐτήν.
εἰς,εἰς,—,—,—,—,—,—,—,preposition,Matthew 7:19,πᾶν  δένδρον μὴ ποιοῦν καρπὸν καλὸν ἐκκόπτεται καὶ,πῦρ βάλλεται.
εἰς,εἰς,—,—,—,—,—,—,—,preposition,Matthew 7:21,"Οὐ πᾶς ὁ λέγων μοι· κύριε κύριε, εἰσελεύσεται","τὴν βασιλείαν τῶν οὐρανῶν, ἀλλʼ ὁ ποιῶν τὸ θέλημα τοῦ πατρός μου τοῦ ἐν τοῖς οὐρανοῖς."
εἰς,εἰς,—,—,—,—,—,—,—,preposition,Matthew 8:4,"ὕπαγε σεαυτὸν δεῖξον τῷ ἱερεῖ καὶ προσένεγκον τὸ δῶρον ὃ προσέταξεν Μωϋσῆς,",μαρτύριον αὐτοῖς.
εἰς,εἰς,—,—,—,—,—,—,—,preposition,Matthew 8:5,Εἰσελθόντος δὲ αὐτοῦ,Καφαρναοὺμ προσῆλθεν αὐτῷ ἑκατόνταρχος παρακαλῶν αὐτὸν
εἰς,εἰς,—,—,—,—,—,—,—,preposition,Matthew 8:12,οἱ δὲ υἱοὶ τῆς βασιλείας ἐκβληθήσονται,τὸ σκότος τὸ ἐξώτερον· ἐκεῖ ἔσται ὁ κλαυθμὸς καὶ ὁ βρυγμὸς τῶν ὀδόντων.
εἰς,εἰς,—,—,—,—,—,—,—,preposition,Matthew 8:14,Καὶ ἐλθὼν ὁ Ἰησοῦς,τὴν οἰκίαν Πέτρου εἶδεν τὴν πενθερὰν αὐτοῦ βεβλημένην καὶ πυρέσσουσαν·
εἰς,εἰς,—,—,—,—,—,—,—,preposition,Matthew 8:18,Ἰδὼν δὲ ὁ Ἰησοῦς ὄχλον περὶ αὐτὸν ἐκέλευσεν ἀπελθεῖν,τὸ πέραν.
εἰς,εἰς,—,—,—,—,—,—,—,preposition,Matthew 8:23,Καὶ ἐμβάντι αὐτῷ,τὸ πλοῖον ἠκολούθησαν αὐτῷ οἱ μαθηταὶ αὐτοῦ.
εἰς,εἰς,—,—,—,—,—,—,—,preposition,Matthew 8:28,Καὶ ἐλθόντος αὐτοῦ,τὸ πέραν εἰς τὴν χώραν τῶν Γαδαρηνῶν ὑπήντησαν αὐτῷ δύο δαιμονιζόμενοι ἐκ τῶν
εἰς,εἰς,—,—,—,—,—,—,—,preposition,Matthew 8:28,Καὶ ἐλθόντος αὐτοῦ εἰς τὸ πέραν,"τὴν χώραν τῶν Γαδαρηνῶν ὑπήντησαν αὐτῷ δύο δαιμονιζόμενοι ἐκ τῶν μνημείων ἐξερχόμενοι, χαλεποὶ"
εἰς,εἰς,—,—,—,—,—,—,—,preposition,Matthew 8:31,"οἱ δὲ δαίμονες παρεκάλουν αὐτὸν λέγοντες· εἰ ἐκβάλλεις ἡμᾶς, ἀπόστειλον ἡμᾶς",τὴν ἀγέλην τῶν χοίρων.
εἰς,εἰς,—,—,—,—,—,—,—,preposition,Matthew 8:32,καὶ εἶπεν αὐτοῖς· ὑπάγετε. οἱ δὲ ἐξελθόντες ἀπῆλθον,τοὺς χοίρους· καὶ ἰδοὺ ὥρμησεν πᾶσα ἡ ἀγέλη  κατὰ τοῦ κρημνοῦ εἰς τὴν
εἰς,εἰς,—,—,—,—,—,—,—,preposition,Matthew 8:32,εἰς τοὺς χοίρους· καὶ ἰδοὺ ὥρμησεν πᾶσα ἡ ἀγέλη  κατὰ τοῦ κρημνοῦ,τὴν θάλασσαν καὶ ἀπέθανον ἐν τοῖς ὕδασιν.
εἰς,εἰς,—,—,—,—,—,—,—,preposition,Matthew 8:33,"οἱ δὲ βόσκοντες ἔφυγον, καὶ ἀπελθόντες",τὴν πόλιν ἀπήγγειλαν πάντα καὶ τὰ τῶν δαιμονιζομένων.
εἰς,εἰς,—,—,—,—,—,—,—,preposition,Matthew 8:34,καὶ ἰδοὺ πᾶσα ἡ πόλις ἐξῆλθεν,ὑπάντησιν τῷ Ἰησοῦ καὶ ἰδόντες αὐτὸν παρεκάλεσαν ὅπως μεταβῇ ἀπὸ τῶν ὁρίων αὐτῶν.
εἰς,εἰς,—,—,—,—,—,—,—,preposition,Matthew 9:1,Καὶ ἐμβὰς,πλοῖον διεπέρασεν καὶ ἦλθεν εἰς τὴν ἰδίαν πόλιν.
εἰς,εἰς,—,—,—,—,—,—,—,preposition,Matthew 9:1,Καὶ ἐμβὰς  εἰς  πλοῖον διεπέρασεν καὶ ἦλθεν,τὴν ἰδίαν πόλιν.
εἰς,εἰς,—,—,—,—,—,—,—,preposition,Matthew 9:6,ἁμαρτίας—τότε λέγει τῷ παραλυτικῷ· ἐγερθεὶς ἆρόν σου τὴν κλίνην καὶ ὕπαγε,τὸν οἶκόν σου.
εἰς,εἰς,—,—,—,—,—,—,—,preposition,Matthew 9:7,καὶ ἐγερθεὶς ἀπῆλθεν,τὸν οἶκον αὐτοῦ.
εἰς,εἰς,—,—,—,—,—,—,—,preposition,Matthew 9:17,οὐδὲ βάλλουσιν οἶνον νέον,"ἀσκοὺς παλαιούς· εἰ δὲ μή γε, ῥήγνυνται οἱ ἀσκοὶ καὶ ὁ οἶνος ἐκχεῖται"
εἰς,εἰς,—,—,—,—,—,—,—,preposition,Matthew 9:17,καὶ ὁ οἶνος ἐκχεῖται καὶ οἱ ἀσκοὶ ἀπόλλυνται·  ἀλλὰ βάλλουσιν οἶνον νέον,"ἀσκοὺς καινούς, καὶ ἀμφότεροι συντηροῦνται."
εἰς,εἰς,—,—,—,—,—,—,—,preposition,Matthew 9:23,Καὶ ἐλθὼν ὁ Ἰησοῦς,τὴν οἰκίαν τοῦ ἄρχοντος καὶ ἰδὼν τοὺς αὐλητὰς καὶ τὸν ὄχλον θορυβούμενον
εἰς,εἰς,—,—,—,—,—,—,—,preposition,Matthew 9:26,καὶ ἐξῆλθεν ἡ φήμη αὕτη,ὅλην τὴν γῆν ἐκείνην.
εἰς,εἰς,—,—,—,—,—,—,—,preposition,Matthew 9:28,ἐλθόντι δὲ,"τὴν οἰκίαν προσῆλθον αὐτῷ οἱ  τυφλοί, καὶ λέγει αὐτοῖς ὁ Ἰησοῦς· πιστεύετε ὅτι"
εἰς,εἰς,—,—,—,—,—,—,—,preposition,Matthew 9:38,δεήθητε οὖν τοῦ κυρίου τοῦ θερισμοῦ ὅπως ἐκβάλῃ ἐργάτας,τὸν θερισμὸν αὐτοῦ.
εἰς,εἰς,—,—,—,—,—,—,—,preposition,Matthew 10:5,Τούτους τοὺς δώδεκα ἀπέστειλεν ὁ Ἰησοῦς παραγγείλας αὐτοῖς λέγων·,ὁδὸν ἐθνῶν μὴ ἀπέλθητε καὶ εἰς πόλιν Σαμαριτῶν μὴ εἰσέλθητε·
εἰς,εἰς,—,—,—,—,—,—,—,preposition,Matthew 10:5,Τούτους τοὺς δώδεκα ἀπέστειλεν ὁ Ἰησοῦς παραγγείλας αὐτοῖς λέγων· εἰς ὁδὸν ἐθνῶν μὴ ἀπέλθητε καὶ,πόλιν Σαμαριτῶν μὴ εἰσέλθητε·
εἰς,εἰς,—,—,—,—,—,—,—,preposition,Matthew 10:9,Μὴ κτήσησθε χρυσὸν μηδὲ ἄργυρον μηδὲ χαλκὸν,"τὰς ζώνας ὑμῶν,"
εἰς,εἰς,—,—,—,—,—,—,—,preposition,Matthew 10:10,μὴ πήραν,ὁδὸν μηδὲ δύο χιτῶνας μηδὲ ὑποδήματα μηδὲ ῥάβδον· ἄξιος γὰρ ὁ ἐργάτης τῆς τροφῆς αὐτοῦ.
εἰς,εἰς,—,—,—,—,—,—,—,preposition,Matthew 10:12,εἰσερχόμενοι δὲ,τὴν οἰκίαν ἀσπάσασθε αὐτήν·
εἰς,εἰς,—,—,—,—,—,—,—,preposition,Matthew 10:17,Προσέχετε δὲ ἀπὸ τῶν ἀνθρώπων· παραδώσουσιν γὰρ ὑμᾶς,συνέδρια καὶ ἐν ταῖς συναγωγαῖς αὐτῶν μαστιγώσουσιν ὑμᾶς·
εἰς,εἰς,—,—,—,—,—,—,—,preposition,Matthew 10:18,καὶ ἐπὶ ἡγεμόνας δὲ καὶ βασιλεῖς ἀχθήσεσθε ἕνεκεν ἐμοῦ,μαρτύριον αὐτοῖς καὶ τοῖς ἔθνεσιν.
εἰς,εἰς,—,—,—,—,—,—,—,preposition,Matthew 10:21,Παραδώσει δὲ ἀδελφὸς ἀδελφὸν,"θάνατον καὶ πατὴρ τέκνον, καὶ ἐπαναστήσονται τέκνα ἐπὶ γονεῖς καὶ θανατώσουσιν αὐτούς."
εἰς,εἰς,—,—,—,—,—,—,—,preposition,Matthew 10:22,καὶ ἔσεσθε μισούμενοι ὑπὸ πάντων διὰ τὸ ὄνομά μου· ὁ δὲ ὑπομείνας,τέλος οὗτος σωθήσεται.
εἰς,εἰς,—,—,—,—,—,—,—,preposition,Matthew 10:23,Ὅταν δὲ διώκωσιν ὑμᾶς ἐν τῇ πόλει ταύτῃ φεύγετε,"τὴν ἑτέραν·  ἀμὴν γὰρ λέγω ὑμῖν, οὐ μὴ τελέσητε τὰς πόλεις τοῦ Ἰσραὴλ"
εἰς,εἰς,—,—,—,—,—,—,—,preposition,Matthew 10:27,"ὃ λέγω ὑμῖν ἐν τῇ σκοτίᾳ εἴπατε ἐν τῷ φωτί, καὶ ὃ",τὸ οὖς ἀκούετε κηρύξατε ἐπὶ τῶν δωμάτων.
εἰς,εἰς,—,—,—,—,—,—,—,preposition,Matthew 10:41,ὁ δεχόμενος προφήτην,"ὄνομα προφήτου μισθὸν προφήτου λήμψεται, καὶ ὁ δεχόμενος δίκαιον εἰς ὄνομα δικαίου μισθὸν δικαίου λήμψεται."
εἰς,εἰς,—,—,—,—,—,—,—,preposition,Matthew 10:41,"ὁ δεχόμενος προφήτην εἰς ὄνομα προφήτου μισθὸν προφήτου λήμψεται, καὶ ὁ δεχόμενος δίκαιον",ὄνομα δικαίου μισθὸν δικαίου λήμψεται.
εἰς,εἰς,—,—,—,—,—,—,—,preposition,Matthew 10:42,καὶ ὃς ἂν ποτίσῃ ἕνα τῶν μικρῶν τούτων ποτήριον ψυχροῦ μόνον,"ὄνομα μαθητοῦ, ἀμὴν λέγω ὑμῖν, οὐ μὴ ἀπολέσῃ τὸν μισθὸν αὐτοῦ."
εἰς,εἰς,—,—,—,—,—,—,—,preposition,Matthew 11:7,Τούτων δὲ πορευομένων ἤρξατο ὁ Ἰησοῦς λέγειν τοῖς ὄχλοις περὶ Ἰωάννου· τί ἐξήλθατε,τὴν ἔρημον θεάσασθαι; κάλαμον ὑπὸ ἀνέμου σαλευόμενον;
εἰς,εἰς,—,—,—,—,—,—,—,preposition,Matthew 12:4,πῶς εἰσῆλθεν,"τὸν οἶκον τοῦ θεοῦ καὶ τοὺς ἄρτους τῆς προθέσεως ἔφαγον, ὃ οὐκ ἐξὸν"
εἰς,εἰς,—,—,—,—,—,—,—,preposition,Matthew 12:9,Καὶ μεταβὰς ἐκεῖθεν  ἦλθεν,τὴν συναγωγὴν αὐτῶν·
εἰς,εἰς,—,—,—,—,—,—,—,preposition,Matthew 12:11,ὑμῶν ἄνθρωπος ὃς ἕξει πρόβατον ἓν καὶ ἐὰν ἐμπέσῃ τοῦτο τοῖς σάββασιν,"βόθυνον, οὐχὶ κρατήσει αὐτὸ καὶ ἐγερεῖ;"
εἰς,εἰς,—,—,—,—,—,—,—,preposition,Matthew 12:18,"ἰδοὺ ὁ παῖς μου  ὃν ᾑρέτισα,           ὁ ἀγαπητός μου","ὃν εὐδόκησεν ἡ ψυχή μου        θήσω τὸ πνεῦμά μου ἐπʼ αὐτόν,           καὶ κρίσιν τοῖς ἔθνεσιν ἀπαγγελεῖ."
εἰς,εἰς,—,—,—,—,—,—,—,preposition,Matthew 12:20,"κάλαμον συντετριμμένον οὐ κατεάξει           καὶ λίνον τυφόμενον οὐ σβέσει,        ἕως ἂν ἐκβάλῃ",νῖκος τὴν κρίσιν .
εἰς,εἰς,—,—,—,—,—,—,—,preposition,Matthew 12:29,ἢ πῶς δύναταί τις εἰσελθεῖν,"τὴν οἰκίαν τοῦ ἰσχυροῦ καὶ τὰ σκεύη αὐτοῦ ἁρπάσαι, ἐὰν μὴ πρῶτον δήσῃ"
εἰς,εἰς,—,—,—,—,—,—,—,preposition,Matthew 12:41,"Ἄνδρες Νινευῖται ἀναστήσονται ἐν τῇ κρίσει μετὰ τῆς γενεᾶς ταύτης καὶ κατακρινοῦσιν αὐτήν, ὅτι μετενόησαν","τὸ κήρυγμα Ἰωνᾶ, καὶ ἰδοὺ πλεῖον Ἰωνᾶ ὧδε."
εἰς,εἰς,—,—,—,—,—,—,—,preposition,Matthew 12:44,τότε λέγει·,τὸν οἶκόν μου ἐπιστρέψω ὅθεν ἐξῆλθον· καὶ ἐλθὸν εὑρίσκει  σχολάζοντα  σεσαρωμένον καὶ κεκοσμημένον.
εἰς,εἰς,—,—,—,—,—,—,—,preposition,Matthew 13:2,"καὶ συνήχθησαν πρὸς αὐτὸν ὄχλοι πολλοί, ὥστε αὐτὸν","πλοῖον ἐμβάντα καθῆσθαι, καὶ πᾶς ὁ ὄχλος ἐπὶ τὸν αἰγιαλὸν εἱστήκει."
εἰς,εἰς,—,—,—,—,—,—,—,preposition,Matthew 13:22,ὁ δὲ,"τὰς ἀκάνθας σπαρείς, οὗτός ἐστιν ὁ τὸν λόγον ἀκούων, καὶ ἡ μέριμνα τοῦ"
εἰς,εἰς,—,—,—,—,—,—,—,preposition,Matthew 13:30,τοῦ θερισμοῦ ἐρῶ τοῖς θερισταῖς· συλλέξατε πρῶτον τὰ ζιζάνια καὶ δήσατε αὐτὰ,"δέσμας πρὸς τὸ κατακαῦσαι αὐτά, τὸν δὲ σῖτον συναγάγετε εἰς τὴν ἀποθήκην μου."
εἰς,εἰς,—,—,—,—,—,—,—,preposition,Matthew 13:30,"δήσατε αὐτὰ εἰς δέσμας πρὸς τὸ κατακαῦσαι αὐτά, τὸν δὲ σῖτον συναγάγετε",τὴν ἀποθήκην μου.
εἰς,εἰς,—,—,—,—,—,—,—,preposition,Matthew 13:33,"Ἄλλην παραβολὴν ἐλάλησεν αὐτοῖς· ὁμοία ἐστὶν ἡ βασιλεία τῶν οὐρανῶν ζύμῃ, ἣν λαβοῦσα γυνὴ ἐνέκρυψεν",ἀλεύρου σάτα τρία ἕως οὗ ἐζυμώθη ὅλον.
εἰς,εἰς,—,—,—,—,—,—,—,preposition,Matthew 13:36,Τότε ἀφεὶς τοὺς ὄχλους ἦλθεν,τὴν οἰκίαν . καὶ προσῆλθον αὐτῷ οἱ μαθηταὶ αὐτοῦ λέγοντες· διασάφησον ἡμῖν τὴν παραβολὴν τῶν ζιζανίων τοῦ ἀγροῦ.
εἰς,εἰς,—,—,—,—,—,—,—,preposition,Matthew 13:42,καὶ βαλοῦσιν αὐτοὺς,τὴν κάμινον τοῦ πυρός· ἐκεῖ ἔσται ὁ κλαυθμὸς καὶ ὁ βρυγμὸς τῶν ὀδόντων.
εἰς,εἰς,—,—,—,—,—,—,—,preposition,Matthew 13:47,Πάλιν ὁμοία ἐστὶν ἡ βασιλεία τῶν οὐρανῶν σαγήνῃ βληθείσῃ,τὴν θάλασσαν καὶ ἐκ παντὸς γένους συναγαγούσῃ·
