Result,Lemma (Greek),Tense (Logos Greek),Voice (Logos Greek),Mood (Logos Greek),Person (Logos Greek),Gender (Logos Greek),Case (Logos Greek),Number (Logos Greek),Part of Speech,Reference,Previous Context,Next Context
Πέπεισμαι,πείθω,perfect,passive,indicative,first person,—,—,singular,verb,Romans 15:14,—,"δέ, ἀδελφοί μου, καὶ αὐτὸς ἐγὼ περὶ ὑμῶν ὅτι καὶ αὐτοὶ μεστοί ἐστε"
Πείθεσθε,πείθω,present,middle,imperative,second person,—,—,plural,verb,Hebrews 13:17,—,"τοῖς ἡγουμένοις ὑμῶν καὶ ὑπείκετε, αὐτοὶ γὰρ ἀγρυπνοῦσιν ὑπὲρ τῶν ψυχῶν ὑμῶν ὡς"
Πεπείσμεθα,πείθω,perfect,passive,indicative,first person,—,—,plural,verb,Hebrews 6:9,—,"δὲ περὶ ὑμῶν, ἀγαπητοί, τὰ κρείσσονα καὶ ἐχόμενα σωτηρίας, εἰ καὶ οὕτως λαλοῦμεν."
Πεποιθὼς,πείθω,perfect,active,participle,—,masculine,nominative,singular,verb,Philemon 21,—,"τῇ ὑπακοῇ σου ἔγραψά σοι, εἰδὼς ὅτι καὶ ὑπὲρ ἃ λέγω ποιήσεις."
πέπεισμαι,πείθω,perfect,passive,indicative,first person,—,—,singular,verb,Romans 8:38,—,γὰρ ὅτι οὔτε θάνατος οὔτε ζωὴ οὔτε ἄγγελοι οὔτε ἀρχαὶ οὔτε ἐνεστῶτα οὔτε μέλλοντα οὔτε δυνάμεις
πέπεισμαι,πείθω,perfect,passive,indicative,first person,—,—,singular,verb,Romans 14:14,οἶδα καὶ,"ἐν κυρίῳ Ἰησοῦ ὅτι οὐδὲν κοινὸν διʼ ἑαυτοῦ, εἰ μὴ τῷ λογιζομένῳ τι κοινὸν εἶναι, ἐκείνῳ κοινόν."
πέπεισμαι,πείθω,perfect,passive,indicative,first person,—,—,singular,verb,2 Timothy 1:5,"ἐνῴκησεν πρῶτον ἐν τῇ μάμμῃ σου Λωΐδι καὶ τῇ μητρί σου Εὐνίκῃ,",δὲ ὅτι καὶ ἐν σοί.
πέπεισμαι,πείθω,perfect,passive,indicative,first person,—,—,singular,verb,2 Timothy 1:12,"διʼ ἣν αἰτίαν καὶ ταῦτα πάσχω· ἀλλʼ οὐκ ἐπαισχύνομαι, οἶδα γὰρ ᾧ πεπίστευκα καὶ",ὅτι δυνατός ἐστιν τὴν παραθήκην μου φυλάξαι εἰς ἐκείνην τὴν ἡμέραν.
πέποιθάς,πείθω,perfect,active,indicative,second person,—,—,singular,verb,Romans 2:19,—,"τε σεαυτὸν ὁδηγὸν εἶναι τυφλῶν, φῶς τῶν ἐν σκότει,"
πέποιθα,πείθω,perfect,active,indicative,first person,—,—,singular,verb,Galatians 5:10,ἐγὼ,εἰς ὑμᾶς ἐν κυρίῳ ὅτι οὐδὲν ἄλλο φρονήσετε· ὁ δὲ ταράσσων ὑμᾶς βαστάσει
πέποιθα,πείθω,perfect,active,indicative,first person,—,—,singular,verb,Philippians 2:24,—,δὲ ἐν κυρίῳ ὅτι καὶ αὐτὸς ταχέως ἐλεύσομαι.
πέποιθεν,πείθω,perfect,active,indicative,third person,—,—,singular,verb,Matthew 27:43,—,"ἐπὶ τὸν θεόν, ῥυσάσθω νῦν εἰ θέλει αὐτόν· εἶπεν γὰρ ὅτι θεοῦ εἰμι υἱός."
πέποιθεν,πείθω,perfect,active,indicative,third person,—,—,singular,verb,2 Corinthians 10:7,Τὰ κατὰ πρόσωπον βλέπετε. εἴ τις,"ἑαυτῷ Χριστοῦ  εἶναι, τοῦτο λογιζέσθω πάλιν ἐφʼ ἑαυτοῦ, ὅτι καθὼς αὐτὸς Χριστοῦ, οὕτως καὶ ἡμεῖς."
πείθεις,πείθω,present,active,indicative,second person,—,—,singular,verb,Acts 26:28,ὁ δὲ Ἀγρίππας πρὸς τὸν Παῦλον· ἐν ὀλίγῳ με,Χριστιανὸν ποιῆσαι.
πείθεσθαι,πείθω,present,passive,infinitive,—,—,—,—,verb,Galatians 5:7,Ἐτρέχετε καλῶς· τίς ὑμᾶς ἐνέκοψεν [τῇ] ἀληθείᾳ μὴ,;
πείθεσθαι,πείθω,present,passive,infinitive,—,—,—,—,verb,James 3:3,εἰ δὲ τῶν ἵππων τοὺς χαλινοὺς εἰς τὰ στόματα βάλλομεν εἰς τὸ,"αὐτοὺς ἡμῖν, καὶ ὅλον τὸ σῶμα αὐτῶν μετάγομεν."
πείθομαι,πείθω,present,passive,indicative,first person,—,—,singular,verb,Acts 26:26,"ἐπίσταται γὰρ περὶ τούτων ὁ βασιλεὺς πρὸς ὃν καὶ παρρησιαζόμενος λαλῶ, λανθάνειν γὰρ αὐτόν [τι] τούτων οὐ",οὐθέν· οὐ γάρ ἐστιν ἐν γωνίᾳ πεπραγμένον τοῦτο.
πείθομεν,πείθω,present,active,indicative,first person,—,—,plural,verb,2 Corinthians 5:11,Εἰδότες οὖν τὸν φόβον τοῦ κυρίου ἀνθρώπους,", θεῷ δὲ πεφανερώμεθα· ἐλπίζω δὲ καὶ ἐν ταῖς συνειδήσεσιν ὑμῶν πεφανερῶσθαι."
πείθω,πείθω,present,active,indicative,first person,—,—,singular,verb,Galatians 1:10,Ἄρτι γὰρ ἀνθρώπους,"ἢ τὸν θεόν; ἢ ζητῶ ἀνθρώποις ἀρέσκειν; εἰ  ἔτι ἀνθρώποις ἤρεσκον, Χριστοῦ δοῦλος οὐκ ἂν ἤμην."
πείθων,πείθω,present,active,participle,—,masculine,nominative,singular,verb,Acts 19:8,Εἰσελθὼν δὲ εἰς τὴν συναγωγὴν  ἐπαρρησιάζετο ἐπὶ μῆνας τρεῖς διαλεγόμενος καὶ,[τὰ] περὶ τῆς βασιλείας τοῦ θεοῦ.
πείθων,πείθω,present,active,participle,—,masculine,nominative,singular,verb,Acts 28:23,"Ταξάμενοι δὲ αὐτῷ ἡμέραν ἦλθον πρὸς αὐτὸν εἰς τὴν ξενίαν πλείονες οἷς ἐξετίθετο διαμαρτυρόμενος τὴν βασιλείαν τοῦ θεοῦ,","τε αὐτοὺς περὶ τοῦ Ἰησοῦ ἀπό τε τοῦ νόμου Μωϋσέως καὶ τῶν προφητῶν, ἀπὸ πρωῒ ἕως ἑσπέρας."
πείσαντες,πείθω,aorist,active,participle,—,masculine,nominative,plural,verb,Acts 12:20,Ἦν δὲ θυμομαχῶν Τυρίοις καὶ Σιδωνίοις· ὁμοθυμαδὸν δὲ παρῆσαν πρὸς αὐτὸν καὶ,"Βλάστον, τὸν ἐπὶ τοῦ κοιτῶνος τοῦ βασιλέως, ᾐτοῦντο εἰρήνην διὰ τὸ τρέφεσθαι αὐτῶν"
πείσαντες,πείθω,aorist,active,participle,—,masculine,nominative,plural,verb,Acts 14:19,Ἐπῆλθαν δὲ ἀπὸ Ἀντιοχείας καὶ Ἰκονίου Ἰουδαῖοι καὶ,τοὺς ὄχλους καὶ λιθάσαντες τὸν Παῦλον ἔσυρον ἔξω τῆς πόλεως νομίζοντες αὐτὸν τεθνηκέναι.
πείσας,πείθω,aorist,active,participle,—,masculine,nominative,singular,verb,Acts 19:26,καὶ θεωρεῖτε καὶ ἀκούετε ὅτι οὐ μόνον Ἐφέσου ἀλλὰ σχεδὸν πάσης τῆς Ἀσίας ὁ Παῦλος οὗτος,μετέστησεν ἱκανὸν ὄχλον λέγων ὅτι οὐκ εἰσὶν θεοὶ οἱ διὰ χειρῶν γινόμενοι.
πείσομεν,πείθω,future,active,indicative,first person,—,—,plural,verb,Matthew 28:14,"καὶ ἐὰν ἀκουσθῇ τοῦτο ἐπὶ τοῦ ἡγεμόνος, ἡμεῖς",[αὐτὸν] καὶ ὑμᾶς ἀμερίμνους ποιήσομεν.
πείσομεν,πείθω,future,active,indicative,first person,—,—,plural,verb,1 John 3:19,Καὶ ἐν τούτῳ γνωσόμεθα ὅτι ἐκ τῆς ἀληθείας ἐσμέν. καὶ ἔμπροσθεν αὐτοῦ,"τὴν καρδίαν ἡμῶν,"
πειθομένοις,πείθω,present,middle,participle,—,masculine,dative,plural,verb,Romans 2:8,τοῖς δὲ ἐξ ἐριθείας καὶ ἀπειθοῦσιν  τῇ ἀληθείᾳ,δὲ τῇ ἀδικίᾳ ὀργὴ καὶ θυμός.
πειθομένου,πείθω,present,passive,participle,—,masculine,genitive,singular,verb,Acts 21:14,μὴ,δὲ αὐτοῦ ἡσυχάσαμεν εἰπόντες· τοῦ κυρίου τὸ θέλημα γινέσθω.
πειθόμεθα,πείθω,present,passive,indicative,first person,—,—,plural,verb,Hebrews 13:18,Προσεύχεσθε  περὶ ἡμῶν·,"γὰρ ὅτι καλὴν συνείδησιν ἔχομεν, ἐν πᾶσιν καλῶς θέλοντες ἀναστρέφεσθαι."
πεισθήσονται,πείθω,future,passive,indicative,third person,—,—,plural,verb,Luke 16:31,"εἶπεν δὲ αὐτῷ· εἰ Μωϋσέως καὶ τῶν προφητῶν οὐκ ἀκούουσιν, οὐδʼ ἐάν τις ἐκ νεκρῶν ἀναστῇ",.
πεισθῇς,πείθω,aorist,passive,subjunctive,second person,—,—,singular,verb,Acts 23:21,σὺ οὖν μὴ,"αὐτοῖς· ἐνεδρεύουσιν γὰρ αὐτὸν ἐξ αὐτῶν ἄνδρες πλείους τεσσεράκοντα, οἵτινες ἀνεθεμάτισαν ἑαυτοὺς μήτε"
πεπεισμένος,πείθω,perfect,passive,participle,—,masculine,nominative,singular,verb,Luke 20:6,"ἐὰν δὲ εἴπωμεν· ἐξ ἀνθρώπων, ὁ λαὸς ἅπας καταλιθάσει ἡμᾶς,",γάρ ἐστιν Ἰωάννην προφήτην εἶναι.
πεποίθαμεν,πείθω,perfect,active,indicative,first person,—,—,plural,verb,2 Thessalonians 3:4,—,"δὲ ἐν κυρίῳ ἐφʼ ὑμᾶς, ὅτι ἃ παραγγέλλομεν  [καὶ] ποιεῖτε καὶ ποιήσετε."
πεποιθέναι,πείθω,perfect,active,infinitive,—,—,—,—,verb,Philippians 3:4,καίπερ ἐγὼ ἔχων πεποίθησιν καὶ ἐν σαρκί. Εἴ τις δοκεῖ ἄλλος,"ἐν σαρκί, ἐγὼ μᾶλλον·"
πεποιθότας,πείθω,perfect,active,participle,—,masculine,accusative,plural,verb,Luke 18:9,Εἶπεν δὲ καὶ πρός τινας τοὺς,ἐφʼ ἑαυτοῖς ὅτι εἰσὶν δίκαιοι καὶ ἐξουθενοῦντας τοὺς λοιποὺς τὴν παραβολὴν ταύτην·
πεποιθότας,πείθω,perfect,active,participle,—,masculine,accusative,plural,verb,Philippians 1:14,καὶ τοὺς πλείονας τῶν ἀδελφῶν ἐν κυρίῳ,τοῖς δεσμοῖς μου περισσοτέρως τολμᾶν ἀφόβως τὸν λόγον  λαλεῖν.
πεποιθότες,πείθω,perfect,active,participle,—,masculine,nominative,plural,verb,2 Corinthians 1:9,"ἀλλʼ αὐτοὶ ἐν ἑαυτοῖς τὸ ἀπόκριμα τοῦ θανάτου ἐσχήκαμεν, ἵνα μὴ",ὦμεν ἐφʼ ἑαυτοῖς ἀλλʼ ἐπὶ τῷ θεῷ τῷ ἐγείροντι τοὺς νεκρούς·
πεποιθότες,πείθω,perfect,active,participle,—,masculine,nominative,plural,verb,Philippians 3:3,"ἡμεῖς γάρ ἐσμεν ἡ περιτομή, οἱ πνεύματι θεοῦ λατρεύοντες καὶ καυχώμενοι ἐν Χριστῷ Ἰησοῦ καὶ οὐκ ἐν σαρκὶ",","
πεποιθὼς,πείθω,perfect,active,participle,—,masculine,nominative,singular,verb,2 Corinthians 2:3,"καὶ  ἔγραψα τοῦτο αὐτό, ἵνα μὴ ἐλθὼν λύπην σχῶ ἀφʼ ὧν ἔδει με χαίρειν,",ἐπὶ πάντας ὑμᾶς ὅτι ἡ ἐμὴ χαρὰ πάντων ὑμῶν ἐστιν.
πεποιθὼς,πείθω,perfect,active,participle,—,masculine,nominative,singular,verb,Philippians 1:6,—,"αὐτὸ τοῦτο, ὅτι ὁ ἐναρξάμενος ἐν ὑμῖν ἔργον ἀγαθὸν ἐπιτελέσει ἄχρι ἡμέρας Χριστοῦ Ἰησοῦ·"
πεποιθὼς,πείθω,perfect,active,participle,—,masculine,nominative,singular,verb,Philippians 1:25,καὶ τοῦτο,"οἶδα ὅτι μενῶ καὶ παραμενῶ πᾶσιν ὑμῖν εἰς τὴν ὑμῶν προκοπὴν καὶ χαρὰν τῆς πίστεως,"
πεποιθὼς,πείθω,perfect,active,participle,—,masculine,nominative,singular,verb,Hebrews 2:13,καὶ πάλιν·      ἐγὼ ἔσομαι,"ἐπʼ αὐτῷ,  καὶ πάλιν·      ἰδοὺ ἐγὼ καὶ τὰ παιδία ἅ μοι ἔδωκεν ὁ θεός."
ἐπείθετο,πείθω,imperfect,passive,indicative,third person,—,—,singular,verb,Acts 27:11,ὁ δὲ ἑκατοντάρχης τῷ κυβερνήτῃ καὶ τῷ ναυκλήρῳ μᾶλλον,ἢ τοῖς ὑπὸ  Παύλου λεγομένοις.
ἐπείθοντο,πείθω,imperfect,passive,indicative,third person,—,—,plural,verb,Acts 5:36,"ἑαυτόν, ᾧ προσεκλίθη ἀνδρῶν ἀριθμὸς ὡς τετρακοσίων· ὃς ἀνῃρέθη , καὶ πάντες ὅσοι",αὐτῷ διελύθησαν καὶ ἐγένοντο εἰς οὐδέν.
ἐπείθοντο,πείθω,imperfect,passive,indicative,third person,—,—,plural,verb,Acts 5:37,τῆς ἀπογραφῆς καὶ ἀπέστησεν λαὸν ὀπίσω αὐτοῦ· κἀκεῖνος ἀπώλετο καὶ πάντες ὅσοι,αὐτῷ διεσκορπίσθησαν.
ἐπείθοντο,πείθω,imperfect,passive,indicative,third person,—,—,plural,verb,Acts 28:24,καὶ οἱ μὲν,"τοῖς λεγομένοις, οἱ δὲ ἠπίστουν·"
ἐπείσθησαν,πείθω,aorist,passive,indicative,third person,—,—,plural,verb,Acts 5:39,"εἰ δὲ ἐκ θεοῦ ἐστιν, οὐ δυνήσεσθε καταλῦσαι αὐτούς, μήποτε καὶ θεομάχοι εὑρεθῆτε.",δὲ αὐτῷ
ἐπείσθησαν,πείθω,aorist,passive,indicative,third person,—,—,plural,verb,Acts 17:4,καί τινες ἐξ αὐτῶν,"καὶ προσεκληρώθησαν τῷ Παύλῳ καὶ τῷ Σιλᾷ, τῶν τε σεβομένων  Ἑλλήνων πλῆθος πολύ"
ἐπεποίθει,πείθω,pluperfect,active,indicative,third person,—,—,singular,verb,Luke 11:22,"ἐπὰν δὲ  ἰσχυρότερος αὐτοῦ ἐπελθὼν νικήσῃ αὐτόν, τὴν πανοπλίαν αὐτοῦ αἴρει ἐφʼ ᾗ",καὶ τὰ σκῦλα αὐτοῦ διαδίδωσιν.
ἔπειθέν,πείθω,imperfect,active,indicative,third person,—,—,singular,verb,Acts 18:4,Διελέγετο δὲ ἐν τῇ συναγωγῇ κατὰ πᾶν σάββατον,τε Ἰουδαίους καὶ Ἕλληνας.
ἔπειθον,πείθω,imperfect,active,indicative,third person,—,—,plural,verb,Acts 13:43,"καὶ τῶν σεβομένων προσηλύτων τῷ Παύλῳ καὶ τῷ Βαρναβᾷ, οἵτινες προσλαλοῦντες αὐτοῖς",αὐτοὺς προσμένειν τῇ χάριτι τοῦ θεοῦ.
ἔπεισαν,πείθω,aorist,active,indicative,third person,—,—,plural,verb,Matthew 27:20,Οἱ δὲ ἀρχιερεῖς καὶ οἱ πρεσβύτεροι,"τοὺς ὄχλους ἵνα αἰτήσωνται τὸν Βαραββᾶν, τὸν δὲ Ἰησοῦν ἀπολέσωσιν."
