Result,Lemma (Greek),Tense (Logos Greek),Voice (Logos Greek),Mood (Logos Greek),Person (Logos Greek),Gender (Logos Greek),Case (Logos Greek),Number (Logos Greek),Part of Speech,Reference,Previous Context,Next Context
ἔγειρε,ἐγείρω,present,active,imperative,second person,—,—,singular,verb,Mark 2:11,"σοὶ λέγω,",ἆρον τὸν κράβαττόν σου καὶ ὕπαγε εἰς τὸν οἶκόν σου.
ἔγειρε,ἐγείρω,present,active,imperative,second person,—,—,singular,verb,Mark 3:3,καὶ λέγει τῷ ἀνθρώπῳ τῷ τὴν ξηρὰν χεῖρα ἔχοντι·,εἰς τὸ μέσον.
ἔγειρε,ἐγείρω,present,active,imperative,second person,—,—,singular,verb,Mark 10:49,"καὶ στὰς ὁ Ἰησοῦς εἶπεν · φωνήσατε αὐτόν. καὶ φωνοῦσιν τὸν τυφλὸν λέγοντες αὐτῷ· θάρσει,",", φωνεῖ σε."
ἔγειρε,ἐγείρω,present,active,imperative,second person,—,—,singular,verb,Luke 5:23,"τί ἐστιν εὐκοπώτερον, εἰπεῖν· ἀφέωνταί σοι αἱ ἁμαρτίαι σου, ἢ εἰπεῖν·",καὶ περιπάτει;
ἔγειρε,ἐγείρω,present,active,imperative,second person,—,—,singular,verb,Luke 5:24,"ἐξουσίαν ἔχει ἐπὶ τῆς γῆς ἀφιέναι ἁμαρτίας — εἶπεν τῷ παραλελυμένῳ· σοὶ λέγω,",καὶ ἄρας τὸ κλινίδιόν σου  πορεύου εἰς τὸν οἶκόν σου.
ἔγειρε,ἐγείρω,present,active,imperative,second person,—,—,singular,verb,Luke 6:8,"αὐτὸς δὲ ᾔδει τοὺς διαλογισμοὺς αὐτῶν, εἶπεν δὲ τῷ ἀνδρὶ τῷ ξηρὰν ἔχοντι τὴν χεῖρα·",καὶ στῆθι εἰς τὸ μέσον· καὶ ἀναστὰς ἔστη.
ἔγειρε,ἐγείρω,present,active,imperative,second person,—,—,singular,verb,Luke 8:54,"αὐτὸς δὲ  κρατήσας τῆς χειρὸς αὐτῆς ἐφώνησεν λέγων· ἡ παῖς,",.
ἔγειρε,ἐγείρω,present,active,imperative,second person,—,—,singular,verb,John 5:8,λέγει αὐτῷ ὁ Ἰησοῦς·,ἆρον τὸν κράβαττόν σου καὶ περιπάτει.
ἔγειρε,ἐγείρω,present,active,imperative,second person,—,—,singular,verb,Acts 3:6,δὲ ἔχω τοῦτό σοι δίδωμι· ἐν τῷ ὀνόματι Ἰησοῦ Χριστοῦ τοῦ Ναζωραίου [,καὶ] περιπάτει.
ἔγειρε,ἐγείρω,present,active,imperative,second person,—,—,singular,verb,Ephesians 5:14,πᾶν γὰρ τὸ φανερούμενον φῶς ἐστιν. διὸ λέγει·,", ὁ καθεύδων,        καὶ ἀνάστα ἐκ τῶν νεκρῶν,        καὶ ἐπιφαύσει σοι ὁ Χριστός."
ἔγειρε,ἐγείρω,present,active,imperative,second person,—,—,singular,verb,Revelation 11:1,"Καὶ ἐδόθη μοι κάλαμος ὅμοιος ῥάβδῳ,  λέγων·",καὶ μέτρησον τὸν ναὸν τοῦ θεοῦ καὶ τὸ θυσιαστήριον καὶ τοὺς προσκυνοῦντας ἐν αὐτῷ.
ἔγειρε,ἐγείρω,present,active,imperative,second person,—,—,singular,verb,Mark 5:41,"καὶ κρατήσας τῆς χειρὸς τοῦ παιδίου λέγει αὐτῇ· ταλιθα κουμ, ὅ ἐστιν μεθερμηνευόμενον· τὸ κοράσιον, σοὶ λέγω,",.
ἠγέρθη,ἐγείρω,aorist,passive,indicative,third person,—,—,singular,verb,Matthew 8:15,"καὶ ἥψατο τῆς χειρὸς αὐτῆς, καὶ ἀφῆκεν αὐτὴν ὁ πυρετός, καὶ",καὶ διηκόνει αὐτῷ.
ἠγέρθη,ἐγείρω,aorist,passive,indicative,third person,—,—,singular,verb,Matthew 9:25,"ὅτε δὲ ἐξεβλήθη ὁ ὄχλος εἰσελθὼν ἐκράτησεν τῆς χειρὸς αὐτῆς, καὶ",τὸ κοράσιον.
ἠγέρθη,ἐγείρω,aorist,passive,indicative,third person,—,—,singular,verb,Matthew 14:2,καὶ εἶπεν τοῖς παισὶν αὐτοῦ·  οὗτός ἐστιν Ἰωάννης ὁ βαπτιστής · αὐτὸς,ἀπὸ τῶν νεκρῶν καὶ διὰ τοῦτο αἱ δυνάμεις ἐνεργοῦσιν ἐν αὐτῷ.
ἠγέρθη,ἐγείρω,aorist,passive,indicative,third person,—,—,singular,verb,Matthew 27:64,"ἡμέρας, μήποτε ἐλθόντες οἱ μαθηταὶ αὐτοῦ κλέψωσιν αὐτὸν καὶ εἴπωσιν τῷ λαῷ·","ἀπὸ τῶν νεκρῶν, καὶ ἔσται ἡ ἐσχάτη πλάνη χείρων τῆς πρώτης."
ἠγέρθη,ἐγείρω,aorist,passive,indicative,third person,—,—,singular,verb,Matthew 28:6,"οὐκ ἔστιν ὧδε,",γὰρ καθὼς εἶπεν· δεῦτε ἴδετε τὸν τόπον ὅπου ἔκειτο.
ἠγέρθη,ἐγείρω,aorist,passive,indicative,third person,—,—,singular,verb,Matthew 28:7,καὶ ταχὺ πορευθεῖσαι εἴπατε τοῖς μαθηταῖς αὐτοῦ ὅτι,"ἀπὸ τῶν νεκρῶν, καὶ ἰδοὺ προάγει ὑμᾶς εἰς τὴν Γαλιλαίαν, ἐκεῖ αὐτὸν ὄψεσθε· ἰδοὺ εἶπον ὑμῖν."
ἠγέρθη,ἐγείρω,aorist,passive,indicative,third person,—,—,singular,verb,Mark 2:12,καὶ,"καὶ εὐθὺς ἄρας τὸν κράβαττον ἐξῆλθεν ἔμπροσθεν πάντων, ὥστε ἐξίστασθαι πάντας καὶ δοξάζειν"
ἠγέρθη,ἐγείρω,aorist,passive,indicative,third person,—,—,singular,verb,Mark 6:16,"ἀκούσας δὲ ὁ Ἡρῴδης ἔλεγεν·  ὃν ἐγὼ ἀπεκεφάλισα Ἰωάννην, οὗτος",.
ἠγέρθη,ἐγείρω,aorist,passive,indicative,third person,—,—,singular,verb,Mark 16:6,ὁ δὲ λέγει αὐταῖς· μὴ ἐκθαμβεῖσθε· Ἰησοῦν ζητεῖτε τὸν Ναζαρηνὸν τὸν ἐσταυρωμένον·,", οὐκ ἔστιν ὧδε· ἴδε ὁ τόπος ὅπου ἔθηκαν αὐτόν."
ἠγέρθη,ἐγείρω,aorist,passive,indicative,third person,—,—,singular,verb,Luke 7:16,ἔλαβεν δὲ φόβος πάντας καὶ ἐδόξαζον τὸν θεὸν λέγοντες ὅτι προφήτης μέγας,ἐν ἡμῖν καὶ ὅτι ἐπεσκέψατο ὁ θεὸς τὸν λαὸν αὐτοῦ.
ἠγέρθη,ἐγείρω,aorist,passive,indicative,third person,—,—,singular,verb,Luke 9:7,Ἤκουσεν δὲ Ἡρῴδης ὁ τετραάρχης τὰ γινόμενα  πάντα καὶ διηπόρει διὰ τὸ λέγεσθαι ὑπό τινων ὅτι Ἰωάννης,"ἐκ νεκρῶν,"
ἠγέρθη,ἐγείρω,aorist,passive,indicative,third person,—,—,singular,verb,Luke 24:6,"οὐκ ἔστιν ὧδε, ἀλλʼ",. μνήσθητε ὡς ἐλάλησεν ὑμῖν ἔτι ὢν ἐν τῇ Γαλιλαίᾳ
ἠγέρθη,ἐγείρω,aorist,passive,indicative,third person,—,—,singular,verb,Luke 24:34,λέγοντας ὅτι ὄντως,ὁ κύριος καὶ ὤφθη Σίμωνι.
ἠγέρθη,ἐγείρω,aorist,passive,indicative,third person,—,—,singular,verb,John 2:22,ὅτε οὖν,"ἐκ νεκρῶν, ἐμνήσθησαν οἱ μαθηταὶ αὐτοῦ ὅτι τοῦτο ἔλεγεν, καὶ ἐπίστευσαν τῇ γραφῇ"
ἠγέρθη,ἐγείρω,aorist,passive,indicative,third person,—,—,singular,verb,John 11:29,ἐκείνη δὲ ὡς ἤκουσεν,ταχὺ καὶ ἤρχετο πρὸς αὐτόν.
ἠγέρθη,ἐγείρω,aorist,passive,indicative,third person,—,—,singular,verb,Acts 9:8,—,"δὲ Σαῦλος ἀπὸ τῆς γῆς, ἀνεῳγμένων δὲ τῶν ὀφθαλμῶν αὐτοῦ οὐδὲν ἔβλεπεν· χειραγωγοῦντες"
ἠγέρθη,ἐγείρω,aorist,passive,indicative,third person,—,—,singular,verb,Romans 4:25,ὃς παρεδόθη διὰ τὰ παραπτώματα ἡμῶν καὶ,διὰ τὴν δικαίωσιν ἡμῶν.
ἠγέρθη,ἐγείρω,aorist,passive,indicative,third person,—,—,singular,verb,Romans 6:4,"συνετάφημεν οὖν αὐτῷ διὰ τοῦ βαπτίσματος εἰς τὸν θάνατον, ἵνα ὥσπερ","Χριστὸς ἐκ νεκρῶν διὰ τῆς δόξης τοῦ πατρός, οὕτως καὶ ἡμεῖς ἐν καινότητι ζωῆς περιπατήσωμεν."
ἠγέρθησαν,ἐγείρω,aorist,passive,indicative,third person,—,—,plural,verb,Matthew 25:7,τότε,πᾶσαι αἱ παρθένοι ἐκεῖναι καὶ ἐκόσμησαν τὰς λαμπάδας ἑαυτῶν.
ἠγέρθησαν,ἐγείρω,aorist,passive,indicative,third person,—,—,plural,verb,Matthew 27:52,καὶ τὰ μνημεῖα ἀνεῴχθησαν καὶ πολλὰ σώματα τῶν κεκοιμημένων ἁγίων,","
ἤγειραν,ἐγείρω,aorist,active,indicative,third person,—,—,plural,verb,Matthew 8:25,καὶ προσελθόντες,"αὐτὸν λέγοντες· κύριε, σῶσον , ἀπολλύμεθα."
ἤγειρεν,ἐγείρω,aorist,active,indicative,third person,—,—,singular,verb,Mark 1:31,καὶ προσελθὼν,"αὐτὴν κρατήσας τῆς χειρός καὶ ἀφῆκεν αὐτὴν ὁ πυρετός , καὶ διηκόνει αὐτοῖς."
ἤγειρεν,ἐγείρω,aorist,active,indicative,third person,—,—,singular,verb,Mark 9:27,ὁ δὲ Ἰησοῦς κρατήσας τῆς χειρὸς αὐτοῦ,"αὐτόν, καὶ ἀνέστη."
ἤγειρεν,ἐγείρω,aorist,active,indicative,third person,—,—,singular,verb,Luke 1:69,καὶ,"κέρας σωτηρίας ἡμῖν           ἐν  οἴκῳ Δαυὶδ  παιδὸς αὐτοῦ,"
ἤγειρεν,ἐγείρω,aorist,active,indicative,third person,—,—,singular,verb,John 12:1,"Ὁ οὖν Ἰησοῦς πρὸ ἓξ ἡμερῶν τοῦ πάσχα ἦλθεν εἰς Βηθανίαν, ὅπου ἦν Λάζαρος , ὃν",ἐκ νεκρῶν Ἰησοῦς.
ἤγειρεν,ἐγείρω,aorist,active,indicative,third person,—,—,singular,verb,John 12:9,"οὐ διὰ τὸν Ἰησοῦν μόνον, ἀλλʼ ἵνα καὶ τὸν Λάζαρον ἴδωσιν ὃν",ἐκ νεκρῶν.
ἤγειρεν,ἐγείρω,aorist,active,indicative,third person,—,—,singular,verb,John 12:17,Ἐμαρτύρει οὖν ὁ ὄχλος ὁ ὢν μετʼ αὐτοῦ ὅτε τὸν Λάζαρον ἐφώνησεν ἐκ τοῦ μνημείου καὶ,αὐτὸν ἐκ νεκρῶν.
ἤγειρεν,ἐγείρω,aorist,active,indicative,third person,—,—,singular,verb,Acts 3:7,καὶ πιάσας αὐτὸν τῆς δεξιᾶς χειρὸς,"αὐτόν· παραχρῆμα δὲ  ἐστερεώθησαν αἱ βάσεις αὐτοῦ καὶ τὰ σφυδρά,"
ἤγειρεν,ἐγείρω,aorist,active,indicative,third person,—,—,singular,verb,Acts 3:15,τὸν δὲ ἀρχηγὸν τῆς ζωῆς ἀπεκτείνατε ὃν ὁ θεὸς,"ἐκ νεκρῶν, οὗ ἡμεῖς μάρτυρές ἐσμεν."
ἤγειρεν,ἐγείρω,aorist,active,indicative,third person,—,—,singular,verb,Acts 4:10,"τῷ ὀνόματι Ἰησοῦ Χριστοῦ τοῦ Ναζωραίου ὃν ὑμεῖς ἐσταυρώσατε, ὃν ὁ θεὸς","ἐκ νεκρῶν, ἐν τούτῳ οὗτος παρέστηκεν ἐνώπιον ὑμῶν ὑγιής."
ἤγειρεν,ἐγείρω,aorist,active,indicative,third person,—,—,singular,verb,Acts 5:30,ὁ  θεὸς τῶν πατέρων ἡμῶν,Ἰησοῦν ὃν ὑμεῖς διεχειρίσασθε κρεμάσαντες ἐπὶ ξύλου·
ἤγειρεν,ἐγείρω,aorist,active,indicative,third person,—,—,singular,verb,Acts 10:26,ὁ δὲ Πέτρος,αὐτὸν λέγων· ἀνάστηθι· καὶ ἐγὼ αὐτὸς ἄνθρωπός εἰμι.
ἤγειρεν,ἐγείρω,aorist,active,indicative,third person,—,—,singular,verb,Acts 10:40,τοῦτον ὁ θεὸς,"[ἐν] τῇ τρίτῃ ἡμέρᾳ καὶ ἔδωκεν αὐτὸν ἐμφανῆ γενέσθαι,"
ἤγειρεν,ἐγείρω,aorist,active,indicative,third person,—,—,singular,verb,Acts 12:7,καὶ ἰδοὺ ἄγγελος κυρίου ἐπέστη  καὶ  φῶς ἔλαμψεν ἐν τῷ οἰκήματι· πατάξας δὲ τὴν πλευρὰν τοῦ Πέτρου,αὐτὸν λέγων· ἀνάστα ἐν τάχει. καὶ ἐξέπεσαν αὐτοῦ αἱ ἁλύσεις ἐκ τῶν χειρῶν.
ἤγειρεν,ἐγείρω,aorist,active,indicative,third person,—,—,singular,verb,Acts 13:22,καὶ μεταστήσας αὐτὸν,τὸν Δαυὶδ αὐτοῖς εἰς βασιλέα ᾧ καὶ εἶπεν μαρτυρήσας· εὗρον Δαυὶδ τὸν τοῦ
ἤγειρεν,ἐγείρω,aorist,active,indicative,third person,—,—,singular,verb,Acts 13:30,ὁ δὲ θεὸς,"αὐτὸν ἐκ νεκρῶν,"
ἤγειρεν,ἐγείρω,aorist,active,indicative,third person,—,—,singular,verb,Acts 13:37,ὃν δὲ ὁ θεὸς,", οὐκ εἶδεν διαφθοράν."
ἤγειρεν,ἐγείρω,aorist,active,indicative,third person,—,—,singular,verb,Romans 10:9,κύριον Ἰησοῦν καὶ πιστεύσῃς ἐν τῇ καρδίᾳ σου ὅτι ὁ θεὸς αὐτὸν,"ἐκ νεκρῶν, σωθήσῃ·"
ἤγειρεν,ἐγείρω,aorist,active,indicative,third person,—,—,singular,verb,1 Corinthians 6:14,ὁ δὲ θεὸς καὶ τὸν κύριον,καὶ ἡμᾶς ἐξεγερεῖ διὰ τῆς δυνάμεως αὐτοῦ.
ἤγειρεν,ἐγείρω,aorist,active,indicative,third person,—,—,singular,verb,1 Corinthians 15:15,"εὑρισκόμεθα δὲ καὶ ψευδομάρτυρες τοῦ θεοῦ, ὅτι ἐμαρτυρήσαμεν κατὰ τοῦ θεοῦ ὅτι","τὸν Χριστόν, ὃν οὐκ ἤγειρεν εἴπερ ἄρα νεκροὶ οὐκ ἐγείρονται."
ἤγειρεν,ἐγείρω,aorist,active,indicative,third person,—,—,singular,verb,1 Corinthians 15:15,"εὑρισκόμεθα δὲ καὶ ψευδομάρτυρες τοῦ θεοῦ, ὅτι ἐμαρτυρήσαμεν κατὰ τοῦ θεοῦ ὅτι ἤγειρεν τὸν Χριστόν, ὃν οὐκ",εἴπερ ἄρα νεκροὶ οὐκ ἐγείρονται.
ἤγειρεν,ἐγείρω,aorist,active,indicative,third person,—,—,singular,verb,1 Thessalonians 1:10,"καὶ ἀναμένειν τὸν υἱὸν αὐτοῦ ἐκ τῶν οὐρανῶν, ὃν","ἐκ [τῶν] νεκρῶν, Ἰησοῦν τὸν ῥυόμενον ἡμᾶς ἐκ τῆς ὀργῆς τῆς ἐρχομένης."
