Result,Lemma (Greek),Tense (Logos Greek),Voice (Logos Greek),Mood (Logos Greek),Person (Logos Greek),Gender (Logos Greek),Case (Logos Greek),Number (Logos Greek),Part of Speech,Reference,Previous Context,Next Context
εἰς,εἰς,—,—,—,—,—,—,—,preposition,Mark 14:68,ὁ δὲ ἠρνήσατο λέγων· οὔτε οἶδα οὔτε ἐπίσταμαι σὺ τί λέγεις. καὶ ἐξῆλθεν ἔξω,τὸ προαύλιον [καὶ ἀλέκτωρ ἐφώνησεν].
εἰς,εἰς,—,—,—,—,—,—,—,preposition,Mark 15:34,"ελωι λεμα σαβαχθανι;  ὅ ἐστιν μεθερμηνευόμενον· ὁ θεός μου ὁ θεός μου,",τί ἐγκατέλιπές με;
εἰς,εἰς,—,—,—,—,—,—,—,preposition,Mark 15:38,Καὶ τὸ καταπέτασμα τοῦ ναοῦ ἐσχίσθη,δύο  ἀπʼ ἄνωθεν ἕως κάτω.
εἰς,εἰς,—,—,—,—,—,—,—,preposition,Mark 15:41,"αἳ ὅτε ἦν ἐν τῇ Γαλιλαίᾳ ἠκολούθουν αὐτῷ καὶ διηκόνουν αὐτῷ, καὶ ἄλλαι πολλαὶ αἱ συναναβᾶσαι αὐτῷ",Ἱεροσόλυμα.
εἰς,εἰς,—,—,—,—,—,—,—,preposition,Mark 16:5,Καὶ εἰσελθοῦσαι,"τὸ μνημεῖον εἶδον νεανίσκον καθήμενον ἐν τοῖς δεξιοῖς περιβεβλημένον στολὴν λευκήν, καὶ ἐξεθαμβήθησαν."
εἰς,εἰς,—,—,—,—,—,—,—,preposition,Mark 16:7,ἀλλʼ ὑπάγετε εἴπατε τοῖς μαθηταῖς αὐτοῦ καὶ τῷ Πέτρῳ ὅτι προάγει ὑμᾶς,"τὴν Γαλιλαίαν· ἐκεῖ αὐτὸν ὄψεσθε, καθὼς εἶπεν ὑμῖν."
εἰς,εἰς,—,—,—,—,—,—,—,preposition,Mark 16:12,Μετὰ δὲ ταῦτα δυσὶν ἐξ αὐτῶν περιπατοῦσιν ἐφανερώθη ἐν ἑτέρᾳ μορφῇ πορευομένοις,ἀγρόν·
εἰς,εἰς,—,—,—,—,—,—,—,preposition,Mark 16:15,καὶ εἶπεν αὐτοῖς· πορευθέντες,τὸν κόσμον ἅπαντα κηρύξατε τὸ εὐαγγέλιον πάσῃ τῇ κτίσει.
εἰς,εἰς,—,—,—,—,—,—,—,preposition,Mark 16:19,Ὁ μὲν οὖν κύριος Ἰησοῦς μετὰ τὸ λαλῆσαι αὐτοῖς ἀνελήμφθη,τὸν οὐρανὸν καὶ ἐκάθισεν ἐκ δεξιῶν τοῦ θεοῦ.
εἰς,εἰς,—,—,—,—,—,—,—,preposition,Luke 1:9,κατὰ τὸ ἔθος τῆς ἱερατείας ἔλαχεν τοῦ θυμιᾶσαι εἰσελθὼν,"τὸν ναὸν τοῦ κυρίου,"
εἰς,εἰς,—,—,—,—,—,—,—,preposition,Luke 1:20,"ἡμέρας γένηται ταῦτα, ἀνθʼ ὧν οὐκ ἐπίστευσας τοῖς λόγοις μου, οἵτινες πληρωθήσονται",τὸν καιρὸν αὐτῶν.
εἰς,εἰς,—,—,—,—,—,—,—,preposition,Luke 1:23,"καὶ ἐγένετο ὡς ἐπλήσθησαν αἱ ἡμέραι τῆς λειτουργίας αὐτοῦ, ἀπῆλθεν",τὸν οἶκον αὐτοῦ.
εἰς,εἰς,—,—,—,—,—,—,—,preposition,Luke 1:26,Ἐν δὲ τῷ μηνὶ τῷ ἕκτῳ ἀπεστάλη ὁ ἄγγελος Γαβριὴλ ἀπὸ τοῦ θεοῦ,πόλιν τῆς Γαλιλαίας ᾗ ὄνομα Ναζαρὲθ
εἰς,εἰς,—,—,—,—,—,—,—,preposition,Luke 1:33,καὶ βασιλεύσει ἐπὶ τὸν οἶκον Ἰακὼβ,τοὺς αἰῶνας      καὶ τῆς βασιλείας αὐτοῦ οὐκ ἔσται τέλος.
εἰς,εἰς,—,—,—,—,—,—,—,preposition,Luke 1:39,Ἀναστᾶσα δὲ Μαριὰμ ἐν ταῖς ἡμέραις ταύταις ἐπορεύθη,"τὴν ὀρεινὴν μετὰ σπουδῆς εἰς πόλιν Ἰούδα,"
εἰς,εἰς,—,—,—,—,—,—,—,preposition,Luke 1:39,Ἀναστᾶσα δὲ Μαριὰμ ἐν ταῖς ἡμέραις ταύταις ἐπορεύθη εἰς τὴν ὀρεινὴν μετὰ σπουδῆς,"πόλιν Ἰούδα,"
εἰς,εἰς,—,—,—,—,—,—,—,preposition,Luke 1:40,καὶ εἰσῆλθεν,τὸν οἶκον Ζαχαρίου καὶ ἠσπάσατο τὴν Ἐλισάβετ.
εἰς,εἰς,—,—,—,—,—,—,—,preposition,Luke 1:44,ἰδοὺ γὰρ ὡς ἐγένετο ἡ φωνὴ τοῦ ἀσπασμοῦ σου,"τὰ ὦτά μου, ἐσκίρτησεν ἐν ἀγαλλιάσει τὸ βρέφος ἐν τῇ κοιλίᾳ μου."
εἰς,εἰς,—,—,—,—,—,—,—,preposition,Luke 1:50,καὶ τὸ ἔλεος αὐτοῦ,γενεὰς καὶ γενεὰς        τοῖς φοβουμένοις αὐτόν.
εἰς,εἰς,—,—,—,—,—,—,—,preposition,Luke 1:55,"καθὼς ἐλάλησεν πρὸς τοὺς πατέρας ἡμῶν,        τῷ Ἀβραὰμ καὶ τῷ σπέρματι αὐτοῦ",τὸν αἰῶνα.
εἰς,εἰς,—,—,—,—,—,—,—,preposition,Luke 1:56,"Ἔμεινεν δὲ Μαριὰμ σὺν αὐτῇ ὡς μῆνας τρεῖς, καὶ ὑπέστρεψεν",τὸν οἶκον αὐτῆς.
εἰς,εἰς,—,—,—,—,—,—,—,preposition,Luke 1:79,"ἐπιφᾶναι  τοῖς ἐν σκότει καὶ σκιᾷ θανάτου καθημένοις,           τοῦ κατευθῦναι τοὺς πόδας ἡμῶν",ὁδὸν εἰρήνης.
εἰς,εἰς,—,—,—,—,—,—,—,preposition,Luke 2:3,"καὶ ἐπορεύοντο πάντες ἀπογράφεσθαι, ἕκαστος",τὴν ἑαυτοῦ πόλιν.
εἰς,εἰς,—,—,—,—,—,—,—,preposition,Luke 2:4,Ἀνέβη δὲ καὶ Ἰωσὴφ ἀπὸ τῆς Γαλιλαίας ἐκ πόλεως Ναζαρὲθ,"τὴν Ἰουδαίαν εἰς πόλιν Δαυὶδ ἥτις καλεῖται Βηθλέεμ, διὰ τὸ εἶναι αὐτὸν ἐξ οἴκου καὶ πατριᾶς Δαυίδ,"
εἰς,εἰς,—,—,—,—,—,—,—,preposition,Luke 2:4,Ἀνέβη δὲ καὶ Ἰωσὴφ ἀπὸ τῆς Γαλιλαίας ἐκ πόλεως Ναζαρὲθ εἰς τὴν Ἰουδαίαν,"πόλιν Δαυὶδ ἥτις καλεῖται Βηθλέεμ, διὰ τὸ εἶναι αὐτὸν ἐξ οἴκου καὶ πατριᾶς Δαυίδ,"
εἰς,εἰς,—,—,—,—,—,—,—,preposition,Luke 2:15,Καὶ ἐγένετο ὡς ἀπῆλθον ἀπʼ αὐτῶν,"τὸν οὐρανὸν οἱ ἄγγελοι,  οἱ ποιμένες ἐλάλουν πρὸς ἀλλήλους· διέλθωμεν δὴ ἕως Βηθλέεμ"
εἰς,εἰς,—,—,—,—,—,—,—,preposition,Luke 2:22,"Καὶ ὅτε ἐπλήσθησαν αἱ ἡμέραι τοῦ καθαρισμοῦ αὐτῶν κατὰ τὸν νόμον Μωϋσέως, ἀνήγαγον αὐτὸν","Ἱεροσόλυμα παραστῆσαι τῷ κυρίῳ,"
εἰς,εἰς,—,—,—,—,—,—,—,preposition,Luke 2:27,καὶ ἦλθεν ἐν τῷ πνεύματι,τὸ ἱερόν· καὶ ἐν τῷ εἰσαγαγεῖν τοὺς γονεῖς τὸ παιδίον Ἰησοῦν τοῦ ποιῆσαι
εἰς,εἰς,—,—,—,—,—,—,—,preposition,Luke 2:28,καὶ αὐτὸς ἐδέξατο αὐτὸ,τὰς ἀγκάλας  καὶ εὐλόγησεν τὸν θεὸν καὶ εἶπεν·
εἰς,εἰς,—,—,—,—,—,—,—,preposition,Luke 2:32,φῶς,ἀποκάλυψιν ἐθνῶν           καὶ δόξαν λαοῦ σου Ἰσραήλ.
εἰς,εἰς,—,—,—,—,—,—,—,preposition,Luke 2:34,καὶ εὐλόγησεν αὐτοὺς Συμεὼν καὶ εἶπεν πρὸς Μαριὰμ τὴν μητέρα αὐτοῦ· ἰδοὺ οὗτος κεῖται,πτῶσιν καὶ ἀνάστασιν πολλῶν ἐν τῷ Ἰσραὴλ καὶ εἰς σημεῖον ἀντιλεγόμενον —
εἰς,εἰς,—,—,—,—,—,—,—,preposition,Luke 2:34,ἰδοὺ οὗτος κεῖται εἰς πτῶσιν καὶ ἀνάστασιν πολλῶν ἐν τῷ Ἰσραὴλ καὶ,σημεῖον ἀντιλεγόμενον —
εἰς,εἰς,—,—,—,—,—,—,—,preposition,Luke 2:39,"Καὶ ὡς ἐτέλεσαν πάντα τὰ κατὰ τὸν νόμον κυρίου, ἐπέστρεψαν",τὴν Γαλιλαίαν εἰς  πόλιν ἑαυτῶν Ναζαρέθ.
εἰς,εἰς,—,—,—,—,—,—,—,preposition,Luke 2:39,"Καὶ ὡς ἐτέλεσαν πάντα τὰ κατὰ τὸν νόμον κυρίου, ἐπέστρεψαν εἰς τὴν Γαλιλαίαν",πόλιν ἑαυτῶν Ναζαρέθ.
εἰς,εἰς,—,—,—,—,—,—,—,preposition,Luke 2:41,Καὶ ἐπορεύοντο οἱ γονεῖς αὐτοῦ κατʼ ἔτος,Ἰερουσαλὴμ τῇ ἑορτῇ τοῦ πάσχα.
εἰς,εἰς,—,—,—,—,—,—,—,preposition,Luke 2:45,καὶ μὴ εὑρόντες ὑπέστρεψαν,Ἰερουσαλὴμ ἀναζητοῦντες αὐτόν.
εἰς,εἰς,—,—,—,—,—,—,—,preposition,Luke 2:51,καὶ κατέβη μετʼ αὐτῶν καὶ ἦλθεν,Ναζαρὲθ καὶ ἦν ὑποτασσόμενος αὐτοῖς. καὶ ἡ μήτηρ αὐτοῦ διετήρει πάντα τὰ ῥήματα ἐν τῇ καρδίᾳ αὐτῆς.
εἰς,εἰς,—,—,—,—,—,—,—,preposition,Luke 3:3,Καὶ ἦλθεν,"πᾶσαν [τὴν] περίχωρον τοῦ Ἰορδάνου κηρύσσων βάπτισμα μετανοίας εἰς ἄφεσιν ἁμαρτιῶν,"
εἰς,εἰς,—,—,—,—,—,—,—,preposition,Luke 3:3,Καὶ ἦλθεν εἰς πᾶσαν [τὴν] περίχωρον τοῦ Ἰορδάνου κηρύσσων βάπτισμα μετανοίας,"ἄφεσιν ἁμαρτιῶν,"
εἰς,εἰς,—,—,—,—,—,—,—,preposition,Luke 3:5,"πᾶσα φάραγξ πληρωθήσεται           καὶ πᾶν ὄρος καὶ βουνὸς ταπεινωθήσεται,        καὶ ἔσται τὰ σκολιὰ",εὐθεῖαν           καὶ αἱ τραχεῖαι εἰς ὁδοὺς λείας·
εἰς,εἰς,—,—,—,—,—,—,—,preposition,Luke 3:5,"πᾶσα φάραγξ πληρωθήσεται           καὶ πᾶν ὄρος καὶ βουνὸς ταπεινωθήσεται,        καὶ ἔσται τὰ σκολιὰ εἰς εὐθεῖαν           καὶ αἱ τραχεῖαι",ὁδοὺς λείας·
εἰς,εἰς,—,—,—,—,—,—,—,preposition,Luke 3:9,τῶν δένδρων κεῖται· πᾶν οὖν δένδρον μὴ ποιοῦν καρπὸν καλὸν ἐκκόπτεται καὶ,πῦρ βάλλεται.
εἰς,εἰς,—,—,—,—,—,—,—,preposition,Luke 3:17,οὗ τὸ πτύον ἐν τῇ χειρὶ αὐτοῦ διακαθᾶραι τὴν ἅλωνα αὐτοῦ καὶ συναγαγεῖν τὸν  σῖτον,"τὴν ἀποθήκην αὐτοῦ, τὸ δὲ ἄχυρον κατακαύσει πυρὶ ἀσβέστῳ."
εἰς,εἰς,—,—,—,—,—,—,—,preposition,Luke 4:9,Ἤγαγεν δὲ αὐτὸν,Ἰερουσαλὴμ καὶ ἔστησεν ἐπὶ τὸ πτερύγιον τοῦ ἱεροῦ καὶ εἶπεν αὐτῷ· εἰ υἱὸς
εἰς,εἰς,—,—,—,—,—,—,—,preposition,Luke 4:14,Καὶ ὑπέστρεψεν ὁ Ἰησοῦς ἐν τῇ δυνάμει τοῦ πνεύματος,τὴν Γαλιλαίαν. καὶ φήμη ἐξῆλθεν καθʼ ὅλης τῆς περιχώρου περὶ αὐτοῦ.
εἰς,εἰς,—,—,—,—,—,—,—,preposition,Luke 4:16,Καὶ ἦλθεν,"Ναζαρά, οὗ ἦν τεθραμμένος, καὶ εἰσῆλθεν κατὰ τὸ εἰωθὸς αὐτῷ ἐν τῇ ἡμέρᾳ"
εἰς,εἰς,—,—,—,—,—,—,—,preposition,Luke 4:16,"Καὶ ἦλθεν εἰς Ναζαρά, οὗ ἦν τεθραμμένος, καὶ εἰσῆλθεν κατὰ τὸ εἰωθὸς αὐτῷ ἐν τῇ ἡμέρᾳ τῶν σαββάτων",τὴν συναγωγὴν καὶ ἀνέστη ἀναγνῶναι.
εἰς,εἰς,—,—,—,—,—,—,—,preposition,Luke 4:23,"καὶ εἶπεν πρὸς αὐτούς· πάντως ἐρεῖτέ μοι τὴν παραβολὴν ταύτην· ἰατρέ, θεράπευσον σεαυτόν· ὅσα ἠκούσαμεν γενόμενα",τὴν Καφαρναοὺμ ποίησον καὶ ὧδε ἐν τῇ πατρίδι σου.
εἰς,εἰς,—,—,—,—,—,—,—,preposition,Luke 4:26,καὶ πρὸς οὐδεμίαν αὐτῶν ἐπέμφθη Ἠλίας εἰ μὴ,Σάρεπτα τῆς Σιδωνίας πρὸς γυναῖκα χήραν.
εἰς,εἰς,—,—,—,—,—,—,—,preposition,Luke 4:31,Καὶ κατῆλθεν,Καφαρναοὺμ πόλιν τῆς Γαλιλαίας . καὶ ἦν διδάσκων αὐτοὺς ἐν τοῖς σάββασιν·
εἰς,εἰς,—,—,—,—,—,—,—,preposition,Luke 4:35,καὶ ἐπετίμησεν αὐτῷ ὁ Ἰησοῦς λέγων· φιμώθητι καὶ ἔξελθε ἀπʼ αὐτοῦ. καὶ ῥῖψαν αὐτὸν τὸ δαιμόνιον,τὸ μέσον  ἐξῆλθεν ἀπʼ αὐτοῦ μηδὲν βλάψαν αὐτόν.
εἰς,εἰς,—,—,—,—,—,—,—,preposition,Luke 4:37,καὶ ἐξεπορεύετο ἦχος περὶ αὐτοῦ,πάντα τόπον τῆς περιχώρου.
εἰς,εἰς,—,—,—,—,—,—,—,preposition,Luke 4:38,Ἀναστὰς δὲ ἀπὸ τῆς συναγωγῆς εἰσῆλθεν,τὴν οἰκίαν Σίμωνος . πενθερὰ δὲ τοῦ Σίμωνος ἦν συνεχομένη πυρετῷ μεγάλῳ καὶ ἠρώτησαν αὐτὸν περὶ αὐτῆς.
εἰς,εἰς,—,—,—,—,—,—,—,preposition,Luke 4:42,Γενομένης δὲ ἡμέρας ἐξελθὼν ἐπορεύθη,ἔρημον τόπον· καὶ οἱ ὄχλοι ἐπεζήτουν αὐτὸν καὶ ἦλθον ἕως αὐτοῦ καὶ κατεῖχον
εἰς,εἰς,—,—,—,—,—,—,—,preposition,Luke 4:44,Καὶ ἦν κηρύσσων,τὰς συναγωγὰς τῆς Ἰουδαίας.
εἰς,εἰς,—,—,—,—,—,—,—,preposition,Luke 5:3,ἐμβὰς δὲ,"ἓν τῶν πλοίων, ὃ ἦν  Σίμωνος, ἠρώτησεν αὐτὸν ἀπὸ τῆς γῆς ἐπαναγαγεῖν ὀλίγον"
εἰς,εἰς,—,—,—,—,—,—,—,preposition,Luke 5:4,"Ὡς δὲ ἐπαύσατο λαλῶν, εἶπεν πρὸς τὸν Σίμωνα· ἐπανάγαγε",τὸ βάθος καὶ χαλάσατε τὰ δίκτυα ὑμῶν εἰς ἄγραν.
εἰς,εἰς,—,—,—,—,—,—,—,preposition,Luke 5:4,"Ὡς δὲ ἐπαύσατο λαλῶν, εἶπεν πρὸς τὸν Σίμωνα· ἐπανάγαγε εἰς τὸ βάθος καὶ χαλάσατε τὰ δίκτυα ὑμῶν",ἄγραν.
εἰς,εἰς,—,—,—,—,—,—,—,preposition,Luke 5:14,"σεαυτὸν τῷ ἱερεῖ καὶ προσένεγκε περὶ τοῦ καθαρισμοῦ σου καθὼς προσέταξεν Μωϋσῆς,",μαρτύριον αὐτοῖς.
εἰς,εἰς,—,—,—,—,—,—,—,preposition,Luke 5:17,πάσης κώμης τῆς Γαλιλαίας καὶ Ἰουδαίας καὶ Ἰερουσαλήμ · καὶ δύναμις κυρίου ἦν,τὸ ἰᾶσθαι αὐτόν.
εἰς,εἰς,—,—,—,—,—,—,—,preposition,Luke 5:19,ἀναβάντες ἐπὶ τὸ δῶμα διὰ τῶν κεράμων καθῆκαν αὐτὸν σὺν τῷ κλινιδίῳ,τὸ μέσον ἔμπροσθεν τοῦ Ἰησοῦ.
εἰς,εἰς,—,—,—,—,—,—,—,preposition,Luke 5:24,"εἶπεν τῷ παραλελυμένῳ· σοὶ λέγω, ἔγειρε καὶ ἄρας τὸ κλινίδιόν σου  πορεύου",τὸν οἶκόν σου.
εἰς,εἰς,—,—,—,—,—,—,—,preposition,Luke 5:25,"καὶ παραχρῆμα ἀναστὰς ἐνώπιον αὐτῶν, ἄρας ἐφʼ ὃ κατέκειτο, ἀπῆλθεν",τὸν οἶκον αὐτοῦ δοξάζων τὸν θεόν.
εἰς,εἰς,—,—,—,—,—,—,—,preposition,Luke 5:32,οὐκ ἐλήλυθα καλέσαι δικαίους ἀλλʼ ἁμαρτωλοὺς,μετάνοιαν.
εἰς,εἰς,—,—,—,—,—,—,—,preposition,Luke 5:37,καὶ οὐδεὶς βάλλει οἶνον νέον,"ἀσκοὺς παλαιούς· εἰ δὲ μή γε, ῥήξει ὁ οἶνος ὁ νέος τοὺς ἀσκοὺς"
εἰς,εἰς,—,—,—,—,—,—,—,preposition,Luke 5:38,ἀλλʼ οἶνον νέον,ἀσκοὺς καινοὺς βλητέον.
εἰς,εἰς,—,—,—,—,—,—,—,preposition,Luke 6:4,[ὡς] εἰσῆλθεν,τὸν οἶκον τοῦ θεοῦ καὶ τοὺς ἄρτους τῆς προθέσεως λαβὼν ἔφαγεν καὶ ἔδωκεν
εἰς,εἰς,—,—,—,—,—,—,—,preposition,Luke 6:6,Ἐγένετο δὲ ἐν ἑτέρῳ σαββάτῳ εἰσελθεῖν αὐτὸν,τὴν συναγωγὴν καὶ διδάσκειν. καὶ ἦν ἄνθρωπος ἐκεῖ καὶ ἡ χεὶρ αὐτοῦ ἡ δεξιὰ ἦν ξηρά.
εἰς,εἰς,—,—,—,—,—,—,—,preposition,Luke 6:8,"αὐτὸς δὲ ᾔδει τοὺς διαλογισμοὺς αὐτῶν, εἶπεν δὲ τῷ ἀνδρὶ τῷ ξηρὰν ἔχοντι τὴν χεῖρα· ἔγειρε καὶ στῆθι",τὸ μέσον· καὶ ἀναστὰς ἔστη.
εἰς,εἰς,—,—,—,—,—,—,—,preposition,Luke 6:12,Ἐγένετο δὲ ἐν ταῖς ἡμέραις ταύταις ἐξελθεῖν αὐτὸν,"τὸ ὄρος προσεύξασθαι, καὶ ἦν διανυκτερεύων ἐν τῇ προσευχῇ τοῦ θεοῦ."
εἰς,εἰς,—,—,—,—,—,—,—,preposition,Luke 6:20,Καὶ αὐτὸς ἐπάρας τοὺς ὀφθαλμοὺς αὐτοῦ,"τοὺς μαθητὰς αὐτοῦ ἔλεγεν·        Μακάριοι οἱ πτωχοί,           ὅτι ὑμετέρα ἐστὶν ἡ βασιλεία τοῦ θεοῦ."
εἰς,εἰς,—,—,—,—,—,—,—,preposition,Luke 6:38,"δίδοτε, καὶ δοθήσεται ὑμῖν· μέτρον καλὸν πεπιεσμένον σεσαλευμένον ὑπερεκχυννόμενον δώσουσιν",τὸν κόλπον ὑμῶν· ᾧ γὰρ μέτρῳ μετρεῖτε ἀντιμετρηθήσεται ὑμῖν.
εἰς,εἰς,—,—,—,—,—,—,—,preposition,Luke 6:39,Εἶπεν δὲ καὶ παραβολὴν αὐτοῖς· μήτι δύναται τυφλὸς τυφλὸν ὁδηγεῖν; οὐχὶ ἀμφότεροι,βόθυνον ἐμπεσοῦνται;
εἰς,εἰς,—,—,—,—,—,—,—,preposition,Luke 7:1,Ἐπειδὴ ἐπλήρωσεν πάντα τὰ ῥήματα αὐτοῦ,"τὰς ἀκοὰς τοῦ λαοῦ, εἰσῆλθεν εἰς Καφαρναούμ."
εἰς,εἰς,—,—,—,—,—,—,—,preposition,Luke 7:1,"Ἐπειδὴ ἐπλήρωσεν πάντα τὰ ῥήματα αὐτοῦ εἰς τὰς ἀκοὰς τοῦ λαοῦ, εἰσῆλθεν",Καφαρναούμ.
εἰς,εἰς,—,—,—,—,—,—,—,preposition,Luke 7:10,Καὶ ὑποστρέψαντες,τὸν οἶκον οἱ πεμφθέντες  εὗρον τὸν δοῦλον ὑγιαίνοντα.
εἰς,εἰς,—,—,—,—,—,—,—,preposition,Luke 7:11,Καὶ ἐγένετο ἐν τῷ ἑξῆς ἐπορεύθη,πόλιν καλουμένην Ναῒν καὶ συνεπορεύοντο αὐτῷ οἱ μαθηταὶ αὐτοῦ  καὶ ὄχλος πολύς.
εἰς,εἰς,—,—,—,—,—,—,—,preposition,Luke 7:24,Ἀπελθόντων δὲ τῶν ἀγγέλων Ἰωάννου ἤρξατο λέγειν πρὸς τοὺς ὄχλους περὶ Ἰωάννου· τί ἐξήλθατε,τὴν ἔρημον θεάσασθαι; κάλαμον ὑπὸ ἀνέμου σαλευόμενον;
εἰς,εἰς,—,—,—,—,—,—,—,preposition,Luke 7:30,οἱ δὲ Φαρισαῖοι καὶ οἱ νομικοὶ τὴν βουλὴν τοῦ θεοῦ ἠθέτησαν,ἑαυτοὺς μὴ βαπτισθέντες ὑπʼ αὐτοῦ.
εἰς,εἰς,—,—,—,—,—,—,—,preposition,Luke 7:36,"Ἠρώτα δέ τις αὐτὸν τῶν Φαρισαίων ἵνα φάγῃ μετʼ αὐτοῦ, καὶ εἰσελθὼν",τὸν οἶκον τοῦ Φαρισαίου κατεκλίθη.
εἰς,εἰς,—,—,—,—,—,—,—,preposition,Luke 7:44,καὶ στραφεὶς πρὸς τὴν γυναῖκα τῷ Σίμωνι ἔφη· βλέπεις ταύτην τὴν γυναῖκα; εἰσῆλθόν σου,"τὴν οἰκίαν, ὕδωρ μοι ἐπὶ πόδας οὐκ ἔδωκας· αὕτη δὲ τοῖς δάκρυσιν ἔβρεξέν"
εἰς,εἰς,—,—,—,—,—,—,—,preposition,Luke 7:50,εἶπεν δὲ πρὸς τὴν γυναῖκα·  ἡ πίστις σου σέσωκέν σε· πορεύου,εἰρήνην.
εἰς,εἰς,—,—,—,—,—,—,—,preposition,Luke 8:8,καὶ ἕτερον ἔπεσεν,τὴν γῆν τὴν ἀγαθὴν καὶ φυὲν ἐποίησεν καρπὸν ἑκατονταπλασίονα. ταῦτα λέγων ἐφώνει· ὁ ἔχων ὦτα ἀκούειν ἀκουέτω.
εἰς,εἰς,—,—,—,—,—,—,—,preposition,Luke 8:14,τὸ δὲ,"τὰς ἀκάνθας πεσόν, οὗτοί εἰσιν οἱ  ἀκούσαντες, καὶ ὑπὸ μεριμνῶν καὶ πλούτου καὶ"
εἰς,εἰς,—,—,—,—,—,—,—,preposition,Luke 8:17,οὐ γάρ ἐστιν κρυπτὸν ὃ οὐ φανερὸν γενήσεται οὐδὲ ἀπόκρυφον ὃ οὐ μὴ γνωσθῇ καὶ,φανερὸν ἔλθῃ.
εἰς,εἰς,—,—,—,—,—,—,—,preposition,Luke 8:22,Ἐγένετο δὲ ἐν μιᾷ τῶν ἡμερῶν καὶ αὐτὸς ἐνέβη,"πλοῖον καὶ οἱ μαθηταὶ αὐτοῦ καὶ εἶπεν πρὸς αὐτούς· διέλθωμεν εἰς τὸ πέραν τῆς λίμνης, καὶ ἀνήχθησαν."
εἰς,εἰς,—,—,—,—,—,—,—,preposition,Luke 8:22,ἐνέβη εἰς πλοῖον καὶ οἱ μαθηταὶ αὐτοῦ καὶ εἶπεν πρὸς αὐτούς· διέλθωμεν,"τὸ πέραν τῆς λίμνης, καὶ ἀνήχθησαν."
εἰς,εἰς,—,—,—,—,—,—,—,preposition,Luke 8:23,πλεόντων δὲ αὐτῶν ἀφύπνωσεν. καὶ κατέβη λαῖλαψ ἀνέμου,τὴν λίμνην καὶ συνεπληροῦντο καὶ ἐκινδύνευον.
εἰς,εἰς,—,—,—,—,—,—,—,preposition,Luke 8:26,Καὶ κατέπλευσαν,"τὴν χώραν τῶν Γερασηνῶν, ἥτις ἐστὶν ἀντιπέρα τῆς Γαλιλαίας."
εἰς,εἰς,—,—,—,—,—,—,—,preposition,Luke 8:29,ἁλύσεσιν καὶ πέδαις φυλασσόμενος καὶ διαρρήσσων τὰ δεσμὰ ἠλαύνετο ὑπὸ τοῦ δαιμονίου,τὰς ἐρήμους.
εἰς,εἰς,—,—,—,—,—,—,—,preposition,Luke 8:30,"ἐπηρώτησεν δὲ αὐτὸν ὁ Ἰησοῦς· τί σοι ὄνομά ἐστιν; ὁ δὲ εἶπεν· λεγιών, ὅτι εἰσῆλθεν δαιμόνια πολλὰ",αὐτόν.
εἰς,εἰς,—,—,—,—,—,—,—,preposition,Luke 8:31,καὶ παρεκάλουν αὐτὸν ἵνα μὴ ἐπιτάξῃ αὐτοῖς,τὴν ἄβυσσον ἀπελθεῖν.
εἰς,εἰς,—,—,—,—,—,—,—,preposition,Luke 8:32,ἦν δὲ ἐκεῖ ἀγέλη χοίρων ἱκανῶν βοσκομένη ἐν τῷ ὄρει· καὶ παρεκάλεσαν αὐτὸν ἵνα ἐπιτρέψῃ αὐτοῖς,ἐκείνους εἰσελθεῖν· καὶ ἐπέτρεψεν αὐτοῖς.
εἰς,εἰς,—,—,—,—,—,—,—,preposition,Luke 8:33,ἐξελθόντα δὲ τὰ δαιμόνια ἀπὸ τοῦ ἀνθρώπου εἰσῆλθον,"τοὺς χοίρους, καὶ ὥρμησεν ἡ ἀγέλη κατὰ τοῦ κρημνοῦ εἰς τὴν λίμνην καὶ ἀπεπνίγη."
εἰς,εἰς,—,—,—,—,—,—,—,preposition,Luke 8:33,"ἐξελθόντα δὲ τὰ δαιμόνια ἀπὸ τοῦ ἀνθρώπου εἰσῆλθον εἰς τοὺς χοίρους, καὶ ὥρμησεν ἡ ἀγέλη κατὰ τοῦ κρημνοῦ",τὴν λίμνην καὶ ἀπεπνίγη.
εἰς,εἰς,—,—,—,—,—,—,—,preposition,Luke 8:34,Ἰδόντες δὲ οἱ βόσκοντες τὸ γεγονὸς ἔφυγον καὶ ἀπήγγειλαν,τὴν πόλιν καὶ εἰς τοὺς ἀγρούς.
