Result,Lemma (Greek),Tense (Logos Greek),Voice (Logos Greek),Mood (Logos Greek),Person (Logos Greek),Gender (Logos Greek),Case (Logos Greek),Number (Logos Greek),Part of Speech,Reference,Previous Context,Next Context
οὐρανῷ,οὐρανός,—,—,—,—,masculine,dative,singular,noun,Revelation 11:19,Καὶ ἠνοίγη ὁ ναὸς τοῦ θεοῦ ὁ ἐν τῷ,"καὶ ὤφθη ἡ κιβωτὸς τῆς διαθήκης αὐτοῦ ἐν τῷ ναῷ αὐτοῦ, καὶ ἐγένοντο"
οὐρανῷ,οὐρανός,—,—,—,—,masculine,dative,singular,noun,Revelation 12:7,Καὶ ἐγένετο πόλεμος ἐν τῷ,", ὁ Μιχαὴλ καὶ οἱ ἄγγελοι αὐτοῦ τοῦ πολεμῆσαι μετὰ τοῦ δράκοντος. καὶ ὁ"
οὐρανῷ,οὐρανός,—,—,—,—,masculine,dative,singular,noun,Revelation 12:8,καὶ οὐκ ἴσχυσεν οὐδὲ τόπος εὑρέθη αὐτῶν ἔτι ἐν τῷ,.
οὐρανῷ,οὐρανός,—,—,—,—,masculine,dative,singular,noun,Revelation 13:6,"θεὸν βλασφημῆσαι τὸ ὄνομα αὐτοῦ καὶ τὴν σκηνὴν αὐτοῦ,  τοὺς ἐν τῷ",σκηνοῦντας.
οὐρανῷ,οὐρανός,—,—,—,—,masculine,dative,singular,noun,Revelation 14:17,Καὶ ἄλλος ἄγγελος ἐξῆλθεν ἐκ τοῦ ναοῦ τοῦ ἐν τῷ,ἔχων καὶ αὐτὸς δρέπανον ὀξύ.
οὐρανῷ,οὐρανός,—,—,—,—,masculine,dative,singular,noun,Revelation 15:5,"Καὶ μετὰ ταῦτα εἶδον, καὶ ἠνοίγη ὁ ναὸς τῆς σκηνῆς τοῦ μαρτυρίου ἐν τῷ",","
οὐρανῷ,οὐρανός,—,—,—,—,masculine,dative,singular,noun,Revelation 19:1,Μετὰ ταῦτα ἤκουσα ὡς φωνὴν μεγάλην ὄχλου πολλοῦ ἐν τῷ,"λεγόντων·      ἁλληλουϊά·      ἡ σωτηρία καὶ ἡ δόξα καὶ ἡ δύναμις τοῦ θεοῦ ἡμῶν,"
οὐρανῷ,οὐρανός,—,—,—,—,masculine,dative,singular,noun,Revelation 19:14,Καὶ τὰ στρατεύματα [τὰ] ἐν τῷ,"ἠκολούθει αὐτῷ ἐφʼ ἵπποις λευκοῖς, ἐνδεδυμένοι βύσσινον λευκὸν καθαρόν."
οὐρανῷ,οὐρανός,—,—,—,—,masculine,dative,singular,noun,Revelation 4:1,"Μετὰ ταῦτα εἶδον, καὶ ἰδοὺ θύρα ἠνεῳγμένη ἐν τῷ",", καὶ  ἡ φωνὴ ἡ πρώτη ἣν ἤκουσα ὡς σάλπιγγος λαλούσης μετʼ ἐμοῦ λέγων"
οὐρανῷ,οὐρανός,—,—,—,—,masculine,dative,singular,noun,Revelation 4:2,"Εὐθέως ἐγενόμην ἐν πνεύματι, καὶ ἰδοὺ θρόνος ἔκειτο ἐν τῷ",", καὶ ἐπὶ τὸν θρόνον καθήμενος,"
οὐρανῷ,οὐρανός,—,—,—,—,masculine,dative,singular,noun,Revelation 12:1,Καὶ σημεῖον μέγα ὤφθη ἐν τῷ,", γυνὴ περιβεβλημένη τὸν ἥλιον, καὶ ἡ σελήνη ὑποκάτω τῶν ποδῶν αὐτῆς καὶ ἐπὶ"
οὐρανῷ,οὐρανός,—,—,—,—,masculine,dative,singular,noun,Revelation 12:3,καὶ ὤφθη ἄλλο σημεῖον ἐν τῷ,", καὶ ἰδοὺ δράκων μέγας πυρρὸς ἔχων κεφαλὰς ἑπτὰ καὶ κέρατα δέκα καὶ ἐπὶ"
οὐρανῷ,οὐρανός,—,—,—,—,masculine,dative,singular,noun,Revelation 12:10,καὶ ἤκουσα φωνὴν μεγάλην ἐν τῷ,λέγουσαν·      ἄρτι ἐγένετο ἡ σωτηρία καὶ ἡ δύναμις        καὶ ἡ βασιλεία τοῦ θεοῦ
οὐρανῷ,οὐρανός,—,—,—,—,masculine,dative,singular,noun,Revelation 15:1,Καὶ εἶδον ἄλλο σημεῖον ἐν τῷ,"μέγα καὶ θαυμαστόν, ἀγγέλους ἑπτὰ ἔχοντας πληγὰς ἑπτὰ τὰς ἐσχάτας, ὅτι ἐν αὐταῖς"
